2020-01-02T02:44:08.000Z	1212565207295254528	次元も賢さも全然違うのはわかってるけど、言いたいことは一緒。いい施設(安全な施設)であり続けるにはめちゃくちゃお金がかかる。大雨や台風の日は休まざるを得ないんだしそれを休みだと思えばいい。もっといい施設にしたい。体力が続く限り営業する。1月2日、今日も朝からフル出勤だっ！！⚽️ https://t.co/o3GbIbFWpj https://t.co/JzKbmWHwTW	{'place_id': '07d9dfd35ec80001'}
2020-01-02T02:25:24.000Z	1212560491039449088	@PHAZER17 カツカツ旅行が好きなんですよw今は70分待ちなのでコーヒー飲んで箱根駅伝見てますよw.	{'place_id': 'dca0d1073411f55e'}
2020-01-02T01:39:03.000Z	1212548830492684288	夜は飲みになりました。	{'place_id': 'f62cf04248a8314b'}
2020-01-02T01:21:01.000Z	1212544292410937344	日本一記念旅行行ってきます#SoftBank #HAWKS  #ソフトバンクホークス https://t.co/kgyIEczonX	{'place_id': '83e30e314d0e5320'}
2020-01-02T00:20:30.000Z	1212529060271669249	天気もお出かけ日和みたいだし‼️景色が超綺麗なあの場所🌊1回だけ行ったことあるけど何年ぶりだろう❓10なん年は行ってないハズ💦あの時は曇りやったし☁️楽しみ‼️	{'place_id': '06dee0fd8a4d815c'}
2020-01-02T00:18:01.000Z	1212528434246647814	もともと今日のお出かけは日帰りだったけど、せっかくならゆっくりしたい‼️ってことで行きたい場所とホテル提案したらおっけー出たので1泊でまたお出かけしてきます🚘早めには帰ってくるけど♫自主トレしたいし参拝もおみくじもまだだから🤗	{'place_id': '06dee0fd8a4d815c'}
2020-01-02T00:03:49.000Z	1212524861647548416	🎍運勢【小吉】🎍願事　想いのまま待人　ねねは来ぬ恋愛　はなちゃんまるにチャンスあり旅行　ハワイに利益あり病気　握手会依存症に注意失物　ねねを失う#ツイッターおみくじ2020 https://t.co/pFa3tPgGRsねねは来ぬとねねを失うはまじ怖い笑#地頭江。	{'place_id': '19592724f6230037'}
2020-01-03T22:26:44.000Z	1213225204949737472	あけましておめでとうございます今日は仕事始め今年も　♪Love  Myself♪聴きながら出勤中バンタンに力をもらい顔晴ります https://t.co/4I3mqz1MmQ	{'place_id': '07d9e3ddd0088000'}
2020-01-03T22:23:49.000Z	1213224472754286593	🎍運勢【吉】🎍願事　叶わぬ待人　架純が来る恋愛　白石麻衣を愛しぬけ旅行　東京に利益あり病気　架純大好き症候群に注意失物　失わず#ツイッターおみくじ2020 https://t.co/gXqrmuiKsG	{'place_id': '28d9f7c5865651ca'}
2020-01-03T21:02:01.000Z	1213203886690881537	土曜日なのに出勤新年の挨拶（社内）と新年会のために本社へGO日帰り東京とかマジだるいよぉ…	{'place_id': '4bda4536528abe8f'}
2020-01-03T19:43:23.000Z	1213184097691897856	おはようございます、今日から出勤日の今年初仕事です。☺昨年末のトラブルがまだ解決してないのでまだ朝早くから出勤です。(ー_ー;)それでは今年も仕事頑張って行ってきます、今日１日宜しくお願い致します。😃👋 https://t.co/iIUd2Sj7OD	{'place_id': '6f8692fbabd23e62'}
2020-01-03T19:03:04.000Z	1213173950701637635	@erotic_nuisance 総合病院の待合室状態は酷かったです。挨拶しても無視するしおつまみ差し上げても返事しなけりゃお礼もなし。M氏とH氏なのですがジットリした妬んだような目でみるんで放置！ありがとうございます⭐今日は元気に外出しますね🥳🍷	{'place_id': 'f62cf04248a8314b'}
2020-01-03T17:16:53.000Z	1213147229130645504	家族で旅行がしたいです。お願いします🚢 https://t.co/8eDqljlQEA	{'place_id': '4c6f6aa0ae926c41'}
2020-01-03T16:46:33.000Z	1213139594964656128	@mahironron111 出勤忘れてたのに(笑)	{'place_id': '83e30e314d0e5320'}
2020-01-03T15:31:08.000Z	1213120617513226240	🎍運勢【大吉】🎍願事　村重の助けありて叶うかも待人　山下は来ぬ恋愛　りんりんにチャンスあり旅行　朝長に利益あり病気　配信中依存症に注意失物　村重を失う#ツイッターおみくじ2020 https://t.co/dpkOKwlvpI	{'place_id': 'd458617907c51263'}
2020-01-03T14:51:04.000Z	1213110536180649986	@gerbera_gospel お疲れさまでしたー。カラオケにも行きたかったなあ😊	{'place_id': 'f62cf04248a8314b'}
2020-01-03T14:39:51.000Z	1213107709534302211	🎍新春 リコピー福袋🎍【価格】24億円《中身例》・リコピーフィギュア (下着姿.Ver)・リコピーと世界旅行券他8点（7200億円相当）入り！限定 69本！　お早めにどうぞ！！#あなた福袋メーカー #shindanmakerhttps://t.co/ZxjrPnSY3P買うかw俺と旅行行きたい人かなりの物好き	{'place_id': '8d59909b600e0352'}
2020-01-03T14:02:53.000Z	1213098409646649346	🎍運勢【末吉】🎍願事　トムの助けありて叶うかも待人　くまモンがトムを連れてくる恋愛　くまモンは振り向かぬ旅行　やめとけ病気　トム大好き症候群に注意失物　総選挙を失う#ツイッターおみくじ2020 https://t.co/XXkxOioCHB私、ジェリー派	{'place_id': '1809b21424d0d7a1'}
2020-01-03T13:45:24.000Z	1213094007913381888	@masaru_endoh @daisuke_mark2 ほんとそれなぁ🤦‍♂️車も電車も😭😭	{'place_id': '4c6f6aa0ae926c41'}
2020-01-03T13:20:11.000Z	1213087661478383617	@_umix スケジュールと予算等々と相談した結果…空席の関係で大阪まで夜行バスで電車で京都入りします笑ありがとうございます！今のところ明日のプランもほぼ固まったのであとはその通りに動くだけになりそうです👍	{'place_id': '06dee0fd8a4d815c'}
2020-01-03T13:15:26.000Z	1213086465690763264	楽しい時間でした。今から電車に乗って帰ります。弟よ、御馳走でした〜＼(^o^)／#や台ずし #夜廻り猫 #ワカル https://t.co/OgIswPxaMV	{'place_id': '07d9db4261488002'}
2020-01-03T13:08:40.000Z	1213084762568413188	明日、実家に帰る。また韓国旅行10日からだから、その打ち合わせがてら、ついでに飯でもねだってみよう。 https://t.co/CenPqKpYsL	{'place_id': '4c6f6aa0ae926c41'}
2020-01-03T12:44:48.000Z	1213078756664864768	@iori831_hkt48 熊本旅行行ったときにぜひ行くね👍	{'place_id': '207e95d6143148a2'}
2020-01-03T12:04:03.000Z	1213068501990154240	SAPの新年会二次会でカラオケに来たらハプニング続きで笑いが止まらない。 場所: ビッグエコー BIG ECHO 天神大名店 https://t.co/5yYf9Yd2j8	{'coordinates': {'type': 'Point', 'coordinates': [130.396188, 33.588685]}, 'place_id': 'f62cf04248a8314b'}
2020-01-03T12:00:43.000Z	1213067662810419200	ご飯…外出たくないけどお腹空いた…	{'place_id': 'a29d2918916e6486'}
2020-01-03T10:56:10.000Z	1213051421328732161	こんばんは！🌃✨遅くなりましたが 皆さん新年あけましておめでとうございます🎍💕只今大好評のポケパラですが、出勤情報は随時公開していくので少々お待ちください😥本日は女の子５人でお待ちしております🙋✨今年もMELLDYを宜しくお願いいたします！💃💖	{'place_id': 'f62cf04248a8314b'}
2020-01-03T09:13:28.000Z	1213025572994990080	今から電車でお出かけ。本当は車での移動予定だったんだけどね。行ってきまーす♪#夜廻り猫 #ワカル https://t.co/oV8IlAJVBY	{'place_id': 'd3e7247214ae4e2d'}
2020-01-03T07:08:23.000Z	1212994095393558529	台湾旅行めっちゃ楽しかったー！もちろんBUMP聖地巡りも！九份に行った時🙂#BUMPOFCHICKEN#台湾#九份#聖地巡り https://t.co/JJvcsqazM9	{'place_id': '0fc340d106142001'}
2020-01-03T07:01:18.000Z	1212992312256499712	あーファンヒーターが気持ちいいこと外出たらあまりの寒さに鳥肌と乳首がたつねんけどはぁ(｡´-д-)ﾊｧ-何言ってんだ私	{'place_id': '1809b21424d0d7a1'}
2020-01-03T06:33:05.000Z	1212985214110060545	先輩達とのお出かけ終わり‼️明日から仕事なのにまだ参拝行ってない‼️おみくじひいてない‼️バタバタ行ってきます💨	{'place_id': 'aa7c3ccdbb497079'}
2020-01-03T06:05:54.000Z	1212978370859790337	ご連絡お待ちしております。#福岡 #博多 #天神 #福岡市 #旅行 #観光 #ホテル #もつ鍋 #Fukuoka #マリンメッセ　#ヤフオクドーム #福岡もつ鍋 #天神もつ鍋 #博多もつ鍋 #福岡旅行 #九州旅行 #zeepfukuoka #もつもつ #正月休み　#初詣   #天神でもつ鍋 #太宰府天満宮 #ASKA #坂本八幡宮 https://t.co/uiy0woEg6P	{'place_id': '07d9eeb39d088000'}
2020-01-03T05:37:34.000Z	1212971243139256321	#あなたが一万円推し福袋を買ったら・真奈Ｔシャツ・またよしと一時間おしゃべり券・平野愛用パジャマ・晴時と旅行できる券・バグースマグカップ～総額59200円相当～ https://t.co/Gu9sQLmz2N真奈Tシャツ持ってるよww	{'place_id': '19592724f6230037'}
2020-01-03T05:18:32.000Z	1212966452950523905	@ASURAN_S 今日天気いいからお出かけ日和ですね〜(＊¯∀¯＊)	{'place_id': '67e8b450ce5fa959'}
2020-01-03T05:12:00.000Z	1212964806178684930	パプリカ歌ってるちびっこ電車乗っとるんやけど、ばちくそかわいいお年玉あげたい	{'place_id': '4bda4536528abe8f'}
2020-01-03T05:05:03.000Z	1212963059045519360	こんにちは！滝澤家は温泉家族旅行中です。昨年は湯布院でしたが今年は近場で原鶴温泉。とりあえず途中でお蕎麦を食べて、これからお宿へ向かいます。年々婆ちゃんが動けなくなってきてる。喘息持ちだから少しの距離を歩くのもひと苦労。それでも温泉入りたいと言ってくれるうちは続けたい。 https://t.co/rSYkcXn5Bn	{'place_id': '0fc358b8c914f000'}
2020-01-03T05:04:05.000Z	1212962815201312769	大宰府も相変わらずやな。公共交通機関っても西鉄電車だけだし。西鉄電車も輸送力には限界あるから3号線バイパスより天満宮側に車入れないようにしないとねぇ https://t.co/NpK45xzgem	{'place_id': '684cc1cfd89cacef'}
2020-01-03T04:28:52.000Z	1212953950854504456	威風凜凜。#japan #walking #fukuoka #Travel #beautiful #discovertokyo #daily_photo_jpn #explorejapan #explorejpn #visitjapanjp #reco_ig #photography #light_nikon #nikon #nikontaiwan #櫛田神社 #shrine #日本 #福岡 #旅行 #photo… https://t.co/0rLSARhLMR	{'coordinates': {'type': 'Point', 'coordinates': [130.3833, 33.5817]}, 'place_id': 'f62cf04248a8314b'}
2020-01-03T04:09:44.000Z	1212949136946814976	🎍運勢【大凶】🎍願事　秋吉はお前のものにならぬ待人　秋吉が来る恋愛　優花に誠意を尽くせ旅行　やめとけ病気　優花大好き症候群に注意失物　神推しを失う#ツイッターおみくじ2020 https://t.co/pvaGWJFIoj	{'place_id': '06dee0fd8a4d815c'}
2020-01-03T04:02:21.000Z	1212947279004327936	本日の昼食。我が家の先生と王子と姫が揃いましたので、久し振りに自宅にて作りました、野菜炒めと麻婆春雨(白菜&amp;挽肉追加)。味付けも喜んでくれましたが、もんまりと作りましたので、量的にも満足してくれました。ちなみに奥さんは枕のメンテナンスと温泉♨️で外出中です。。。 https://t.co/zn8QCJQQf5	{'place_id': '67e8b450ce5fa959'}
2020-01-03T03:41:17.000Z	1212941975671861248	嫁さん達のお出かけは中止らしい…という事はラーツーに出れない😭おとなしく家で食べますw https://t.co/Zl2OZRpLAx	{'place_id': '9a9414fd6ec311ca'}
2020-01-03T02:13:34.000Z	1212919902056566788	新年入ってのニュース全く見てないけど、ゴーンが海外旅行行ったのは知ってる(なんかちがう)	{'place_id': '06dee0fd8a4d815c'}
2020-01-03T01:59:40.000Z	1212916404342575105	電車で博多駅着いたのに爆睡してて知らない女の子が起こしてくれたの神過ぎた好き	{'place_id': '83e30e314d0e5320'}
2020-01-03T01:55:23.000Z	1212915327312379905	日本に来るなよ、清々しとるのに。韓国旅行会社、昨年１２月日本観光需要が８０％以上減少 https://t.co/m0xrgXSCdY	{'place_id': '19592724f6230037'}
2020-01-03T01:03:02.000Z	1212902154316341248	本日は西鉄電車で太宰府へ。 https://t.co/YLDYFQJMVD	{'place_id': 'f62cf04248a8314b'}
2020-01-03T00:33:31.000Z	1212894723167227905	電車の中で、お腹が痛くなるのでスタバは回避。走行しているうちに電車の時間だ。我ながら英断。#大橋駅 https://t.co/m1kxr4keDy	{'place_id': '207e95d6143148a2'}
2020-01-03T00:30:16.000Z	1212893905076666368	あけましておめでとうございます🙇‍♀️前澤様にとって良き年になりますようにお祈り申し上げます🙇‍♀️両親を沖縄へ家族旅行に連れて行きたいのでその資金にしたいのでよろしくお願いします🙇‍♀️ https://t.co/dCs6T1ylQ8	{'place_id': '361d4120fc43007e'}
2020-01-04T16:57:51.000Z	1213504826618679297	私のタイムツリーに登録されている2019年の予定数は236件！充実した1年でした。2020年にやりたいことは家族を旅行に連れていく。 https://t.co/C4Po80ZbIN #2020年にやりたいこと #タイムツリー宣言	{'place_id': '19592724f6230037'}
2020-01-04T16:57:39.000Z	1213504777604100096	私のタイムツリーに登録されている2019年の予定数は236件！充実した1年でした。2020年にやりたいことは家族を旅行に連れていく。 https://t.co/C4Po80ZbIN #2020年にやりたいこと #タイムツリー宣言	{'place_id': '19592724f6230037'}
2020-01-04T15:09:40.000Z	1213477601194364930	¥100万欲しいです。家族旅行行きたいです。お願い致します。 https://t.co/uObXGuSdbo	{'place_id': '83e30e314d0e5320'}
2020-01-04T15:05:22.000Z	1213476519948849152	しかも俺は今まで休み希望ほとんど出してないとよ。LinQを理由に休んだこともないし、友達との飲みにも休み希望を出さずに俺の休みの日に合わせてもらってるしお盆とかはずっと出て正直自分がキャパオーバーで壊れそうになるし、	{'place_id': '207e95d6143148a2'}
2020-01-04T15:04:31.000Z	1213476306454626304	令和2年1月4日 晴今日は峯と薬院ガストに宿題しに行った。捗らんけん天神TSUTAYAのカフェに移動した。そこではまずまず捗ったかな。いや、そうでもないか。その後、新年初ラーメン食べて、今度は宮本から山口旅行のお土産貰うためにスシローに行った。回転寿司ってマイペースに食べれるけんいい。 https://t.co/LRFpH3S3UF	{'place_id': 'f62cf04248a8314b'}
2020-01-04T14:42:14.000Z	1213470698120704000	明日朝の便が早いので、本日は就寝します。明日昼前に羽田に到着すると思いますけど、買い物やお弁当の食材調理等が目白押しなので、ライブはお休みします。ヴァターシは休日出勤がなければ1/11が、1/11が出勤なら12が初ライブですので、皆様暖かくお迎えくださいw。では良い週末を。。。#style3	{'place_id': '67e8b450ce5fa959'}
2020-01-04T14:21:16.000Z	1213465421925384194	@miyunasinger 旅行は無理したりリズムが狂ったりしますからね。無理しないでくださいね🤗	{'place_id': '8e3eb7e8205ad5b8'}
2020-01-04T14:01:57.000Z	1213460561133879296	旅行から帰宅～🚗 とりあえず寝る😪💤💤	{'place_id': 'd3e7247214ae4e2d'}
2020-01-04T12:42:06.000Z	1213440465841745921	さすが新年。普段日曜日配達無いところの荷物が。通常通りの出勤。って、年末も呟いたな。	{'place_id': '10399e3c0b1f3a07'}
2020-01-04T12:39:37.000Z	1213439842962595845	久しぶりの電車 (@ 下大利駅 in 大野城市, 福岡県) https://t.co/PdlmVhdJLk	{'place_id': '4c6f6aa0ae926c41', 'coordinates': {'type': 'Point', 'coordinates': [130.48954798, 33.52245312]}}
2020-01-04T12:34:24.000Z	1213438530740842503	@nadukari_h フォロー外から失礼しますこの人は高田勝則と言ってクオリティの低い矢沢永吉のコスプレしててコスプレファンから｢矢沢永吉に似てないよ｣って言われてます矢沢永吉はこんな格好しませんよね？あと、高田は電車の中で車椅子専用の所で椅子を持ってきて座ってますので奴には気を付けてください	{'place_id': 'eeaeb313b9cb73ae'}
2020-01-04T12:21:08.000Z	1213435190023872514	@saganmarion 銀山温泉は仙台から山形に移動して更に北上した山間の温泉地ですので、移動にかなりの時間がかかると思われます。試合を含め二泊三日くらいで旅行計画をたてると、いい感じなのではないかと思います！	{'place_id': '10399e3c0b1f3a07'}
2020-01-04T12:13:05.000Z	1213433163919179781	今日の電車で一番加速がいい、その2#鹿児島本線#JR九州#青春18きっぷ https://t.co/czNnm0olCZ	{'place_id': '06dee0fd8a4d815c'}
2020-01-04T12:11:24.000Z	1213432739673755648	今日の電車で一番加速がいい、その1#鹿児島本線#JR九州#青春18きっぷ#聴き慣れないモーター音 https://t.co/K6w0sCXjRp	{'place_id': '06dee0fd8a4d815c'}
2020-01-04T11:36:52.000Z	1213424051814711296	続けて今からお出かけしてくるね	{'place_id': '19592724f6230037'}
2020-01-04T11:28:58.000Z	1213422062447939584	@kyozenji えっと、1月14日と15日は出勤予定です。安藤サンもそのあたりで京都の予定らしいです。	{'place_id': 'ee211065bf2eca64'}
2020-01-04T10:26:33.000Z	1213406354460856320	路面電車の警笛軽し初明り#365日季語手帖 場所: Fukuoka-shi, Fukuoka, Japan https://t.co/PxKTIftifp	{'place_id': 'f62cf04248a8314b', 'coordinates': {'type': 'Point', 'coordinates': [130.3833, 33.5817]}}
2020-01-04T10:15:51.000Z	1213403661033865217	ずっと一人で生きてきて、本当に疲れました。人生を楽しんでいる前澤さんが羨ましいです。お年玉を頂けたら、一泊温泉旅行にでも行きたいです。宜しくお願いします。 https://t.co/PE5VeK7eJS	{'place_id': '90670800ee355ca4'}
2020-01-04T08:43:05.000Z	1213380316821364736	ご連絡お待ちしております。#福岡 #博多 #天神 #福岡市 #旅行 #観光 #ホテル #もつ鍋 #Fukuoka #マリンメッセ　#ヤフオクドーム #福岡もつ鍋 #天神もつ鍋 #博多もつ鍋 #福岡旅行 #九州旅行 #zeepfukuoka #official髭男dism #NCT127 #SHISHAMO #福岡サンパレス #正月休み #もつもつ https://t.co/iAgOQmI8lk	{'place_id': 'f62cf04248a8314b'}
2020-01-04T08:31:00.000Z	1213377276982779905	ディナータイムオープンです🍽新年最初のお客様は、ご家族で焼肉パーティしてくださいました✌️😊この後お出かけ…でも大丈夫👍ちゃんと消臭スプレーも準備してますよ〜✨昼でも夜でも焼肉が食べられるのが、焼肉モ〜モ〜のオススメポイントですね‼️https://t.co/eLcOI4nqvW#焼肉モーモー https://t.co/q9wGsbgzLi	{'place_id': '10111d0bbad41000'}
2020-01-04T08:09:59.000Z	1213371986333724672	【悲報】急な勤務時間変更で今から帰ります…(日勤担当者が身内の不幸で明日出勤できなくなるため)波瀾の2020年の悪寒…((((；ﾟДﾟ))))ｶﾞｸｶﾞｸﾌﾞﾙﾌﾞﾙ #社畜	{'place_id': '10399e3c0b1f3a07'}
2020-01-04T08:05:40.000Z	1213370899639853056	家帰ったら、時間作って今回の旅行まとめよ。	{'place_id': 'dca0d1073411f55e'}
2020-01-04T08:05:28.000Z	1213370848309964800	今からようやくお正月休みです✨なので今回は実家へは新幹線ではなく在来線でゆっくり帰省します🚃プチ旅行気分？(笑)	{'place_id': '83e30e314d0e5320'}
2020-01-04T07:22:09.000Z	1213359946768584704	20代後半オンワード時代の上司がふらっと遊びにきた。約20年振りの再会…上司も63歳とお互い歳を取った。なんとも言えない思いが込み上げて少し胸が熱くなった。今度飲みに行こう。その時は自分の奢りで感謝の乾杯だ。	{'place_id': 'f62cf04248a8314b'}
2020-01-04T07:11:55.000Z	1213357374989373440	今日は家族でお出かけご飯🍷	{'place_id': 'f62cf04248a8314b'}
2020-01-04T06:24:44.000Z	1213345499291385857	@komanyako 旅行に？	{'place_id': '1809b21424d0d7a1'}
2020-01-04T06:23:48.000Z	1213345265698164737	福岡・佐賀旅行最終日福岡美味しいパン屋さん②painstockとのコラボ店、amam dacotonへ連れていっていただきました。..#amamdacotan 場所: amam dacotan https://t.co/ocmiyIsVT3	{'place_id': 'f62cf04248a8314b', 'coordinates': {'type': 'Point', 'coordinates': [130.381438, 33.578121]}}
2020-01-04T05:51:32.000Z	1213337142052524032	南福岡電車区が見える https://t.co/0YzmlWtti1	{'place_id': '90670800ee355ca4'}
2020-01-04T05:47:56.000Z	1213336239878877184	@dartsmeichan 私も14歳から孤立　孤独ですがまだ生きてますひとりの時間て大事だし気楽ですよ　楽しめる時もある旅行も海外も１人で行きます１人もいいですよ人間がいつも横にいると気がくるいます	{'place_id': 'd86aacdaf45b3cbd'}
2020-01-04T04:55:55.000Z	1213323148185104384	お昼は呼子でイカ🦑こうやって家族で旅行できる幸せをしみじみ感じながら。#呼子#玄海#新春三者詣りミステリーツアー https://t.co/Nsh9E5gZqi	{'place_id': '0fc2f660ae54f000'}
2020-01-04T04:46:48.000Z	1213320851711561728	福岡・佐賀旅行2日目③糸島→かなり久しぶりに呼子へ鉄板の呼子大橋みながらのイカをいただく！...#呼子大橋 #呼子のイカ #河太郎 場所: 元祖呼子のイカの活造り 河太郎 呼子店 https://t.co/b6z4SWoPI5	{'place_id': 'dca0d1073411f55e', 'coordinates': {'type': 'Point', 'coordinates': [129.89142182, 33.54665952]}}
2020-01-04T04:29:06.000Z	1213316397000019968	福岡・佐賀旅行2日目②パン屋さんはしごから、電車使って、糸島へそのあと、レンタカー借りて、ぶらり楽しむ✨...#糸島 #糸島ドライブ #糸島カフェ #糸島雑貨屋巡り 場所: Itoshima-shi, Fukuoka, Japan https://t.co/qrOoWdnPxr	{'place_id': '6772c147e8066ea1', 'coordinates': {'type': 'Point', 'coordinates': [130.196, 33.5573]}}
2020-01-04T04:06:13.000Z	1213310638673387521	昼休憩中に椅子で10分くらい寝てったらバイクに乗ってる夢見た💨ブレーキングのフォークの沈み込みで体がびくっとなって起きたよ🤣バスや電車で居眠りしてる人がびくっとなったら、ワンチャンバイク乗りかも知れない✨w	{'place_id': '83e30e314d0e5320'}
2020-01-04T03:48:26.000Z	1213306163799805952	長崎本線は特急天国普通電車より多いんじゃないかと	{'place_id': '7aef1c8833fa125d'}
2020-01-04T03:29:09.000Z	1213301310272880640	交通安全のお守りの引き継ぎ式去年も全く同じお守りを香椎宮で買っていたらしい。神様のご加護のおかげで、私が乗っている車両(バス/電車/自家用車etc.)で事故が起こらないまま2019年が終わった。今年も無事故でありますように！#みずたに三社参り https://t.co/Wi7OuZ6PHJ	{'place_id': '06dee0fd8a4d815c'}
2020-01-04T03:15:33.000Z	1213297890346455040	昨日の晩は飲み過ぎてぬるっと起床ノープランでとりあえず太宰府天満宮までお参りに来たのは中学の修学旅行以来かな笑ランチ代わりに梅ヶ枝餅と抹茶で太宰府駅はホームも電車もカッコいいね https://t.co/RWCSaOYf5K	{'place_id': '0fc295112694c000'}
2020-01-04T02:58:03.000Z	1213293483571564545	@hiromop0491 海外旅行	{'place_id': '06dee0fd8a4d815c'}
2020-01-04T01:26:58.000Z	1213270562308386816	@tattunturbo 御祝儀(๑꒪ㅁ꒪๑)u✩ra✩ya✩maこっちはワンマン出勤なので全くもらえません🤣出荷と受注の電話対応やってるけど全く鳴らず(・・)運送の引取りもそろそろ来るけど勝手に早退出来ないのがしんどいっす😭	{'place_id': 'f62cf04248a8314b'}
2020-01-04T01:25:16.000Z	1213270134078357504	幼馴染みに、引越したからお茶飲みに来ない？と言われて行ってみたらびっくりマンション買ってた。超いい感じの中古リノベ物件で興奮しまくりだった。色々な苦労を聞いてきただけあって、涙出そう。良かった。	{'place_id': '83e30e314d0e5320'}
2020-01-04T01:09:02.000Z	1213266051481255938	飲みに行きたいとかではないんだけど、現在住吉に居る人ご一報いただけたら幸いです(๑･ิټ･ิ๑)💕	{'place_id': '83e30e314d0e5320'}
2020-01-04T00:42:05.000Z	1213259269178441730	@asami_cho_511 麻未さん、おはよう😃ございます❗️リアルゴールド派なんですね❗️私はオロC派です。30日からずっと仕事です。これから出勤します。麻未さんもガンバ、ガンバ‼️	{'place_id': '1809b21424d0d7a1'}
