2019-12-29T22:37:45.000Z	1211416041391149057	さすがに電車少ない。#12月30日	{'place_id': '19592724f6230037'}
2019-12-29T21:47:45.000Z	1211403458558869509	今年最後の出勤。行ってきます。	{'place_id': 'ae083492b529328a'}
2019-12-29T20:04:20.000Z	1211377431040286720	おはようございます、今日は今年最後の週明けの月曜日です。☺今日は朝早くから仕事出勤、今日仕事収めです。☺ゝ今年最後の仕事頑張っていってきます、今日も宜しくお願い致します。😄👋 https://t.co/tanX31jUB5	{'place_id': '6f8692fbabd23e62'}
2019-12-29T16:21:14.000Z	1211321287605276672	旅行でアニメ聖地巡り https://t.co/TRyDcwGl5A	{'place_id': 'deb3f9e0199e0633'}
2019-12-29T16:07:53.000Z	1211317927019831296	31日は蕎麦屋のお祭りってのは分かるけどこの時間に終わるとかどういう事？！笑しかも明日7:30出勤。。。詰みこれはもう詰みでしかない	{'place_id': '83e30e314d0e5320'}
2019-12-29T15:01:31.000Z	1211301223069962245	喧嘩別れした屋台の大将と飲んでる。めちゃくちゃ嬉しそうに飲みに来てくれた。俺もめちゃくちゃ嬉しいぞ。大将！！！！！！！！！ https://t.co/5pfLBv8aXk	{'place_id': 'f62cf04248a8314b'}
2019-12-29T14:58:14.000Z	1211300396326502405	@ShuMc51 @Factory_adachi 婚前旅行だよ！	{'place_id': '06dee0fd8a4d815c'}
2019-12-29T14:45:40.000Z	1211297235092131841	今年の社員旅行時に発見したものです(*´-`) #なんの脈絡もない画像を貼って寝る https://t.co/Jz0Mkt5kCn	{'place_id': 'd458617907c51263'}
2019-12-29T13:45:58.000Z	1211282213758619650	今年は、バイクに乗って、キャンプして、山登って、マラソン走って、旅行して、飲んで、食べて…いい一年でした…ありがとうございました🙇‍♂️ https://t.co/Nhwc8gjHHY	{'place_id': '83e30e314d0e5320'}
2019-12-29T12:38:27.000Z	1211265219076341761	@he21s8316 そう言えば、昔、会社の仲間と鹿児島に旅行に行ったな～。砂蒸し風呂にも入ったし、黒豚料理や、きびなごも食べた。楽しかったなぁ～。	{'place_id': 'a29d2918916e6486'}
2019-12-29T12:30:51.000Z	1211263306880565248	福岡到着✈️ほんとは更に特急に乗って実家なんだけど、疲れたからカプセルホテル予約した😓夜行バスが辛かったのかな…今回の旅行は行程を間違えた気がする…	{'place_id': '83e30e314d0e5320'}
2019-12-29T12:12:48.000Z	1211258767641235456	#セリア で可愛いケースを発見したピンクと黒の2色あるんだけどリカちゃん入れるのにぴったり！お出かけする時とかにこうやってお人形いれて持ち運べるからお子さんいる人にはオススメだよ(*´艸`*)ちょっとライト入れて雰囲気出して見たリカちゃん https://t.co/nBtsnOqlsb	{'place_id': '9d0651f2d83b1584'}
2019-12-29T11:46:35.000Z	1211252168633643009	@syakejs 誰か飲みに行く人いますか？私は行きませんが...	{'place_id': 'f62cf04248a8314b'}
2019-12-29T10:29:01.000Z	1211232649194303488	ほんで今日はgrafにてDJです🙆‍♂️grafの店長と2人で永遠DJしてますんでお暇な方は飲みに来てくださいまし🍻 https://t.co/RZIA6ViLdJ	{'place_id': 'f62cf04248a8314b'}
2019-12-29T10:19:09.000Z	1211230165981777920	#ワンビアの乗車録青春18きっぷの旅　2019年冬　4日目その14【日付】       2019/12/29【乗車区間】田川後藤寺→新飯塚【座席】       【列車番号】1568D【行先】       新飯塚【車両】       キハ40 8063【備考】⠀    折り返し同じ電車！！車内で色々あり運転手さんに感謝された！ https://t.co/doE13sWAbn	{'place_id': '8d59909b600e0352'}
2019-12-29T10:03:33.000Z	1211226240708800512	綺麗なコインランドリーがあることは、地域の人にも旅行者にも愛される街であるひとつの基準。一家に一台洗濯機の時代ももはや変わりつつある。 https://t.co/JWJJgIsp6A	{'place_id': '83e30e314d0e5320'}
2019-12-29T09:28:13.000Z	1211217347660267521	電車で斜め前にFIDESの帽子被って寝てる人いてめちゃめちゃ気になる…	{'place_id': '9a9414fd6ec311ca'}
2019-12-29T08:48:53.000Z	1211207449056669696	公演見ながらオタ飲みに参加なう https://t.co/wrcagfPwai	{'place_id': 'f62cf04248a8314b'}
2019-12-29T08:23:36.000Z	1211201085727068160	プロが教える「エアライン」最新雑学! 旅行で得する＆空港で楽しめる（GetNavi web） https://t.co/P6E0UXiEKB	{'place_id': '457f617e602ae066'}
2019-12-29T07:49:37.000Z	1211192533969031168	本日発送18時までの営業です。珍しく今日と明日はTwitterの中の人が出勤です。	{'place_id': '10c028902d14c000'}
2019-12-29T07:36:04.000Z	1211189123026800640	ご連絡お待ちしております。#福岡 #博多 #天神 #福岡市 #旅行 #観光 #ホテル #もつ鍋 #Fukuoka #マリンメッセ　#ヤフオクドーム #福岡もつ鍋 #天神もつ鍋 #博多もつ鍋 #福岡旅行 #九州旅行 #zeepfukuoka #年末年始 #厚腸もつ鍋 #もつもつ #LDHPERFECTYEAR2020 #正月休み　 #天神グルメ #肉の日 https://t.co/ddf70iv8rg	{'place_id': '07d9eeb39d088000'}
2019-12-29T07:02:02.000Z	1211180560694906880	電車好きのお子様が前面展望していらしゃっしゃる	{'place_id': '06dee0fd8a4d815c'}
2019-12-29T06:47:15.000Z	1211176837969170432	博多駅後発の電車が着いた、納得いかない3分遅れ。	{'place_id': 'da55dfd4e124ccb5'}
2019-12-29T06:33:07.000Z	1211173280696029184	やっと、電車きました。そして、スペースワールド駅で遅れてる特急電車の通過待ちー。茉佑ちゃん、待ってろ！例のブツは用意してる！＃東原茉佑生誕祭	{'place_id': '0f026d7e49007a8d'}
2019-12-29T06:22:45.000Z	1211170671134265350	悲報上り電車4分遅れで運行中。それも特急だから、前の普通電車、八幡かスペワ駅で何分か止まるやつ。。、	{'place_id': '361d4120fc43007e'}
2019-12-29T06:14:55.000Z	1211168703154245632	黒崎駅で電車待ちの間におみくじロボットやりました。 https://t.co/CUbY9DFmOK	{'place_id': '361d4120fc43007e'}
2019-12-29T05:59:31.000Z	1211164825536978944	@mimi_0922_ 明日こそ ポム🐱出勤ですね✨(*^ω^*)サンリオキャラ 第3位のポムですっ‼️て元気に言うんやで⭐️	{'place_id': '06dee0fd8a4d815c'}
2019-12-29T05:28:35.000Z	1211157043219857408	日曜日オレ休みだからなんかあったら誘ってーって言った12時間後に出勤してしまいました。	{'place_id': 'f62cf04248a8314b'}
2019-12-29T05:17:53.000Z	1211154347444146184	ご連絡お待ちしております。#福岡 #博多 #天神 #福岡市 #旅行 #観光 #ホテル #もつ鍋 #Fukuoka #マリンメッセ　#ヤフオクドーム #福岡もつ鍋 #天神もつ鍋 #博多もつ鍋 #福岡旅行 #九州旅行 #zeepfukuoka #年末年始 #厚腸もつ鍋 #もつもつ #LDHPERFECTYEAR2020 #正月休み　 #ライブ終わりにもつ鍋 https://t.co/LLSwzdgTAQ	{'place_id': '07d9eeb39d088000'}
2019-12-29T05:15:13.000Z	1211153676015820800	糸島高校前駅。物販には全く間に合わなかったので、家に車を置いて電車で天神に向かいます。原直子さんのトークショーにも間に合わないかな？(^_^;)	{'place_id': '6772c147e8066ea1'}
2019-12-29T04:40:59.000Z	1211145064279396354	乗りたい電車間に合った😅 (@ 西鉄小郡駅 in 小郡市, 福岡県) https://t.co/NjUPw4rNyH	{'coordinates': {'type': 'Point', 'coordinates': [130.55364044, 33.39662498]}, 'place_id': 'deb3f9e0199e0633'}
2019-12-29T03:51:09.000Z	1211132519820644352	出先で昼食って一息ついたあとで通帳や現金入れたバッグ持ってきてないことに気付く。何しに外出してんだ。	{'place_id': '28d9f7c5865651ca'}
2019-12-29T02:32:29.000Z	1211112725373284352	@0jg7641Milk 今から電車で大宰府行きますがまた天神には戻って来ますw	{'place_id': 'f62cf04248a8314b'}
2019-12-29T01:20:50.000Z	1211094693779345408	2か月ぶりにマスクつけずに外出した	{'place_id': '06dee0fd8a4d815c'}
2019-12-29T01:10:18.000Z	1211092041066672132	三国志展へ向かう電車で乗り込んできた大人数の中国人をうざいと思うの巻。	{'place_id': '9a9414fd6ec311ca'}
2019-12-29T00:54:32.000Z	1211088075071188997	出遅れましたが、今電車出発しました。😅💦これから目的地に向かいます、まず博多駅で乗り換えです。☺ https://t.co/w5o9nm9tQl	{'place_id': '01784c311a5312c7'}
2019-12-29T00:32:18.000Z	1211082477189529600	神戸旅行2日目グルメ編アップしました🤗【グルメVlog】神戸グルメ探訪編Vol.2☆旧居留地・北野周辺の美味しいお店♪ https://t.co/a2wFDlDvgN @YouTubeより	{'place_id': '207e95d6143148a2'}
2019-12-29T00:22:08.000Z	1211079921918832640	9:12 #透析 スタート！日曜祝日手当が付くとは云え、我が儘云える時代に出勤している医療スタッフに感謝！	{'place_id': '207e95d6143148a2'}
2019-12-30T23:37:28.000Z	1211793456374243329	@kenzi91397663 kenziさんおはようございます😁出勤した記録だけつけてきます🤣	{'place_id': '06dee0fd8a4d815c'}
2019-12-30T23:07:34.000Z	1211785931557986304	@loveyassy @NissanJP @asahi 元経営者兼被告が、海外旅行を楽しんでいるようです。海外逃亡だったら、被告は、保釈金１億5,000万円を #日本政府 🇯🇵に納め、牢屋から出られないことになります。裁判所が、被告の出国を許可したのなら、｢人質司法｣を掲げながら｢可哀想な被告｣を演じることはできません。https://t.co/4ieRrZh2ow	{'place_id': '6f8692fbabd23e62'}
2019-12-30T22:47:02.000Z	1211780762992660481	今年は挑戦と継続が目標でした。英語は365日連続で勉強中😄今はスマホで外出先でも継続できて便利♪そしてyoutubeに挑戦。コンスタントに動画を作れなかったので来年はなるべく多く作りたい💻最大の目標は「やめない事」です。#喋りも上手くなりたい#下手でもやってみる#反省はそれから	{'place_id': '207e95d6143148a2'}
2019-12-30T21:45:27.000Z	1211765266725490689	今年最後の出勤は7時から眠いぜ	{'place_id': '1809b21424d0d7a1'}
2019-12-30T17:41:14.000Z	1211703807169585152	@emi_aaa514 ５時間後に仕事なんですけど…寝ないで出勤になるかも💦	{'place_id': 'a29d2918916e6486'}
2019-12-30T15:08:35.000Z	1211665389756661760	この電車終電か。	{'place_id': '19592724f6230037'}
2019-12-30T14:42:28.000Z	1211658816690900992	家につきました。今回の旅行では、プラサミ会場を除いても20人以上の人とあえて、本当に楽しかったです。また機会があればよろしくお願いします！	{'place_id': 'f62cf04248a8314b'}
2019-12-30T13:53:03.000Z	1211646383096131586	まあ色々言われてるけど…実際知らん土地で電車乗ってる時にコレやとイラッとするのは事実やな🙄ここ日本やろって思う🙄 https://t.co/e2PKKFGIFr	{'place_id': '06dee0fd8a4d815c'}
2019-12-30T11:49:05.000Z	1211615185926008833	振り返ったら12月は旅行やら二日酔いやらでノーラン。12月初ランが走り納めになりました(^^;;  #マリノア  #마리노아시티　#百道浜 #모모치해변 #福岡タワー #후쿠오카타워 場所: Fukuoka-shi, Fukuoka, Japan https://t.co/UKR0BGsGzI	{'place_id': 'f62cf04248a8314b', 'coordinates': {'type': 'Point', 'coordinates': [130.3833, 33.5817]}}
2019-12-30T11:15:45.000Z	1211606798114807808	カラオケで誰も知らない曲を歌おう選手権でUVER歌ったらひろきさんが2年前の宮崎旅行の移動時間にひたすらUVER聞かされたってだけの理由で知ってる認定されたからそーまくんに怒りたい👹👹👹	{'place_id': '83e30e314d0e5320'}
2019-12-30T11:05:10.000Z	1211604132219346946	@emi_aaa514 なんで一時間早く出勤して帰りこの時間😒毎年のこと…この時間に帰れるのに慣れてるところがね…べてらんさんになるとあとよろしく😃🙌で店長も丸投げで帰った！	{'place_id': 'a29d2918916e6486'}
2019-12-30T10:34:13.000Z	1211596342268592129	８時に出勤して今終わって帰るけど…何時間職場に拘束されるんだよ……パートのおばちゃんなんだけどこれからガソリン入れて家に帰ったら、主婦教務が待ってて、がめ煮「筑前煮」を作らんばとよね……なかなかハードなんだけど辛っ…	{'place_id': '6b52871b45b5b261'}
2019-12-30T10:27:49.000Z	1211594733329338369	長い長い8連勤も終わり今年は今日をもって仕事納め今から飲みに行くぞOh Yeah!Party People🤘😎🤘🎶🎶🎶	{'place_id': '01784c311a5312c7'}
2019-12-30T10:18:42.000Z	1211592439120588801	実家帰ってきたんだが誰か飲みに行けんかね	{'place_id': 'aa7c3ccdbb497079'}
2019-12-30T09:59:17.000Z	1211587554723561473	地元の忘年会に顔だけ出して(刺身だけ食べて)出勤します(*´罒`*)ビールうんまい… https://t.co/2xaJige1rb	{'place_id': '207e95d6143148a2'}
2019-12-30T09:13:07.000Z	1211575933007810560	本日は2019年営業最終日。今年もご愛顧いただきありがとうございました😆良い年をお迎えください✨#佐賀県 #佐賀市 #佐賀 #遊園地 #神野公園 #神野公園こども遊園地 #お出かけ #福岡 #長崎 #熊本 #子供 #こども #遊び場 #遊び #たのしい #楽しい 場所: 神野公園こども遊園地 https://t.co/9dphgA2U9o	{'place_id': 'a29d2918916e6486', 'coordinates': {'type': 'Point', 'coordinates': [130.28150347, 33.26507692]}}
2019-12-30T08:36:48.000Z	1211566796920233986	ウチのスタッフ(ほぼ幽霊部員)のアンと新館のキエンが、差し入れ持ってきてくれたよ♪そろそろ出勤してよ、アン(笑)  #極味や#極味や福岡パルコ店 場所: 極味やパルコ店 https://t.co/AaVuNTzTU8	{'place_id': 'f62cf04248a8314b', 'coordinates': {'type': 'Point', 'coordinates': [130.3983239, 33.5910158]}}
2019-12-30T08:32:16.000Z	1211565653309583360	ご連絡お待ちしております。#福岡 #博多 #天神 #福岡市 #旅行 #観光 #ホテル #もつ鍋 #Fukuoka #マリンメッセ　#ヤフオクドーム #福岡もつ鍋 #天神もつ鍋 #博多もつ鍋 #福岡旅行 #九州旅行 #zeepfukuoka #年末年始 #もつもつ #LDHPERFECTYEAR2020 #正月休み　 #天神グルメ #UVERworld  #レコード大賞 https://t.co/uTy3GMNGxI	{'place_id': '07d9eeb39d088000'}
2019-12-30T08:16:00.000Z	1211561561585635329	築城基地って電車からほとんど見えないんだなー	{'place_id': 'a6b5f5acee9327fa'}
2019-12-30T08:06:22.000Z	1211559137294737408	2人で映画を見に行けるような歳に娘が成長したかと思うと感慨深い。アナ雪2は忘れられない映画になるだろうなぁ。ポップコーンを盛大にぶちまけたことも含めて🍿	{'place_id': '06dee0fd8a4d815c'}
2019-12-30T07:44:32.000Z	1211553642769027073	旅行マニアが選んだ｢2020年こそ行くべき場所｣ リーマントラベラーが選ぶトップ15（上） | 街･住まい - 東洋経済オンライン https://t.co/wu3ANV3h8g @Toyokeizaiより週末旅に出かけよう！#リーマントラベラー	{'place_id': '207e95d6143148a2'}
2019-12-30T06:33:44.000Z	1211535825155964928	やっぱ自分の家(義両親外出時のみ)が落ち着くし、実家(さっきのオンボロ長屋じゃない方ね)より快適やわ https://t.co/cCY2l11xTG	{'place_id': 'a29d2918916e6486'}
2019-12-30T05:54:20.000Z	1211525909888557057	福岡旅行２日目 ６軒目中洲… https://t.co/fhoBa4yjHu	{'place_id': '83e30e314d0e5320', 'coordinates': {'type': 'Point', 'coordinates': [130.40805067, 33.59271638]}}
2019-12-30T04:52:30.000Z	1211510349490343936	@joni_32 そうなんすか！いつも出勤の時にはいないっす🤔	{'place_id': '67e8b450ce5fa959'}
2019-12-30T04:51:07.000Z	1211510000494895104	ご連絡お待ちしております。#福岡 #博多 #天神 #福岡市 #旅行 #観光 #ホテル #もつ鍋 #Fukuoka #マリンメッセ　#ヤフオクドーム #福岡もつ鍋 #天神もつ鍋 #博多もつ鍋 #福岡旅行 #九州旅行 #zeepfukuoka #年末年始 #もつもつ #LDHPERFECTYEAR2020 #正月休み　 #天神グルメ #UVERworld  #レコード大賞 https://t.co/lYRPI79AOG	{'place_id': '07d9eeb39d088000'}
2019-12-30T04:47:27.000Z	1211509076661637122	エチュードハウス♪#エチュードハウス#韓国コスメ#長女#二女#早く温泉でゆっくりしたい#家族旅行 場所: 福岡パルコ https://t.co/MDEelUNCDg	{'place_id': 'f62cf04248a8314b', 'coordinates': {'type': 'Point', 'coordinates': [130.39888774, 33.59091252]}}
2019-12-30T04:06:35.000Z	1211498791565611008	福岡旅行ラストはマリノアシティ福岡で終わりそうだな(´～｀)	{'place_id': '07d9ec9f18882000'}
2019-12-30T03:57:30.000Z	1211496507641192449	(｡´-д-)ﾊｧ-今日で福岡旅行も終わりかぁ〜…_(:3」∠)_	{'place_id': '28d9f7c5865651ca'}
2019-12-30T03:51:13.000Z	1211494925264674816	お出かけ (@ 折尾駅 in Kitakyūshū, 福岡県) https://t.co/f08xsb7FZz	{'place_id': '361d4120fc43007e', 'coordinates': {'type': 'Point', 'coordinates': [130.71199271, 33.86397126]}}
2019-12-30T03:21:55.000Z	1211487550843637760	福岡県糸島市へ旅行。昼ごはん。 (@ ビーチ食堂 Mr.BEACH in 糸島市, Fukuoka) https://t.co/hnq8GIAOfT https://t.co/skl4AAWcfI	{'place_id': '6772c147e8066ea1', 'coordinates': {'type': 'Point', 'coordinates': [130.198274, 33.557377]}}
2019-12-30T02:53:55.000Z	1211480503884247040	長女がキンプリが好きなのでジャニーズショップ♪#長女#キンプリ#ジャニーズショップ福岡#家族旅行#美容師の休日 場所: ジャニーズショップ福岡天神 https://t.co/txpXYw3SKZ	{'place_id': 'f62cf04248a8314b', 'coordinates': {'type': 'Point', 'coordinates': [130.39729345, 33.59401789]}}
2019-12-30T01:26:24.000Z	1211458482240512000	@elc024 いえいえ😃31日迄。年明けは1日から。2日迄出勤で3、4は休み。特養ですから。	{'place_id': 'a29d2918916e6486'}
2019-12-30T01:13:07.000Z	1211455138524590082	西唐津行き電車に乗車。	{'place_id': '6772c147e8066ea1'}
2019-12-30T01:11:54.000Z	1211454832512339968	今朝、旦那が出勤する時に、「今年のお年玉にケンタッキーとミスドとマックと資さんの福袋買って❤」と頼んたら無言でプラスチックのゴミ袋持って出ていきました。。。あっ、しまむらの福袋も頼むの忘れた。。	{'place_id': '0f026d7e49007a8d'}
2019-12-30T01:08:46.000Z	1211454044843044864	おそようございます( ˙~˙ )福岡旅行最終日です_(:3」∠)_	{'place_id': '83e30e314d0e5320'}
2019-12-30T00:58:51.000Z	1211451549253173248	田舎のジジババは電車乗るとうるさい	{'place_id': '83e30e314d0e5320'}
2019-12-30T00:57:51.000Z	1211451295820738560	@FZ25_Returner 歌舞伎町は観光するだけで素人は飲みに行くところじゃないかことにしてるんで	{'place_id': '83e30e314d0e5320'}
2019-12-30T00:55:51.000Z	1211450793754103808	そういえば、さっしーが西鉄電車で乗った車両が6502やったな	{'place_id': '1809b21424d0d7a1'}
2019-12-30T00:37:27.000Z	1211446163888472066	おはようございます🌂今日は長時間の外出はせずに餅付きして、年賀状書いて（←今更ww）、部屋の整理して気持ち良く新年を迎えたいです😄	{'place_id': '361d4120fc43007e'}
2019-12-30T00:17:28.000Z	1211441133085028353	ご連絡お待ちしております。#福岡 #博多 #天神 #福岡市 #旅行 #観光 #ホテル #もつ鍋 #Fukuoka #マリンメッセ　#ヤフオクドーム #福岡もつ鍋 #天神もつ鍋 #博多もつ鍋 #福岡旅行 #九州旅行 #zeepfukuoka #年末年始 #もつもつ #LDHPERFECTYEAR2020 #正月休み　 #天神グルメ #UVERworld  #レコード大賞 https://t.co/yjdhY1vhDq	{'place_id': '07d9eeb39d088000'}
2019-12-30T00:08:00.000Z	1211438752058396673	10時に出勤して、帰れるのが明日の21時ぐらい。嫌だなぁ。	{'place_id': '06dee0fd8a4d815c'}
2019-12-30T00:07:11.000Z	1211438544327102465	楽しかった代償にとてつもなく風邪をひきました()ほんとにうつってたら申し訳ない…帰ったら病院行きます…明後日旅行なのに😭😭ぴえんぴえん https://t.co/JlV8NA3caK	{'place_id': '07d9f10079487000'}
2019-12-31T23:49:59.000Z	1212158992807383040	新年早々寝坊してタクシーで出勤って超死にたいな？(夜中に騒いで寝なかった自分が悪い)	{'place_id': '207e95d6143148a2'}
2019-12-31T23:49:42.000Z	1212158922703831040	日付変わってから、約5時間、走行距離は110キロ。糟屋郡内7町の17の寺社やお地蔵様を参拝しました。事務所で1時間半仮眠した後、電車で都心を目指しています。10時半には地元に戻ります。最寄駅は　#門松駅　めでたい！ https://t.co/P6HUFrvSMh	{'place_id': '07d9ec9b45c84000'}
2019-12-31T23:27:23.000Z	1212153305750630400	出勤前に初詣羽黒神社 場所: Kashihara, Minami-ku https://t.co/WeuOMkKvZ3	{'coordinates': {'type': 'Point', 'coordinates': [130.39609186, 33.52535444]}, 'place_id': '207e95d6143148a2'}
2019-12-31T23:24:48.000Z	1212152654652067840	家族で旅行いきたい！！ https://t.co/dweThJc43b	{'place_id': 'f62cf04248a8314b'}
2019-12-31T23:21:52.000Z	1212151915598888960	@EnkasukiHeichan 浴衣での外出はお控えください	{'place_id': '83e30e314d0e5320'}
2019-12-31T22:28:46.000Z	1212138556031815680	ごめんなさい！LINEとかTwitterとか絡んでくれるのはありがたいんですが返す暇がありません！( ・`д・´)というより追えない！( ・`д・´)推しのツイートやらモバメでさえ追えてないんで許して(๑o̴̶̷᷄﹏o̴̶̷̥᷅๑)てことで夜勤終わったんで寝ます、起きたらまた出勤ですので(๑o̴̶̷᷄﹏o̴̶̷̥᷅๑)	{'place_id': '207e95d6143148a2'}
2019-12-31T22:00:49.000Z	1212131518975488000	電車待ち..。 (@ 天神駅 in 福岡市, 福岡県) https://t.co/XtMSTjaPoi https://t.co/onyvYN48tg	{'coordinates': {'type': 'Point', 'coordinates': [130.39885618, 33.59122865]}, 'place_id': 'f62cf04248a8314b'}
2019-12-31T20:15:02.000Z	1212104900517101569	@KAOGON6 おめでとうございます😊今年もよろしくお願い致します。本日早出勤務。ちなみに職場は全員出勤。早い朝食です。	{'place_id': 'a29d2918916e6486'}
2019-12-31T16:03:48.000Z	1212041672898404353	応募させて頂きます‼️‼️もし当選したら、ばあば連れて家族旅行に行きたいです🙏✨こういった応募になかなか当たったことないので今回こそは宜しくお願いします😌🙏 https://t.co/WgmdOdo61n	{'place_id': '83e30e314d0e5320'}
2019-12-31T16:02:46.000Z	1212041415561105408	@yousuck2020 あけましておめでとうございます。100万円に当選出来たら、息子が行きたい！！と言ってる沖縄と北海道に旅行に行きたいです。私は、息子に出来るだけ色んなことを体験させてあげたい。目で見て感じることを、させてあげたい。です！！飛行機にまた乗せてあげたい。	{'place_id': 'd3e7247214ae4e2d'}
2019-12-31T15:07:58.000Z	1212027624341544960	明けましておめでとう御座います🎉100万円当たったら宇宙旅行は無理ですが母と家族旅行に❗️当りますように😄 https://t.co/pIVZsBdGZP	{'place_id': '67e8b450ce5fa959'}
2019-12-31T14:58:56.000Z	1212025351595057153	結局今年も年越しは電車内かぁ... https://t.co/KDSc2eCAoj	{'place_id': '07d9c95c3fc83000'}
2019-12-31T14:48:14.000Z	1212022658306588673	皆さま2019年はお世話になりました。旅行へ行きまくったり、沢山美味しいものを食べたり飲んだり、富士登山したり、院試があったりの充実した1年でした。来年から関東で大学院生をすることになりますが、引き続き仲良くしてくれると嬉しいです。	{'place_id': '90670800ee355ca4'}
2019-12-31T14:39:05.000Z	1212020355725840385	その後散々な結果に終わった期末テストがあって冬休み。冬休みはクリスマスに自転車別府温泉旅行に行った。初の自転車泊まり旅行でめちゃくちゃきつかった。坂道がやばい。でも別府着いて疲れた体で入った温泉は最高に気持ちよかった。次行く時はカブでゆっくり行きたい。地獄めぐりもたのしかった。 https://t.co/GHp4rKFoGk	{'place_id': '06dee0fd8a4d815c'}
2019-12-31T14:35:51.000Z	1212019539883356161	春休みは進級記念の一人九州一周ヒッチハイク旅行をした。1人と言っても宮本と反対周りの熊本で会った。こんな長期旅行は初めてで楽しかったし達成感もあった。新元号が令和ってのを乗せてくれたおじちゃんに聞いた。全部で1週間。二村と野球見に行く約束しとった日の昼に着いたけんめっちゃぎりぎり。 https://t.co/PNhGPhGdVu	{'place_id': '06dee0fd8a4d815c'}
2019-12-31T13:54:30.000Z	1212009134205231104	@hime19550522 沖縄旅行で沢山リフレッシュ出来ました😊元旦から気持ちを新たに頑張ります🙇‍♂️後、メールってDMの事ですか？何回も見直したんですがメールは来てません( ；∀；)又送って頂いても良いですか？	{'place_id': '9ec333dd2f8d1d3c'}
