2020-11-13T09:14:40.000Z	1327178055664562176	駅前そば屋の定番の富士そば屋は残業代不払いそれどころか有給休暇扱い出勤させて従業員に裁判所提訴されてます。給料未払いは労働債権です。従業員が会社に金を貸している事です。富士そば屋の社長と役員は従業員債権者に土下座センカイ😡😡社長と役員報酬は全面的カットしてください。他社問題訴えろ	{'place_id': 'dca0d1073411f55e'}
2020-11-13T08:35:51.000Z	1327168284152668162	退勤！！職場に戻っても試験環境は戻ってなくて、日曜日に延期になった。休日出勤だ。予定がない日の休日出勤は振休がもらえるのでむしろ歓迎である。日曜日に復旧してないと詰む。競合しまくりの試験面とよわよわDBサーバ、どうにかしてくれ～ https://t.co/3hrGHuAW6U	{'place_id': 'f62cf04248a8314b'}
2020-11-13T07:59:12.000Z	1327159064057446400	平日でも満席になるほどの賑わい！ハンドルキーパーで来たけども、結局地元に戻ったら車を置いて飲みに行くという……。次の日は一日中二日酔いでした…。#焼肉 #大衆焼肉やまにく #糸島 #グルメ https://t.co/IFBl9t6tba	{'place_id': '11aa206bb9950000'}
2020-11-13T07:57:41.000Z	1327158679259414528	よいしょよいしょと乗る電車が見事に全部快速で南福岡⇄大野城を３往復目一生春日に着かん	{'place_id': 'aa7c3ccdbb497079'}
2020-11-13T07:06:16.000Z	1327145741488431105	楽しい西鉄電車の旅！ https://t.co/JHcKzfBV7a	{'place_id': 'deb3f9e0199e0633'}
2020-11-13T07:00:34.000Z	1327144305845264387	旅行中止の慫慂してくれたら、まぁ行くのやめるけど。	{'place_id': '7ca4f6231f5e7aeb'}
2020-11-13T06:47:20.000Z	1327140977400799234	いいね〜☺️仕事終わって電車乗って、駅に着いて駅のファミマで新鮮野菜買って、保育園に楓花を迎えに行って、帰宅して、ご飯作るって流れもいいねぇ☺️スーパー行かんで、そのまま降りて買えるの時短になるね😉ていう、復職後の妄想🥳	{'place_id': '9a9414fd6ec311ca'}
2020-11-13T06:46:17.000Z	1327140712052305921	私が出勤したときから店長の表情が冴えなかったので『具合が悪いor今日の作業が遅れているかだな』と感じ話し掛けると後者のほうだった。	{'place_id': 'a29d2918916e6486'}
2020-11-13T05:36:56.000Z	1327123257913434114	今日は　#九響　定期。昨日から2日間の定休。休日出勤も無く、久し振りににゆったりとした休日です。明日は朝から仕事なので、今日は早めにお風呂に入って、会場へ向かいます。 https://t.co/afMKn0ZEuw	{'place_id': '1809b21424d0d7a1'}
2020-11-13T05:23:07.000Z	1327119783301672962	@Sendai_701_719 電車だったのか！？Σ(ﾟДﾟ)	{'place_id': '684cc1cfd89cacef'}
2020-11-13T05:14:55.000Z	1327117719024570368	今回の旅行代金（ANA往復＋宿泊2日）と同じくらいの価格の照明を買いました笑　ありがとうございます！ (@ More Light in 福岡市, 福岡縣) https://t.co/RT68pFmBHz	{'coordinates': {'type': 'Point', 'coordinates': [130.41242, 33.576401]}, 'place_id': 'f62cf04248a8314b'}
2020-11-13T05:04:24.000Z	1327115070833192960	明日の試験の集合時間、13時過ぎ。いつも通り、朝散歩して、朝ヨガ行って。遅めの朝ごはんしっかり食べて、最寄駅ではお茶ぐらいにしとこうかね。電車の時刻、チェック完了！	{'place_id': 'a29d2918916e6486'}
2020-11-13T03:47:59.000Z	1327095840813445120	女の子とカラオケに行っても最初はイキってバックナンバーとかコブクロとか歌ってるんですけど酔いが回ってくるとおジャ魔女カーニバルとペガサス幻想と愛、覚えていますかとガツガツ‼︎とか歌い始めるので最初のイキリは無かったことになります	{'place_id': 'ed9d1fb34bf317e2'}
2020-11-13T03:39:02.000Z	1327093590351233025	@choco_choco117 世界旅行ですね(*бωб)	{'place_id': '1809b21424d0d7a1'}
2020-11-13T02:40:06.000Z	1327078756343713793	@jijicom 11/12、外出先で、私とは、顔も髪型も、スカートの色も違うのに、体型と上半身の服の色は似ている女が、付近にいるのを見かけました。嫌な感じがした私は、#旭日旗 のスマホ壁紙を周囲に見せて、人違いがないようにしました。服や体型が似ているだけでも、別人と見間違いの可能性があります。#袴田事件 https://t.co/wjPfi1H4Ds	{'place_id': '6f8692fbabd23e62'}
2020-11-13T02:37:13.000Z	1327078031693803520	おはようございます☀シュネコカフェ11:00より元気にオープンしております🥰🥰本日も太陽サンサンお出かけ日和ですね😽皆様のご来店、心よりお待ちしてます🖤ドイルくん🤍クッションでふみ〜ふみ〜🐾ウトウトしてて、とっても気持ち良さそ〜う😽#福岡猫カフェ https://t.co/oBiFPxwNi7	{'place_id': 'f62cf04248a8314b'}
2020-11-13T02:00:11.000Z	1327068711019167749	西鉄電車に初乗車。これで大手私鉄の全会社乗ったことになります。全線制覇には程遠いですけどね。 https://t.co/FqKc1XmK5z	{'place_id': '07d9f5c157080002'}
2020-11-14T23:58:00.000Z	1327762741168283648	今までの長崎駅しか知らない方は、乗る電車の10分前くらいにはかもめ広場にいっとかないと、そこから改札まで、走らされるよ、ホント(笑)	{'place_id': '9a9414fd6ec311ca'}
2020-11-14T23:34:04.000Z	1327756714851110916	出勤前に #恵方詣り と #吉方位取り 今日は西なので両方行けました☺️良いお天気で空も海も真っ青🥰 場所: 波津海岸 https://t.co/Zrygqtn3ck	{'place_id': 'd322b10e6a665c22', 'coordinates': {'type': 'Point', 'coordinates': [130.57112623, 33.87946985]}}
2020-11-14T22:21:29.000Z	1327738449412059136	おはよー世界！#今日の目標　・9時半チェックアウト・空港でお土産・DM送る・読書・24時までに就寝海外でも国内でも、旅行や出張で行く時に気を付ける事はいつもより多く寝る事！環境が変わると思ってるより疲れるので。今日は帰宅したら緩く過ごします🌱	{'place_id': 'f62cf04248a8314b'}
2020-11-14T15:24:47.000Z	1327633584509775872	義両親の誕生月に4人で旅行、サプライズケーキの相談をホテルにしたら、部屋orレストランどっち？って聞かれて、主人に相談後、レストランで！ってお願いしたら、レストランはその時間営業してません！って返信きたの。今までのやりとりなんやねん。	{'place_id': '06dee0fd8a4d815c'}
2020-11-14T14:18:55.000Z	1327617009710821376	@KUMA_0402 西鉄ホテルも暖房専用になってて窓開けたよ←8Fで目の前を西鉄電車が走行してるからカナリうるさいww	{'place_id': 'f62cf04248a8314b'}
2020-11-14T13:30:54.000Z	1327604924205547522	電車の中で見るべきじゃなかった最高 https://t.co/wTtyg2ys0O	{'place_id': '06dee0fd8a4d815c'}
2020-11-14T13:08:45.000Z	1327599351439364096	#おつかれ戦隊1114r2 #お疲れ様でした お疲れ様です屋台は最期の追い込みです今日は天気もよく休日の人はお出かけ日和でした高速道路はいつもより車も多く感じられました明日お出かけ予定の方お気をつけてそれではまた明日…… https://t.co/vR2uCTqyDv	{'place_id': '19592724f6230037'}
2020-11-14T12:48:23.000Z	1327594225324630016	西鉄電車旅人に乗車しました旅人車内では赤いボックスが設置されていて、旅人オリジナル開運カードが１人１枚づつもらえます‼️旅人に乗車した若いおねーちゃんが彼氏と「雰囲気が嵐電(嵐山電車)に似ている」とはしゃいでいました。うーん、わかるような気がします。(^ー^)#西鉄電車旅人 https://t.co/RqC1FQE0H7	{'place_id': '4bda4536528abe8f'}
2020-11-14T12:11:38.000Z	1327584978515922944	休日出勤久しぶり…しんど(^_^;) (@ セブンイレブン 福岡姪浜駅西店 - @711sej in 福岡市, 福岡県) https://t.co/s9Mtm2aqne	{'place_id': '28d9f7c5865651ca', 'coordinates': {'type': 'Point', 'coordinates': [130.32157322, 33.5832475]}}
2020-11-14T12:03:03.000Z	1327582817480441856	負けたら帰りの電車でも呑む😭🚅💨#クライマックスシリーズ https://t.co/YywPw2Wxc5	{'place_id': '0fc29d9ab055b000'}
2020-11-14T11:33:01.000Z	1327575258681942017	来週の土日は東京旅行	{'place_id': '207e95d6143148a2'}
2020-11-14T11:26:59.000Z	1327573742113865729	やべ💦ゆっくりし過ぎた💦出勤準備しなきゃ(笑)	{'place_id': '83e30e314d0e5320'}
2020-11-14T10:58:01.000Z	1327566450337333248	@_foxygirls @sake_yowa 神出勤の3人だけど 行けない😭今から保護者も一緒に面談。	{'place_id': 'd3e7247214ae4e2d'}
2020-11-14T10:38:22.000Z	1327561506326683648	@hemdaru6373 出勤ス。飲んでるだけですけどwww	{'place_id': 'f62cf04248a8314b'}
2020-11-14T10:34:33.000Z	1327560545793241088	@Nitizyo_Nisizyo 「徳島旅行」を総括した表現だよ！！鳴門線は、確か撫養駅が在りますよね！！	{'place_id': '0fc344eaa955b000'}
2020-11-14T09:55:16.000Z	1327550659646926850	休日出勤していました。 (@ 海鮮角打イタリアン じゃこくじら in 福岡市, 福岡県 w/ @yuuuka48) https://t.co/wzag3cPtid	{'place_id': 'f62cf04248a8314b', 'coordinates': {'type': 'Point', 'coordinates': [130.40189541, 33.59261612]}}
2020-11-14T09:42:40.000Z	1327547488442740736	西鉄電車に乗換🚃 (@ 中央口改札 in Fukuoka, 福岡県) https://t.co/PQosv6U7k2 https://t.co/fOb6ZXFueu	{'place_id': 'f62cf04248a8314b', 'coordinates': {'type': 'Point', 'coordinates': [130.39888139, 33.59125532]}}
2020-11-14T09:38:52.000Z	1327546532632006656	明日普通に出勤じゃん🙄腰やったって言ったよね私…あれ…言ったよね…今日は急やったけん無理して現場出たけど…	{'place_id': '4c6f6aa0ae926c41'}
2020-11-14T09:29:27.000Z	1327544163739467776	朝、博多駅で合流した広島の友人に見送られて、搭乗手続き完了👍とりあえず羽田まで帰るぞ～😉楽しかった福岡旅行も終わりだぁ～😭 https://t.co/im2RxJw1be	{'place_id': '83e30e314d0e5320'}
2020-11-14T08:59:17.000Z	1327536569893326848	《１１月１４日土曜日》皆さん、こんばんは！今日もとても良い天気でしたね～☀️紅葉も見頃だし絶好のお出かけ日和でしたね(^-^)さて今夜も３７３は１９時オープンです❗店内除菌、換気して皆さんのご来店お待ちしてま～す(^-^)v https://t.co/0XTBkxJQ3Q	{'place_id': 'f62cf04248a8314b'}
2020-11-14T07:54:29.000Z	1327520262883999745	国産にこだわって使っている富士通のarrowsが立ち上がらなくなった。研修中はかまえなかったので今ラウンジでいろいろ試みているがダメそう。携帯が使えないと今時電車にも乗れないな。まあ切符を買えばいいのだけれど。 場所: くつろぎのラウンジTIME (Relaxing Lounge TIME) https://t.co/TDW3V3UL15	{'place_id': '83e30e314d0e5320', 'coordinates': {'type': 'Point', 'coordinates': [130.44748669, 33.59948519]}}
2020-11-14T07:54:19.000Z	1327520219187740672	旅行の日にはよならんかなー←あと3日	{'place_id': '4c6f6aa0ae926c41'}
2020-11-14T07:02:39.000Z	1327507216975486977	近場ですけどお出かけします　グリーン車が満席だったのでデラックスグリーンを取りました (@ JR 博多駅 in Fukuoka, Fukuoka Prefecture) https://t.co/EtP8ZvBgQQ https://t.co/C13K5NMy89	{'place_id': '83e30e314d0e5320', 'coordinates': {'type': 'Point', 'coordinates': [130.420685, 33.590138]}}
2020-11-14T06:56:46.000Z	1327505736901951488	今宗像市にきてます本日も晴天なり#イマソラ#宗像市#お出かけ https://t.co/nauPjZbJVb	{'place_id': '19592724f6230037'}
2020-11-14T06:51:16.000Z	1327504353284947969	ウェイト終了後電車とグッデイに工具箱🧰買いに行きました！	{'place_id': '4c6f6aa0ae926c41'}
2020-11-14T06:15:59.000Z	1327495473746169857	早くコロナが消滅してうきはの宝で働くばあちゃんたちとバスを借りきって温泉旅行に行きたいです。そこでご長寿クイズをしながら中継で映像を流したいです。	{'place_id': '1809b21424d0d7a1'}
2020-11-14T05:17:30.000Z	1327480757594562560	久しぶりにみんなでお出かけ、買い物以外でいつぶりだろうか…。急に思い立って、朝から糸島に紅葉を見に行ってきた。またお寺めぐりして行きたいなぁ〜#今日のみさみさ #紅葉 #おでかけ #糸島 場所: 雷山 千如寺 https://t.co/tLBgTAmbEq	{'place_id': '6772c147e8066ea1', 'coordinates': {'type': 'Point', 'coordinates': [130.22888089, 33.49472372]}}
2020-11-14T04:10:38.000Z	1327463927555399680	裸で電車ごっこしてるお子たちを発見!?(*ﾟДﾟ*) https://t.co/rokdFM4PhP	{'place_id': '83e30e314d0e5320'}
2020-11-14T03:49:33.000Z	1327458622339567616	今日・明日がベストな #紅葉 見ごろになりそうな #油山市民の森 🍁もみじ谷🍁15時を過ぎると急に寒くなるのでお早めのお出かけを🏃‍♀️🏃‍♂️💨#すいとーよ油山 https://t.co/4CrLAUby6g	{'place_id': '207e95d6143148a2'}
2020-11-14T03:14:26.000Z	1327449787046653952	本日11/14(土)オープンマイクにエントリーの皆さんです。まだ空きがあります、参加希望の方はご連絡ください！観覧の方は予約不要なので気軽に飲みにきてくださいね。中溝正樹さんしばたよしゆきさん渡辺純二さんぽんきちさん妖Yohさん終了後22時位から通常バー営業です。 https://t.co/bxpglz0DDb	{'place_id': 'f62cf04248a8314b'}
2020-11-14T02:07:27.000Z	1327432929375522816	いかん。放課後、ビックカメラにiPhone12miniを見に行った。めちゃくちゃ良い。iPhone5に戻った様な感じ。片手で苦なく画面の端まで届くのが良い。でも画面は7よりでかい。値段は7万ぐらいらしい。次買い換えるときはiPhone12のミニのSIMフリーを買いたい。SIMフリー買っとくと海外旅行の時も便利。 https://t.co/B637rA3qiY	{'place_id': 'f62cf04248a8314b'}
2020-11-14T02:05:55.000Z	1327432545168879616	@masakyharada 会場に向かう電車の中で読みました。ありがとうございます。今からクライエントに逢いに行くと思って行ってきます！	{'place_id': '1b2a1dff4f189343'}
2020-11-14T02:00:11.000Z	1327431098666602496	帰る途中照葉のスーパーで買い物して近所のスタンドで相棒にガソリン補充して帰宅出勤前に冷却水やエンジンオイル等チェックして明日の準備完了納車から半年&amp;走行距離が5000キロ越えるので明日の夕方SOXでオイル交換します。明日が楽しみです。 https://t.co/D5VXKHgJad	{'place_id': '07d9cbd6f6481000'}
2020-11-14T01:52:37.000Z	1327429194784014336	今日の佐賀県は最適です#イマソラ#佐賀県#お出かけ https://t.co/gwXXGSOcC0	{'place_id': 'ed9d1fb34bf317e2'}
2020-11-14T01:47:47.000Z	1327427978427449347	朝方#小鉄 が布団に潜り込んできて目覚め#二度寝 したお陰で完全に #寝坊今から出勤です#締切 が気になってる皆様ちゃんと仕事しますよ御安心を〜	{'place_id': 'f62cf04248a8314b'}
2020-11-14T01:37:48.000Z	1327425468446822402	せっかくの旅行なのに、みんなカリカリしてる。嫌なことも聞き流してもっとしなやかに過ごせばいいのに。	{'place_id': 'f62cf04248a8314b'}
2020-11-14T00:28:56.000Z	1327408136504836098	9:50まで電車待ちにつき、駅ホームでかしわうどんをイーティング https://t.co/MulHxm4A8P	{'place_id': '0fc3865ac0d41001'}
2020-11-14T00:13:39.000Z	1327404291078856704	あっどうしよっ、コールドブリューとスイーツ口ん中絞りこみたみっ、でも焼けるわこの時間外出たくない、ウーバーさんはなんか諸料金が許せなくて使いたくない(まだ贅沢したくない)、ん～～	{'place_id': '0feb8e41f2b83801'}
2020-11-14T00:06:30.000Z	1327402490891968512	夢の中でスイス🇨🇭に団体旅行行ってたんだが。今日は移動で15時フロント集合で起きた。夢診断難しいだろう	{'place_id': '9a9414fd6ec311ca'}
