2021-02-28T23:15:44.000Z	1366165215813849089	@poteto777p たぶん同じ電車🚃	{'place_id': '10399e3c0b1f3a07'}
2021-02-28T22:41:17.000Z	1366156548381155329	出勤前に早起きしてもう一度、不本意アンロックの見逃し配信を観た。観るの6回目だけど、やっぱりちょっと感動した。劇なので元々架空の人達だけど、朱流セイル、佳、エニシ、樹、周、栗内そして田口でさえ明日からもう会えないのが寂しい。#不本意アンロック#劇はじ #劇はじロス https://t.co/tlFouEO0et	{'place_id': '06dee0fd8a4d815c'}
2021-02-28T22:22:53.000Z	1366151918226051073	皆さんおはようございます。今日は車検のためお昼前後からの仕事になります(と言っても、出勤は後30分ですけどw)問題は･･･お昼までに車検が終わってれば良いな～…🤔💭	{'place_id': '28d9f7c5865651ca'}
2021-02-28T21:46:50.000Z	1366142843266371587	おはようございます。明るくなり始めた空。西の空にお月さん。今朝はそこまで寒く無い。これから出勤です。今日もよろしくお願いします。	{'place_id': '06dee0fd8a4d815c'}
2021-02-28T21:00:13.000Z	1366131112745918466	6時出勤クソ眠い	{'place_id': '1809b21424d0d7a1'}
2021-02-28T15:59:26.000Z	1366055416782725121	今日は寝る🥱残りの分は明日出勤迄に上げれたら上げよう。おやすみなさい🌙#そろそろ寝よう#おやすみなさい	{'place_id': '361d4120fc43007e'}
2021-02-28T14:09:31.000Z	1366027756656496640	明日から新しい現場に通勤します！希望の通勤経路で許可が下りたので、めでたく3月もバス通勤できることが決まりました。明日から西鉄バスとJRを乗り継いで出勤します。SUGOCA定期初購入、これにより手持ちの SUGOCA/nimoca/はやかけん に定期券を印字することができました。お仕事頑張るぞー！！ https://t.co/vyDU8ZANp5	{'place_id': '06dee0fd8a4d815c'}
2021-02-28T13:55:39.000Z	1366024267138101254	いつぶりにおめかししてお出かけしたやろう😋いかちゃんのカラコングリーンで可愛い😍 https://t.co/jjBQal2Y1Z	{'place_id': 'ae083492b529328a'}
2021-02-28T13:50:45.000Z	1366023032578318340	今日は仕事で参加できんで残念やったけど、いつかNNR君と一緒に西鉄電車撮りたいな～。こういうの考えるとワクワクする。	{'place_id': 'da55dfd4e124ccb5'}
2021-02-28T13:35:31.000Z	1366019202037948421	今日は木管三重奏+チェンバロのコンサートに行った。いい音楽を全身に浴びる感じ。良かった〜😇最近レッスンで教えて貰った『音を出す直前に自分がどうしたいかを周りに伝える』のをどう実践されているのかガン見して学びました。得られるものが沢山ありました！ https://t.co/7Fcx0wJe9z	{'place_id': '207e95d6143148a2'}
2021-02-28T12:27:13.000Z	1366002014321213440	土曜日まで休日出勤&amp;深夜残業！流石にヘロヘロ状態。。そんな今日は癒し三昧‼️食べる前に撮れなかった…そこまで疲れが貯まってたんですよねぇ( ノД`)… https://t.co/e18xPqD7Mk	{'place_id': '83e30e314d0e5320'}
2021-02-28T10:01:12.000Z	1365965265419128834	遠くの競輪場に行く際にお世話になっていた旅行会社が来月4日に閉店とのこと。いやぁ2月は悲しくなるような知らせばかりだった。3月は良い知らせもある月になるといいな😃 https://t.co/xhxIqwK9zD	{'place_id': '1809b21424d0d7a1'}
2021-02-28T09:32:25.000Z	1365958022514626563	サザエさんはなんで、旅行できるの？コロナ禍なのに……┐(´-д-｀)┌くそぉー。たまには家の中で遊ぶOPも流せ〜😤笑笑	{'place_id': 'a29d2918916e6486'}
2021-02-28T09:27:27.000Z	1365956774633725952	喉痛てーでも楽しかった！酔っ払いカラオケにお付き合い頂いた皆様ありがとうございました！！ ┏○ﾍﾟｺｯ	{'place_id': 'd67424014a26ea2f'}
2021-02-28T08:15:28.000Z	1365938659254431747	もしかしてだけどもしかしてだけど簿記3級の解答速報で87点で合格取れたんじゃないの🎶朝早めに出たら人身事故で電車動かず11時に再開って聞いてすぐにバスで博多駅へ移動…だけど博多駅からの方が会場に近くラッキーでした✨勉強も大事だけど試験会場行くのも万があると思い知らされたよ…	{'place_id': '684cc1cfd89cacef'}
2021-02-28T07:18:16.000Z	1365924261932621824	電車に揺られて八幡に。途中、暖かそうな赤いマフラーの落とし物を発見。斜め前に座ってた女の子のものではないかと。彼女は、福工大前で降りていきました。学生にとってはマフラーは大事な品ではしょう。一応、落とし物で届けるものの、あとは仏様のみぞ知る。本人に上手く戻ればよいのだけど。 https://t.co/GHzL12ntVV	{'place_id': '19592724f6230037'}
2021-02-28T06:17:59.000Z	1365909093488058369	簿記3級が終わって久しぶりにカラオケに行きました🎶ONAKAMAの3バンドの曲それぞれと昨日、hydeさんと清春さんがトークしたニコ生観たのでSADSの忘却の空とhydeさんのBELIEVEING IN MYSELFとINTERPLAYのPVで歌えて楽しかったです(笑) https://t.co/a6yv9P7y39	{'place_id': '684cc1cfd89cacef'}
2021-02-28T04:46:15.000Z	1365886005996228608	西鉄電車天神大牟田線、特急が大橋に止まるようになってから、特急のスピード感が消えた感じがする。特急→急行急行→準急に格下げしたような感じで乗ってます。 https://t.co/HakZkkGxqB	{'place_id': '0fc2fdd12e947000'}
2021-02-28T01:43:48.000Z	1365840092070252548	出勤中、西鉄電車の切符売場で視聴覚障害の男性に、どうされましたか？と声をかけて代わりに切符を購入してあげている男子学生をら偶然見かけました。人との距離がちょっと遠くなった今だけど、泣けた	{'place_id': 'f62cf04248a8314b'}
2021-02-28T01:29:00.000Z	1365836365204660227	本当はね豊スタ行きたかったけど…そこを本拠地にしてるチームの試合を見に来たこれで俺も豊スタに行った気に……。なれないw https://t.co/1duoZ9XLgU	{'place_id': '1122fc20e914d001'}
2021-02-28T01:09:49.000Z	1365831537841762309	両親のリクエストで飯塚までちこっとお出かけ。	{'place_id': '06dee0fd8a4d815c'}
2021-02-28T00:31:45.000Z	1365821960479891459	@aizen_092 おはーざーす❣️え、twiggy⁉️カラオケにあるんですね‼️独りカラオケ行って🎤自分の下手なフロウを磨いて見たくなりました。	{'place_id': '83e30e314d0e5320'}
2021-02-28T00:22:59.000Z	1365819751906168835	今日は科学館勤務ですが、通勤電車の中で卒論生の統計的検定について対応中。今、検定結果が出たという連絡が携帯メールに届きました。科学館に着いたら出勤時間入力前にZoomで卒論生と相談します。次は六本松。毎日が充実しています♪。	{'place_id': 'f62cf04248a8314b'}
2021-02-28T00:03:20.000Z	1365814807975268353	@piyochan_shufu 私も20歳の時にイギリスに短期留学させてもらって、海外にどハマりして、そのまま旅行会社に就職しました〜✨　今も飛行機乗る時とか、荷物パッキングするときドキドキワクワクします😄海外早く行きたいー！！！	{'place_id': 'f62cf04248a8314b'}
2021-02-28T00:02:50.000Z	1365814681793748994	今週も1週間赤門屋をありがとうございました。昨晩は退院後初めて営業時間フルで働きました。しっかり働いてみんなで飯を食う。嬉しかったし楽しかった。来週はさらに出勤時間を増やしてアクセルを強めていくので、さらに勢い付いた赤門屋をお見せできるでしょう。ドンミスイットやで！！！ https://t.co/ohsDVOJlnt	{'place_id': '07d9db6e31480001'}
2021-03-01T23:43:59.000Z	1366534715616858116	おはようございますそろそろ出勤久留米セット長野県上田向け〜	{'place_id': '06dee0fd8a4d815c'}
2021-03-01T23:39:55.000Z	1366533691921457153	鹿児島で「マグマやきいも電車」　アフロマンスこと中間理一郎さんが企画 https://t.co/EU9gDFtx4Z	{'place_id': 'da55dfd4e124ccb5'}
2021-03-01T22:28:31.000Z	1366515721849556992	@Yama_Tsubaki おはようございます🌧️🙋福岡は雨☔降ってますし突風🌬️が吹いてます😫そして寒いです🥶昨日はちょっと生暖かったです。今、電車🚃に乗りました。行って来ます🖐️	{'place_id': 'aa7c3ccdbb497079'}
2021-03-01T21:47:03.000Z	1366505285452500997	おはようございます。今朝は雨降り。風強くて寒い。それでは出勤です。今日もよろしくお願いします。	{'place_id': '06dee0fd8a4d815c'}
2021-03-01T17:31:03.000Z	1366440862649966592	@CBDoiljapan420 無理ならお出かけすれば良い🍒✌️🌈	{'place_id': '06dee0fd8a4d815c'}
2021-03-01T15:32:54.000Z	1366411129916858370	明日からパパは中勤てやつやけん、あたしは時短やけど、パパの出勤とはすれ違い😂4月いっぱいまでは、お風呂入れから寝かしつけまで一気に一人でせやーん😂仕事始まったら、保育園迎えに行ってからが勝負や💨今みたいにのんびり過ごせない💦	{'place_id': '9a9414fd6ec311ca'}
2021-03-01T14:43:57.000Z	1366398812353298433	@JTB_jp 自由に旅行が出来るようになったら、10年以上前にカナダ留学🇨🇦した時のホストファミリーに、子ども達を会わせてあげたいです👧🏻👧🏻👶🏻💕連絡をとる度に＂コロナが終息したら早く会いたい!!＂と言ってくれるので、私達も1日でも早く会える日を願うばかりです🙏🏼#未来の私にプレゼントしたい旅	{'place_id': 'da55dfd4e124ccb5'}
2021-03-01T13:59:45.000Z	1366387687863721990	僕のアイコンありました。ありがとうございます。とても嬉しいです。こういうの本当に元気が出ます。いつか一緒に電車撮りたいですね。 https://t.co/KU1ykj2Haw	{'place_id': 'da55dfd4e124ccb5'}
2021-03-01T12:22:08.000Z	1366363122915708930	@peroperochanko ですね😅私はバツの独身、今日は、23歳の独身女性と、お泊り案件💕独身同士だから、いいよね😉駅の駐車場で、お相手待ち🚗この娘と待合せの時は、電車の到着時間まで、いつもドキドキする💓	{'place_id': '06dee0fd8a4d815c'}
2021-03-01T11:29:10.000Z	1366349792968798210	電車来るまえ、色々見ましたが・・・画像１、九州新幹線もう開通10年経つの？😳自分は４年前アイカツ オフィシャルショップが熊本のゆめタウン光の森で期間限定の時、正月でみずほ号(東京方面でみたら、のぞみ号的)で乗っただけです、１回だけ。😅また行ってみたいです、九州新幹線で。😃✨🚄 https://t.co/8NYT4Clqis	{'place_id': '07d9e3d2d7883002'}
2021-03-01T09:22:44.000Z	1366317973334421506	@i_piariso おめでとう！！飲みに行こうね！メイク会もしよ！！	{'place_id': 'f62cf04248a8314b'}
2021-03-01T07:25:15.000Z	1366288407257784320	@morisitamio １月に家🏠の近くにも開店しました😆今迄は通勤電車🚃で途中下車して駅中の店で購入してました😅本当に安い食品が多いですね😉	{'place_id': '06dee0fd8a4d815c'}
2021-03-01T04:18:51.000Z	1366241496664449028	ハンバーグ＆バー　POTお昼のハンバーグランチ美味しかった～いつか飲みにも行きたいです https://t.co/kbX9n6WVNw	{'place_id': 'a29d2918916e6486'}
2021-03-01T03:57:57.000Z	1366236239272108034	アラーム⏰💥に全く気付かず 12:00に起きてしまった😂バタバタ出勤ですが、皆さん今週も宜しくお願いします✌️ https://t.co/M3p2aaPJYc	{'place_id': 'ae083492b529328a'}
2021-03-01T03:18:42.000Z	1366226360797077504	出勤。めっちゃ暑い。帽子の代わりにネット使う。今日も頑張ろう。	{'place_id': '66b3953bdc6122dd'}
2021-03-01T03:16:00.000Z	1366225680166387712	前回ぽーたま食べた次の日から、油味噌も食べたくてずっとぽーたまに向かおうとしてるのに南へ東へ飛ばされ続けていまだたどり着いてない。なのでそのためだけにウバッグ背負って外出しようと思う。千円稼いだらオフぽーたま	{'place_id': '83e30e314d0e5320'}
2021-03-01T02:26:21.000Z	1366213187465449476	そろそろ夜勤出勤しますか。	{'place_id': '361d4120fc43007e'}
2021-03-01T01:59:17.000Z	1366206374770745347	みなさん、おはようございます‼️今日も素晴らしい天気ですね🌤お出かけの際には是非お昼ご飯はよもぎうどんでお願いします👍美味しいうどんやサクッとジューシーな唐揚げやサクサクのごぼう天などを用意して、みなさんのご来店をお待ちしております🙆‍♂️今日も開店しまーす‼️#嘉麻市 #よもぎうどん https://t.co/8B7qCl5XvB	{'place_id': '07d9d43e6f483004'}
2021-03-01T01:55:24.000Z	1366205399397928963	透明度半端なし！慶良間島には大学の卒業旅行でクジラを見に行ったことあります。また行きたいですね。＃沖縄　＃慶良間諸島　＃ケラマブルー https://t.co/ottua44umQ	{'place_id': '207e95d6143148a2'}
2021-03-01T00:47:58.000Z	1366188426605731846	今日から七隈線のダイヤが変わったっぽいー。いつもの時間に家を出て、いつもの時間に駅に着いたのに電車が来る時間が違った。2分後ろにズレたけど、時間の余裕はあるので問題ないです。	{'place_id': 'ae083492b529328a'}
2021-03-02T23:36:33.000Z	1366895232323756033	久しぶりに地下鉄出勤中。	{'place_id': '06dee0fd8a4d815c'}
2021-03-02T22:45:41.000Z	1366882430968156164	@yabecchi_vic おはようございます🤗戦略的重役出勤ですって言い訳考えてたけど、皆さん朝活されてて逆に早起きだったこと忘れてたウッカリ薬剤師は私ですwよい一日を😘今日もよろしくお願いします🙌	{'place_id': 'ae083492b529328a'}
2021-03-02T22:32:42.000Z	1366879164024819712	@Shin_medaka お早い社長出勤ですねっ🤭おはようございます☀️🙋‍♀️❗この後いつもの🤣	{'place_id': 'aa02369974b2c1f9'}
2021-03-02T22:18:32.000Z	1366875599088746496	是非とも月面旅行行きたいです。よろしくお願いします。 https://t.co/WON5j2jdjJ	{'place_id': '06dee0fd8a4d815c'}
2021-03-02T21:47:59.000Z	1366867908949778433	おはようございます。今朝は雲多めの空。東の空は青空見えて朝焼け空へ。風は冷たい。それでは出勤です。今日もよろしくお願いします。	{'place_id': '06dee0fd8a4d815c'}
2021-03-02T19:59:25.000Z	1366840588557975554	小：合同が嫌で不参加中：不登校の為不参加高：苗場スキー場（途中で帰った、初めて飛行機に乗った）大：卒業旅行①屋久島　　卒業旅行②沖縄なおぼくはゼミなしっ子なので専門演習の旅行とかも行ってないです留：ユーロスターとシティナイトで巡る大陸7泊8日、その後中退 https://t.co/uuh6LwCGmE	{'place_id': '0fbeafeace541000'}
2021-03-02T16:28:12.000Z	1366787435011530755	おはようございます😴たけは今からひな祭りのひなちらしを作りに出勤致します😴丹精込めて作りますので皆さんぜひ食べてみて下さいね😴✨#雛祭り#ちらし寿司#たけからお届け	{'place_id': 'dca0d1073411f55e'}
2021-03-02T12:28:52.000Z	1366727204764221442	〜緊急事態宣言解除〜帰宅途中の満員電車の中、吊り革に掴まっているとマスク越しに明らかに誰かの口臭と判るニンニク唐揚げの臭い。口臭に新型コロナウィルスが混ざってないようにと祈りつつ、通勤の無い在宅勤務の幸福感を思い出す。	{'place_id': '4c6f6aa0ae926c41'}
2021-03-02T11:09:34.000Z	1366707248316219398	西鉄電車に乗換🚇 (@ 中央口改札 in Fukuoka, 福岡県) https://t.co/RceWedB0t8 https://t.co/S1Sa4fg2dT	{'place_id': 'f62cf04248a8314b', 'coordinates': {'type': 'Point', 'coordinates': [130.39888139, 33.59125532]}}
2021-03-02T07:52:41.000Z	1366657700990308353	@durga_017 ありがとうございます🙇こんなに苦手なことが続けられたのは初めてです。次回の香港旅行までに、少しでも英語で話せるようになりたい！と…英語ができなくてどうする！と初めましてなのに香港のホテルマンにお小言を言われたののリベンジです😅💦	{'place_id': '684cc1cfd89cacef'}
2021-03-02T07:22:54.000Z	1366650205995626496	早速着てお出かけ。（笑）仮面ライダーのパーカーとの組み合わせですみませんwww特撮オタ全開ですみませんwww#evilwire #仮面ライダー #GU #code https://t.co/DTFhGlkWji	{'place_id': '83e30e314d0e5320'}
2021-03-02T03:21:57.000Z	1366589569307615232	お出かけランチ～懐かしい、会津ラーメン～「ラーメンセット」～🐧🐷🐧 https://t.co/jSoYaLWmWm	{'place_id': '6772c147e8066ea1'}
2021-03-02T03:13:58.000Z	1366587557627092993	出勤。昨日と逆で寒い😨花粉症も辛いし😔今日も頑張ろう。	{'place_id': '66b3953bdc6122dd'}
2021-03-02T02:27:31.000Z	1366575868135440387	そろそろ夜勤出勤しますか。	{'place_id': '361d4120fc43007e'}
2021-03-02T00:22:29.000Z	1366544403129503747	新婚旅行はモルディブでした。もっとゆっくり行きたかった。 https://t.co/hQCfVxwJjy	{'place_id': '207e95d6143148a2'}
2021-03-03T23:33:45.000Z	1367256914812231682	@pato_jp プーケットに旅行行った時は必ず寄ってました。岐阜にも一度お邪魔しました。また行きたいなー。	{'place_id': '83e30e314d0e5320'}
2021-03-03T22:05:43.000Z	1367234758766338049	@hiroka8bts 旅行いきたーい💗💗	{'place_id': '67e8b450ce5fa959'}
2021-03-03T21:48:45.000Z	1367230490759950338	おはようございます。今朝は曇り空かな。風はないけど、ひんやり。今は雨降ってないけど、帰る頃には雨降り出すのかな？それでは出勤です。今日もよろしくお願いします。	{'place_id': '06dee0fd8a4d815c'}
2021-03-03T20:29:44.000Z	1367210606382571521	出勤	{'place_id': 'd458617907c51263'}
2021-03-03T20:16:54.000Z	1367207375501856770	再来月は関東あたりに旅行しよう	{'place_id': '207e95d6143148a2'}
2021-03-03T15:33:15.000Z	1367135991425687556	@durga_017 短期留学だけでなく、台湾人の生活も垣間見れるなんて、面白くて充実していたことかと思います✨私は台湾料理の脂が合わず、何も食べられなくて大変申し訳ないわ、げっそりして帰国するわでした💦アメリカ旅行、最高にアメリカ満喫で羨ましいです✨帰りの飛行機まで😍✨最高ですね💕	{'place_id': '684cc1cfd89cacef'}
2021-03-03T14:29:59.000Z	1367120071554854919	来週の健康診断所定の勤務で出勤して受けるみたいやけどその日バリューム飲むから仕事にならんやろ（笑）	{'place_id': '361d4120fc43007e'}
2021-03-03T13:18:06.000Z	1367101982582796290	今日は #桃の節句🌸唐津のまちなかでは #唐津のひいな遊び を開催中です🎎唐津に残る5つの歴史的建造物で愉しむ様々な時代の #お雛様 期間は今週3月7日（日）まで📣ぜひお出かけください☺️▼ https://t.co/tVCHEM5OVU https://t.co/73w0bzFQFM	{'place_id': 'dca0d1073411f55e'}
2021-03-03T12:55:53.000Z	1367096390199824388	コレは見なければ😁大江さんはわたしの住む町の隣市🤣月旅行立候補しました。理由:ルナエンバシー社から購入した月の土地をまじかに見たい。 https://t.co/nX3VCl5Gpe	{'place_id': 'a6b5f5acee9327fa'}
2021-03-03T12:35:30.000Z	1367091262361202696	@ymmt_photo 家の自宅には、風呂がありません、ので銭湯に通っております、バスで５分～10分の銭湯はコロナ禍の為お休みなので、電車で福岡市内の銭湯に行っております。	{'place_id': 'b625c675c61c863b'}
2021-03-03T10:56:03.000Z	1367066235007983616	#福ふくの里#菜の花 満開🙌電車来た🚞と思ったら、反対からも来た🚋春ですね🎵🚴‍♀️🚴‍♂️Location : 福岡県糸島市二丈福井６３３３#自転車 #ロードバイク #サイクリング #腳踏車 #ポタリング #九州のサイクリストと繋がりたい #福岡  #糸島観光 #左側通行  #鬼滅のチャリダー #サイクリング糸島 https://t.co/KL1NZPCWFF	{'place_id': '6772c147e8066ea1'}
2021-03-03T10:45:41.000Z	1367063623781150722	明日5時30出勤やぞ笑笑	{'place_id': '1809b21424d0d7a1'}
2021-03-03T10:43:37.000Z	1367063106069819395	ありゃ、電話確認したら父ちゃんから着信あったよ。電車降りたら折り返すべぇ。	{'place_id': '0feb8e41f2b83801'}
2021-03-03T10:23:53.000Z	1367058138961117186	1年電車に乗ってない1年女の子がいる飲み屋に行ってない半年外食してない半年外泊してない2ヶ月酒を飲んでない生活が変わった	{'place_id': 'd86aacdaf45b3cbd'}
2021-03-03T10:07:19.000Z	1367053970422730753	明日は5時出勤。寝る。	{'place_id': 'd458617907c51263'}
2021-03-03T10:06:54.000Z	1367053864285794306	福岡市もワーケーションでビジネスホテルに適用して旅行会社に頼んで5,000円割引みたいなのが今日の西日本新聞の一面に出ててズッコケました。 https://t.co/XMrU9i0C1Y	{'place_id': 'ae083492b529328a'}
2021-03-03T09:25:47.000Z	1367043514752622594	@mo_ko_mo_ どこ行きの電車さ🤔	{'place_id': 'f62cf04248a8314b'}
2021-03-03T06:05:47.000Z	1366993184228741121	2りんかんに愛機預けて電車＋歩きで帰宅中·····JR初乗り210円になったの知らなかった、何でも上がるな〜😥	{'place_id': '67e8b450ce5fa959'}
2021-03-03T06:05:08.000Z	1366993022651490306	ＺＯＺＯ前沢氏、月旅行８人募集 https://t.co/H4DOB0bMbn @sagashimbunより	{'place_id': 'a29d2918916e6486'}
2021-03-03T04:04:10.000Z	1366962578979651588	食った食ったーと思って外出たら https://t.co/bfzczhp7kf	{'place_id': '83e30e314d0e5320'}
2021-03-03T03:12:27.000Z	1366949563500662787	出勤。めっちゃ眠い💤疲れてる証拠かな🥺今日も頑張ろう。	{'place_id': '66b3953bdc6122dd'}
2021-03-03T03:11:10.000Z	1366949243458629636	出勤 (@ 大西化成 in 宮若市, 福岡県) https://t.co/o4J8XNv3Nx	{'coordinates': {'type': 'Point', 'coordinates': [130.642042, 33.746046]}, 'place_id': '66b3953bdc6122dd'}
2021-03-03T02:39:53.000Z	1366941367872622592	@iwachan91223460 また電車が発車したあとに～😢	{'place_id': '07d9f5c157080002'}
2021-03-03T02:26:09.000Z	1366937912768565248	そろそろ夜勤出勤しますか	{'place_id': '361d4120fc43007e'}
2021-03-03T02:00:06.000Z	1366931358392619009	@mikimurai バス対電車は、いいね！続けて下さい。宜しくです。😃✌️	{'place_id': 'f137852bc138e15b'}
2021-03-03T00:50:00.000Z	1366913715501600772	出勤時によく使う電車最近混んでるな〜って思ってたら、本数が減ってこっちに集中してるっぽい。小倉までは長いので、そのうち座れるからそこまで問題ないけど。 https://t.co/OxKVcD9sSW	{'place_id': '06dee0fd8a4d815c'}
2021-03-03T00:05:56.000Z	1366902624612618243	昨夜から博多に滞在。誰かランチでも行きませんかー？夕方から飲みに行くのも大歓迎。#博多#天神#ランチ#裏アカ #遊び用	{'place_id': 'f62cf04248a8314b'}
2021-03-04T23:12:01.000Z	1367613832785391617	おはようございます🌞本日の福岡は晴れのち曇りです⛅️気温もそんなに低くなく、ジメッとしています ( ˙ᒡ̱˙ )🌂金曜日ですね！✨弊社は明日まで出勤ですがラストスパート頑張りましょう！💪#企業公式が毎朝地元の天気を言い合う#企業公式春のフォロー祭り #福岡 #天気  #イマソラ https://t.co/mpnxwNIdI4	{'place_id': '07d9eb9a1d885000'}
2021-03-04T21:47:18.000Z	1367592513532358662	おはようございます。雲多めの空。雨はやんでる。風はあるけどそこまで寒く無い。それでは出勤です。今日もよろしくお願いします。	{'place_id': '06dee0fd8a4d815c'}
2021-03-04T14:17:30.000Z	1367479316510953472	#緊急事態宣言再延長反対すべき事(←病床の確保、ワクチン開発の促進、給付金の一律給付など)を一切せずしなくて良い事(←緊急事態宣言をダラダラ延長、飲食店への一律支援、若者への旅行自粛など)は沢山やりこんな政府の為に税金払ってるのがバカらしくなる✊	{'place_id': 'd458617907c51263'}
2021-03-04T14:11:30.000Z	1367477806054006785	みさです🥰金曜、土曜出勤します👚11時から17時半スタート位迄💕週末自分にたっぷりご褒美✨✨ほぐしストレッチ&amp;アロマでリフレッシュして運気UP🐬⤴️❤️✨🙆‍♀️🤞😆 　#スッキリ ＃ストレッチ　＃筋膜　#オイルマッサージ ＃リンパ　＃鼠蹊部　＃技術　＃血流改善　＃デトックス　#博多メンズエステ https://t.co/N7fauOA4TQ	{'place_id': '83e30e314d0e5320'}
