2021-06-12T08:37:26.000Z	1403632523528179713	電車の棚に忘れてたバッグ20年と使っているだろう3泊４日くらいはこれで済ましていた下げてるワイヤー式ハンガーは、昔はクリーニング物についていたこれを使って部屋干ししかしていない物干し竿は持っているが昨年の台風以来避難しっぱなし https://t.co/CphO9HuHh5	{'place_id': '6772c147e8066ea1'}
2021-06-12T07:54:32.000Z	1403621728706654210	あと1時間待たないと発券した電車来ない・・・もっと早い便予約すればよかった・・・耐えてくれよ生体！	{'place_id': '83e30e314d0e5320'}
2021-06-12T06:59:07.000Z	1403607779277897735	マリノアシティの観覧車を下から。久しぶりの外出。試合がないと暇だなー。 https://t.co/rQD8Ei8XLr	{'place_id': '28d9f7c5865651ca'}
2021-06-12T05:28:06.000Z	1403584876394127360	いつもありがとうございます☺️✨✨緊急事態宣言解除になったら、CBDビール🍻飲みに来て下さいね😋女性に人気の@cannapresso_jp VAPE PENです✌︎︎✌︎︎ https://t.co/NUjoXFieuo	{'place_id': 'f62cf04248a8314b'}
2021-06-12T04:29:11.000Z	1403570051416956932	雨が降る予定だったから映画を見に行ったのに出てきたら晴れて…見えるのは私だけでしょうか？	{'place_id': '83e30e314d0e5320'}
2021-06-12T03:24:15.000Z	1403553707589980163	少し前の新聞記事#リモートワーク は事業継続性のために大事男は出勤したがる女は在宅したがると、同友会できいた https://t.co/xUEXR1BVh6	{'place_id': 'aa7c3ccdbb497079'}
2021-06-12T01:52:54.000Z	1403530719964504064	電車好きな方へプレゼント🚋😊ドヴォルザークさんに見せてあげたい。#かわせみやませみ https://t.co/oqthDKh8T9	{'place_id': '108523b250d46000'}
2021-06-12T01:49:51.000Z	1403529951039528960	@mikUsan_n 30代です♂仕事でドタバタしてるので、飲みに行ったり、優しくしてくれると大変なつくと思います。	{'place_id': '207e95d6143148a2'}
2021-06-12T01:45:26.000Z	1403528838970183689	こんな夢を見たいがテーマですね。私は海外旅行に行く夢が見たいです。スペインが好きなのでまたバルセロナにまた行きたい https://t.co/YklzTfbg0g	{'place_id': '207e95d6143148a2'}
2021-06-12T00:25:12.000Z	1403508648677052416	@syoujikun0363 コロナの関係で外出外泊ができません。寂しいです。	{'place_id': '19592724f6230037'}
