2020-06-01T10:51:35.000Z	1267408444077686791	たまに電車乗るとストレスしかない。車の良いところは車内はプライベート空間なところ。事務所も母以外とは無理だな。一人事務所直行便。こうしてワガママ(自由)になってゆくのね。	{'place_id': 'f72cbd7b378a05fc'}
2020-06-01T10:50:09.000Z	1267408083224899589	帰りの電車、普通に混んでる😓	{'place_id': 'b9351bbc6fc4189d'}
2020-06-01T10:50:08.000Z	1267408080196648961	ほんとだ。電車めっちゃ密。でも、無数にある仕事の中で満員電車使わなきゃ行けない勤務先を選んだんだからこれは誰に文句を言う話でもない。	{'place_id': 'dcc2630623880f96'}
2020-06-01T10:49:16.000Z	1267407863997034496	しごおわ。小雨だけど外出てみようかな。花火！	{'place_id': '4c1c4868f96634ed'}
2020-06-01T10:48:28.000Z	1267407659990319112	まあ、空いていたときから電車の席は3蜜ですけどね	{'place_id': '76c498282a5a7997'}
2020-06-01T10:48:20.000Z	1267407627782197249	店舗や学校の再開で、まちのムードが少し変わってきていますね。だんだん外出する機会が増えそうな方も、変わらずお家で過ごす時間が長い方も、お気に入りのコーヒーと過ごすホッとできる時間をぜひ、1日の始まりや、終わりに。#コーヒー #福祉 https://t.co/bz1t6HXLJZ	{'place_id': '28b9063fdce43645'}
2020-06-01T10:44:55.000Z	1267406768902008833	くっそ久しぶりに電車乗る	{'place_id': 'b74d0f4a87a68c66'}
2020-06-01T10:44:39.000Z	1267406700346105857	電車で座れない、、、、汗　#2メートル	{'place_id': '594fa6c6bc5b5ba9'}
2020-06-01T10:44:11.000Z	1267406585850028032	とりあえず自主的に外出自粛よね🤧	{'place_id': '411f0aa7fce9a8fc'}
2020-06-01T10:43:29.000Z	1267406407411752960	@2784U56 リプも含めて電車の中で読んではいけないものでした🤣	{'place_id': '28b9063fdce43645'}
2020-06-01T10:42:57.000Z	1267406272774541312	明日も早番（フル出勤）になった〜😅	{'place_id': '920d3a170bebcb1a'}
2020-06-01T10:42:08.000Z	1267406069577310208	"@zero_oj お出かけ→ケーキ買った→帰宅からの( '༥'  )ŧ‹""ŧ‹""ŧ‹""ŧ‹""ŧ‹"""	{'place_id': 'a1383746d9e64c93'}
2020-06-01T10:41:29.000Z	1267405904372133890	また二日連続かー明日からいよいよ店舗に出勤やのに家からかよって大丈夫かな https://t.co/q4Qt4isnns	{'place_id': 'a1383746d9e64c93'}
2020-06-01T10:39:32.000Z	1267405413823074305	今日もお疲れ様です🍳久しぶりの出勤？の方も多いかもしれません。今日はなんと、当院の内定者がYouTubeで動画配信をスタートしました👀💓#有料配信　ではなく、無料配信です✨#校長先生の話  よりも遥かにタメになるでしょう🤩🎤#就活生にエールを https://t.co/6R9LYY1sQA	{'place_id': '0fc3486077155000'}
2020-06-01T10:36:43.000Z	1267404705115680770	電車やバスでマスクを着用していない人を見かけます。最低限のマナーとして着用して欲しい。	{'place_id': '86315f8740971686'}
2020-06-01T10:34:42.000Z	1267404196828950530	二ヶ月ぐらいぶりに蒲田出勤なので https://t.co/jBPc0opHEf	{'place_id': '07d9c9e009488001'}
2020-06-01T10:33:14.000Z	1267403829781225472	今日は出勤日でした🚃一日の疲れをジャズピアノで癒す夜😌💿🎹✨✨#RobertLakatos #ロバートラカトシュ #澤野工房https://t.co/BOuqUPTri6 https://t.co/wC4115IYzq	{'place_id': '4ad3383e25ac98d9'}
2020-06-01T10:32:58.000Z	1267403761409916929	電車動かず...。結局駅外のコンビニで買ってきた。ザ🍋クラフト、初めて。大人の味🙂 https://t.co/JLcm8UpoCi	{'place_id': 'b41f5dcb002a1886'}
2020-06-01T10:28:37.000Z	1267402667950632961	渋谷の工事がまじでいらなかったと思ってしまいました🥺多数の色んな方々が何かしら便利になったのなら良いとはおもいます。少なくとも自分は不便被ってます(´∵`)ｼｭﾝ自分を追い抜いた電車が数十メートル先まで行った所で止まり、乗ろうと走るも電車が先にあるから間に合わず発車します💦	{'place_id': 'f7c22e0cf7b3af2b'}
2020-06-01T10:27:57.000Z	1267402496772734976	欧州を視察と称して大名旅行を繰り返した前と知事に対し次々と難題に対応、ご苦労さまです。 https://t.co/fn9hyl6OaM	{'place_id': '1ca8e0d6512be99d'}
2020-06-01T10:26:34.000Z	1267402150323208193	久しぶりの出勤終えた。疲れますわね…	{'place_id': '7ee61f505fdfdf5c'}
2020-06-01T10:26:20.000Z	1267402090382417920	@mamachan99 うめこさんもすっかり電車が混んでるので家でいい人達が出勤する必要性を感じていたようす	{'place_id': 'afd2dbc6df82cca8'}
2020-06-01T10:25:30.000Z	1267401882407854080	アベノマスクとやらが届いたけど、こんな小さいのなんていらねーよ！三密でイベントとか無観客とかの前に電車が一番危ないぞ。	{'place_id': 'd2262f18bc1f84c5'}
2020-06-01T10:25:01.000Z	1267401761779671041	@Caesar1915 混まない平日の夜が良さそうですね☺️電車🚃に乗るのも久しぶり…来週の早い内がいいな‼️いつも本当にありがとうございます😊	{'place_id': 'f1299e526e0cc34d'}
2020-06-01T10:24:38.000Z	1267401664211775488	@omejirapid103 向こうも商売とはいえ、濃厚接触の温床ですからね…その辺の満員電車よりもよっぽど危ない。	{'place_id': '77173905596af4ab'}
2020-06-01T10:23:15.000Z	1267401314926866432	@zin_zin @alice_187 @itinoe ですよね。私の最初の転職は転職先に猶予を半年開けてもらいましたし。次の転職に至っては半年給料満額貰いながら出勤せずに転職活動しました。	{'place_id': '7efb0fd5276fdda5'}
2020-06-01T10:23:04.000Z	1267401271629115392	https://t.co/OAxssFrebuコロナ後のリモート継続を希望する人が年代ごちゃ混ぜでも過半数を超えたらしく。Withコロナ時代における営業は基本的にリモートでの営業にしてもらえると助かる。満員電車でみんなで営業に赴くとかもう辞めましょ。逆にリモートしたくないもう半数の理由を聞きたい。	{'place_id': '735b6f2b933efaf6'}
2020-06-01T10:23:02.000Z	1267401262724599808	約2ヶ月振りの電車通勤。今日は帰りだけだけど、まぁまぁ混んでんな。いくら会社でソーシャルディスタンスって言ってもリセットされた気分。在宅の方が装備が充実してて会社行く意味がわからなくなった…	{'place_id': '8b0ea1e7e0f9eba8'}
2020-06-01T10:22:10.000Z	1267401042032947203	なにが「新しい日常」だ(｀Δ´)通勤電車は「元の日常」のままやんけ(怒)(怒)(怒)	{'place_id': 'db215c78c59027e4'}
2020-06-01T10:21:55.000Z	1267400980540186624	思いの外電車混んでて	{'place_id': 'bcf7dca0cae1c2e6'}
2020-06-01T10:21:05.000Z	1267400769566736385	タイの海外旅行者受け入れは最善のシナリオで10月。タイ国政府観光庁 東京事務所所長に聞く新しい日常と観光 - トラベル Watch https://t.co/k0UN1es50l	{'place_id': 'f7c22e0cf7b3af2b'}
2020-06-01T10:20:56.000Z	1267400732732305409	しごおーわ！久しぶりに出勤したと思ったらメンバー三人のうち二人休み！一番繁忙な月初に‼️病み上がり、期間限定虚弱体質の中年をこんなに駆けずり回らせて、明日休むからね‼️定休日だから(笑)	{'place_id': '519decbcbebfd98d'}
2020-06-01T10:18:36.000Z	1267400145466830853	本日は雨の為、バイクはお休み。それでも仕事には行かないと行けないので久しぶりの電車通勤。帰りは新宿中本へ。新宿店限定インド北極＋粉チー＋プチライス。カレーが溶け込んだ北極スープを最後まで飲んで満腹満足です。ジャンボ北極は次回挑戦します。#蒙古タンメン中本 https://t.co/knxOP2t8M8	{'place_id': '0fc294d462546001'}
2020-06-01T10:18:17.000Z	1267400064579727360	もう満員電車には乗りたく無い。	{'place_id': '4ad3383e25ac98d9'}
2020-06-01T10:17:17.000Z	1267399813743566848	@a50s_sencounter 懐かしい👍😁新婚旅行の汽車で買ってもらったけど、恥ずかしくて、食べられなかった💦６０年近く前です😆💕✨パッケージが立派になっています✌	{'place_id': '03060ba847e52dcd'}
2020-06-01T10:16:45.000Z	1267399679060242432	時短勤務継続なんだが、みんな同じ時間帯に終わるから、結局満員電車に…。これなら、居酒屋で飲んでから帰った方が三密をクリアできるのでは？？？#在宅勤務#満員電車	{'place_id': '4f8c5ba59b1e3250'}
2020-06-01T10:16:19.000Z	1267399572625616896	9末まで交代勤務継続🥺週2出勤🥺🥺もう普通に戻れない笑笑🥺🥺🥺🥺	{'place_id': '28b9063fdce43645'}
2020-06-01T10:15:07.000Z	1267399267569692672	電車めっちゃ人増えてきたな。。緊急事態宣言終わったけどコロナ0になったわけじゃないんだから、今までテレワークでなんとかなってた会社はも少し継続しててくれてもいいのにな	{'place_id': '28b9063fdce43645'}
2020-06-01T10:14:44.000Z	1267399172543541248	田園都市線急行おかげさまで通常の三密電車になり、また遅れるだろうな🤣#田園都市線 #TDL	{'place_id': '920d3a170bebcb1a'}
2020-06-01T10:14:03.000Z	1267399001197776897	@haiyuza 2013年の「とりつくしま」の時も2児の若い母親役でしたが、長男が亡くなり好きだったオモチャの電車が走っていたのを思い出しました。あとおまけが良かったです。笑	{'place_id': '336251fac4207ae3'}
2020-06-01T10:11:45.000Z	1267398420056006657	だいぶ帰りの電車が混んできてる。でもまだ座れるからこれからなのか？🤔	{'place_id': '28b9063fdce43645'}
2020-06-01T10:09:34.000Z	1267397874045734918	今日は用事が有ったので昼から不調ながらも外出してビックマックをテイクアウトしたのだけど、帰宅したらいつものBOXでは無くメガマフィンの包紙。また間違えたのかと（以前にも入れ忘れ事件有り）電話をしたらBOX不足な為代用しているとの事、その場で一言伝えるべきでは無いのだろうか？#マック	{'place_id': '962b0af43cd1ad6c'}
2020-06-01T10:08:35.000Z	1267397626355306496	@Kojo0619 なんで電車か？	{'place_id': 'd9ac10e7c031f3c2'}
2020-06-01T10:08:28.000Z	1267397594335985664	朝はラッシュがバラけてるけど帰りはどこも同じらしく朝よりも電車が混んでる…。#帰宅ラッシュ #通勤ラッシュ #通勤電車	{'place_id': '28b9063fdce43645'}
2020-06-01T10:06:39.000Z	1267397136422821893	みんな時差出勤で早く来てるのに家より会社の方が捗ると進んで残業していたのでヘンタイ	{'place_id': '594fa6c6bc5b5ba9'}
2020-06-01T10:03:39.000Z	1267396383226515459	緊急事態宣言が解除され、6月に入った。人出が戻ってきた。電車も混んできた。また、通勤が苦痛になる。#通勤百景 https://t.co/zRsLzE8Lae	{'place_id': '28b9063fdce43645'}
2020-06-01T09:59:08.000Z	1267395244531695618	東海道線はおっさんとバトルする電車 https://t.co/fWK7CVuL4e	{'place_id': '1df8c91136c4c140'}
2020-06-01T09:58:52.000Z	1267395177489915904	つぐちゃん出勤中♪お話に来て下さいね☆22時迄！#西川口 #コスプレ #コスプレカフェ #コスプレバー #メイド #メイドカフェ #メイドバー #カフェバー #コンセプトカフェ #コンカフェ https://t.co/ZJyKwPNapu	{'place_id': '0ff5b03999546000'}
2020-06-01T09:57:46.000Z	1267394904285515776	今日は2ヶ月ぶりに出社。行きの電車はまぁまぁ空いてたけど、帰りの電車は結構混んでる😢東京駅横のKITTE地下街の超人気店はガラガラでした。 https://t.co/K5Qaoa6ric	{'place_id': '07d9db6b89084002'}
2020-06-01T09:53:34.000Z	1267393844552712199	むっちゃむかついて帰宅。ご機嫌の悪い私の話を「うんうん」ってきいて高校生の息子がひとこと「その人が他人に優しくできるようになるといいね」きみはほんとに優しいなあ。母は、そいつが帰りの電車の乗り継ぎが悪いといいのに！とか思う(人がちっちゃい)	{'place_id': '1d5d82d43a574e4f'}
2020-06-01T09:52:53.000Z	1267393671889993728	@meikohaigou 電車混んでるよ〜(≧з≦)	{'place_id': 'a35b6b4421e1a506'}
2020-06-01T09:51:10.000Z	1267393241445330947	電車動いてるなう	{'place_id': '0fd33386c57b038a'}
2020-06-01T09:48:40.000Z	1267392612790493186	@Chika_chm 最近の私もそうです笑電車待つ間電子レンジでチンしてる最中...ずーっとTwitter見てます（笑）	{'place_id': '594fa6c6bc5b5ba9'}
2020-06-01T09:47:07.000Z	1267392223034740737	新型コロナ対策で作家さんも隔週で出勤なさっているので、自撮りしてみました。自撮り難しいなぁ。#まいどスポーツ https://t.co/Uk0Zg1zsmQ	{'place_id': '594fa6c6bc5b5ba9'}
2020-06-01T09:47:05.000Z	1267392213635354624	エレベーターに壁向いて乗るとかクリーニング店に一人ずつしか入らないとかが無駄に思えるくらい電車混んでるぞ	{'place_id': '4c1c4868f96634ed'}
2020-06-01T09:45:57.000Z	1267391930553348097	たまには自分も。どうぞよろしくです😌#車乗りとして軽く自己紹介名前: Kei性別: 男年齢: 33歳身長: 170cm住み: 辰巳PAの近く職業: 経営コンサルタント愛車: Porsche 911 Carrera Cabriolet好き: カメラ、クルマ、旅行、彼女一言: 被写体募集中です^^ https://t.co/Wqqs1bky7z	{'place_id': '0fc29952aa146002'}
2020-06-01T09:44:36.000Z	1267391590194020353	このズボン、おれ本当に3か月前 履いてたのか、、？(明日久々出勤)	{'place_id': 'd313627ad749ca61'}
2020-06-01T09:43:38.000Z	1267391344193855488	超絶に密な電車。こんなの第二波くるぜ	{'place_id': '44bd8dbe9ffe1625'}
2020-06-01T09:41:09.000Z	1267390721385918464	電車が密すぎてやばいな	{'place_id': 'd9ac10e7c031f3c2'}
2020-06-01T09:40:31.000Z	1267390561532604416	6月１日をもって、三田線の満員電車🚃🚻🚻🈵が華麗に復活‼️	{'place_id': '77173905596af4ab'}
2020-06-01T09:40:27.000Z	1267390542842716160	満員電車( ꒪౪꒪ )	{'place_id': '65b41c11aca77bdb'}
2020-06-01T09:39:59.000Z	1267390425859362818	電車混んでるな‼️コロナ発症前に近くなってきた様な感じだな❓再び感染拡大なんてならなければいいけどな😰	{'place_id': '94c92bc0c4b78c62'}
2020-06-01T09:39:26.000Z	1267390287246057472	羽田→ドバイのEK313、奴隷船77W(オンボロ772で運航の日もあり)なのでできれば乗りたくないんだけど、ヨーロッパやアフリカに旅行する時の定番でもう3回乗ってて、色んな思い出が詰まってるから時々無性に乗りたくなる https://t.co/YllHfRX6h8	{'place_id': '0fc2eb1ef0d4f000'}
2020-06-01T09:39:04.000Z	1267390195080425473	#あつ森 #あつ森交換  #あつ森マイル旅行券譲）マイル旅行3枚求）パームツリーランプのレシピ	{'place_id': '1df8c91136c4c140'}
2020-06-01T09:39:01.000Z	1267390185974697987	今日はリアル出勤日だったので「本家しぶそば」さんで「もりそば」を食べてから帰ってきた。 (@ 本家しぶそば - @sibusoba in 渋谷区, 東京都) https://t.co/tKnQNIXkoF https://t.co/siROtbxb1K	{'place_id': 'f7c22e0cf7b3af2b', 'coordinates': {'type': 'Point', 'coordinates': [139.70104505, 35.6585418]}}
2020-06-01T09:36:39.000Z	1267389590362415104	ロシアンティーを飲みに来るやつだ！（笑） https://t.co/QldBdLJbJy	{'place_id': '519decbcbebfd98d'}
2020-06-01T09:36:24.000Z	1267389525073903617	久々に電車に立って乗ってるけど、足が痛い🦵耐性がなくなってるww	{'place_id': '1b0cfebe3424e14f'}
2020-06-01T09:34:29.000Z	1267389044087906304	いろんなご意見が飛び交っておりますな“満員電車”がさっそくトレンド入り　「第2波が来そう」「なんでテレワークを続けない？」などの声が集まる https://t.co/A8YArCCZwm	{'place_id': '7efb0fd5276fdda5'}
2020-06-01T09:31:55.000Z	1267388396378316800	@shizuokamatsuz1 @GakunanEtrain 松坂屋・岳南電車店開店？(^_^;)	{'place_id': '28b9063fdce43645'}
2020-06-01T09:29:27.000Z	1267387776665698305	朝からお財布持ってソワソワしてる人。どこか行くの？と聞いてもちょっとそこまでだの月がきれいですねだの言ってるけどしろたん屋さん行くのバレバレ紫陽花きれい小さなお菓子セットを手土産に電車に乗る人今日はクレープなんて気にも...とめな...いのだ！#しろたん#気まぐれキュウーバー https://t.co/wifvW2bsBJ	{'place_id': '594fa6c6bc5b5ba9'}
2020-06-01T09:25:25.000Z	1267386760914337792	@tk3605hallo ホームセンターのんがもしかしたら更に安かったかなぁ…😅💦電車移動になって行動範囲が一気に狭くなった分、選択肢が無くなっちゃった面わ否めませんね💦	{'place_id': '336251fac4207ae3'}
2020-06-01T09:25:04.000Z	1267386674742300672	本日の出勤予定つぐちゃん　19〜22ちぃちゃん　20〜23:30 https://t.co/DJ7FcW5pbJ	{'place_id': '0ff5b03999546000'}
2020-06-01T09:24:10.000Z	1267386446865891329	あおいちゃんも6月から出勤増えるみたい^_^楽しみだね！ https://t.co/n4aEAksxRb	{'place_id': '7efb0fd5276fdda5'}
2020-06-01T09:22:55.000Z	1267386132003577857	久々の電車通勤、横浜駅で上野東京ラインを眺めながら、緊急事態宣言明け最初の“越境”は大宮のセイコーマートもいいかな、なんて…:*:・(￣∀￣)・:*: #セイコーマート  #越境 https://t.co/m91YnoBb2m	{'place_id': '962b0af43cd1ad6c'}
2020-06-01T09:22:54.000Z	1267386129017274368	電車の手すりとか、よく見たらピカピカなのね。普段は白く濁った反射してるのに、コロナ対策で綺麗にクリーニングされてるみたい。誰も掴んでないみたいだから安心して掴む。	{'place_id': 'dded92a2db180dd1'}
2020-06-01T09:19:21.000Z	1267385233101385728	酷い話しですね😱警察官がコレでは障害ある方はいつまでも外出出来ないし健常者に負けまいと頑張ってらっしゃる方を踏みにじってる😡😡😡 https://t.co/4zIumL89UG	{'place_id': 'ed61afd47a8bfd91'}
2020-06-01T09:17:08.000Z	1267384678731771904	二ヶ月ぶりに電車乗ってる！	{'place_id': '76c498282a5a7997'}
2020-06-01T09:13:39.000Z	1267383801002332171	うわぁ、帰りの電車混んでんな	{'place_id': '962b0af43cd1ad6c'}
2020-06-01T09:11:16.000Z	1267383198712922113	大阪と神奈川のライブハウス再開のガイドラインを見たけど、あんな厳しいガイドラインではライブハウスに「営業するな！」と言っているのと同じでしょう？マスクをして声も発さないのに客と客の間を2m取らなければならないのなら、電車でも職場でも飲食店でも人と人の間を2m取らなければならないよね。	{'place_id': 'e1868e4848694c69'}
2020-06-01T09:09:24.000Z	1267382732507631616	残業、準夜勤、夜勤、24時間勤務の方お疲れ様です。https://t.co/n1Ntbll3za明日は私は通常通り出勤いたします。なお明日は通常通りの勤務となっております。	{'place_id': '5cf616c8f739cb2b'}
2020-06-01T09:09:22.000Z	1267382724391833600	電車を途中で降りて晩ご飯、角煮ラーメン（太麺）いただきます (@ 纏 高幡不動店 - @matoi_takahata in 日野市, 東京都) https://t.co/lcJ48rn4ti https://t.co/MaeMTIkTDQ	{'place_id': '5cf616c8f739cb2b', 'coordinates': {'type': 'Point', 'coordinates': [139.41455481, 35.6611889]}}
2020-06-01T09:08:54.000Z	1267382606858907649	ミーティングで久々に出社したけど、普通に満員電車なのね、、	{'place_id': '03060ba847e52dcd'}
2020-06-01T09:08:27.000Z	1267382493558140929	@ht626_sghg 今日出勤したくないめぅ	{'place_id': 'd313627ad749ca61'}
2020-06-01T09:06:02.000Z	1267381881412042753	なんか電車の中で遊戯王カードをワサワサやってたヤツがガン見してくるんだが。	{'place_id': '1b0cfebe3424e14f'}
2020-06-01T09:05:00.000Z	1267381621746855936	今、電車の中で目の前座ってるおばさんが電話に出て相手に『今電車の中なんで…』切ったのは良いけど、電話に出た時点で駄目だろって…	{'place_id': 'bc892a7922752d1a'}
2020-06-01T09:04:16.000Z	1267381440431284225	"「""密""に戻っている」「めっちゃ増えた」 6月からの職場復帰ラッシュで「満員電車」復活 https://t.co/sEtnec99bk( ´Д`)y━･~~ 7月からまた緊急事態宣言とかだと意味ねー"	{'place_id': '27b43920b8b63188'}
2020-06-01T09:03:38.000Z	1267381280351481863	@Lapis__pis 暴走電車を紹介しましょうか？(震え声)	{'place_id': '43d0bb3c4e9eb702'}
2020-06-01T09:02:12.000Z	1267380917342859266	@fMUqqHZvmz4NMti まるで京阪電車の旧塗装の下半分のよーな(笑)←知らない方にはわかりづらいw	{'place_id': 'e60fb4e164191d47'}
2020-06-01T09:01:10.000Z	1267380660542439425	ゆめた５。今電車に揺られながらラジオ聞いてます。朝の電車は、怖い位の人が多い満員電車だったけど、夕方は少し立っている人がいる位の混み具合。早く帰ってご飯食べよう！＃ゆうが５	{'place_id': '32049a95db695cb8'}
2020-06-01T09:01:06.000Z	1267380643664543744	ゆうごはん食べに外出ようとしたけど、雨降ってるのか・・・どうしよ。	{'place_id': '0d8054846be7f7be'}
2020-06-01T09:00:44.000Z	1267380549875666944	ガールズバールカ🎵🎵1set40分2000円❇🍺 飲み放題🍺🎤カラオケ歌い放題🎤⏰19時~翌5時🎉 本日の出勤🎉✨れい✨りな✨なつ✨ひかる✨ゆなお待ちしてます💓💓☎03-5942-6606#ガールズバールカ #西武新宿線 #中野区 #夜のお仕事 #沼袋 #飲み屋　#野方 #新井薬師 #中井	{'place_id': 'a35b6b4421e1a506'}
2020-06-01T08:58:07.000Z	1267379892527566848	帰りの電車 コロナ前と同じくらいコミ混みf(^^;大丈夫かな 二次感染 ちょっとヤバくない？	{'place_id': '03060ba847e52dcd'}
2020-06-01T08:53:32.000Z	1267378736942342147	明日は2ヶ月以上ぶりに会社に出勤…今月は週2出勤、週3在宅って感じ。この在宅勤務中に変わったこと、・めちゃくちゃ手洗い癖がついた・10kg太った・坊主になった	{'place_id': '4c1c4868f96634ed'}
2020-06-01T08:52:10.000Z	1267378392577437697	結婚6周年で鶴ヶ島バス旅行(200円)。つるバス、つるワゴン乗り継ぎで。ゼロベースで考えたらはとバスで都心周回も鶴ヶ島のそれも同じだろ。#鶴ヶ島 https://t.co/fqEJOChdpQ	{'place_id': 'e60fb4e164191d47'}
2020-06-01T08:47:10.000Z	1267377137251528704	満員電車で座れないなんて久しぶりでございます。	{'place_id': '1b0cfebe3424e14f'}
2020-06-01T08:46:37.000Z	1267376995261771776	何でかなぁ？劇場や映画館が50%の制限的入場で、電車は先週まで50%以下だったのに今日から100%～150%の混み具合。100%言えるよ！(GW以外働いていたりしてた自分の見解だけど)劇場や映画館の満席の方が絶対安全！(建設現場の超密よりは全然ね！！)	{'place_id': 'b74d0f4a87a68c66'}
2020-06-01T08:44:28.000Z	1267376454217502726	5ヶ月ぶりに電車に乗った🚈 https://t.co/Ag6V0oYS9f	{'place_id': '411f0aa7fce9a8fc'}
2020-06-01T08:43:44.000Z	1267376273464025089	こんにちは！！！！！上野FSTです！！！！！今日から当ビル2階にて通常営業再開です！！！！！出勤情報につきましては店舗にお問い合わせください。フロントで画面ご提示でオールタイム2,000円オフ！！！！！本日より皆様のご来店を心よりお待ちしております。 https://t.co/XtdLdvDsF7	{'place_id': '32049a95db695cb8'}
2020-06-01T08:41:21.000Z	1267375672269262848	@ayamake 電車は良かったですか？	{'place_id': '594fa6c6bc5b5ba9'}
2020-06-01T08:37:14.000Z	1267374635915440129	@yo_nyanko こんにちは😄電車ねーっ💦確実に人増えてきてるから座れなくなってきましたよ😩ニャンコちゃんもお留守番頑張って貰わないとね☺️ママは稼ぐのじゃーっ💪こちらこそ、よろしくでーす🙌	{'place_id': 'c71f3a7498fe95d7'}
2020-06-01T08:32:19.000Z	1267373397622747136	2ヶ月振りの外出だったので、先ずは新刊チェックに三省堂書店さんへ。古書でも新刊でも、本がたくさんある街は素晴らしいぃッ✨‼️本当に愉しい街なんだなぁ…と実感しながら、いつもの ［三省堂書店従業員口］→［ミロンガ］→［小宮山書店］→［すずらん通り］への抜け道　【続く】 https://t.co/cPgQ1f8kbc	{'place_id': '0fc35ac499d5e001'}
2020-06-01T08:31:47.000Z	1267373262167629824	メンバー出勤なんですけど、週末まで予定ないし給料も無いです。www	{'place_id': '7ee61f505fdfdf5c'}
2020-06-01T08:30:14.000Z	1267372873351651329	電車の中、そんなに端っこに座りたいのか(ｰ ｰ;)❓手摺りなは雑菌があるぞい‼️我、帰宅したら、すぐにシャワーだ、、	{'place_id': 'bfdffb491d839e84'}
