2020-05-31T23:58:13.000Z	1267244019136028674	京急品川駅から浦賀駅の普通電車は彼女達dw溢れている。8:55出発あたり。学校再開ですね (@ 品川女子学院中等部・高等部 in 品川区, 東京都) https://t.co/SplOhy2TRf	{'coordinates': {'type': 'Point', 'coordinates': [139.73906076, 35.62058206]}, 'place_id': '4ad3383e25ac98d9'}
2020-05-31T23:57:37.000Z	1267243868333805569	ひとりひとりに乗るなって言っても満員電車は避けられないって。	{'place_id': '1b0cfebe3424e14f'}
2020-05-31T23:56:59.000Z	1267243711794016257	電車通勤怖い…自粛前の通常通りの混み具合〜そのうちたま拡散するだろな。（5/31までに社宅退去してください。電車通勤です。）テレワークどこいった？	{'place_id': '76c498282a5a7997'}
2020-05-31T23:56:45.000Z	1267243651064664064	思ったよりは混雑していなかった今朝の電車。	{'place_id': '7ee61f505fdfdf5c'}
2020-05-31T23:55:49.000Z	1267243415298662400	6/1（月）少しずつ、平穏な日常が戻って来たのでしょうか。外出自粛を解かれたお客様のご来店が増えて参りました。非日常から日常への移行期ですね。もう梅雨入りなの？と思わせるような天候に、体調管理が悩ましいです。栄養と睡眠、しっかり摂取して臨みましょうhttps://t.co/did6zUA2ED	{'place_id': 'db215c78c59027e4'}
2020-05-31T23:55:23.000Z	1267243308461383682	大変ご無沙汰しておりますが皆さまいかがお過ごしでしょうか。2ヵ月間の完全テレワークを経て今月から週2日オフィスに出勤できることになりました。(嬉)久しぶりの電車通勤を満喫します。#今日から週2日オフィス出勤 #電車は普通に混んでます #見た感じマスク装着100パーセント #SNS再開 https://t.co/WYox8QWQH7	{'place_id': '5c43b25fece122d2'}
2020-05-31T23:54:49.000Z	1267243166702305280	@IHayato 都心に向かう電車に乗ってますが、やはり元に戻りましたね😅学生さんが、通学してるのも理由ですね。	{'place_id': '0fd33386c57b038a'}
2020-05-31T23:54:40.000Z	1267243127506563072	電車の中人増えたな〜#総武線	{'place_id': '336251fac4207ae3'}
2020-05-31T23:53:50.000Z	1267242918768599040	大江戸線、大門新宿方面、電車内少ないなあ‥　いまこの時でつり革立ちしてる人がいない。まあ、こちらも多少時差通勤しているが‥	{'place_id': '594fa6c6bc5b5ba9'}
2020-05-31T23:52:34.000Z	1267242599703646208	今日から、学校再開。電車も思ってたより、空いてるし良かったと思いながら、池袋はすげかった（涙）こえーから、ささっと帰る❗私、こんなにびびりだったか（涙）	{'place_id': '7efb0fd5276fdda5'}
2020-05-31T23:52:34.000Z	1267242598244118529	@yosihironosuke 2ヶ月ぶりの通勤途中の電車で観ました。元々元気やけど（笑）更に明るい気持ちになりました🎵	{'place_id': '8d59ab31bce58e76'}
2020-05-31T23:50:22.000Z	1267242044730163200	リーマンになった事ないからよく分からんけど、コロナ収束してないのになんでテレワーク解除してんの？どうしても出勤しなきゃいけない理由でもあんの？別にテレワークで仕事回るならそれに越した事ないと思うけど…あれか？日本特有の悪しき風習って奴？	{'place_id': '1b0cfebe3424e14f'}
2020-05-31T23:50:22.000Z	1267242043635449856	久しぶりの出勤今日から通常勤務です😊	{'place_id': '0fd33386c57b038a'}
2020-05-31T23:50:08.000Z	1267241986769088513	@dog08101213 働き方改革は強制されるものでなく本来自主的にやるべきものをあえて基準を打ち出したのだから最低限のことだけですよ。時間をずらす、在宅延長などは各社の判断でしょう。同時に、この時間に電車に乗ってる人たちは転職を考えたほうがいいと思います。	{'place_id': '27b43920b8b63188'}
2020-05-31T23:49:03.000Z	1267241713250086912	満員電車や、満員な駅構内の写真載せて「第二波来たらやばい」とか「終わってる」とか言ってる人に限って、いつも通り起きていつも通り通勤してビックリしてるんでしょ？そいつの方が終わってると思うが（笑）	{'place_id': '735b6f2b933efaf6'}
2020-05-31T23:48:35.000Z	1267241596174528512	当店の取組スタッフの体調管理の徹底は以下の対応をいたします。 こまめな手洗い、うがい、アルコール消毒の励行を徹底いたします。 出退勤時にマスク着用の徹底いたします。出勤前の検温と 37.5°C以上の場合の出勤中止をいたします。 勤務中のマスク着用徹底をいたします。	{'place_id': '61774861ea700565'}
2020-05-31T23:48:02.000Z	1267241458907533312	健康診断の問診票取りに約2ヶ月ぶりに所沢をでて出勤😆書類受け取りすぐ帰るのに、郵送やなくて全員取りに行くのがうちの会社らしく、そうゆうとこ決してキライではない（笑）	{'place_id': 'b3b52bda7ae86b07'}
2020-05-31T23:47:58.000Z	1267241442319065090	満員電車がトレンドに入っていますが、このご時世なのに1番出口に近い車両に移ろうと、自ら密の場所に行く人も結構いて驚きます。	{'place_id': '7efb0fd5276fdda5'}
2020-05-31T23:47:18.000Z	1267241275532603392	この時間は割と電車すいてる。よかった	{'place_id': '0fd33386c57b038a'}
2020-05-31T23:47:10.000Z	1267241239742517250	いよいよ電車で座れなくなった😞テレワークしようよ😌	{'place_id': '8ffa995231a47059'}
2020-05-31T23:46:49.000Z	1267241152337424386	2ヶ月ぶりの電車🚃今日も相変わらず混んでるけど、みんなお疲れ様です🥦🥦	{'place_id': '8e483d36e0b9b001'}
2020-05-31T23:46:48.000Z	1267241146700292096	@shioshioshiipon 屋上は4階相当。今やマンションに囲まれ丸見えですよ。( ´▽｀;)そして電車とも目線が一緒。	{'place_id': '76c498282a5a7997'}
2020-05-31T23:46:33.000Z	1267241086847553537	きょうあすだけひさびさに出社。朝の電車久々に乗ったけど乗車率低いねー。	{'place_id': 'afd2dbc6df82cca8'}
2020-05-31T23:46:07.000Z	1267240977900531712	おはようございます。今日は生憎の雨ですね☔️今日から多くの方が出勤でしょうか？足元にお気をつけてお過ごし下さい🤗今日はお昼に仕事が入っております。それ以外は明日の資格講座のために、復習です📖👍✨良い一日を‼️✨ https://t.co/DJUI8TKds1	{'place_id': 'dcc2630623880f96'}
2020-05-31T23:46:02.000Z	1267240953548468224	@wHWKgJavJSIURjB おはようさん🦊仕事いってらしゃい、うちも今電車の中てむかってます。安全にいきましょう。ただ、まだ眠いよ。 https://t.co/KAgzXOb5qu	{'place_id': '2e6e669592f1353f'}
2020-05-31T23:45:09.000Z	1267240731048939521	わけわからんところが終点の電車に乗ってしまったので完全に遅刻ですねこれは…	{'place_id': '28b9063fdce43645'}
2020-05-31T23:44:35.000Z	1267240589663203328	電車普通に混んでる。ちょっと怖い。	{'place_id': '77173905596af4ab'}
2020-05-31T23:44:28.000Z	1267240561947234306	@norinoriuch おはよ今日は出勤？気を付けてね	{'place_id': 'dcc2630623880f96'}
2020-05-31T23:44:04.000Z	1267240458465361920	弊社、6月からグループメンバー12人が大体、1日2人で持ち回りで出勤する事に。私、今月4回出勤。。。今日が勤務日。2ヶ月ぶりくらいに電車乗ってる。。。意外ときちんと自粛してたんだなって改めて。変な気持ちですね。ゆりかもめは、座れますが気持ち人が多い気が	{'place_id': '4c1c4868f96634ed'}
2020-05-31T23:43:56.000Z	1267240426206982145	電車内や通学路に学生さんが復活してた。	{'place_id': '43d0bb3c4e9eb702'}
2020-05-31T23:41:37.000Z	1267239844431818752	通勤電車、満席、立ってる人11人/両、全員マスク着用、	{'place_id': '0fc2c59cf594f000'}
2020-05-31T23:41:29.000Z	1267239809308782592	@MIKA_u1 やっぱり通勤電車はソーシャルディスタンスを守れないんですね。国もその他の業界にはあれだけ守れと言っているんだから、限界まで本数増やさせて車内にライン引いて乗車人数を制限するべきですよね。それが原因で遅刻したなら遅延証明書出すとかすれば良いかと。	{'place_id': '1b0cfebe3424e14f'}
2020-05-31T23:40:22.000Z	1267239529439612930	@shigetaro_ 仕事場に着いたらすぐに手洗い、外出先からも手洗いです、お気をつけて、良い一日を🙏☺️	{'place_id': 'bfdffb491d839e84'}
2020-05-31T23:40:06.000Z	1267239462485934080	今日から強制的な在宅勤務から、任意で出勤可能にした弊社なのですが、同時に創業3期目が始まります。依然厳しい経済状況は続きますが、だからこそ我々が貢献できる部分があるはず！とのことで、今期も躍動の一年にしますので、みなさま宜しく御願い致します！	{'place_id': '451617631d24d98c'}
2020-05-31T23:39:08.000Z	1267239219585400832	先週と比べ物にならないくらい電車混んでる。	{'place_id': '4fc060f8061bb535'}
2020-05-31T23:39:05.000Z	1267239205006004224	電車通勤めっちゃ普通に増えてるううう😭おうちで仕事してみんな😭😭	{'place_id': '4fc060f8061bb535'}
2020-05-31T23:38:15.000Z	1267238994405801985	出勤復帰初日から雨とは勘弁。まあ小降りになったのでよかったけど。あと電車そこまで混んでないのは幸い。	{'place_id': '0b7c83abc823ec59'}
2020-05-31T23:37:03.000Z	1267238692738883584	おはようございます！時差出勤なので座れはしないけれど快適ですねぇあいにくの雨でせっかく磨いた革靴も帰ったら直ぐにお手入れです…さて久しぶりのオフィスはどんなかなぁ…今日も頑張りましょー	{'place_id': '7ee61f505fdfdf5c'}
2020-05-31T23:35:18.000Z	1267238254278881281	@sdhiga おはようございます☺️電車が混んでいて、各駅でゆっくり行きます、今日は事務所にいての荷物取りと事務仕事でまったりします、😅	{'place_id': 'bfdffb491d839e84'}
2020-05-31T23:35:02.000Z	1267238188415717376	@Karech19 おはようございます。ちょうど出勤時に地震来ましたが…たいしたこと無いのでそのまま会社行ってましたが…本日は3ヶ月点検の為おやすみですよ（笑）あとはガスの開通待ちですけどね…(￣▽￣;)今月もよろしくお願いしますね❣️	{'place_id': 'ca43bf1f5905f3cf'}
2020-05-31T23:33:21.000Z	1267237762635386884	電車がめっちゃ混んでる。まさしく三蜜	{'place_id': 'e60fb4e164191d47'}
2020-05-31T23:33:11.000Z	1267237721400958977	それにしても電車けっこう混んでる学生もいる、みんないっしよなんだね、皆さまほんとにご苦労様です。#ご苦労様です。	{'place_id': '519decbcbebfd98d'}
2020-05-31T23:32:58.000Z	1267237666405281794	おはようゴザいます。今朝は雨模様ですが、だんだん弱まってきましたね。今朝は、多摩市愛宕2丁目の公社住宅にお住まいのお客様宅の畳替えです。バス、電車が混んでいると聞いています。通勤、通学の皆様、くれぐれも気をつけてお出掛けください。 https://t.co/qApaDQYCRR	{'place_id': '07d9e8cb47486001'}
2020-05-31T23:32:37.000Z	1267237579260219392	あいにくの雨ですが本日出勤日。人はにわかにかなり増えました。ドトールのサンドイッチも復活。三省堂さんも19時まで開けるとな。でも帰りは寄り道出来ないかな😢 https://t.co/pwBOae1KVJ	{'place_id': '28b9063fdce43645'}
2020-05-31T23:31:03.000Z	1267237183544426497	電車の席を必死で取りに行く人(˘❥˘)それだけ動けるなら立ってろ！	{'place_id': 'f808b328dbac41d3'}
2020-05-31T23:31:01.000Z	1267237174715363328	電車普通に人多い	{'place_id': '4ad3383e25ac98d9'}
2020-05-31T23:30:59.000Z	1267237166448435200	今日の電車は平常時の3割減って感じだね。やはり混んできた‥	{'place_id': '77173905596af4ab'}
2020-05-31T23:30:52.000Z	1267237137558065153	テレワークで仕事できてた人たちはこれからもテレワークしてればいいのに🤮（電車混んでる）	{'place_id': '336251fac4207ae3'}
2020-05-31T23:30:50.000Z	1267237129752424448	@sakurareika111 涼(^-^)/おはよう😊昨日出勤だったのと、月曜日なので憂鬱です😥	{'place_id': '4c1c4868f96634ed'}
2020-05-31T23:30:48.000Z	1267237121154101248	@takoPchan @milktea0226 @Seicomart_TW 品揃えにどこか北海道を感じさせる物が多くて、気分は北海道旅行ですよ。	{'place_id': 'e60fb4e164191d47'}
2020-05-31T23:30:27.000Z	1267237033346359296	普通に満員電車	{'place_id': 'afd2dbc6df82cca8'}
2020-05-31T23:30:05.000Z	1267236939633053697	@0519yuchan 始発電車は、ガラガラですよ(笑)毎日始発はしんどい(涙)	{'place_id': '7ee61f505fdfdf5c'}
2020-05-31T23:29:59.000Z	1267236916174262272	今日普通に電車混んでたけど、１日だからだよね？そうじゃないと無理🤮	{'place_id': '28b9063fdce43645'}
2020-05-31T23:29:49.000Z	1267236875300794368	電車混んでて座れない・・・って思ったら隣の駅で沢山の人が降りた😁すぐ座れてしかも空席有り何だったんだ？	{'place_id': '632c12d964b5772f'}
2020-05-31T23:29:14.000Z	1267236725442482176	うわ電車めちゃくちゃ混み出した通勤時間は電車本数増やそうよー	{'place_id': '7efb0fd5276fdda5'}
2020-05-31T23:28:42.000Z	1267236591975559168	@Nekonohige7070 ボールペンの持ち方も忘れたんじゃない？💦ちゃんとスーツ着れた？💦靴下左右逆じゃない？💦違う会社に出勤しちゃダメよ🤗	{'place_id': '307c68972fd1dc20'}
2020-05-31T23:28:38.000Z	1267236577870139392	@_kana_cheese_ 少しお出かけは減ると思う	{'place_id': 'bc892a7922752d1a'}
2020-05-31T23:28:15.000Z	1267236477697581061	大分通勤電車の人が多くなったなぁ。	{'place_id': '336251fac4207ae3'}
2020-05-31T23:27:51.000Z	1267236380129677312	平日のこの時間は普通に電車混んでる🚃	{'place_id': 'e9d13ad4ff9f02c1'}
2020-05-31T23:27:50.000Z	1267236374937169921	【悲報】都内完全に満員電車に戻る学生居ないのに…第二波到来待ったなし。	{'place_id': '7ee61f505fdfdf5c'}
2020-05-31T23:27:29.000Z	1267236285090955265	とうとう電車で座れない日が、きた学校も始まった…	{'place_id': '7ee61f505fdfdf5c'}
2020-05-31T23:26:22.000Z	1267236003737026561	満員電車復活か通勤は不毛だから、職場近くに引っ越すか、無駄に異動させる謎人事を改めてくれよ	{'place_id': '61774861ea700565'}
2020-05-31T23:25:48.000Z	1267235863689224193	今日から通常通り仕事開始・・・いつもの電車に乗ったらやっぱり　人が多くて座れなかった😭	{'place_id': '299928071b13fbb6'}
2020-05-31T23:25:23.000Z	1267235757061582848	2日ぶり。外出しなかったので💦 https://t.co/xxh0e4UuNA	{'place_id': '92b6a770413525fe'}
2020-05-31T23:25:21.000Z	1267235751755804673	毎日思うけど初石から出てるバス？パンパンすぎじゃね？大丈夫かな？俺なんかは電車とかバスと無縁の仕事だけど、やっぱり都内とか行く人はしょうがないのか！！気をつけて下さい。	{'place_id': 'b2216c57788fc225'}
2020-05-31T23:25:08.000Z	1267235694390333441	二ヶ月半ぶりの電車通勤したけどこんなの密すぎて怖すぎる！でも武蔵野線だいぶ人減ったなとは思った	{'place_id': '336251fac4207ae3'}
2020-05-31T23:24:09.000Z	1267235447769452545	@yami_ken221 今日は久しぶりのラッシュ。グリーン車も満席！テレワークや時差出勤を継続している企業は少ないと思われる😷	{'place_id': 'f7c22e0cf7b3af2b'}
2020-05-31T23:23:42.000Z	1267235335437561856	6/1、月曜日から、もう電車が遅延してる(ｰ ｰ;)やられた💦	{'place_id': '519decbcbebfd98d'}
2020-05-31T23:23:22.000Z	1267235249710231553	みんなで満員電車みんなで感染みんなでクラスタースウェーデン型でみんなで抗体赤信号みんなで渡れば怖くないと一緒ですね自己防衛しないといけない企業のあり方行政のあり方が問われるね働き方改革が進まない要因自律型社会へのチャンスだよ https://t.co/0gFfpKahLG	{'place_id': '32049a95db695cb8'}
2020-05-31T23:22:56.000Z	1267235141643952128	今日はいつも以上に朝の電車混んでたな…#武漢ウイルス #通勤電車 #自粛解除 #第二波	{'place_id': '7ee61f505fdfdf5c'}
2020-05-31T23:22:50.000Z	1267235116427833344	2ヶ月以上ぶりの出勤🚃下りとはいえ、8時の中央線に空席がある！🙍🏻‍♀️💺🙎🏻‍♂️そして、人と人の間、座りにくい座るけど👋	{'place_id': '92b6a770413525fe'}
2020-05-31T23:22:34.000Z	1267235048429780992	今日からみんな出勤か！電車混んでる😳	{'place_id': '1b0cfebe3424e14f'}
2020-05-31T23:22:10.000Z	1267234947577724929	『ビビッ』ときた人に会ってみようと思ったら『即行動』会ってガッカリしようが感動しようが、どちらにせよ失うのは少しの電車賃とコーヒー代。1000円あれば誰にでも会いにいけるのだから時間を作って行ってみよう。ガッカリした人だとしても時代が変わり未来には助けになるかもなのです。	{'place_id': '7ee61f505fdfdf5c'}
2020-05-31T23:21:48.000Z	1267234858402643969	満員電車を解消するためには、人数制限しかないかも。	{'place_id': '7efb0fd5276fdda5'}
2020-05-31T23:21:14.000Z	1267234714240184320	電車すごい人だぞ....	{'place_id': 'f7d0d5bd6b472eaa'}
2020-05-31T23:20:13.000Z	1267234459658498049	おはようございますー。６月になりました。そして、電車は人が増えました。	{'place_id': '1df8c91136c4c140'}
2020-05-31T23:19:50.000Z	1267234361729933314	今日は出勤日。ひとおおおおおおい	{'place_id': '1b0cfebe3424e14f'}
2020-05-31T23:19:12.000Z	1267234201151004674	おはよう😃さぁ〜今月から⚾️が始まるぞぉ〜〜😆😆😆👍❤️明日から🎏が見れるよ😍💓📺通勤路も電車も今までの様に戻って来て嬉しいけどチョット複雑😅第二派が起こりません様に🙏	{'place_id': '0fd33386c57b038a'}
2020-05-31T23:18:04.000Z	1267233918647799808	今日の横須賀線通勤電車はだいぶ混んでます。しかし武蔵小杉からはあまり乗ってこず。行きの通勤電車で座れるのも今日くらいまでかな。通勤路のお供は昨日仕入れたニコラエーワの平均律。目を閉じじっと聴き入る。寝そうです。	{'place_id': '4ad3383e25ac98d9'}
2020-05-31T23:17:15.000Z	1267233711071744000	今朝のいつもの通勤電車はそんなでもなかったですね🤗一番不安でしたけど(・ω・)	{'place_id': 'b41f5dcb002a1886'}
2020-05-31T23:16:58.000Z	1267233641362419712	乗る時と乗り換え時、連続で慌てて降りて来る数人の乗客。久々の電車ですかね。	{'place_id': '7ee61f505fdfdf5c'}
2020-05-31T23:16:37.000Z	1267233551335866368	おはよーございます。今日は雨。先週より電車は混雑しているなあ。この程度で推移して欲しいところだな。	{'place_id': 'afd2dbc6df82cca8'}
2020-05-31T23:16:36.000Z	1267233546600542208	@jwave813fm #満員電車 #通勤電車 #コロナ緊急事態宣言後から先週末までの通勤電車内です。どんなに少なくなっても50%くらいでした。そして緊急事態宣言解除後はどんどん増えて今は80%位です。クラスター心配です。 https://t.co/nHmfXJtKOD	{'place_id': '49524fd7b35fd754'}
2020-05-31T23:16:36.000Z	1267233546189471744	電車しばらく乗ってなかったな( ꒪౪꒪ )	{'place_id': '336251fac4207ae3'}
2020-05-31T23:15:55.000Z	1267233375376400384	この前までの電車の空き具合はなんだったんだろう‥始発の椅子取りゲーム始まってる。	{'place_id': 'f72cbd7b378a05fc'}
2020-05-31T23:15:43.000Z	1267233327188078592	今日から確実に人が多いんだろうな電車座りたいから増えないでくれ	{'place_id': 'b74d0f4a87a68c66'}
2020-05-31T23:15:26.000Z	1267233255792599040	嫌ぁぁ電車一気に人増えてるぅぅ	{'place_id': '594fa6c6bc5b5ba9'}
2020-05-31T23:15:22.000Z	1267233237803208706	二ヶ月ぶりに朝の電車乗ったらコロナ前と密度が変わらず… 地下鉄なので窓も開かず…🥺	{'place_id': '32049a95db695cb8'}
2020-05-31T23:14:50.000Z	1267233101442244610	9割って本当か？今2ヶ月ぶりに出勤中ですが、電車の密度は2月頃と変わらない水準。 https://t.co/9PP4uKkQLf	{'place_id': '962b0af43cd1ad6c'}
2020-05-31T23:14:29.000Z	1267233014532038657	通勤電車、先週も増えたと思ったけど今日はその倍くらいの人が乗ってる。自粛前にどれくらい人がいたかすでに忘れたけど学生さんがいないからMAXではないんだろうな。	{'place_id': 'a24531308a92ae15'}
2020-05-31T23:13:49.000Z	1267232848487911424	おぉ…混雑してる電車がうるさくなった(´д｀|||)	{'place_id': '8f844bd31a72243f'}
2020-05-31T23:13:37.000Z	1267232798407966721	@kame_ten １本早い電車でこれなので、普段の電車が怖いです😱	{'place_id': '27b43920b8b63188'}
2020-05-31T23:12:41.000Z	1267232563984084992	会社も今日からテレワーク解除化粧、パンプス、電車全てが久々過ぎて意味の分からない緊張。。。	{'place_id': 'a35b6b4421e1a506'}
2020-05-31T23:11:01.000Z	1267232141332471808	今日から通常営業時間、出勤が1時間はやい、今日はなんとか起きれた	{'place_id': '95484b83e4708f58'}
2020-05-31T23:10:30.000Z	1267232014278619136	６月になって、少し電車も混んできたかな？	{'place_id': '8d59ab31bce58e76'}
2020-05-31T23:10:13.000Z	1267231940903448576	電車がコロナ前に戻りつつあってツライ。	{'place_id': '4ad3383e25ac98d9'}
2020-05-31T23:10:01.000Z	1267231890425217026	2ケ月ぶりの会社出勤 (@ 品川駅 in 港区, 東京都) https://t.co/eE2ywcIbsQ	{'coordinates': {'type': 'Point', 'coordinates': [139.73908413, 35.62875177]}, 'place_id': '594fa6c6bc5b5ba9'}
2020-05-31T23:09:52.000Z	1267231855100583936	思ったよりも電車は空いていて、銀座線はまたずとも座れました。もちろん、解除前よりは乗ってますけど。	{'place_id': 'f7c22e0cf7b3af2b'}
2020-05-31T23:08:45.000Z	1267231570357702656	ハノイのホテルから目茶苦茶プロモーションレターがくる。経済の再開を感じる。電車も明らかに人が増えた。	{'place_id': '594fa6c6bc5b5ba9'}
2020-05-31T23:08:13.000Z	1267231436492308480	今朝の電車で思った事。マスクしないマナーよりもエスカレーター歩いて上り下りしてる人ばかり、エスカレーターでは歩かない様にの張り紙みんな無視。コロナよりよっぽど危険。1人転んだら将棋倒し。何がモラルか分かりません＃コロナ脳#洗脳　＃モラル	{'place_id': '28b9063fdce43645'}
2020-05-31T23:07:54.000Z	1267231359531012096	癒される。なんとか起きれたし、いつも通りの電車にも乗れた。結構満員だけど、みんなマスクしてるし、咳やくしゃみしてる人ほとんどいない。窓も空いてる。あとは職場か。保育園は、保育士さんがかなり頑張ってて、蒼翔も久しぶりに友達に会えて大はしゃぎ。今日は早く寝る。 https://t.co/jGlE2jAImo	{'place_id': '03060ba847e52dcd'}
2020-05-31T23:07:54.000Z	1267231356595040256	電車が混んでいる…帰りたい…orz	{'place_id': '76c498282a5a7997'}
2020-05-31T23:07:42.000Z	1267231307156688897	そりゃそうなんだがもう電車で座れないわ	{'place_id': 'f72cbd7b378a05fc'}
2020-05-31T23:07:17.000Z	1267231204408885248	雨の日でも電車の窓開けたままにするのかな？と思ってたけど、開いてるな…	{'place_id': '61774861ea700565'}
2020-05-31T23:07:15.000Z	1267231195726622721	分かってはいたけど満員電車トレンド入ってますね！！しかも、2,30分前だと8000弱のツイート数が11000弱SNSってすげー	{'place_id': '7ee61f505fdfdf5c'}
2020-05-31T23:06:57.000Z	1267231120669564928	2ヶ月ぶりに電車乗ったけど変わらず混んでるなぁ	{'place_id': '4c1c4868f96634ed'}
2020-05-31T23:06:36.000Z	1267231032878624768	え、久しぶりの出勤で？電車逆方向乗っていたんだが	{'place_id': '962b0af43cd1ad6c'}
2020-05-31T23:06:13.000Z	1267230936040521728	いつまでも自粛、制限などできないのはわかります。でもいきなり満員電車、小学校クラスター…今までの努力はなんだったの？？#とくだね #とくダネコロナSOS	{'place_id': '5cf616c8f739cb2b'}
2020-05-31T23:06:03.000Z	1267230894382649344	店舗や演劇やコンサートは再開してほしいけど、1番要らない満員電車があっさり復活してるのは残念すぎます。	{'place_id': 'a35b6b4421e1a506'}
2020-05-31T23:04:46.000Z	1267230568544002048	在宅出来る奴等は一生在宅しててくれよ本当にその出勤必要か？	{'place_id': '49524fd7b35fd754'}
