2020-05-25T10:33:44.000Z	1264867238386921472	全面解除されましたってさ。明日から電車混まないといいなぁ	{'place_id': 'dded92a2db180dd1'}
2020-05-25T10:29:52.000Z	1264866265744605184	普通に帰りの電車は混んでます	{'place_id': '7bd3d82b03caf040'}
2020-05-25T10:28:01.000Z	1264865798322941953	@oiooRIEooio りえさんもおつー😆電車の中で腹減った😚立川駅で崎陽軒のシュウマイ買いたくなるんだなー	{'place_id': '07d9ec7aa0481002'}
2020-05-25T10:24:40.000Z	1264864959227281408	緊急事態宣言解除。とりあえず速攻でうな丼とスタ丼を食べに外出してきた。満腹になり心地よい幸せを感じているが、自分がダイエット中で来月健康診断という現実が少しだけ悪いことをしたように感じさせる😶	{'place_id': '1b0cfebe3424e14f'}
2020-05-25T10:24:31.000Z	1264864919809175552	強制的外出規制がなかっただけで、日本人は予防頑張ったと思う✨６月暑くはなるけど予防継続して頑張りましょ！	{'place_id': '0fd33386c57b038a'}
2020-05-25T10:23:52.000Z	1264864756755648513	@netgeekOogiri 要は電車通勤したくないんでしょ！	{'place_id': '4ad3383e25ac98d9'}
2020-05-25T10:22:39.000Z	1264864447920607233	@jwave813tk いいえ❗気のせいじゃあないと思いますよ。優先順位、滅茶苦茶ですよ❗旅行控えさせていたのにこれでは拡大してもおかしくないし訳わかりません(T＿T)	{'place_id': 'dded92a2db180dd1'}
2020-05-25T10:22:24.000Z	1264864386746703873	残業、準夜勤、夜勤、24時間勤務の方お疲れ様です。https://t.co/n1Ntbll3za明日は私は通常通り出勤いたします。なお明日は通常通りの勤務となっております。	{'place_id': '5cf616c8f739cb2b'}
2020-05-25T10:17:59.000Z	1264863275965005825	しごおわ。緊急事態宣言は、予定通り解除ですのね。これによって何が変わって何が変わらないのか。とりあえず明日の電車は混むだろうな。あとTACは６月頭からやるんだね	{'place_id': '4ad3383e25ac98d9'}
2020-05-25T10:16:40.000Z	1264862942685609984	帰りの電車は扇風機が回っていた。 https://t.co/ymkXbgudlq	{'place_id': 'bb7a59998ec7fdba'}
2020-05-25T10:16:33.000Z	1264862916093730816	緊急事態宣言はひとまず解除になりましたね。病が無くなった訳でも無いので、飲みに来てとは言えないんですけどね。通常運転で開けております。小規模イベントも解除ですので、お問い合わせ下さいませ〜。#まにゅ	{'place_id': '4ad3383e25ac98d9'}
2020-05-25T10:16:24.000Z	1264862877434777600	インスタグラムを更新しました📷歌舞伎町のbarの施工事例です。本日、緊急事態宣言が全面解除になりましたね！これからも引き続き感染症対策は徹底して、みんなで協力すればまた繁華街に飲みに行ける日も遠くないはずです。その日を楽しみに、頑張りましょう🍺https://t.co/7uQZmTvY63	{'place_id': '735b6f2b933efaf6'}
2020-05-25T10:14:18.000Z	1264862348625367040	大泉から帰宅ちゅうの西武池袋線。明日からこの電車も混んじゃうんだろうな。	{'place_id': 'dcc2630623880f96'}
2020-05-25T10:12:24.000Z	1264861868792795137	4月7日からおよそ1ヶ月半、緊急事態宣言がようやく解除。さらに外出自粛要請が出された3月28日からおよそ2ヶ月、全てのライブを中止とした自粛営業でしたがその間毎日このステージで歌い続けました。ほぼほぼ一人きり、時にはー#辻堂良いとこ #緊急事態宣言解除 #音の辻https://t.co/PuQhDsGVAx	{'place_id': '61774861ea700565'}
2020-05-25T10:12:22.000Z	1264861860198641665	東京のいい点・色んな系統の美味しい飲食店が超豊富・娯楽が多い・普通の正社員の場合給料が高水準 東京の悪い点・自然が少ないところが多い・人が多くて満員電車乗る生活はストレスたまる・地価が高い	{'place_id': '1b0cfebe3424e14f'}
2020-05-25T10:12:17.000Z	1264861840942616578	久々の通勤電車。混んでますねぇ。テレワークは浸透しないのか…	{'place_id': '519decbcbebfd98d'}
2020-05-25T10:11:16.000Z	1264861584469266433	うんそうだ！みんなまだまだ慎重になった方がイイ！まずオタクすんのに電車乗んのが怖いしさw	{'place_id': '1df8c91136c4c140'}
2020-05-25T10:08:06.000Z	1264860787916460034	@Artist_Boss マスクしてると余計に暑いよね💦未だ電車は乗れない💧	{'place_id': '4fc060f8061bb535'}
2020-05-25T10:01:26.000Z	1264859111004332032	まーだ通勤電車が主な感染源とか言ってる人おるんか…	{'place_id': 'afd2dbc6df82cca8'}
2020-05-25T10:00:44.000Z	1264858934260535296	いつ以来の電車？と思ってツイッタ溯ったら、やっぱ遥のエレアコ買いに横浜行った時から乗ってないから50日ぶり位。更に山手線となると、3.7のリハ以来か。色々緊張する。一昨日のベースrecの余韻にまだ浸ってます(多分私だけ)。ディレクターもベーシストももう次の事を考えてるよ、きっとね。	{'place_id': '7ee61f505fdfdf5c'}
2020-05-25T10:00:21.000Z	1264858837720297472	つぐちゃん出勤中♪お話に来て下さいね☆22時迄！#西川口 #コスプレ #コスプレカフェ #コスプレバー #メイド #メイドカフェ #メイドバー #カフェバー #コンセプトカフェ #コンカフェ https://t.co/cZEFVwhphg	{'place_id': '0ff5b03999546000'}
2020-05-25T09:59:20.000Z	1264858580785590272	リモートワークが不可能な私の職場では解除後も時差出勤を継続するようです。可能ならこのままの通勤時間にさせて欲しい。再び満員電車に慣れるまでは時間がかかりそう	{'place_id': '49524fd7b35fd754'}
2020-05-25T09:57:21.000Z	1264858083651497984	もう空いてる電車は無いな...	{'place_id': '0fd33386c57b038a'}
2020-05-25T09:56:42.000Z	1264857918760878081	会社到着して終業点呼受けたのでこれから帰ります(*^▽^*)明日は朝8時出勤で埼玉県越谷市越谷自転車保管所で自転車50台です(((・・;)	{'place_id': 'bdb1349c1eb3ecb4'}
2020-05-25T09:53:59.000Z	1264857236133654528	少し暑くなってきて、窓がガンガン空いてる電車に乗ると、高校時代（大昔）、エアコンがない古い車両に当たってガーンとなった事を思い出す笑ちなみに名鉄です	{'place_id': '962b0af43cd1ad6c'}
2020-05-25T09:52:18.000Z	1264856812802592770	旅行協会の会長は二階だったのか🤬それでかぁ🤬	{'place_id': '86dd570dcbbf393e'}
2020-05-25T09:50:08.000Z	1264856264531521537	明日朝の通勤電車は混んでいるのだろうか？	{'place_id': 'cd477ff3b533582b'}
2020-05-25T09:49:34.000Z	1264856122986336256	日本においてだけ言えば 押さえ込みに成功した 外出自粛が功を奏したと 思いたいとこなんだろうけど 実際は そもそも緊急事態宣言するような 大したもんじゃなかっただけ いつだかの新型インフルエンザの時の方が よっぽどヤバかったんじゃないの？数字的なもんは比較してみないと分かんねーけんども()	{'place_id': '76c498282a5a7997'}
2020-05-25T09:48:30.000Z	1264855856270594048	@hideyan0812 解除ってなるとね俺くらいなら私くらいならって奴がいっぱい出てくるのが目に見えてるし現に他の地域が解除になってから外出した人増えたって言うしね💦だいたい東京､神奈川は解除の基準まで達していないのにおかしいよね😏💦	{'place_id': '4f8c5ba59b1e3250'}
2020-05-25T09:48:30.000Z	1264855853997285376	満員電車の件はどんな答えを期待した質問なのだろう？リモートワークを推進する具体的政策でも出てくると思ったのかなニコ動の人は…。 #首相会見	{'place_id': 'dcc2630623880f96'}
2020-05-25T09:46:10.000Z	1264855266626990082	左派メディアがツイッタラーレベルの質問しかしない中で産経は満員電車に言及	{'place_id': 'e55409e2b3f74247'}
2020-05-25T09:45:48.000Z	1264855174092173313	おい！非常事態宣言が解除されたからって浮かれるなよ！まだ、自粛警察が蠢いているからな！キチガイはウイルスよりも怖いんだから！気を付けろ！電車にも乗るなよ！通勤は基本徒歩かタクシーを使え！人を見たらキチガイと思って間違いないから！	{'place_id': 'faab662cb34cf04f'}
2020-05-25T09:45:45.000Z	1264855161437958145	安倍首相の会見。なぜ満員電車はオーケーか？それは珍型コロナの脅威はウソだから。	{'place_id': 'dded92a2db180dd1'}
2020-05-25T09:42:47.000Z	1264854415510392835	安倍　麻生　内閣　閣僚に文句言わないと死ぬのか？この人達。外出自粛もなかなか出来ない人間といい、派手だから目立つけど、少数派はいつも問題起こしてばかりだな。	{'place_id': 'bc892a7922752d1a'}
2020-05-25T09:42:21.000Z	1264854306198441984	只今、会社上がりーの川崎駅以前までの退勤時間の18:00に上がると電車のホームに人が多い、南武線が遅れてるのもあるけど😥今日も沢山仕事したなあ。😆	{'place_id': '0fc2e90b4b94c001'}
2020-05-25T09:41:40.000Z	1264854136454963200	続いて電車待ちで... https://t.co/ctUzXvKkrq	{'place_id': '0fd33386c57b038a'}
2020-05-25T09:40:50.000Z	1264853924399341569	外出できない腹いせか、ジェットコースター🎢の動画観るのにハマってるけど、これ足元にレールないけどどうなってるの？宙吊りになってるのかしら https://t.co/DISZ2djTeN	{'place_id': 'dded92a2db180dd1'}
2020-05-25T09:38:01.000Z	1264853216539205632	本当に本当にこれこれ。これからは外出自体が価値ある行動になるので武器がなければ存在しないと一緒。ホットペッパーで来店されたお客様にどうやって検索して探してくれましたか、と聞けば自分の武器がわかるはず。 https://t.co/VrO8sXf2o5	{'place_id': '0d8054846be7f7be'}
2020-05-25T09:37:29.000Z	1264853083277807617	ライブハウス休業でもめっちゃ電車混んでて草😰	{'place_id': 'dcc2630623880f96'}
2020-05-25T09:37:28.000Z	1264853080425631745	そうはいっても「はいっ！これから元通り！」なーんてことはないんだから。第二波・長期戦に備えておく。というわけで洗えるマスクを4枚買いました！¥1000也。　出勤になったら毎回マスク使うからねー！販売もされてるけど消費量を考えると洗えるやつが経済的✨ https://t.co/N81kCEgshf	{'place_id': '4ad3383e25ac98d9'}
2020-05-25T09:36:54.000Z	1264852936036777985	@kekkorock 私今から出勤というど正論	{'place_id': '44bd8dbe9ffe1625'}
2020-05-25T09:35:28.000Z	1264852575553114112	解除されたので飲みに行く。	{'place_id': '1b0cfebe3424e14f'}
2020-05-25T09:34:11.000Z	1264852252637884418	一言申し上げて、マスクは絶対いや、外出自粛にも協力はできない。世の中の考え方があまりに過剰すぎて笑えてしまう。。インフルの時もそうするんだよね？新しい生活様式を押し付けられてもそれは実践できない。	{'place_id': '5cf616c8f739cb2b'}
2020-05-25T09:32:21.000Z	1264851792610770949	電車乗ってたらふつうに満員電車でびびったw	{'place_id': 'ed61afd47a8bfd91'}
2020-05-25T09:29:19.000Z	1264851027083190276	@hiroyuki_ni 働いている世代は使えない。つまり、老人が旅行しまくってコロナでタヒぬと。高齢化対策に本気だよ、政府はw	{'place_id': '28b9063fdce43645'}
2020-05-25T09:29:03.000Z	1264850958816669696	@kyonoyubune_ss 息子も一応外出する時はマスクしてますねまだ、ちゃんと聞いてないけど6月から学校も始まると思います今年の夏休みは短い夏休みになりそうですね	{'place_id': '1df8c91136c4c140'}
2020-05-25T09:28:30.000Z	1264850824238297088	てか電車乗りたくない感ある、チャリで行けたら良いのになあ。	{'place_id': '7ee61f505fdfdf5c'}
2020-05-25T09:26:05.000Z	1264850214076035073	N国改めホリエモン党と旅行半額補助券のダブルパンチで日本の今後をマジで心配している。。。	{'place_id': 'f7c22e0cf7b3af2b'}
2020-05-25T09:23:00.000Z	1264849440076005376	明日から通常の月〜金5連勤に戻った時差出勤は継続だけど	{'place_id': '4c1c4868f96634ed'}
2020-05-25T09:22:53.000Z	1264849409084231680	渋谷を小一時間歩いたが、すぐウンチしたくなるのにできる場所がない。これはうんチッたれには外出厳しいな。家に籠らなきゃ…	{'place_id': 'f7c22e0cf7b3af2b'}
2020-05-25T09:19:47.000Z	1264848629082148865	ぴこぴこ💘ショルダーバッグはお気に入りだからお出かけの時はいつも愛用してるよ🐰✌👜 https://t.co/lECn7z58OZ	{'place_id': 'd2262f18bc1f84c5'}
2020-05-25T09:19:06.000Z	1264848456511700992	まさかの今日限りでテレワーク中止令…うちの会社バカじゃないのか？客先への外出もオッケーって人事部に言われたくないわ。やっぱり傾く会社は人事部がアホなんだな。営業部門長もドン引きだぜー。ちなみに東京都の指針は無視でよいと通達も社外秘で発行された。#緊急事態宣言全面解除	{'place_id': '735b6f2b933efaf6'}
2020-05-25T09:17:09.000Z	1264847964352049154	@nikkeiren お疲れさまでした。私は出勤でしたが、ほとんどやることが無いまま一日が終わりました😅💦💦	{'place_id': 'ae10e4565c20a69b'}
2020-05-25T09:17:01.000Z	1264847932374675457	カラオケも営業が再開が始まったケド、大半の人は週末は出掛けるって思ってるでしょ⁉️昨日、江戸川の河川敷でマスクしないでスポーツしてた人が何人も居たケド、マスク無いなら外出するなよ。。。💦で、月曜だからデジグラ・ラブポップを見る(*^^*)→続く２	{'place_id': 'db215c78c59027e4'}
2020-05-25T09:16:32.000Z	1264847812266610689	コロナ太りを防ぐ為にダイエット中！！アラフィフでも痩せれるダイエットを模索。基礎代謝が落ちて、運動もせず、外出は全て車！今の所良い感じ！！仕事は来月から開始です。入りたてでやっと慣れた頃に自粛。ログインパスワード忘れたよ...一気に痩せそうです...	{'place_id': '7e3f97730ab390c0'}
2020-05-25T09:15:36.000Z	1264847576236322818	日本も是非、期間限定で週休3日制を導入して国内旅行と国内消費を盛り上げましょう！月火休木金休休。 https://t.co/xcrO7fQTCq	{'place_id': 'f43d3d50a3b017e9'}
2020-05-25T09:14:17.000Z	1264847245880381440	@kisskiss2020929 家で飲むとね弱いけど外に飲みに行くと強いで～😏俺もゆきちゃんと飲んでみたいの😏😳	{'place_id': '4f8c5ba59b1e3250'}
2020-05-25T09:13:34.000Z	1264847062308282368	緊急事態宣言解除後のあさのっちの予定今週にも再開　とり鉄　移え(写真とってのインスタ映え)ライブ参戦は８月下旬から再開遠くの乗り鉄旅(旅行)は７月下旬から https://t.co/QfelcHxkYa	{'place_id': 'ceb864015598e127'}
2020-05-25T09:13:01.000Z	1264846925720780800	フェイスシールドして電車に乗ってる人を初めて見た	{'place_id': '28b9063fdce43645'}
2020-05-25T09:11:51.000Z	1264846634342477824	緊急事態宣言解除、されたみたいですね❗漸く外出ができる❗#緊急事態宣言全面解除	{'place_id': 'e60fb4e164191d47'}
2020-05-25T09:10:38.000Z	1264846326962876416	ガールズバールカ🎵🎵1set40分2000円❇🍺 飲み放題🍺🎤カラオケ歌い放題🎤⏰19時~翌5時🎉 本日の出勤🎉✨あみ✨ゆな✨ひかる✨れい✨らん✨なつお待ちしてます💓💓☎03-5942-6606#ガールズバールカ #西武新宿線 #中野区 #夜のお仕事 #沼袋 #飲み屋　#野方 #新井薬師 #中井	{'place_id': 'a35b6b4421e1a506'}
2020-05-25T09:09:33.000Z	1264846053326684160	こんなに座って通勤できたのは生まれて初めての経験だった。高速も渋滞なし、電車も遅延なしという正常な世の中から、またあの異常な世の中に移行するんだな… (@ 水天宮前駅 - @z_line_info in 中央区, 東京都) https://t.co/IDnPzy7Eys	{'place_id': '735b6f2b933efaf6', 'coordinates': {'type': 'Point', 'coordinates': [139.7863014, 35.68159939]}}
2020-05-25T09:09:27.000Z	1264846030152982529	本日の出勤予定つぐちゃん　19〜22優菜ちゃん　19:30〜lastちぃちゃん　20〜23:30 https://t.co/LYJmc7m542	{'place_id': '0ff5b03999546000'}
2020-05-25T09:08:52.000Z	1264845880584110080	国内旅行の半額補助やプレミアム付き食事券、７月下旬開始へ…予算１・７兆円確保（読売新聞オンライン） https://t.co/Txrsrc4IN0	{'place_id': 'b41f5dcb002a1886'}
2020-05-25T09:08:28.000Z	1264845779740397568	緊急事態宣言解除されたけど、休日の不要不急の外出はダメだし、歌や応援は距離を置くかリモートと言われてちゃ、結局何も変わらないな😢	{'place_id': '735b6f2b933efaf6'}
2020-05-25T09:04:43.000Z	1264844838496645120	2か月東京にいながら電車乗ってないんだけど電車乗るの怖い。こんなに乗らないの中学上がる前以来。	{'place_id': '735b6f2b933efaf6'}
2020-05-25T09:04:25.000Z	1264844760444887042	解除は良いけど電車通勤は大変だなあ｡おそらく混雑しそうだ｡自分は自転車通勤だから良いけど｡ https://t.co/JiqVzxafvT	{'place_id': 'b3b52bda7ae86b07'}
2020-05-25T09:03:43.000Z	1264844584800129025	もう電車はほぼ元どおりの混み方だなぁ。座れなくなった。	{'place_id': 'd2262f18bc1f84c5'}
2020-05-25T08:59:43.000Z	1264843576980062213	27日から普通出勤がスタートすることが確定致しました。🥺	{'place_id': '8ffa995231a47059'}
2020-05-25T08:56:56.000Z	1264842879379234817	@n2ynana 仕事終わって、地下鉄の電車の中で、読みました。吉祥寺の香り、何となくわかる気がします。友達の事もコラムの短いなかによく表現できていると思います。読みやすいです。ヒラタカ	{'place_id': '7ee61f505fdfdf5c'}
2020-05-25T08:54:09.000Z	1264842177152118785	@KOBAYASH_megu そこは思う。ウチ受験生だし。満員電車での通学は…ヤバいから複雑	{'place_id': '4ad3383e25ac98d9'}
2020-05-25T08:53:40.000Z	1264842055898955776	@AgileHyde19 こんばんは😃🌃やっぱり電車空いてますね😅解除になったら混むだろうからまた2次感染が心配ですよね😭本当にそうですよね😉明るい気持ち、前向き思考が１番ですよね😉笑う事が体にも良いですからね🤗🤗🤗	{'place_id': 'afd2dbc6df82cca8'}
2020-05-25T08:42:09.000Z	1264839157433593856	OLD SPICE / オールドスパイスPURE SPORT DEODORANT STICK緊急非常事態も解除の方向に進んでますまだまだ様子を見ながらの生活になりそうですが、STAY HOME中だろうが、お出かけ中だろうが、常にいい匂いで居たいですね1000¥+tax https://t.co/xbWyaGgwK6	{'place_id': '61774861ea700565'}
2020-05-25T08:38:52.000Z	1264838332221030400	今日で流山までのスクーター通勤は終わりさぁこれから帰宅に70kmほど走り、明日は電車通勤して仕事車を乗って帰る https://t.co/XKBp2hukzd	{'place_id': '0fc2e1358b54f000'}
2020-05-25T08:37:32.000Z	1264837996865441792	予防に夏〜加えたいのは歯磨き#手洗いうがいに歯磨き迄加える事でどれだけあがるか⤴#旅行 にも携行する事でスポットスポットで#リスク排除 できそう#医療ツーリズム温泉♨巡りも#カラダの機能回復 には#スポーツ選手もやってください#メディカルツーリズム巡らなくても集中入浴を合宿に＋ https://t.co/kn78d8lUOM	{'place_id': 'f05d4b0cfac65c65'}
2020-05-25T08:29:59.000Z	1264836095692308481	マジか！政府の旅行半額補助、７月下旬から　外出自粛緩和に合わせて https://t.co/XkcTkdflP7 @Sankei_newsより	{'place_id': '735b6f2b933efaf6'}
2020-05-25T08:29:50.000Z	1264836058283249664	どさくさに中韓からの旅行者も受け入れるつもりでしょう https://t.co/KVoOQJSabp	{'place_id': '8dedbfcdb8337d67'}
2020-05-25T08:27:52.000Z	1264835564143968259	解除＝通常出勤＝平日飲酒自粛😭😭😭😭😭☘️ #dfs897	{'place_id': '1b0cfebe3424e14f'}
2020-05-25T08:26:58.000Z	1264835335604670464	旅行好きで観光業やってるぼくは嬉しいけど、こんなところよりも本当に困ってる人にあげた方がいいような。国内旅行の半額補助やプレミアム付き食事券、７月下旬開始へ…予算１・７兆円確保 : 経済 : ニュース : 読売新聞オンライン https://t.co/XiOJRVmGdW	{'place_id': 'e55409e2b3f74247'}
2020-05-25T08:25:47.000Z	1264835041038749698	新しい生活様式と、旅費補助って矛盾してないか補助された旅費で電車じゃなくてレンタカー使ってカプセルホテルとかも使うなってことかな	{'place_id': '0fd33386c57b038a'}
2020-05-25T08:21:00.000Z	1264833834287132672	@shushuglad ありえないです、満員電車乗るから🙁	{'place_id': 'afd2dbc6df82cca8'}
2020-05-25T08:20:57.000Z	1264833823532920833	#さよなら安倍総理　　奥様の旅行、森友等をうやむやにしてるよね。	{'place_id': '4fc060f8061bb535'}
2020-05-25T08:16:25.000Z	1264832682095083525	東京駅、ちょっと人増えてる相変わらず電車はガラガラ https://t.co/QGzTn3jvyg	{'place_id': '108583bdc3d4e000'}
2020-05-25T08:16:07.000Z	1264832607994306561	@chihiro__sakura 外出の時も、ご注意を	{'place_id': '76c498282a5a7997'}
2020-05-25T08:08:58.000Z	1264830808788877313	7月から旅行半額補助って本当に気が狂ってるとしか思えない。。#さよなら安倍政権 #旅行半額補助	{'place_id': '14c3daac3d85acba'}
2020-05-25T08:06:51.000Z	1264830275306967041	By far my favorite apple cider 🍎#mitsuya #applecider #サイダー #飲み物 #電車 https://t.co/61EBiZHdc6	{'place_id': 'a35b6b4421e1a506'}
2020-05-25T08:06:27.000Z	1264830175574806529	緊急事態宣言解除の直後に、国から皆んな！旅行いこうぜーー！！だって。マスクも１０万も大半の方はまだだし、それは置いても、こりゃ秋くらいまで静かにしてた方が良さそうだ。 https://t.co/KfEGpDyJlC	{'place_id': '5daa72ccdd68afee'}
2020-05-25T08:02:48.000Z	1264829253624844293	すげぇな　電車内座席一個あけで皆んな座ってるわ	{'place_id': '7efb0fd5276fdda5'}
2020-05-25T08:01:42.000Z	1264828979032121345	俺の仕事内容(今日)12時に出勤洗い物して食札並べてふわふわして昼寝して配膳して洗い物して終わり、、、、仕事？これ笑え？	{'place_id': '1df8c91136c4c140'}
2020-05-25T08:01:39.000Z	1264828965316784129	@70kosa 海外旅行行くのか、隔離生活味わいに行くのか。	{'place_id': '594fa6c6bc5b5ba9'}
2020-05-25T07:59:20.000Z	1264828383550033920	徐々に国内旅行は増加するだろうけど、海外旅行はいつ頃解禁かな。こればっかりは日本が良くても、諸外国の対応にもよるだろうから、秋とかまでは厳しいのかな。自主隔離付きの海外旅行は行きたくないしな。	{'place_id': '594fa6c6bc5b5ba9'}
2020-05-25T07:57:44.000Z	1264827980859060224	こうやって第2波が、って思ってるよね皆。きっとそうだろうと私も思う。旅行半額補助など 7月開始へ#Yahooニュースhttps://t.co/dQ2r1ZKHL2	{'place_id': '1df8c91136c4c140'}
2020-05-25T07:56:22.000Z	1264827637421076481	何も考えないツイート009。数日前から6年ほど放置していたギターを弾き始めた。コードや運指が思い出せないばかりかチューニングも覚束なかったがタブ譜を見ながら音を出していたら、バッキングとギターソロ1曲ずつ通して弾けるようになった。次にWeb飲みに参加できたら披露しようかな。2曲だけど。	{'place_id': 'dee4362fa7f11785'}
2020-05-25T07:53:06.000Z	1264826812544081922	お出かけしたいです。近場で楽しむとなると夜しかないんだよなー	{'place_id': '594fa6c6bc5b5ba9'}
2020-05-25T07:52:01.000Z	1264826543311814659	今日も今日とてカフェ出勤新メニューあるよ！ https://t.co/bG2eBiVpvs	{'place_id': '7ee61f505fdfdf5c'}
2020-05-25T07:51:54.000Z	1264826513087586304	完全終息してない状況で、離島に殺到したら？ 発症者出たらパニックやで…第２波、第３波を意図的に引き起こそうとしとるのか？夏の甲子園や、花火など中止を決断した人達が報われん…※高校総体中止が、なぜあまり話題にならんのや？旅行半額補助など#Yahooニュースhttps://t.co/Yj5FTNFSFU	{'place_id': '519decbcbebfd98d'}
2020-05-25T07:51:39.000Z	1264826449921363968	国内旅行、半額…じゅるり。	{'place_id': '6c5c2473e68be79e'}
2020-05-25T07:48:14.000Z	1264825588193222657	外出自粛解除一発目洗車してきた https://t.co/CiR3GMrrIS	{'place_id': '0fc297385a55e001'}
