2020-12-27T23:58:43.000Z	1343345598653599745	出勤途中追っかけで聴いています＃istory ＃bayfm	{'place_id': '0fd33386c57b038a'}
2020-12-27T23:56:58.000Z	1343345156171284480	朝めざましテレビ以外は時間表示が無くもう皆冬休みかよ！って期待して駅に行ったら普通に人居た😅私は明日まで仕事なので明日は電車ガラガラで良いのよ？	{'place_id': '386e90e8f5c5d17a'}
2020-12-27T23:56:56.000Z	1343345151108730880	おはようございます😊電車に乗ろうと駅に着いたら、駅前交番から、お巡りさんが2人走り出してきました👮‍♀️なんだか…不穏な朝ですが…何もない事を祈りつつ…🙏気分を変えて、本日に仕事いってきまーす！お仕事の方も、お休みの方も、良き1日を👍✨	{'place_id': 'f72cbd7b378a05fc'}
2020-12-27T23:55:52.000Z	1343344883214426114	ZARD familyな皆様、毎度です✋！2020年ラストな時差出勤前のモーニングレイコー☕！昨日の有馬記念🐴、三連複ゲットで“2020年有終の美✨”を飾れました✌️！今日は、さすがに既に年末年始休暇なところも多いせいか、混み具合がかなり緩和されてましすね☺️。今週も、よろしくお願い致します👍！ https://t.co/V5Kj8fXJix	{'place_id': '0fc34630c6d5e000'}
2020-12-27T23:55:06.000Z	1343344686786699265	感染状況考えると仕方がないけど、旅行業や飲食業の皆さんの暮らしを考えると複雑だよなぁ。ゴトーっていうよりも、一般企業の在宅勤務をもっと強制力持って推奨して欲しい。私の職場超密 https://t.co/V05DMZE4oy	{'place_id': '03060ba847e52dcd'}
2020-12-27T23:54:04.000Z	1343344429143187457	在宅仕事が長引きまくり、今日の外出諦める。	{'place_id': 'ae10e4565c20a69b'}
2020-12-27T23:53:07.000Z	1343344189140963328	@Ikakoocho いま会社着くとこ、年末は世間と同じ今日までと思ってたら、なんと電車の空いてること┐('～`;)┌	{'place_id': '7ee61f505fdfdf5c'}
2020-12-27T23:52:33.000Z	1343344048317161472	まあまあ今日出勤の人多いんだなー😟大掃除🧹とかもあるのかなー最終日はテレワークっす😛	{'place_id': '49524fd7b35fd754'}
2020-12-27T23:48:52.000Z	1343343120679780352	さすがに朝の通勤電車空いてるわ〜	{'place_id': '594fa6c6bc5b5ba9'}
2020-12-27T23:47:59.000Z	1343342899270885376	赤羽始発の京浜東北線だけれども、電車ガラガラ過ぎてワロタw仕事納めでいっせいに仕事終わるのはいかにも日本人ぽっいが・・・・「ウチはコロナ対策で他社よりも早く仕事納めして、遅く仕事初めします！」でも良いんだぞ？なお、勤務先弊社は例年通りと無慈悲な通達があった模様。 https://t.co/AdiKNnIRJg	{'place_id': '07d9d225df484000'}
2020-12-27T23:46:20.000Z	1343342480347996160	@JOB9MArhcMG26CF おはようございます。先週土曜日から17連休なかたもいらっしゃいますが(奥さまがそうです)、電車はフツウに混んでいます。お互いにあとひと踏ん張り頑張りましょうね。(笑)	{'place_id': '5c43b25fece122d2'}
2020-12-27T23:44:20.000Z	1343341977929060353	電車も空いてるこれは嬉しい😃	{'place_id': '28b9063fdce43645'}
2020-12-27T23:42:20.000Z	1343341474595782657	電車すいてるな。どういう事？😅	{'place_id': '7efb0fd5276fdda5'}
2020-12-27T23:42:00.000Z	1343341390185390080	年内ギガ終了😭！！年明けまで外出時無言！！	{'place_id': 'de733ecbe94a943c'}
2020-12-27T23:41:40.000Z	1343341305682821121	電車ガラガラ　　　　？いや、ぜんぜんガラガラではなかったよ。ただ、明らかにコロナ禍の乗車率になっているので、いろいろ変わっていくんだなとしみじみ思ってるよ	{'place_id': 'f7c22e0cf7b3af2b'}
2020-12-27T23:40:55.000Z	1343341120080674816	明日までオシゴトなワタシは今日も元気に出勤です。この1週間ほど「お通じ」が止まりまして、そんな中での今朝の体重測定は83.9kgでした。おやらかしダイエット期限まで残り4日であと1.4kg、いよいよ赤信号でございます。(泣)#おやらかしダイエット2020 #便秘薬を買おう https://t.co/oaLOfULCBO	{'place_id': '5c43b25fece122d2'}
2020-12-27T23:40:33.000Z	1343341025855557633	電車で目の不自由の人居たから助けて上げた	{'place_id': '1b0cfebe3424e14f'}
2020-12-27T23:39:59.000Z	1343340883215699968	年内最終出勤日。電車、空いてるよーな、そーでもないよーな( •́ .̫ •̀ )	{'place_id': '7ee61f505fdfdf5c'}
2020-12-27T23:39:16.000Z	1343340703225503744	さすが、今日は電車ガラガラ	{'place_id': '76c498282a5a7997'}
2020-12-27T23:37:55.000Z	1343340364573233152	おはようございます🎵本日ゲリライベント開催しちゃいます✨ネット指名、本指名のお客様❗ポイント2倍🉐店頭でお写真からお選びのお客様❗2000円割引の25500円🉐お得に楽しんじゃいましょう🎶新人姫、人気姫共に多数出勤👍お気軽にお問い合わせ下さい💕TEL03-3876-8787 https://t.co/ZULsXKSeg2	{'place_id': '0fc2b9b2f9555001'}
2020-12-27T23:37:46.000Z	1343340325775974402	@_yuyuchii おはようございます♡(ス・ω・㌧)💨バタバタw本年ラスト出勤。来年から新職場で心機一転頑張ります。←	{'place_id': '3d4bcaf184b72e12'}
2020-12-27T23:35:50.000Z	1343339840440475648	電車すいとる～	{'place_id': '1b0cfebe3424e14f'}
2020-12-27T23:35:06.000Z	1343339656000069637	マスク、手洗い、アルコール消毒、No3密、不要不急外出自粛、etc.やってきたのにもかかわらずこの人数なんだねっ！ https://t.co/ZVVUbpkiSr	{'place_id': 'f7c22e0cf7b3af2b'}
2020-12-27T23:33:58.000Z	1343339368400896001	@hawaiisaiko おはようございます🎶。電車の空き具合、駅前のカフェの営業時間の変更などを見ると年の瀬を感じますね。	{'place_id': 'a398e1f1025abe37'}
2020-12-27T23:32:23.000Z	1343338973461061632	おはようございます本年最後の出勤です全スタッフで工場の掃除と整理整頓例年は夕刻から忘年会ですが、本年は取りやめ職場への感謝を込めて、働く日ですおおきな事故なく本年を終えて、明年はさらに発展させつつ、明年も無事故で終えられるように皆さま、素晴らしい月曜日になりますように https://t.co/vXjooy3nVa	{'place_id': 'f1299e526e0cc34d'}
2020-12-27T23:32:02.000Z	1343338883832971265	仕事納め出勤、財布とスイカを家に忘れてきた。別にしてあるお金があるので今日１日はなんとかなるけど。ガッカリな仕事納め。	{'place_id': '7ee61f505fdfdf5c'}
2020-12-27T23:31:25.000Z	1343338730317172736	飲食店で働いているのでお休みがいつもどおり。31日まで出勤します☺️明日だけ休みとは…年始も3日〜頑張れ、自分☺️#純喫茶で働く人	{'place_id': '1b0cfebe3424e14f'}
2020-12-27T23:29:07.000Z	1343338150614056960	ちゃんと出勤してます。 https://t.co/zroiGr8r5p	{'place_id': 'afd2dbc6df82cca8'}
2020-12-27T23:29:05.000Z	1343338142036717569	出勤！	{'place_id': '76c498282a5a7997'}
2020-12-27T23:28:29.000Z	1343337988357382145	今日でおしまい！ホントにイロイロあった年でした。（稼働案件立て込んでいるみたいなんで開発チームの皆さんは年末年始は出勤らしい…自分はお休みします…すまん！）	{'place_id': 'bfdffb491d839e84'}
2020-12-27T23:28:19.000Z	1343337948473769984	今年最後の出勤日、今日くらいはひとつのミスも起こさず終わらせましょう♪…朝から寝過ごした。（終了）	{'place_id': '735b6f2b933efaf6'}
2020-12-27T23:28:11.000Z	1343337914495713280	今朝は、電車も空いています。年末年始休みに入られた方が増えたのでしょうか？当院は３０日まで営業。１０時〜１時の午前部までやっています。 https://t.co/XBsrQN1eBZ	{'place_id': '27b43920b8b63188'}
2020-12-27T23:27:52.000Z	1343337834946564098	@tatoyuhi2010 いいなぁ〜あたしなんて２連休までかなぁ？休みたいけどあまり休むと出勤した時に波にのれないまま1日が終わる感じで疲れるからねぇ〜それより心配なのはまた中止なんてならない事を祈りたい‼️配信組で2日目行きたいけどねぇ〜	{'place_id': '18d30ff8086ed40c'}
2020-12-27T23:26:42.000Z	1343337540497985537	@shintano おはようございます。今日は仕事納めですか？そちらは電車がらがら？他はあまり変わらないそうです。今年最後のお仕事頑張って行きましょう❗	{'place_id': '1b0cfebe3424e14f'}
2020-12-27T23:25:55.000Z	1343337343776772096	おはようございます！本日、egg baby cafeでの最終出勤日です。20時までおりますので、宜しければお待ちしてます😌 https://t.co/f1BTYk7Wqw	{'place_id': '0f06848cab94f001'}
2020-12-27T23:25:42.000Z	1343337290714607616	電車ガラガラがトレンドにあるけど、いつも通りやで。ガラガラは田舎方面では？都心は　普通通り、皆さん会社に行って仕事です。	{'place_id': '4c1c4868f96634ed'}
2020-12-27T23:24:46.000Z	1343337054609043458	おはようございます。本日、仕事納めです。電車空いてる＾＾ (@ 東急東横線 武蔵小杉駅 in 川崎市, 神奈川県) https://t.co/twY0iVFgLk	{'place_id': 'd313627ad749ca61', 'coordinates': {'type': 'Point', 'coordinates': [139.659685, 35.57583261]}}
2020-12-27T23:22:52.000Z	1343336578442096641	仕事納め、出勤わず。心境は画像のとおり。 https://t.co/ED3Q8dPG6A	{'place_id': '18d30ff8086ed40c'}
2020-12-27T23:19:21.000Z	1343335693481697280	電車一本乗りそびれて生きた心地してない。	{'place_id': 'f72cbd7b378a05fc'}
2020-12-27T23:13:14.000Z	1343334151596871685	年末だからか電車に人が少ないな	{'place_id': '32049a95db695cb8'}
2020-12-27T23:12:51.000Z	1343334057317298177	@masanaga1972 有り難うございます本日は仕事納め、何とか出勤しています昨日は現場へ行けずに寂しく過ごしましたのんたん誕生祭、無事に開催出来て良かったですね！💐余談ながら、『生誕祭』とは、亡くなった人に対して使う文言を承知で使用していますか？私は失礼になるとの意識で、その表記は避けています https://t.co/jYI6wLjiDB	{'place_id': '07d9c9bb49087001'}
2020-12-27T23:12:42.000Z	1343334019853762560	ぬぅ。地味に電車5分遅延すると乗り換えの兼ね合いで痛い。年末でも、けっこう電車混んでますね。	{'place_id': '3d4bcaf184b72e12'}
2020-12-27T23:11:49.000Z	1343333796905512961	おはようございます☀今年最後の出社前モーニングはジャーマンドッグでした🌭☕😋本日出勤の皆さま、今日一日頑張ってまいりましょ😊👍お休みの方は大掃除頑張ってください😆✨ https://t.co/nFEVgO4MyB	{'place_id': '11707f8710d57000'}
2020-12-27T23:10:57.000Z	1343333576285237248	おはようございます。久しぶりに電車。子供のときから降りる出口関係なく、車掌さんのところが１番好き。車掌さんは英語で CONDUCTOR。コンダクターの憧れから指揮者になったのは運命だな〜。 https://t.co/MO8pjCC6Ox	{'place_id': '7ee61f505fdfdf5c'}
2020-12-27T23:10:18.000Z	1343333413114228736	電車空いてるなぁ… (@ 二俣川駅 in 横浜市, 神奈川県) https://t.co/IoUZ9sPXEP	{'place_id': '5ab538af7e3d614b', 'coordinates': {'type': 'Point', 'coordinates': [139.53252644, 35.46375796]}}
2020-12-27T23:10:06.000Z	1343333363130593281	会社最終日なり、電車空いてますな。まぁ明日も来るけど、取り敢えず今日まで倒れずに来れたことに俺に感謝	{'place_id': '28b9063fdce43645'}
2020-12-27T23:09:52.000Z	1343333304171261952	社畜たけちん子に今電話したらまだ働いていた…。「もう少しなんだけど終わらない…。このまま出勤するしかないっス…。まゆちゃんに会えるのは夜になります…。」どうなってんの…。…………社畜に幸あれ！！！	{'place_id': '5cf616c8f739cb2b'}
2020-12-27T23:09:06.000Z	1343333112281907200	出勤中帰宅中のトイレ無い区間の腹痛はマジでヒヤヒヤする😭	{'place_id': '6d3998663bfdad9b'}
2020-12-27T23:08:46.000Z	1343333029737943041	電車空いてる。もう年末か。こんな日に出勤とは笑わせてくれる。	{'place_id': 'dcc2630623880f96'}
2020-12-27T23:07:17.000Z	1343332653609545728	@haruhi_1111 まだ今日辺りは出勤の方、多いみたいですね。こちらもいつも通り。今日が納めの人が多いのかも。私は、いつでも納める準備はできてるのに…。	{'place_id': 'f808b328dbac41d3'}
2020-12-27T23:05:10.000Z	1343332122669412353	@Ikakoocho σ(^^)は一昨日出勤、年明け３日から勤務…Orz	{'place_id': 'f72cbd7b378a05fc'}
2020-12-27T23:02:55.000Z	1343331557130395648	@hellskichien313 Joeさんおはようございます😃出勤の仕事納めです😁	{'place_id': '4c1c4868f96634ed'}
2020-12-27T23:02:17.000Z	1343331398136995842	今日は電車が空いてる。もう休みのところ多いのかな	{'place_id': '28b9063fdce43645'}
2020-12-27T23:02:08.000Z	1343331358014382086	さすがに今日は電車が空いてるな。久しぶりに座れた。 (@ 京王相模原線 多摩川橋梁 in 調布市/川崎市, 東京都/神奈川県) https://t.co/Pju55NbPDx	{'place_id': 'd473ed704dbcd4a5', 'coordinates': {'type': 'Point', 'coordinates': [139.53488588, 35.6395457]}}
2020-12-27T23:01:30.000Z	1343331200618795008	おはようございます😀今日は年内ラストの休み予定でしたが出勤。10連勤4日目なう。今年の漢字は『共』です。世界的に未曽有なコロナと『共存』して立ち向かう。趣味で『共通』な方とのお付き合い。そして何よりもビッグ・マンモスを通しての様々な『共有』。ホントに感謝。#ビッグ・マンモス https://t.co/BIniBL8Hqx	{'place_id': '594fa6c6bc5b5ba9'}
2020-12-27T23:00:53.000Z	1343331044854910977	通勤電車満席立ってる人 30人ぐらいマスク使用率  してない人1人	{'place_id': '0fc2e9d7d455b001'}
2020-12-27T23:00:20.000Z	1343330904127631361	1週間振りの出勤、今日は13時30分おはよう❗️	{'place_id': 'dcc2630623880f96'}
2020-12-27T22:59:07.000Z	1343330598161682433	行く先になって厠に行きたくなったんで、一本遅い電車で！！(^-^)/ (@ 東神奈川駅 in 横浜市, 神奈川県) https://t.co/rXD80UYl2h	{'place_id': '962b0af43cd1ad6c', 'coordinates': {'type': 'Point', 'coordinates': [139.63330191, 35.4779966]}}
2020-12-27T22:58:27.000Z	1343330430410313729	おはようございます(^o^)/本日はおやすみです。お台場ゲマとアキバゲマに行く予定です。天気が微妙なので電車かな…昨日の有馬記念は枠連コロナ(⑤-⑥-⑦)BOX買いすれば当たってたことに気がつきました。当たってももうけありませんがww https://t.co/4lMunR9BDi	{'place_id': '03060ba847e52dcd'}
2020-12-27T22:58:26.000Z	1343330429374353408	みゆ❤️ちゃんのふふふ黒ちゃんは、みゆちゃんの何しますか⁉️に朝から電車中でニヤニヤしてしまった⁉️可愛いから、、、皆さん、許してね✌️ https://t.co/EJwEAVf6pQ	{'place_id': '28b9063fdce43645'}
2020-12-27T22:56:38.000Z	1343329974527217664	今日も元気に出勤してるょ	{'place_id': '76c498282a5a7997'}
2020-12-27T22:55:54.000Z	1343329790477144065	出勤 (@ 新桜台駅 - @seiburailway in 練馬区, 東京都) https://t.co/E2yBgeolbi	{'place_id': 'dcc2630623880f96', 'coordinates': {'type': 'Point', 'coordinates': [139.66837741, 35.74082025]}}
2020-12-27T22:55:25.000Z	1343329666682114048	流石に少し電車空いてるな。でも意外と乗ってる。	{'place_id': 'b2216c57788fc225'}
2020-12-27T22:55:24.000Z	1343329665465741313	今日は電車も空いてる～😄	{'place_id': 'f05d4b0cfac65c65'}
2020-12-27T22:52:53.000Z	1343329029319872514	いつもこの時間みんな来てるのに誰も来ないww普段は休みの月曜日なんか出勤日にするからだぞww https://t.co/f9hHdyuN1L	{'place_id': 'e55409e2b3f74247'}
2020-12-27T22:50:18.000Z	1343328382314926080	きょう仕事納めだけど、明日の物量次第では出勤しようかな…作業場の大掃除もしたいし	{'place_id': '92b6a770413525fe'}
2020-12-27T22:49:21.000Z	1343328140085489664	朝から電車めっちゃ空いてる	{'place_id': '7efb0fd5276fdda5'}
2020-12-27T22:47:24.000Z	1343327649049923584	電車比較的空いてる	{'place_id': '86315f8740971686'}
2020-12-27T22:46:52.000Z	1343327517877276672	@chamo_dayaka065 ちゃむおさん、いつもありがとうございます！また飲みに行きまひょ🍻	{'place_id': '28b9063fdce43645'}
2020-12-27T22:46:25.000Z	1343327404203278336	通勤電車は空いてる。年末感あるね。	{'place_id': 'd9ac10e7c031f3c2'}
2020-12-27T22:46:13.000Z	1343327352835563520	今日荷物減らしたかったんで、スーツにロボパーカー着てさらにポンチョ着てるんだけど、さすがに電車の中は暑いww	{'place_id': '32049a95db695cb8'}
2020-12-27T22:45:39.000Z	1343327210464190466	朝の通勤電車、ガラガラかと思いきやそれほどでもなく。コロナはまだまだ広がるなと感じました	{'place_id': '594fa6c6bc5b5ba9'}
2020-12-27T22:44:20.000Z	1343326880594755584	ゴミちゃん🍀おはよ～明日から回収がお休みだから…拾えないかも！そんな時には、マイゴミ‼️今日も寒いから外出できたらカウントしよう https://t.co/85iG82jkqZ	{'place_id': '4c1c4868f96634ed'}
2020-12-27T22:42:31.000Z	1343326423428186113	電車が空いてる。。今日から休みな会社もあるんか？	{'place_id': 'dcc2630623880f96'}
2020-12-27T22:42:16.000Z	1343326358135398400	今日は旦那様のお誕生日✨28が夫婦のハッピーday妻の誕生日が08月28日結婚記念日が10月28日夫の誕生日が12月28日外出出来ないから自宅でお祝い🥂しかないなぁ😭 https://t.co/yhhw9esWZE	{'place_id': '4ad3383e25ac98d9'}
2020-12-27T22:40:50.000Z	1343325997672910849	出勤前に寄り道〜　#lovelive (@ アトレ秋葉原1 - @atre_akiba in 千代田区, 東京都) https://t.co/nJ1aSiUOkF https://t.co/jBFzQTZqKQ	{'place_id': '28b9063fdce43645', 'coordinates': {'type': 'Point', 'coordinates': [139.7723506, 35.698415]}}
2020-12-27T22:40:36.000Z	1343325938436567040	今日で今年最後の出勤になります🥺会いに来てください🥺ラストがんばろー💖#エンタメ活動を止めないhttps://t.co/jJhPGuXzXS https://t.co/5ALHN4biz1	{'place_id': '594fa6c6bc5b5ba9'}
2020-12-27T22:40:33.000Z	1343325926671577089	おはようございます。今から出勤です。今日は「『海老名』の商業施設」が現場です。今日も頑張ります。	{'place_id': '61774861ea700565'}
2020-12-27T22:40:27.000Z	1343325903066042368	30日所謂会社の指定有給、有給ない俺らは出勤なんだけど、他企業お休みでお届けない上に、仕事納め雨はマジできついから欠勤することにした。	{'place_id': 'e55409e2b3f74247'}
2020-12-27T22:38:11.000Z	1343325331873140736	今日は今年最後の出勤日大掃除をして帰るだけのはずだけど	{'place_id': 'faab662cb34cf04f'}
2020-12-27T22:37:55.000Z	1343325265091432448	雲☁️空。天気悪いから、もう少し寝てるかと、思ってたら、携帯電話がなる‼️栗原さん、今日は休日じゃなく、出勤ですよ‼️何⁉️スケジュールを見ると、休日に。担当者に、何処を見てるんだ‼️蹴り👣💨すいません🙏栗原さん休日でした😅間違って、朝から携帯鳴らすなよ❗️焦った😵💦おはよー👋😃 https://t.co/GOaEHYEgic	{'place_id': '07d9f32d1ec82000'}
2020-12-27T22:35:39.000Z	1343324694506741762	@Superfly_matsu 電車空いてるよ〜😁	{'place_id': '594fa6c6bc5b5ba9'}
2020-12-27T22:35:32.000Z	1343324666576785409	電車内で空き席にダッシュした妙齢のおばさまに体当たりされたんですが…。仕事納めに向かいます。	{'place_id': '4f8c5ba59b1e3250'}
2020-12-27T22:34:21.000Z	1343324364956168196	最近の出勤日の朝飯はここ。 (@ そば うどん はないち in Chiyoda, 東京都) https://t.co/xsZvcjE2kS	{'place_id': '28b9063fdce43645', 'coordinates': {'type': 'Point', 'coordinates': [139.763732, 35.675044]}}
2020-12-27T22:33:00.000Z	1343324027457159169	今出勤していて同じように電車に乗って出勤している人たちは全員仲間だと思っている	{'place_id': 'ebf44036e84a8152'}
2020-12-27T22:32:09.000Z	1343323812511641600	仕事納め？なんだそりゃ！まだ終わらんよ！今日も出勤！	{'place_id': '336251fac4207ae3'}
2020-12-27T22:32:07.000Z	1343323805423267841	電車、所沢でもガラガラや。マジで年末モードですね…。	{'place_id': '1d5d82d43a574e4f'}
2020-12-27T22:31:03.000Z	1343323536702631936	@katosan2525 傘持って出たのに、誰ーも電車で傘持ってる人いないwww	{'place_id': '76c498282a5a7997'}
2020-12-27T22:29:58.000Z	1343323264093806592	仕事納めで、朝に銀行へ行って通帳記入しないといけなくなり、出勤まで時間があるんで、寒い中どうやって時間をつぶすか私の課題です。流山市岡川幸治♯GPS897	{'place_id': 'b2216c57788fc225'}
2020-12-27T22:29:57.000Z	1343323260809703424	仕事納め大手町へ出勤中😄常磐線品川行きいつもの半分で空いてる😆ラスト頑張るぞ💪帰りはロッテリアのウルトラまんが盛ポテト🍟500円買う〜😋	{'place_id': 'f43d3d50a3b017e9'}
2020-12-27T22:29:34.000Z	1343323161463410688	毎日オープンから出勤して皆勤賞取り続けてます！もうそろそろ5ヶ月連続皆勤です！ https://t.co/Jpm09hyMip	{'place_id': '7ee61f505fdfdf5c'}
2020-12-27T22:28:39.000Z	1343322934144716801	電車ガラガラではない🦠	{'place_id': '594fa6c6bc5b5ba9'}
2020-12-27T22:27:29.000Z	1343322638626803715	出勤やで	{'place_id': '1df8c91136c4c140'}
2020-12-27T22:27:21.000Z	1343322605789409280	さすがに電車がすいてる🎶	{'place_id': '1df8c91136c4c140'}
2020-12-27T22:25:27.000Z	1343322125902303232	何で今日出勤なんだ死ーね～～～🎵	{'place_id': '76c498282a5a7997'}
2020-12-27T22:24:30.000Z	1343321888425127937	今日は今年最後の出勤！一年間、お疲れさまでした！ (@ 神田明神 - @kanda_myoujin in 千代田区, 東京都) https://t.co/DP90abzWsM https://t.co/s1bxKKE6d3	{'place_id': '28b9063fdce43645', 'coordinates': {'type': 'Point', 'coordinates': [139.76771442, 35.70173283]}}
2020-12-27T22:24:09.000Z	1343321797991624704	やっぱり電車ガラガラか4月頃を思い出すな〜	{'place_id': '41d9dd520c812894'}
2020-12-27T22:23:42.000Z	1343321688579063808	ﾝﾅｧｰ、電車に人少ねえ。やはり28日まで働いてるのはクソ雑魚中小企業勤めの社畜だけということか。悲しいね、バナージ。	{'place_id': '1df8c91136c4c140'}
2020-12-27T22:18:54.000Z	1343320478568443904	今日はそれほど寒くない(￣□￣;)?!電車はもう年末の運行ダイヤかな？バイク通勤だと気にしなくていいから楽(о´∀`о)	{'place_id': '86315f8740971686'}
2020-12-27T22:16:31.000Z	1343319877239648256	津田沼駅当駅始発電車🚃乗って幕張本郷駅へ京成幕張本郷駅のファミリーマート🏪入って速攻ゆうちょ銀行だった https://t.co/MSuZy9pdul	{'place_id': '07d9e479aec83003'}
2020-12-27T22:15:55.000Z	1343319727758700545	@yassan2015oo おはようございます(〃ω〃)今日も出勤でしたか！今朝も素敵なコーデですよ🎵	{'place_id': 'e55409e2b3f74247'}
2020-12-27T22:15:35.000Z	1343319643725811712	@IwahashiHide 重役出勤？	{'place_id': '962b0af43cd1ad6c'}
2020-12-27T22:15:32.000Z	1343319629792387072	電車空いてるなーもうみんな休みなのかな🤔いいなー🤔	{'place_id': '28b9063fdce43645'}
2020-12-27T22:15:06.000Z	1343319522338476032	おはよう御座います。💁‍♂️厚い雲が出ていて、雨☔が降りそうな朝です。😖今日は今年最後の夜勤です。出勤まではゆっくり過ごしますが、今年の夜勤の集大成として、ダメだった事・出来なかった事を思い浮かべ、振り返ってみたいと思います。😉次回夜勤は元日、この時は目標を考える事になるのかな？。 https://t.co/DBM4W4FbD8	{'place_id': 'f808b328dbac41d3'}
2020-12-27T22:13:38.000Z	1343319154095497217	通勤電車。やけにスカスカだにゃ (@ いずみ中央駅 - @sotetsu_pr in 横浜市, 神奈川県) https://t.co/Y0ZqaozUqg	{'place_id': '391c9198c36b053c', 'coordinates': {'type': 'Point', 'coordinates': [139.48727731, 35.41536748]}}
2020-12-27T22:13:01.000Z	1343318997597470720	仕事だ💪 病棟の正月飾り付けないとねー(&gt;_&lt;)何とか 出勤時は 雨降らないかもー💨	{'place_id': '56c04190b03cfa94'}
2020-12-27T22:11:21.000Z	1343318578880270338	出勤 (@ モノレール 天空橋駅 in 大田区, 東京都) https://t.co/qVkcUJLXJ7	{'place_id': '1df8c91136c4c140', 'coordinates': {'type': 'Point', 'coordinates': [139.75430466, 35.54914951]}}
