2020-05-27T14:29:54.000Z	1265651447779127296	@haruyosh ホットクックを導入して、むしろ普段より野菜摂取してたけど、出勤になってこの生活も終わりそう🥺	{'place_id': '32049a95db695cb8'}
2020-05-27T14:21:51.000Z	1265649420206407681	今日は久しぶりに友達とカラオケにーやっぱりカラオケは良いよね🎤久しぶりに沢山歌ってストレス解消した‼️#亀梨和也#絆 https://t.co/RJXYFk4VID	{'place_id': '0fc39750a2542001'}
2020-05-27T14:20:57.000Z	1265649194271830017	横浜線と交わるあたりなので電車止まらないか心配ですね https://t.co/5nBaFXZOjF	{'place_id': 'ed61afd47a8bfd91'}
2020-05-27T14:20:56.000Z	1265649191495151619	フルート坂上領くんのバースデーライブ、毎年6月前半に目黒の大きなお店でやってますが、今回のコロナウイルスの影響でライブ配信をすることになったそうです🤡✨遠くて行けない方、お出かけしづらい方にも聴けるチャンスです👍スケジュールにメモしてくださいね😊✨https://t.co/x61VjDuaRL	{'place_id': '093051920e170001'}
2020-05-27T14:15:42.000Z	1265647875129634818	外出自粛中も地道に筋トレとサーキットトレーニングを続けてて、30歳の時より39歳の今の方が良い体型をしてる。が、それでもなおお腹周りの浮き輪がなかなか消えてはくれない。	{'place_id': '4c1c4868f96634ed'}
2020-05-27T14:11:36.000Z	1265646840977870848	行徳と某ランドが同じ島にあるのか通称、行徳島行徳駅は行徳駅前2丁目徳島駅は寺島本町1丁目普通、徳島行（断じて電車ではない）並べ替えたら行徳島	{'place_id': 'db215c78c59027e4'}
2020-05-27T14:09:17.000Z	1265646261287309313	しごおわ。2日酔いでエンジンかかるの遅かったのもあるがやることが多い。今日は飲みに出たかったなーー	{'place_id': 'afd2dbc6df82cca8'}
2020-05-27T14:04:39.000Z	1265645095560216578	夏の｢国鉄｣の電車内は窓が全開で風は感じるけど扇風機だけではメッチャ暑い…(-_-;)#昭和生まれっぽい発言をしろ	{'place_id': '86315f8740971686'}
2020-05-27T14:00:46.000Z	1265644117742084098	JR東青梅駅のホームは電車の床面との段差が大きく、電車との隙間も広め。青梅市役所など公共施設の最寄駅でもあるので、ホーム延伸時（中央線の12両編成化に対応するため）に嵩上げなどの改善がなされるのだろうか。 #青梅線 #東青梅駅 #青梅市 https://t.co/fBHWXPM5z8	{'place_id': '0a6409b7ccd62000'}
2020-05-27T14:00:30.000Z	1265644050431881217	@youhei_1012 またこっち来たときは、飲みに行きましょう❗	{'place_id': '4c1c4868f96634ed'}
2020-05-27T13:59:27.000Z	1265643783703498754	@hinata__ba 2ヶ月の日照不足が無事に解消されて良かった。ちゃちゃまるもかわいかったよ！そして幕張より髪のびてる？とか思ってしまった(ロング好き)。あ、外出しなくても週間天気予報と最高最低気温だけみるだけで全然違うよ。	{'place_id': '9de423c47dbf207e'}
2020-05-27T13:58:30.000Z	1265643545622220802	@hiroshi_n_usagi なんだかですね、(ｰ ｰ;)テレワークが進まないとまた混雑する電車に乗らなきゃいけないですからね、、	{'place_id': '519decbcbebfd98d'}
2020-05-27T13:52:04.000Z	1265641928093134849	昨日の出勤の結果、若干筋肉痛が	{'place_id': '32049a95db695cb8'}
2020-05-27T13:51:37.000Z	1265641812594581504	時差出勤なのかもしれないけどリスクが無くなった訳ではないのだから妊婦さんは早く帰ろうよ‼️※余計なお世話だろうけど‥	{'place_id': '594fa6c6bc5b5ba9'}
2020-05-27T13:49:49.000Z	1265641360926707712	東海道線の事故のせいで京浜東北くんが混んでたので京急ちゃんで帰った🚃💨オリンピックのラッピング電車がいた🙄#まだあったのね#これに乗ったわけではない https://t.co/SLENOUAWyr	{'place_id': '07d9ec8531087000'}
2020-05-27T13:46:09.000Z	1265640437827506176	全社員に常務からメール。感染リスクの中出勤してくれた人に感謝の意味でなんちゃら感謝金を9月分の給料に上乗せします。緊急事態宣言から解除までの出勤日数で3段階金一封。保育園･学校休みで出勤できない人も防疫休暇で満額給料支給なので、ちょっと不満を持ってたけど。ホワイト企業だ。	{'place_id': '336251fac4207ae3'}
2020-05-27T13:45:20.000Z	1265640230461206528	交通事業者、半数が倒産危機　外出自粛続けば8月までに | 2020/5/27 - 共同通信 https://t.co/kIcPrIRuIO	{'place_id': '76c498282a5a7997'}
2020-05-27T13:41:46.000Z	1265639336160063488	すっかり寝坊して午後から出かけたけど、新宿駅は人が少なくて全くストレス無く歩ける。それだけはいいかな。電車も。	{'place_id': '61774861ea700565'}
2020-05-27T13:34:38.000Z	1265637538439393280	お金払って飲みに来てるのにイジられるとか偉そうにされるとか本当不愉快になってる今日この頃精神状態不安定ですね	{'place_id': '962b0af43cd1ad6c'}
2020-05-27T13:33:58.000Z	1265637372474998784	日暮里舎人ライナーはむしろ何であそこに電車が走ってるんだろうって感じ	{'place_id': '49524fd7b35fd754'}
2020-05-27T13:33:55.000Z	1265637359124508672	本日は青井1815～2200南千住。あー、認めたくないので25🌰の表示にしてます。7件です。やけくそで南下して入谷～両国、浅草橋～今戸・南千住で一応🌰はしました。過半数鳴らないなんて初めてですよ。おかしい。ほんとおかしい。明日は出勤日ですからおやすみ。おつかれさま。 https://t.co/kYnS0sr29X	{'place_id': '76c498282a5a7997'}
2020-05-27T13:33:07.000Z	1265637159513419776	マイタケツイッター地雷さんの電車 https://t.co/8VgcQ7Wi7H	{'place_id': '28b9063fdce43645'}
2020-05-27T13:27:08.000Z	1265635652504137728	3/20ぶりに電車に乗ったみたい、こんなに行動変わるってコロナやばいな	{'place_id': '0d8054846be7f7be'}
2020-05-27T13:23:38.000Z	1265634772530851841	あともう一つ検討中な件が...自分の誕生日である6月28日(日)が現時点では出勤日で、その前日(土曜日)が休暇になっているんだけど、他のドライバーと土日の勤務を交代してもらうかどうか？🤔💭	{'place_id': 'dded92a2db180dd1'}
2020-05-27T13:17:33.000Z	1265633240129261568	@poco20161122 50代前半で｢美味しいもの食べたい。｣と、｢ちょっとお洒落したい｣と、｢海外旅行行きたい｣	{'place_id': '1b0cfebe3424e14f'}
2020-05-27T13:11:27.000Z	1265631706465177600	@yoshitomin3 飲みに行こうぜぇ~♪(^-^)	{'place_id': '76c498282a5a7997'}
2020-05-27T13:09:49.000Z	1265631295213723655	緊急事態宣言の解除を受けて、今日から出勤です。ところで、自粛明けに、太った？って聞いちゃいけない法案って国会で通ったと思っていたんだけど、違ったのかな？🤔私のことが大好きな課長に朝一で、あれ？太った？って聞かれたんですけど〜🤣 https://t.co/x7U97G5IWg	{'place_id': '7efb0fd5276fdda5'}
2020-05-27T13:08:46.000Z	1265631031161286658	@hisato76 埼玉から菊名へ行く電車です、ご査収ください(*´･ω･) https://t.co/CQVykC0Yzi	{'place_id': '392fd39267548e81'}
2020-05-27T13:07:35.000Z	1265630730660372481	電車止まってノートＰＣの充電切れた	{'place_id': '1d5d82d43a574e4f'}
2020-05-27T13:07:16.000Z	1265630652151422976	さて夜中の出勤だ💦💦💦最近時刻表示機変更するペース早くね⁉️ https://t.co/9NHSgbjrvD	{'place_id': 'd313627ad749ca61'}
2020-05-27T12:58:01.000Z	1265628325113819138	遅く帰るときに限って電車止まってやがる	{'place_id': '7efb0fd5276fdda5'}
2020-05-27T12:56:41.000Z	1265627991201087488	電車の中ずいぶんにぎやかになったお酒のかほりがぷんぷんするぜ🍻	{'place_id': 'd2262f18bc1f84c5'}
2020-05-27T12:56:29.000Z	1265627937216196609	コロナで、なかなか外出できない方々に、友人である阿部画伯の絵画を、ほんの少しだが堪能してもらおう設置場所は、ネット上の我社内‼️ https://t.co/2OQ0tUy3CP	{'place_id': 'dcc2630623880f96'}
2020-05-27T12:50:47.000Z	1265626503057862658	覆麺智／神保町虎河豚出汁の悪い奴つけそば＋悪い肉一福園さんのご飯に悪い肉乗せて食べるセルフ丼最高🥓勿論つけそばも最幸💞朝から元気貰った😊宣言中、時差出勤日の朝だけ行ける覆麺が唯一の楽しみだった🏝解除と思ったが来月は継続。仕事の効率は良く無いけど、この点だけは嬉しいな✨#覆麺智 https://t.co/9BngK3mCvJ	{'place_id': '0a637fba5f964000'}
2020-05-27T12:48:50.000Z	1265626013830049792	#西武鉄道 #3000系(3011編成「#銀河鉄道999 デザイン電車」)#西武池袋線東長崎〜江古田2011.12.6#鉄道写真 #鉄道大好き #撮り鉄 #撮り鉄お休み #過去の撮り鉄写真を載せております #コロナが早く終息しますように #コロナに負けるな #stayhome https://t.co/P5e339qV7J	{'place_id': 'faab662cb34cf04f'}
2020-05-27T12:48:47.000Z	1265626000634699776	明日から出勤がはじまるのだけど、コロナ対策でウィッグって毎日洗うべきなのかな…？都内が勤務地だから電車で付着するリスクがあり、実家住みだから父母にうつす可能性が高いし…。諸々事情で一人暮らしが出来ないから、ちょっと悩む🌀	{'place_id': 'f1299e526e0cc34d'}
2020-05-27T12:47:59.000Z	1265625800683868160	この時期の電車の窓開け走行は気持ちいいなぁw	{'place_id': 'dee4362fa7f11785'}
2020-05-27T12:44:16.000Z	1265624864074821633	西武池袋線抑止で急行電車も東長崎駅にて停車、ドア開してた😦 https://t.co/UCUgrKncxz	{'place_id': '07d9db2c33087000'}
2020-05-27T12:43:30.000Z	1265624673326231557	関東でも緊急事態宣言が解除され、家族で、久々に外出してしまいました…  　まだ油断せずにほどほどにしなきゃですな、 https://t.co/rAtU01yNzh	{'place_id': 'dcc2630623880f96'}
2020-05-27T12:36:50.000Z	1265622993230721024	#西武鉄道 #3000系(3015編成「ライオンズデザイン電車 L-train」)#西武池袋線東長崎〜江古田2011.12.6#鉄道写真 #鉄道大好き #撮り鉄 #撮り鉄お休み #過去の撮り鉄写真を載せております #コロナが早く終息しますように #コロナに負けるな #stayhome https://t.co/TKwk6IoyiA	{'place_id': 'faab662cb34cf04f'}
2020-05-27T12:36:42.000Z	1265622961349894147	#昭和っぽい発言をしろ で、散々人をボロカスに罵倒して帰り際に「おい、怒鳴られたらそれで良いんだ‼️よし、飲みに行くぞ」と二軒くらい連れてかれるけど全て上司が出してくれる。パワハラとは言いつつもきちんとホロウはしてくれてるのでみんなついてくる https://t.co/1tNspEVHgq	{'place_id': '519decbcbebfd98d'}
2020-05-27T12:34:19.000Z	1265622361270710272	西武線の人身事故で本当に電車鬼ゴミ。	{'place_id': '7efb0fd5276fdda5'}
2020-05-27T12:32:54.000Z	1265622005157490692	自粛もう疲れたから旅行したいな(T ^ T)	{'place_id': '411f0aa7fce9a8fc'}
2020-05-27T12:32:25.000Z	1265621882163720192	@R__n__s2 ありがとうございます。今までにもマスクやマスクケースも頂いてるんです。出勤しなきゃいけない仕事だけど、働く人の事考えてくれていてとても嬉しいです。	{'place_id': '5cf616c8f739cb2b'}
2020-05-27T12:31:49.000Z	1265621732104138752	てかさ、まじでキツくなったら、携帯ぶん投げて外出てごらんよ？空はもう一つあるんだよ。みんな繋がってるよ。大丈夫だよ(^^)	{'place_id': '28b9063fdce43645'}
2020-05-27T12:30:09.000Z	1265621312061333504	@Kyarameru303 @snowfairytaka @saiko3153 ありがとうございます。電車通勤の皆さんはホント大変だと思います。第二波、三波も乗り切って、早く終息することを祈るばかりです。 https://t.co/GoKBm4eqVR	{'place_id': '0dd87f908e544000'}
2020-05-27T12:30:01.000Z	1265621278582423553	乗ってみたい世界の路面電車ランキング1位　香港2位　メルボルン3位　リスボン4位　サンフランシスコ5位　アムステルダム	{'place_id': '594fa6c6bc5b5ba9'}
2020-05-27T12:29:41.000Z	1265621196273520641	@Sacrifi_damball 電車はホントすぐ寝るから下手したら新百合ヶ丘までいくかもしれん😰	{'place_id': '1b0cfebe3424e14f'}
2020-05-27T12:28:59.000Z	1265621019873566721	もう全国的に路面電車復活させよう	{'place_id': '594fa6c6bc5b5ba9'}
2020-05-27T12:27:14.000Z	1265620579668783104	@DeanFujioka で、国家がなくなった場合の件ですが、私的には、そんな事、考えた事もなかったし、ちょっと、考えられまへん‼️😓って言うか、私的には、日本がなくなったら、ちょっと困る‼️😫旅行とかで、他の国に行くのは、良いのですが、日本には、私の好きな食べ物が沢山、溢れているので、	{'place_id': '49524fd7b35fd754'}
2020-05-27T12:20:10.000Z	1265618799799103488	@michi07fttymkn もう少しすると落ち着くと思います。いずれ飲みに行ければよいですよね😃	{'place_id': '920d3a170bebcb1a'}
2020-05-27T12:17:26.000Z	1265618113095073797	明日から久々の仕事🥴出勤再開鬱になりそうだわ🤮	{'place_id': 'f43d3d50a3b017e9'}
2020-05-27T12:13:20.000Z	1265617081845706752	居るとは聞いていたけど初めて遭遇したわ電車内でアダルトビデオ(サンプル)見てるおじさん。座ってて気付かれないと思ったのか思いっきり見てたwかなり激しくパンパンしてるヤツだったからちょっと見入ってしまった←おかず探しだったのかな俺でも若干引いたから女性が見ちゃったらしんどそう	{'place_id': '28b9063fdce43645'}
2020-05-27T12:09:59.000Z	1265616237431681025	あんちゃん出勤中♪お話に来て下さいね☆23時半迄！#西川口 #コスプレ #コスプレカフェ #コスプレバー #メイド #メイドカフェ #メイドバー #カフェバー #コンセプトカフェ #コンカフェ https://t.co/CXcI8jT9KQ	{'place_id': '0ff5b03999546000'}
2020-05-27T12:08:22.000Z	1265615831045554176	あ、そういえば私もシーズンクーポン一枚だけ持ってる😅球団公式高知ツアーの特典で頂いたもの〜！払戻しは…旅行会社から指示が来るのかな〜マリーンズチェック¥5000もどこかで使わないと💦 https://t.co/7WZWHgIQrf	{'place_id': 'b2216c57788fc225'}
2020-05-27T12:07:41.000Z	1265615658114375681	@yo_mori 今、毎日時差を1時間ずつ出勤ずらしながら、オブピークを調べる実験中です！また報告します（都営新宿線限定情報ですがw）	{'place_id': '28b9063fdce43645'}
2020-05-27T12:07:28.000Z	1265615603374518272	@miaou0128 たしかキムタクさんは、おタバコをアレする方みたいですわよ。あらやだ、そういえばマツコさんもタバコをお飲みになるのかしら？？	{'place_id': '735b6f2b933efaf6'}
2020-05-27T12:04:52.000Z	1265614948106829825	コロナって知ってるか？外出自粛ってなんだ？俺は知らないね毎朝5時に起きて35km離れた現場に行き、上司も親会社も知らない機械を調整させられ、ヘトヘトで帰宅する日々やっと今日その現場も抜ける事になったが、明日には新たな現場が待っているこの会社の人間は朝のニュースも見れないらしい	{'place_id': '28b9063fdce43645'}
2020-05-27T12:00:53.000Z	1265613945039020033	久しぶりに出勤したらあんまり働いていないのにグッタリしてソファーで寝てしまった	{'place_id': '451617631d24d98c'}
2020-05-27T12:00:18.000Z	1265613799869968385	@iidaaayako 結局、接触機会を減らしたことで感染者が減っただけで、根本は何も解決してないからね。外出ためらう〜	{'place_id': '1df8c91136c4c140'}
2020-05-27T12:00:11.000Z	1265613772099514368	ガンプラコンペ出ようとするたびに仕事が忙しくなるの何故…。下手したら今週日曜も出勤かも（泣）	{'place_id': 'ed6aab19d7f13910'}
2020-05-27T11:58:28.000Z	1265613339205398534	聖橋口から秋葉原方面にある淡路坂フェンスに穴が空いてるから電車が間近で撮影できるネ🚃🚃🚃この穴はなんの穴なのかな？撮影用？後ろを振り返れば、すぐそこに当館があるので、6/1から待ってます！ https://t.co/7LKj9hNOyi	{'place_id': '07d9d482ddc85001'}
2020-05-27T11:57:09.000Z	1265613004994834432	@nikkan_gendai 西村康稔はダメでしょ。ベトナムで少女買春男ですよ。僕もベトナム･ホーチミンには旅行をしていますが、タイやフィリピンではなくベトナムなんて、相当の強者。野党もマスコミも、徹底的に叩きますから。	{'place_id': 'f72cbd7b378a05fc'}
2020-05-27T11:56:37.000Z	1265612870907129856	なんだか飲みに行きたい気分だけど雨だからなー。	{'place_id': 'f43d3d50a3b017e9'}
2020-05-27T11:51:38.000Z	1265611619276636161	生きてますよ（外出自粛） (@ Odakyu OX 相模大野店 in 相模原市, 神奈川県) https://t.co/hnEwG8sVV6	{'place_id': 'bc892a7922752d1a', 'coordinates': {'type': 'Point', 'coordinates': [139.43727867, 35.53185015]}}
2020-05-27T11:49:27.000Z	1265611070208540672	@ks81000 夏頃に旅行やね	{'place_id': 'f43d3d50a3b017e9'}
2020-05-27T11:45:21.000Z	1265610036962721792	@TsutsuiYasutaka だいたい作家タブーに守られて「強姦してもいい場合」などと言う事を書いても筒井康隆が許されたきたから、これぐらい良いだろうと満員電車の中痴漢する奴が後を立たないのではないか！女性なんか単に性処理道具と思ってるくせに！https://t.co/euv1qKWBzC	{'place_id': '735b6f2b933efaf6'}
2020-05-27T11:44:37.000Z	1265609851889168386	Airpodsを、探して、いたら電車に、乗り遅れて、しまった、ので、湘南新宿ラインを、使う。 (@ 大崎駅 in 品川区, 東京都) https://t.co/sDQ8a5l93C	{'place_id': '4ad3383e25ac98d9', 'coordinates': {'type': 'Point', 'coordinates': [139.72785932, 35.61969086]}}
2020-05-27T11:44:06.000Z	1265609723241312264	もし7月23日からの連休で、千葉さんが旅行を企てたら、みんな千葉さんのこと	{'place_id': 'd2262f18bc1f84c5'}
2020-05-27T11:42:41.000Z	1265609366238982146	これから出勤です(^o^)	{'place_id': '1df8c91136c4c140'}
2020-05-27T11:36:57.000Z	1265607924329508867	手越祐也さんが厳罰無期限処分うーんなるほどそう言えばあの方は、スターを呼んで集合写真　自粛ムード中　旅行にも行ってたかな？そのままになってますけど、〇〇学園普通は追放処分でしょ	{'place_id': '5c43b25fece122d2'}
2020-05-27T11:35:00.000Z	1265607432908111872	仕事おわり。明日は出勤の予定だったが、急遽テレワークに変更。	{'place_id': 'ed61afd47a8bfd91'}
2020-05-27T11:33:27.000Z	1265607041944416258	子供達の発想力の豊さ勿論ですが、明るい色使いが嬉しいなぁー休校や外出自粛で大人以上にストレスが溜まっていて、描くものの色が暗い色になってしまう子供も少なくはないのではないでしょうかねー学校始まったら楽しい明るい絵を沢山描いて欲しい〜(^^) https://t.co/hDBy1DX99m	{'place_id': '76c498282a5a7997'}
2020-05-27T11:29:57.000Z	1265606162923188225	昔、四国旅行したときに、川之江と川越を聞き間違えた、昭和のあの頃…(遠い目) https://t.co/F1b96c5MwO	{'place_id': 'e60fb4e164191d47'}
2020-05-27T11:17:46.000Z	1265603094026448898	@bozu_108 音楽の授業は、電車で二駅。図工の授業は、急行で一駅。	{'place_id': '0d8054846be7f7be'}
2020-05-27T11:15:20.000Z	1265602483243499520	ましろちゃん出勤中♪お話に来て下さいね☆24時迄！#西川口 #コスプレ #コスプレカフェ #コスプレバー #メイド #メイドカフェ #メイドバー #カフェバー #コンセプトカフェ #コンカフェ https://t.co/534x7ZHC3a	{'place_id': '0ff5b03999546000'}
2020-05-27T11:13:55.000Z	1265602125586771970	電車が密に戻ったわ。	{'place_id': '03060ba847e52dcd'}
2020-05-27T11:09:57.000Z	1265601130551107584	リアル出勤日だったので、帰りにお肉🥩🍴うまうま😋うしだけど…😛 https://t.co/Pl1kb0uiS9	{'place_id': '7ee61f505fdfdf5c'}
2020-05-27T11:09:24.000Z	1265600989509320707	今日は、伸びた髭を剃って、久しぶりの出勤。会社の仲間とお話をして、だいぶ気持ちが落ち着きました。 場所: 多摩川浅間神社 https://t.co/fvi1oOT0fl	{'place_id': '1df8c91136c4c140', 'coordinates': {'type': 'Point', 'coordinates': [139.6688913, 35.58715464]}}
2020-05-27T11:07:54.000Z	1265600611061387264	#ゴミ拾い #マスクランのあと、所属事務所の社長と今後の打ち合わせも兼ねて、#池袋 にて #お好み焼き と、締めの #ラーメン までごちそうになりました(*^_^*)久しぶりの外食、久しぶりにかなり満腹(O_O)外出自粛の疲れも吹き飛びました♪飲食店さん方の復興も祈願(&gt;_&lt;)ごちそうさまでした！ https://t.co/8BCyCr2XTJ	{'place_id': 'dcc2630623880f96'}
2020-05-27T11:05:26.000Z	1265599990207938560	@wanawanashi とりあえず6月も埼玉出勤で7月から正式ですね。転勤希望言ってなかったら北海道の遠軽とかマジきついわｗ	
2020-05-27T11:04:56.000Z	1265599867415441412	ランニングエコノミーを向上させるために必要とされているプライオメトリックトレーニング。今回は理学療法士のユウタが動画を交えて分かりやすくまとめてくれています。外出自粛で密かなブームの縄跳びもそのうちの一つなので、イメージしやすいのではないでしょうか。https://t.co/GO7dw8y99B	{'place_id': '28b9063fdce43645'}
2020-05-27T11:02:32.000Z	1265599263951556610	急遽リクエストを受け出勤になりました。本日残り1枠です。✨21:00より120分✨or✨2:00より180分まで✨🦋りりこ🦋#メンズエステ #女性も大歓迎  #出張マッサージ https://t.co/h7bweTWyYc	{'place_id': '594fa6c6bc5b5ba9'}
2020-05-27T10:59:53.000Z	1265598596511969280	最近は会社帰りに電車の中でラランドの漫才を見ることが習慣になっている。面白いし、何より本人たちがとても楽しそうなので、笑いながらもなぜか温かい気持ちになる。一押しは「リスニングテスト」☺️https://t.co/dbyIlUcdLm	{'place_id': 'dded92a2db180dd1'}
2020-05-27T10:59:36.000Z	1265598523724009473	こんな時期ではありますが突然決まった初の国内出張へ行って参ります...🥺よりによってなんで今...😢現地での滞在時間は短いうえ、外出も出来ないし観光も満喫すらできません😔唯一の楽しみは久々の飛行機ってくらいかな...🤔頑張ります❗️HND✈︎✈︎✈︎SPK ✈️ https://t.co/rpl5HV4bPY	{'place_id': '0fc2eb1ef0d4f000'}
2020-05-27T10:55:44.000Z	1265597551664754689	あ〜、自分が旅行したいし美味しいもの食べたいしゴルフしたいから急いで解除したんだ？ https://t.co/ERJt8Yy3BM	{'place_id': '49524fd7b35fd754'}
2020-05-27T10:50:33.000Z	1265596248662278144	@shimo0048 お疲れ様です！残念ですが？茨城県←→汐留の往復ですので、お台場は？行かない。因みに、今日は？茨城県←→秋葉原←→汐留です。会社に自分のクルマを、停めて？汐留までは？電車です。(^_^)v	{'place_id': '8909b3da29756fc0'}
2020-05-27T10:50:15.000Z	1265596171604508677	@ryo02126 コンサートにしよ	{'place_id': '451617631d24d98c'}
2020-05-27T10:41:07.000Z	1265593871561420800	楽天モバイルのばらまきキャンペーンに速やかに午前中に申し込み完了した(｀･ω･´) 外出時に楽天ショップに寄り道したらそんな事言ってて。怪しいから後で調べたら本当にそうだった。店員さん疑ってめんごめんごー。	{'place_id': 'f7c22e0cf7b3af2b'}
2020-05-27T10:38:58.000Z	1265593329917419520	5/27。昼、夫が来週からの出勤に備えて床屋へ。私は昨日買ったケーキと、スープで一人昼ご飯。このケーキ！上に乗っているのチェリーだと思ってた！夕飯は帰宅した夫と、近所で蕎麦定食🥢 https://t.co/9OnQmfQdmB	{'place_id': '10f7d05134160000'}
2020-05-27T10:37:42.000Z	1265593012819595264	今、秋葉を出て、二木の菓子で（わさび漬け）を買った。）此れから上野から電車🚃💨で帰る｡（お腹がヘッタ😵）	{'place_id': '32049a95db695cb8'}
2020-05-27T10:31:43.000Z	1265591507429408768	３つの県を、まとめて旅行できるスポット 笑柳生駅の近くです。 https://t.co/ryuNIVOy1O	{'place_id': '307c68972fd1dc20'}
