2021-08-13T14:32:12.000Z	1426189852173762562	szkお出かけ中… 埼玉県東松山市桜山台２７−１ #imacoconow [イマココくん Android] https://t.co/fbOGwAwCHy	{'place_id': 'b2b9b95f1634817e', 'coordinates': {'type': 'Point', 'coordinates': [139.3845641, 35.9901754]}}
2021-08-13T14:28:00.000Z	1426188794751971335	@kirara_rize 実は南浦和付近で対向列車が異音感知したとばっちり食らって立ち往生したんだよね。それで大宮からの電車がそれぞれ1本ずつ遅くなった。	{'place_id': 'e9d13ad4ff9f02c1'}
2021-08-13T14:26:06.000Z	1426188317851222018	この曲が聴きたいターンになって、聴いたら、うわーーめっちゃかっこいいぞ🍊🍊染みすぎるー。カラオケに行ける日が来たらこの歌を歌いたい。誰か、ゆーし君パート歌って！一緒に歌おう！175R - ORANGE feat.MCU https://t.co/Gz2BjTrCFs @YouTubeより	{'place_id': '4fc060f8061bb535'}
2021-08-13T14:20:47.000Z	1426186976617590793	外出を控えてるこの写真は半分の料理しかないです。後5品ぐらいです https://t.co/9eeuqAIJDe	{'place_id': 'faab662cb34cf04f'}
2021-08-13T14:20:45.000Z	1426186970946961415	オリンピックを諦めた後に頼むのが筋だろ。こんなポンコツばばあに一票いれなくてよかった。“帰省や旅行は諦めて” 助かる命も助からなくなる 小池知事 | NHKニュース   https://t.co/LIM3iySZtL	{'place_id': '1d5d82d43a574e4f'}
2021-08-13T14:15:23.000Z	1426185619722493957	やばい、電車間違えてる…あれ浅草線乗ったはずなのに全然着かない。逆乗っちゃって押上で乗り換えたら今松飛台ってとこで気付いてフリーズしてる…	{'place_id': 'e55409e2b3f74247'}
2021-08-13T14:13:57.000Z	1426185259209543686	やっぱりこうなる😭🥺国内旅行もワクチンパスポート必要かも… https://t.co/xeajRGDYVl	{'place_id': '77173905596af4ab'}
2021-08-13T14:00:00.000Z	1426181748895850503	明日も一日中雨か。チャリで行こうとしたけど、定期券は桜木町まであるから電車で行くか。終わった後はsdn行くかな。野外で飲めてPerfumeガンガンにかけてくれるのはあそこぐらいだものね。注)酒屋です https://t.co/z9NxndOO3l	{'place_id': '12c119fd2f54c001'}
2021-08-13T13:53:39.000Z	1426180151352586242	#豆乳タイカレーでタイ気分 を味わいたい🇹🇭ただ今、世界の豆乳レシピキャンペーン実施中！抽選でお土産品やオリジナルグッズなど🎁豆乳を使ったレシピで旅行気分を味わってみませんか？8/22まで📢 #キッコーマン豆乳 #世界の街歩き #JTB	{'place_id': '61774861ea700565'}
2021-08-13T13:49:25.000Z	1426179085345050629	@ubertokyokohama 幼なじみ(新郎)の結婚式の時は新婦向けに新郎の暴露話しを盛り込みながら新郎の話を‥で「新婚旅行中頑張れよ」と言いながらユンケルを1カートン手渡ししながらの「恥ずかしいのでハネムーンベビーだけはやめましょう」でコンドームを渡す落ちで閉めました。	{'place_id': '0d8054846be7f7be'}
2021-08-13T13:40:39.000Z	1426176877450829824	明日出かける予定がなくなったので、浮いた往復の電車賃で築地のお寿司🍣上寿司に新子と新イカをトッピング🐟🦑美味いなあ。 https://t.co/idSUTEn1fD	{'place_id': '07d9c9fe48c83003'}
2021-08-13T13:38:39.000Z	1426176373601705985	前の職場で知り合って月イチで飲みに行く仲だったけど私が会社クビになってから相手も更年期が酷くて全然連絡してなくて、この前久々私の家で家飲みしようってなって、私が定時で上がれないからその旨を話したらじゃあ今日の飲みはナシにしようとか言い出して私は3ヶ月くらい？返事返さなかった。	{'place_id': '451617631d24d98c'}
2021-08-13T13:37:16.000Z	1426176027710025736	15mmスペーサーで外出してるからあれだけど100系アッパー全寝かせ35mm延長ロア入れても入ってくれない🤔ベースグレードのキャリパー入れて15mmスペーサー抜いたらワンチャンいけるかもって奴ねぎさんのようなツラにしたいんよ🙋‍♂️ https://t.co/OdnwVRP9Pb	{'place_id': '299928071b13fbb6'}
2021-08-13T13:35:46.000Z	1426175649253781506	#豆乳を使ったロコモコ丼でハワイ気分 を味わいたい🇺🇸ただ今、世界の豆乳レシピキャンペーン実施中！抽選でお土産品やオリジナルグッズなど🎁豆乳を使ったレシピで旅行気分を味わってみませんか？8/22まで📢 #キッコーマン豆乳 #世界の街歩き #JTB	{'place_id': '76c498282a5a7997'}
2021-08-13T13:32:03.000Z	1426174714288947200	#新宿三丁目 はまぁまぁ元気です 1/3ぐらいは開いてる印象 帰りの電車はガラガラ#夜ごはん #タイ料理 #ビール #beer #changbeer #新宿 #thaifood #dinner 場所: タイ屋台　999-カオカオカオ-新宿店 https://t.co/2kcmFKinNJ	{'place_id': '7ee61f505fdfdf5c', 'coordinates': {'type': 'Point', 'coordinates': [139.706, 35.6906]}}
2021-08-13T13:29:42.000Z	1426174124569677831	今日8月13日(金)の出勤さくらちゃんるかちゃん体入りあちゃんひのちゃんご来店お待ちしてます。⭐️#ガールズバー #体験入店　#高収入　#日払い　#お金貸して　#体操服　#ブルマ　#制服美少女図鑑　#美少女 #アイドル　#グラビア　#コスプレ　#コスプレイヤー #youtuber #TikTok #アイドル運営 https://t.co/IfbV0RPFXr	{'place_id': '7ee61f505fdfdf5c'}
2021-08-13T13:29:24.000Z	1426174046685720587	@rinks1783 僕もコロナ以外は出勤ですwオリパラが絡んでいまして、毎日毎日会社に居ますw	{'place_id': 'e9d13ad4ff9f02c1'}
2021-08-13T13:28:14.000Z	1426173752560144389	@nhk_news 仕方がないと思う😭　親戚一同で集まる場で、気の緩みでマスク着用など忘れると思うから😷　でもそれ以上に気になるのは、帰省・旅行を諦めて、盆休みどー消化しようと考えた若者達が考えることで心配なのは、友達数人で一つの部屋で集まること🍕🎊📺➰🎮✨🎉　どーしてもコロナ感染対策、緩むかも😅💦	{'place_id': '336251fac4207ae3'}
2021-08-13T13:23:15.000Z	1426172497909612544	やっと政府も俺の唱えてたロックダウン説が浮上｡ま，俺が言ったかって言うわけじゃないけどマジで去年の5月頃から呟いてたよな｡で，電車減らす，終電は22時，は俺のこれからの策｡	{'place_id': '1df8c91136c4c140'}
2021-08-13T13:19:37.000Z	1426171584478269441	忘れてましたがまた、日曜出勤を希望してきました。🙇日曜日は出勤です。ニチアサは見られません❗😢	{'place_id': '519decbcbebfd98d'}
2021-08-13T13:15:28.000Z	1426170541891735554	はじめての目黒雅叙園✨こんないいとこあったの笑ウチから近いのに笑Amazon本社ビルには何度も仕事で行ってたのに笑行ってみるもんですな旅行気分を味わえて満足です😊 https://t.co/K9QoouC0dv	{'place_id': '1b0cfebe3424e14f'}
2021-08-13T13:15:14.000Z	1426170483272163328	小池都知事「最大級 災害級の危機 帰省や旅行は諦めて」https://t.co/uCghXWLCR3 https://t.co/4pLMFxRQJ2	{'place_id': '594fa6c6bc5b5ba9'}
2021-08-13T13:13:46.000Z	1426170111950417923	BOZE STYLE (ボウズスタイル)の投稿動画を楽しみましょう！#TikTok https://t.co/Uc7r9z2TNu電車で見ちゃダメなやつwww	{'place_id': '9de423c47dbf207e'}
2021-08-13T13:12:23.000Z	1426169762652975113	どうやら連れて来られたのは、横浜の一等地に建つアパホテルお部屋は綺麗だし、景色も最高に良い！ただ外出出来ないけどね.. https://t.co/8FlJqq9Nvj	{'place_id': '1176fafc05178006'}
2021-08-13T13:09:43.000Z	1426169094525489153	@aliceriichan 予想してました今の状況はこの１年半の戦いのなかでもっとも厳しいし賢明な判断だと思いますお互い生きていたらまた逢いましょうシクシクリスケジューリングうまく行って延期だといいですねともかくやすおも外出自粛に協力するにはどうしたらいいか葛藤しています皆様もご自愛ください	{'place_id': '4ad3383e25ac98d9'}
2021-08-13T13:04:41.000Z	1426167826155393024	@Hayamin10563401 @SaunaWhistle 外出できます！！！	{'place_id': '7efb0fd5276fdda5'}
2021-08-13T13:02:04.000Z	1426167169797091331	相変わらずの実の無いお答えですこと‼️‼️首相「世界で外出禁止に罰金かけても守られず」：朝日新聞デジタル https://t.co/7STntccpK3	{'place_id': 'f7c22e0cf7b3af2b'}
2021-08-13T13:00:27.000Z	1426166759975919618	テレビ放送は公共放送も民放も一日中ずっとL字でコロナ関連情報を流すで良いよ。外出するな、ワクチン接種情報、などを流し続けろ。こうなったらもう仕方がない。	{'place_id': 'afd2dbc6df82cca8'}
2021-08-13T12:57:12.000Z	1426165945697849344	小池さんが帰省あきらめろと。五輪強行しても人流減ったとうそぶいてた人が何を言うか。五輪で大騒ぎしてもコロナに影響なかったと言うなら帰省も旅行も関係ないんゃないか。小池の言うことなんか誰信用しない。	{'place_id': '0d8054846be7f7be'}
2021-08-13T12:53:10.000Z	1426164930231771136	また、小池がバカ言い出したよ！帰省や旅行を中止さしてくださいと命令したよ！それだったら、何故オリンピックは不要不急に当たらないのか？あなたは何様のつもり、わたくし達はあなたを雇ったつもりはもうとうありませんしねえ！	{'place_id': '86315f8740971686'}
2021-08-13T12:47:01.000Z	1426163381954703370	@u3kuma ちょっとブラリ電車北本からさいたま新都心駅で降りるつもりが電車乗り間違えて湘南新宿ラインに乗ってしまった💦浦和駅で折り返し戻っているところ(^^;あっ煮魚の続きだった(笑)少し甘い方が美味しいですよ😋 https://t.co/CQpVbxTSTT	{'place_id': '648ab73c8abbeb82'}
2021-08-13T12:43:49.000Z	1426162574031155205	外出から帰ってきたらzetaにNth勝ってたw超次元だ。8チームいるけど日本の中でも3チームだけが頭何個も抜けてる	{'place_id': '307c68972fd1dc20'}
2021-08-13T12:43:40.000Z	1426162536856965122	【みやっちお疲れ様】今日でラスト出勤の宮川トレーナー。可愛さ無邪気さ器用さ三拍子揃った有明のスーパーガールでした。範馬刃牙みたいな男が好きとたしか言ってたので全身全霊でバキ目指します。店舗のためにたくさんありがとう。違う道でも無理せずがんばってね。ずっと応援してます。 https://t.co/baduPdKwOH	{'place_id': '4ad3383e25ac98d9'}
2021-08-13T12:34:13.000Z	1426160161618493440	おはよう🥰出勤しました😊同伴からの飲み直しありがとう🤩4組目も待っております🔥 https://t.co/LAnGVXKYsi	{'place_id': '7ee61f505fdfdf5c'}
2021-08-13T12:31:32.000Z	1426159485853212680	なして、乗った電車が故障するんじゃいな🤬🤬🤬🤬小田急さんよ！🤬😡🤬	{'place_id': '1b0cfebe3424e14f'}
2021-08-13T12:30:46.000Z	1426159291598184453	@HANSHINKENSHIRO お疲れ様です。今日みたいな試合なら、先日の仙台旅行の精算作業 (アルバム作り)やって良いですか？　切り貼り画像の１個や２個は試合放置してる間に作れそう😂　↓①、②次の地方の球場応援旅行するときはケンシロウさんとマジで通信で協力プレイするから😂🎮 https://t.co/apPpuiqUcj	{'place_id': 'db215c78c59027e4'}
2021-08-13T12:28:59.000Z	1426158842597937152	みなさまこんばんは東京の今日は梅雨みたいな天気でした　豪雨被害の地域のみなさまお見舞い申し上げますますます酷くなるコロナ禍で外出は制限とは言え良い天気（なおかつ涼しければ）だったら気分良いんでしょうけどとは言え雨の休日を楽しみますかおやすみなさい💤😴良い夢を https://t.co/H1DUYu5twY	{'place_id': '03060ba847e52dcd'}
2021-08-13T12:27:34.000Z	1426158484748324864	電車おくれたやんwまだ仕事終わらない(´・ω・｀)可愛い子応援してね！	{'place_id': '28b9063fdce43645'}
2021-08-13T12:24:57.000Z	1426157825613393928	性別：男年齢：26住所：東京都墨田区身長：178体型：やや痩せ型(63kg)お酒：飲まない煙草：吸わない学歴：大学卒年収：590職業：会社員(銀行系証券)休日：土日祝趣味：旅行、料理、ドライブ、温泉巡り好きなタイプ：家庭的な方、自分の考えや意見を持っている方#Twitter婚活  @konkatwit	{'place_id': '27b43920b8b63188'}
2021-08-13T12:24:49.000Z	1426157792109293569	皆さまおこんばんは( ﾟ∀。)昨日からの勤務…このご時世で遂に…ちゅうことで勤務手配であわあわヽ(；▽；)ノして…明日は休日出勤となりました(°д°)テレワーク…んでマジミラ幕張千秋楽長女の分含めて確保いたすましたヽ(ﾟ∀ﾟ)ﾉ https://t.co/u7VvJPDJMl	{'place_id': '4c1c4868f96634ed'}
2021-08-13T12:24:42.000Z	1426157763160285189	@tomiy103 ほんとその通りです。以前の上司が「その日休んでいいよ」と言った後、必ず「俺は出るけど」と付け加える人で、そう言われて休めるほどメンタル強くなく、出勤してたことを思い出します。	{'place_id': 'c53687ba4506d6ee'}
2021-08-13T12:24:00.000Z	1426157588714967046	来年まで、スラムダンクの映画を見に行くというのを有言実行できるのかどうか🤔次でいいや次の休みでいいやと、先延ばししそうな感じがする🤔	{'place_id': '6439e221c8eaddaa'}
2021-08-13T12:22:51.000Z	1426157297596731392	最近empireが足りてないからブルーレイ見てます。ライブでも無いのにツアーTシャツ着て外出てました。	{'place_id': '94c92bc0c4b78c62'}
2021-08-13T12:22:16.000Z	1426157150405988352	出勤を捨てよ、家に居よう。	{'place_id': 'afd2dbc6df82cca8'}
2021-08-13T12:21:00.000Z	1426156831898963969	サンダルテレフォン定期公演楽しかった〜😄電車の乗り換えで引っ掛かるｗ😅 https://t.co/8RItKRQDC4	{'place_id': '13c035b02c172004'}
2021-08-13T12:18:15.000Z	1426156140824571909	平凡な作品で応募してしまったのはいいとして、仕事さっき終わって帰宅途中なのでほとんど見られない😭 帰宅までに自分の間に合うかな。※弱モバイル回線＆電車なので、、、 https://t.co/FxbyX9qrVo	{'place_id': '8ffa995231a47059'}
2021-08-13T12:17:51.000Z	1426156039074848773	環境が整ってる大手企業にテレワークを徹底させた方が人流は収まると思うんだけどな〜。帰省して、そのまま帰省先からテレワークで出勤してもらうとか。政府より企業の方が影響力が大きそう。会社に来るな！家にいろ！と会社から言われたら逆らう社員はいないもんね〜。 https://t.co/FgvUIJ7ezz	{'place_id': 'bb7a59998ec7fdba'}
2021-08-13T12:16:18.000Z	1426155652632645632	@ZOOL_MAI1013 お疲れ様です。😊いつも、ありがとうございます。🙇‍♂️出勤しました。😌満床で、レベルが落ちてる利用者様もいますので、大変な夜勤になると思いますが、頑張って来ますね。☺️明日も雨みたいなので、ゆっくり過ごします。🙏	{'place_id': 'f808b328dbac41d3'}
2021-08-13T12:13:58.000Z	1426155063194439687	@ruri_qc 行こうと思っていましたが、急遽、臨時出勤になってしまい行けなくなりました😢😢😢また次に会えるの楽しみにしてます🎵🎵🎵るりちゃんが元気みたいで良かったです👍👍👍	{'place_id': '8d59ab31bce58e76'}
2021-08-13T12:12:49.000Z	1426154774794145792	今の日本は本来の感染対策を各個人がバラバラ。オリンピックやったから飲み会や旅行もいいではないか？感染対策上、他人がどうこう言う以上に本来どうあるべきかを考える必要。空いている状況と混雑している状況では普通に考えてもリスクは違う。やりたい事をする為には今は我慢も必要！	{'place_id': '32049a95db695cb8'}
2021-08-13T12:12:37.000Z	1426154724886155270	当店では随時セラピストさんを募集中‼️採用後SNSも頑張ってくれる方には、一定数のフォロワーを集めるとバーキン👜や、海外旅行✈️のプレゼント🎁ここだけの話ですが美容関連の提携先もあります🙈🙉🙊公式LINEでスムーズ応募https://t.co/G5qvAsLpnr#高収入 #メンエス #渋谷 #恵比寿 #未経験可 https://t.co/4FbKnGIUcD	{'place_id': '594fa6c6bc5b5ba9'}
2021-08-13T12:04:56.000Z	1426152790271750147	今日は昼夜うどん。昼は外出先ではなまるうどん。夜はおうちで伊勢うどん。伊勢うどん初めて食べたけど美味しい☺️ https://t.co/ZiREIhA8mR	{'place_id': 'dee4362fa7f11785'}
2021-08-13T12:00:26.000Z	1426151658753380355	旅行行かすために若い女性にワクチンを二回射ったの？？どこか間違ってるんとちゃうか？🤔 https://t.co/s7D9lR9ec0	{'place_id': 'b3b52bda7ae86b07'}
2021-08-13T11:54:18.000Z	1426150114268119042	ん？今日、給料日なの？💦電子版の給料明細更新されてた…💫先月25日も出勤してたわ(笑)やば…。	{'place_id': '8d59ab31bce58e76'}
2021-08-13T11:54:02.000Z	1426150048912396292	#ちんるりキッチンカー 今週は土日の両日出店！！どちらか空いていらっしゃる方、こだわりのコーヒー飲みにきてくださると嬉しいです☕️ https://t.co/stNjv2V9X8	{'place_id': '1b0cfebe3424e14f'}
2021-08-13T11:53:58.000Z	1426150031254454289	※グリーンのラインの電車には、グリーン車は連結されておりません。というかE501系も居るしなかなかツッコミ所が多い案内版！ https://t.co/ZSriPo0kmU	{'place_id': '0fc294f803d46000'}
2021-08-13T11:52:49.000Z	1426149742942191622	@kawakyz97 @Okunoya_jr @owndays_PR @KOtaki1185 @shuji7771 カワキーさんこちらでもありがとうございます😊🙌本当必要ない外出ですから、気軽にお越し下さいね札幌店に🤣	{'place_id': '363cc1df5487a576'}
2021-08-13T11:50:15.000Z	1426149093189976071	電車トラブル続き…😢何に乗り換えるのが良いのやら…	{'place_id': '28b9063fdce43645'}
2021-08-13T11:50:11.000Z	1426149077679415305	ベイスボール電車が来た。 https://t.co/RzDfNg7Ufk	{'place_id': 'dcc2630623880f96'}
2021-08-13T11:50:10.000Z	1426149075594870785	@malicia_nakamu でも経理だけは出勤……😱	{'place_id': '61774861ea700565'}
2021-08-13T11:49:50.000Z	1426148991364857866	🚕 明日仕事〆日、黒公出勤日ゆえ帰宅時間自由♫🚕早く上がるぞ‼️	{'place_id': 'de733ecbe94a943c'}
2021-08-13T11:48:48.000Z	1426148731125080073	いい加減接客業ばかりの規制やめて職場感染や満員電車通勤感染しないようなことして欲しい。	{'place_id': '735b6f2b933efaf6'}
2021-08-13T11:43:52.000Z	1426147486947676163	@cool_katsu 東京で旅行気分が味わえました😊	{'place_id': '77173905596af4ab'}
2021-08-13T11:42:52.000Z	1426147235297783815	旅行はとっくに諦めてるけど、県またぎはダメで国またぎはOKってやってる事がおかしいよね。新宿や六本木の街にはノーマスクの外国人が溢れてますけど。最大級災害級の日って言うのもなんか響かないな。　#小池都知事 #帰省 #災害級の日 #NHK https://t.co/amUHFAe49N	{'place_id': '7ee61f505fdfdf5c'}
2021-08-13T11:37:25.000Z	1426145864964132864	3年ぶり位に電車で渋谷に行ったけど、いつの間にこんなビル出来たんだ、銀座線のホーム新しくなってるし東急百貨店無くなってるし前はすんなり外に出れたのに新しいビルとくっついてて複雑だった😅 https://t.co/hSQ6veLxD2	{'place_id': 'f72cbd7b378a05fc'}
2021-08-13T11:34:51.000Z	1426145219163004928	@seintoseiya394 旅行とかできればパチンコなんか行かなくて済むんですけどね…	{'place_id': 'f43d3d50a3b017e9'}
2021-08-13T11:34:05.000Z	1426145027575582722	電車でお出かけするライスシャワーとミホノブルボンしかし突如乗っていた電車がまさかの車輌故障！！ミホノブルボン「あああああああああああああああああああ(ry」	{'place_id': '519decbcbebfd98d'}
2021-08-13T11:33:23.000Z	1426144851200929799	こうちゃがーでんさん(@Kohcha_garden)の動画を見てお迎えキメました😁フトアゴの繁殖部屋を外出先からエアコンで温度の管理がしたいのと、万が一停電でエアコンが止まってしまった時に電源が入れられるのでこれは最強👊#スイッチボット　#SwitchBot#こうちゃがーでんhttps://t.co/YjzlwyzdFe https://t.co/iEOZpAPPrL	{'place_id': 'e0be6d4a13dfc410'}
2021-08-13T11:29:59.000Z	1426143996468858884	実は風邪を拗らせちゃって(コロナ)、まだ外出できないんだけど外出られるようになったら小川珈琲のモーニングまた食べに行きたいなあ	{'place_id': '8b0ea1e7e0f9eba8'}
2021-08-13T11:26:17.000Z	1426143063953444864	私も電車が1番感染確率高いと思うな。 https://t.co/WBVP0Yb6D3	{'place_id': '451617631d24d98c'}
2021-08-13T11:23:49.000Z	1426142442516926464	二日連続で会社の鍵閉め🔑🔑🔑明日は臨時出勤になりました💦💦💦ここ最近、仕事がバタバタでやることが多過ぎる💦💦💦効率よくやりたいだが💦💦💦	{'place_id': '0fd33386c57b038a'}
2021-08-13T11:21:35.000Z	1426141882501971969	帰還んんん箱根旅行おしまい！ (@ 三河島駅 - @jreast_official in 荒川区, 東京都) https://t.co/6YoImdAPxJ	{'place_id': 'f05d4b0cfac65c65', 'coordinates': {'type': 'Point', 'coordinates': [139.7770921, 35.73341952]}}
2021-08-13T11:18:46.000Z	1426141174025232384	都知事、帰省を「あきらめて」 2021年8月13日 https://t.co/EeehyC52a0 偽帝小池百合子の戯言で諦める必要はない。諦めたら試合終了や後悔するので、偽帝の戯言を無視して帰省や旅行しなさい！！	{'place_id': '5f3279ed753778b7'}
2021-08-13T11:17:00.000Z	1426140728288235522	電車動かなくなっちゃった (@ 浦和駅 in さいたま市, 埼玉県) https://t.co/0LjaPm4jlU	{'place_id': '33b6dbea26d0c6df', 'coordinates': {'type': 'Point', 'coordinates': [139.65720361, 35.85908948]}}
2021-08-13T11:16:29.000Z	1426140595727204361	届けて下さった方本当にありがとうございます💕そしてたまたま電車乗る時に時刻表を確認していたのでその履歴を見せたら凄くスムーズでした🙆🏼‍♀️✨✨ https://t.co/Yeu5CT2TD6	{'place_id': '7ee61f505fdfdf5c'}
2021-08-13T11:13:27.000Z	1426139836180688896	今日は、夢で家に車二台＆ショベルカーが突っ込んで家の回りは何も無い❗二階は店を経営していて、知り合いがショックを受けていた。そして、他の知り合い・フォロワーが来て、さっきのはドッキリだと。朝は、大根の味噌汁でオジヤ🙃✨ 出勤❗最初は荷物を流す仕事で、こういう仕事が良い🎶→続く https://t.co/kIRnaqngtr	{'place_id': 'db215c78c59027e4'}
2021-08-13T11:10:48.000Z	1426139166828417025	「ツムツムってリリースされて8年くらい経ってるけどまだやってる人いるのか…」って電車に乗ってて思ったけど俺も20年以上前に初めてやったウイイレ毎日プレイしてるわ。マスターリーグ最高	{'place_id': 'd313627ad749ca61'}
2021-08-13T11:10:18.000Z	1426139041741688834	乗り換えの時にお気に入りの傘を電車に置き忘れてしまって置き忘れた電車が京王ではなく京王新線やったみたいで地下鉄に入ってしまって管轄外やけど連絡取り合って下さってて無事に届けて下さった方がいるそうなのですがまさかの本八幡駅😭今から迎えに行ってきます❗️見つかっただけよしとしよう✌🏻✨	{'place_id': '7ee61f505fdfdf5c'}
2021-08-13T11:03:37.000Z	1426137359339294729	2日振りに外出コンビニだけど	{'place_id': '7efb0fd5276fdda5'}
2021-08-13T11:03:09.000Z	1426137243442315266	明日は前に所属をしていた道場の仲間の試合を見に行く、楽しみですね。人の試合を観戦するのも、たまには良いかも知れませんね。	{'place_id': 'dcc2630623880f96'}
2021-08-13T11:02:00.000Z	1426136950667321348	「外出避けてください」を国会や都庁とかに外出してる人が外出してるたくさんの記者の前で言っても説得力無い気がするのだけど。。会見も全部オンラインにすればいいのに。	{'place_id': '43d0bb3c4e9eb702'}
2021-08-13T10:59:40.000Z	1426136365687656450	今日のイベント、ドレスコードが黒パン白Tシャツなんだけどさワイシャツかと思ってて全クリーニングだった訳よ。出勤してから買いました。まさかセブンイレブンにDiorが売ってるとは、、、 https://t.co/PuOnqkU9Kj	{'place_id': '7ee61f505fdfdf5c'}
