2021-01-24T23:54:45.000Z	1353491461782740993	今週も電車は空いている国産ワクチンが出来るまで、感染しないように気をつける出来る事はそれだけ	{'place_id': '594fa6c6bc5b5ba9'}
2021-01-24T23:53:57.000Z	1353491258719707137	@7iTG70PazUirsJ6 たろまろちゃん🐸おはよ今週は週6出勤だからパワー下さい😆	{'place_id': 'c71f3a7498fe95d7'}
2021-01-24T23:53:43.000Z	1353491201081495553	休みだけど一瞬会社行く外出たから今日も麺活の可能性が🤔	{'place_id': 'afd2dbc6df82cca8'}
2021-01-24T23:51:01.000Z	1353490520694091777	ZARD familyな皆様、毎度です✋！時差出勤前のモーニングレイコー☕！大相撲初場所は、埼玉出身な大栄翔関が初優勝飾りましたね✨！おめでとうございます🎊！最近は、横綱も大関もみんな不安定な感じなので、新星大栄翔には期待したいですね😊！今週も、よろしくお願い致します👍！ https://t.co/7n8GktiddP	{'place_id': '10f7cff837179000'}
2021-01-24T23:48:12.000Z	1353489810376155136	1月25日(月)出勤情報💕.10:00 さみ、みずき、うみ11:00 もゆ、ひかる12:00 すい、さくら、えりか14:00 ゆか※10:00からに営業時間が変わりました‼️10:00～20:00(酒類の提供は19:00まで) https://t.co/P53Q9414gS	{'place_id': '27b43920b8b63188'}
2021-01-24T23:47:28.000Z	1353489629513539584	#田端大学　の課題がエンリケさん@rie0985　の本だったので代名詞の一気飲みに挑戦してみた。田中の必殺技「取り敢えずやってみる」発動今まで、六本木で100本ぐらいシャンパン開けたけど、この飲み方ははじめて、美味しく無いな。昨日のウチに思い浮かんでたら、お店行ってやれば良かったな〜 https://t.co/RrDGJbfvko	{'place_id': 'f7c22e0cf7b3af2b'}
2021-01-24T23:44:33.000Z	1353488895321600000	おはようございます☀️🙋‍♂️❗昨晩は眠れなくて、通勤電車🚃のなかでウトウト😪💤💤しながら移動中。そして、週明けの月曜朝なのに電車🚃が大幅に遅れるという😔。	{'place_id': 'db215c78c59027e4'}
2021-01-24T23:41:16.000Z	1353488069303836672	電車は窓開けて走ってるからすげー煙臭かった。周辺に煙充満してて、ちょっとしたサイレントヒル感。 https://t.co/jsNv7LGYLf	{'place_id': '28b9063fdce43645'}
2021-01-24T23:39:06.000Z	1353487520328126464	なぅ！本日の通勤電車w今日も途中から1車両に1人#ソーシャルディスタンス https://t.co/XTyLoIF5c5	{'place_id': '03060ba847e52dcd'}
2021-01-24T23:36:29.000Z	1353486863030308864	出勤時に毎朝公園にいるおじさんが、ジャックマーにそっくりすぎて、本国で色々なことあるから最近実は本人なんじゃないかなと思ってきた。	{'place_id': '4c1c4868f96634ed'}
2021-01-24T23:33:34.000Z	1353486129547239424	京葉線電車遅れており、ホームで電車待ちの行列が結構な人数だったけど、電車来たら出勤する人の数が少ないのか、元々の乗車数は少なく普通の混雑状態だった。	{'place_id': '65b41c11aca77bdb'}
2021-01-24T23:31:45.000Z	1353485673349582849	今日から新しい職場。東京横断してるから遠いのかなと思いきや、実際電車乗車時間は1時間くらい。横浜よりは近いや。	{'place_id': '07d9db116e885003'}
2021-01-24T23:30:21.000Z	1353485321674002432	おはようございます🌈良いお天気なので、ご機嫌な朝です🤗🎵本日、今月の出勤ラストdayです🐈12:00-20:00upにて逢瀬のお誘いをお待ちしております🍌💕宜しくお願い致します🍀沢山ご奉仕させてください💋#人妻デリスhttps://t.co/w3hf4IixcW#痴女 #SM #ご奉仕 #人妻 #巨乳 #エロス https://t.co/jrlWuMz5tH	{'place_id': '7ee61f505fdfdf5c'}
2021-01-24T23:29:23.000Z	1353485075120185344	富士山白くなった～☺️朝写真取り忘れて電車から確認…今日も良い１日を～🎵	{'place_id': '61774861ea700565'}
2021-01-24T23:28:37.000Z	1353484885046882304	外食などしてないと!!!いいですか!!!東京都の感染者の55％は家庭内で!!!施設と職場合わせれば87%!!!　家庭内マスクの法整備と高齢者の外出禁止で中心経済は回るし、医療崩壊は止められる!!!60歳女性のPCR検査前死亡など、小池百合子のコロナ災害だ!!!https://t.co/yedLo6n13E	{'place_id': '7efb0fd5276fdda5'}
2021-01-24T23:26:06.000Z	1353484251384090624	@itsukoh0702 先が読めないリーダーによって　同胞は死んで行きます。　企業経営者は、先を読み判断します　感の良さが無いリーダー。　　１か月で収束　　越境旅行のGoto の維持	{'place_id': 'ed61afd47a8bfd91'}
2021-01-24T23:25:57.000Z	1353484211378745344	武蔵野線またとまった。東松戸から動けず。電車の中すっごーい密。座れてるからいいけど、これ立ってる人辛いよー。西船橋止まりとかなんとか。何時に会社つくかなぁ。	{'place_id': 'e55409e2b3f74247'}
2021-01-24T23:23:55.000Z	1353483701624008704	月曜日は他の日よりも電車が混んでる気がします💧週始めだからかな。今週も頑張りましょー😊	{'place_id': '3ae278a47b227f1f'}
2021-01-24T23:21:58.000Z	1353483211893051395	出勤‥今日も一日頑張りますか‥ (@ JR 東京駅 - @jreast_official in 千代田区, 東京都) https://t.co/tTJ9DunSjW	{'place_id': '28b9063fdce43645', 'coordinates': {'type': 'Point', 'coordinates': [139.76660318, 35.68097497]}}
2021-01-24T23:19:59.000Z	1353482713194393614	ユニクロのハイブリッドダウン寒いって呟いてるから何処かと思ったら都内。これ着て電車に乗った日にゃすんごい暑くて汗ダラダラなんだけど。	{'place_id': '735b6f2b933efaf6'}
2021-01-24T23:19:34.000Z	1353482606331846656	久しぶりにタバコ臭い輩に電車内で遭遇😩それだけ電車混んでるってことだな😥	{'place_id': '1b0cfebe3424e14f'}
2021-01-24T23:18:23.000Z	1353482309983330305	@suisui_project バスの連続乗車拒否やエレベーターの連続締め出しなど、遅延要素が有りすぎます。待ち合わせや時間指定の外出は、ほどほどしません。自力で行動出来る範囲か、クルマ主体になっちゃうんです。	{'place_id': 'e20cd4ef291c416b'}
2021-01-24T23:17:58.000Z	1353482202386898944	電車で寝ようと思っても、寝れんかった。	{'place_id': '4c1c4868f96634ed'}
2021-01-24T23:17:48.000Z	1353482160284426240	おはよう御座います🙋🏻‍♂️本日も宜しくお願い致します🙇🏻今日は、温かくなるみたいです👍🏻久し振りに、ちゃんとウォーキングに行こうと思います😊最近寒く、心臓の事も考えてしまい外出を敬遠しがちになっていたので。少しづつ、温かくなってきますが皆様どうぞお身体ご自愛下さい🙇🏻🙇🏻🙇🏻	{'place_id': '8e483d36e0b9b001'}
2021-01-24T23:17:36.000Z	1353482113044066305	不要不急の出勤 (@ 光が丘駅 - @toeikotsu in 練馬区, 東京都) https://t.co/eGrjKyjPU3	{'place_id': 'dcc2630623880f96', 'coordinates': {'type': 'Point', 'coordinates': [139.6292809, 35.7587387]}}
2021-01-24T23:13:46.000Z	1353481147083345920	俺の厄ってやばいんじゃね。今日出勤してどーなんだろ？仕事できる状況じゃなくね？まだ何も見てないから分からんけど。	{'place_id': 'de733ecbe94a943c'}
2021-01-24T23:13:31.000Z	1353481083103264770	20210125久しぶりの出勤日、弁当は棚と冷蔵庫の中にあったあり合わせの材料で。鯖缶の塩唐揚げはリュウジのバズレシピ、ポテトサラダはsioの鳥羽周作さんのレシピ。どちらも美味しい。#お弁当男子 #リュウジのバズレシピ #鳥羽周作シェフレシピ https://t.co/M7M9X92VSb	{'place_id': '451617631d24d98c'}
2021-01-24T23:10:29.000Z	1353480318913667074	おはようございます。子供が発熱のため出勤停止。便乗して #わかコール 参戦❗きびしい中ピックアップしてくれました。最後尻切になっちゃいました。FWPさんありがとー	{'place_id': '46f04ccee8ce6b7d'}
2021-01-24T23:09:37.000Z	1353480103179800578	おはようございます。電車止まってます。 (@ 吉川駅 - @jreast_official in 吉川市, 埼玉県) https://t.co/XmBu2hUlzj	{'place_id': '9e90e75cb1e1e525', 'coordinates': {'type': 'Point', 'coordinates': [139.84339426, 35.87665681]}}
2021-01-24T23:08:41.000Z	1353479866587336704	みなさまおはようございます、今朝は暖かいですね、電車待つ間汗ばんてのに気付きました😓出かける時霧が出ていたからかなりの気温差なんでしょうね、電車のなか立ってる高校生が一生懸命に日本史の参考書読んでます、可愛い❤️頑張って👍若いってそれだけで宝😊	{'place_id': '6c5c2473e68be79e'}
2021-01-24T23:05:07.000Z	1353478969148891136	日本も小池百合子の大失政にデモした方が良い!!!緊急事態宣言で医療を崩壊させ、経済メタメタにしたのは、小池百合子の一人の責任です!!!夜間外出制限に抗議　オランダ各地でデモ #日テレNEWS24 #日テレ #ntv https://t.co/CTCdMZEx33	{'place_id': '7efb0fd5276fdda5'}
2021-01-24T22:58:34.000Z	1353477321999585280	電車で隣に座ってくる人ほんとやだ、Distance保って欲しい#ソーシャルディスタンス	{'place_id': '594fa6c6bc5b5ba9'}
2021-01-24T22:57:52.000Z	1353477147235500033	みな～さんおはよ～ございます🐑おまえ達、本日もよろしくお願いしますm(*_ _)m急遽の午前中出勤いてきまーす♪ https://t.co/I1rOm9QKwi	{'place_id': '07d9deb97b086003'}
2021-01-24T22:56:37.000Z	1353476830020341762	遅出勤でっぱつ！毎日この時間ならいいのに😂 https://t.co/SbJgwuwcq0	{'place_id': '0fc38aeb3c142000'}
2021-01-24T22:56:14.000Z	1353476732242731008	おはようございます。今週は月～木まで出勤日です。火曜と木曜が出張なのでその前日は出社して準備。といった形なのでそういう感じです。とはいえ報告書が溜まってるので金曜も出勤したいんですけどね。…もうあんな愚痴聞かされたくない。#おはようございまむぅ	{'place_id': 'f72cbd7b378a05fc'}
2021-01-24T22:55:04.000Z	1353476438960181251	テレワーク推進で、週一しか出勤してないのに、遅延に巻き込まれた@武蔵野線	{'place_id': 'a703ad469c686234'}
2021-01-24T22:54:17.000Z	1353476243203575808	武蔵野線、新松戸にて線路内人転落のため運転見合わせ。とりま作業もあるので、出社するため振替輸送の新京成にて出勤。#武蔵野線 https://t.co/QdvGVJUqXA	{'place_id': 'e55409e2b3f74247'}
2021-01-24T22:53:52.000Z	1353476137142259712	今年初めて電車に乗ったら遅延するとか（笑）しかも、あと一駅…。	{'place_id': '8d59ab31bce58e76'}
2021-01-24T22:53:24.000Z	1353476022394445824	日本では教会へ行かないけど⛪️東京ジャーミィとか東京聖十字教会とか近いんだし、行ってみたりしたいなぁまだ🇬🇧引きずってるちなみに観光じゃなくてもこのバッグはこのスタイルで持ちがち(ダサいけど楽今年の春はシープスキンでお出かけもたくさん出来たら嬉しい🌼 https://t.co/08HSSfgq4M	{'place_id': '1b0cfebe3424e14f'}
2021-01-24T22:53:02.000Z	1353475930002399234	西武9000系9104F1102列車 快速急行池袋行き＠所沢出勤前の9000系サクリ記録。ずっと9000系10両編成を撮ってきて、通勤急行・通勤準急は捉えたけど、快速急行は意外にも初…？40000系増備車が出場しないと運用離脱しないのでは？との憶測もあるが、さてどうなる？ https://t.co/PNG45vRU2H	{'place_id': '07d9e3a428c88000'}
2021-01-24T22:51:14.000Z	1353475477252448257	さ！出勤ですだあきです💪	{'place_id': '962b0af43cd1ad6c'}
2021-01-24T22:50:11.000Z	1353475211182542851	通勤電車満席立ってる人 30人ぐらいマスク使用率100%	{'place_id': '0fc2e9d7d455b001'}
2021-01-24T22:48:08.000Z	1353474693890625536	出勤前の筋トレ💪タイム7時47分。デッドリフトから💪競馬絶不調川崎記念がんばる💪 https://t.co/Mzh8tm0xNR	{'place_id': '2dca688458c4fd18'}
2021-01-24T22:45:47.000Z	1353474103630389248	おはようございます☀ฅ^•ﻌ•^ฅ出勤前に買い出しだー https://t.co/33pi8MqZ6Z	{'place_id': '0fc2af32c814d000'}
2021-01-24T22:45:36.000Z	1353474056901648384	おはようございます👋😆✨今日の天気は晴れ後曇り、気温は13℃/3℃、降水確率20％の予報です😃結局、昨日は雪は降らず、天気予報は外れました。まぁ、外れて良かったのかもね🤗今日は在宅勤務ではなく、出勤です。チャリ🚲️で颯爽と行きます🎵😆👍️今日も１日宜しくお願いします👋😃	{'place_id': '66b90ad361cfc8e9'}
2021-01-24T22:40:50.000Z	1353472858060537856	@kumakichi6969 体調よくない時の出勤はつらいですよね。どうぞお気をつけて。	{'place_id': 'e55409e2b3f74247'}
2021-01-24T22:39:32.000Z	1353472533169758208	おはようございます‼️ さて、今年の目標は全部達成できるかな? 1、zx14rを買う事　2、TDLホテルに家族旅行‼️ 2が1番大変だな〜	{'place_id': 'f7c22e0cf7b3af2b'}
2021-01-24T22:36:25.000Z	1353471746196684802	そういえば土曜日に車で外出したら、横環みなみの橋桁がJRの線路上を渡っていたわ。よくあんな重いものをスライドさせるわ。	{'place_id': 'a24531308a92ae15'}
2021-01-24T22:33:26.000Z	1353470997333041153	家にいてゴロゴロして誘惑に負けてパチンコ等に行ってしまうよりも、いっその事1日で負けるであろう金額を2泊3日の旅行にブチ込んでしまおうという英断。あると思います。最安便を選んだので行きは春秋航空、帰りはPeachです。	{'place_id': '0fd33386c57b038a'}
2021-01-24T22:33:08.000Z	1353470920493473793	また、道に迷う夢を見た。電車を乗り過ごして、慌てて次の駅から逆向きの電車に乗るも、急行のため目的の駅で降りられない。何かが出来るようになった気になっていても、実際のところ子供の頃から何も変わっていないことを示唆しているようで、つらい。	{'place_id': '4c1c4868f96634ed'}
2021-01-24T22:29:07.000Z	1353469909766955009	電車の運転士をしている人が知り合いにいるけど、正直マナーが悪すぎる鉄オタがいるのも事実らしい。あと、勤務中に急に話しかけてきて間違いだらけの知識をこれみよがしに語らないでくれ！殆ど間違ってる！と言っていたww	{'place_id': 'd9f7e15f9bea1eb0'}
2021-01-24T22:28:20.000Z	1353469712336785408	さてと…出勤するんでとりあえず離脱💨会社に着いたら９時までは暇だから倉庫の中で拝聴しまーす‼️では皆さん…より良い１日を過ごしてね😚あしたまにあーな🙋#ちょうどいいラジオ	{'place_id': 'fd6d701398e33eaa'}
2021-01-24T22:27:35.000Z	1353469522712301574	毎日乗ってる電車が、乗る直前になって隣駅で線路内人転落で運転見合わせ→遅延。一気にやる気が削がれるんですが...w https://t.co/M1OOzUxtgW	{'place_id': 'e55409e2b3f74247'}
2021-01-24T22:23:24.000Z	1353468473494573058	おはようございます✨日の出くらいから活動。お散歩を我慢した。週末色々やりたかった事が出来てないので会社早く来ました😃時差出勤ってやつ？w	{'place_id': '4c1c4868f96634ed'}
2021-01-24T22:21:10.000Z	1353467909637459970	在宅勤務できるのに「会社に誰もいなくなるから出勤して」って、この1年何やってきたんだよって感じ準備しとけよ	{'place_id': 'ed61afd47a8bfd91'}
2021-01-24T22:20:40.000Z	1353467781694414849	おはようございます😃雨あがりの月曜日。#朝らーめん で体温も気持ちもググッと上げてお出かけください。本日も #感染防止対策 万全にして7-10時朝営業11時より通常営業、酒類提供19時まで。20時完全閉店です。テイクアウトもご利用ください。電話注文が便利です#中野駅前#朝ラー https://t.co/CmhfpXtaSz	{'place_id': '07d9d56878886000'}
2021-01-24T22:19:27.000Z	1353467478064566272	ちかりんさんと付き合う【メリット】・人生が楽しくなる・毎日興奮する・笑顔が素敵【デメリット】・カラオケに毎週付き合わされる#あなたと付き合うメリットとデメリット #shindanmakerhttps://t.co/DERT0v5jl9わりと当たってるかもよʬʬʬʬʬʬʬʬʬ	{'place_id': '76c498282a5a7997'}
2021-01-24T22:18:32.000Z	1353467246673182721	各局、おはようございます！お天気は曇り空から晴れ？！気温は2度↗12度！あったかいだから？！本日は、少し早めの出勤！ジムニーで後からの、羽田空港向け～！皆さん、本日も安全運転で！では！では！！よろしくです！ https://t.co/VnUzEIgHVP	{'place_id': '2e6e669592f1353f'}
2021-01-24T22:18:10.000Z	1353467156025905152	駅での電車撮影禁止にすればいいのに。。。めざましでやってるこの撮影者くそだわ〜笑	{'place_id': 'dcc2630623880f96'}
2021-01-24T22:16:38.000Z	1353466768522686464	おはよーJAPAN＼(^^)／寝過ごして遅刻！俺は急いでも電車は急いでくれない！いってきます！←#ちょうどいいラジオ	{'place_id': '307c68972fd1dc20'}
2021-01-24T22:15:18.000Z	1353466431963242496	オリンピック開催に対して金の亡者という輩はこの状況下に満員電車に乗って仕事に行く人達に対しても金の亡者と言うんだろうな。#クロス	{'place_id': '1df8c91136c4c140'}
2021-01-24T22:12:08.000Z	1353465634433114112	おはようごじゃります♪今日からお仕事です、テレワークがんばります(｀_´)ゞ◇外出時にはマスクを付け、人混みを避け、帰宅時には手洗い・うがいをしましょう。ご安全に！　(￣^￣)ゞ	{'place_id': '519decbcbebfd98d'}
2021-01-24T22:05:13.000Z	1353463894354792458	緊急事態宣言の政府の指針では「出勤者数7割削減」とうたってるのに、普段と変わらぬ朝の通勤電車の混み具合ってことは、結局こんなことしても意味ないと思ってる企業が多いということのあらわれだな。実際去年の4月がそうだったわけだし....でオレも出勤	{'place_id': '962b0af43cd1ad6c'}
2021-01-24T22:03:55.000Z	1353463569095028742	@himegami_rinka おはようございます出勤準備して配信待ちます ✌️☺️	{'place_id': '386e90e8f5c5d17a'}
2021-01-24T21:56:29.000Z	1353461697399275521	@LoveDiaNoriko のりちゃん(^O^)／おはよう〜４日ぶりの出勤です	{'place_id': 'dcc2630623880f96'}
2021-01-24T21:56:10.000Z	1353461619032956928	@222kikikuro 仙人さん(^O^)／おはよう〜今日は出勤です	{'place_id': 'dcc2630623880f96'}
2021-01-24T21:55:31.000Z	1353461453827657730	@sariy926 サリーちゃん(^O^)／おはよう〜４日ぶりの出勤です笑	{'place_id': 'dcc2630623880f96'}
2021-01-24T21:51:54.000Z	1353460543730814976	朝から……通勤途中の電車で線路内人立ち入りによる安全確認で西武新宿線遅れが発生中💨飛び込みにしろ無理な踏切横断にしろどれだけの人に迷惑を掛けるのか考えられないのかね本当😓安全運転が直ぐに終わったので、踏切の無理な横断が原因だろう🤔本当週初めの朝から迷惑ですね😡	{'place_id': '9de423c47dbf207e'}
2021-01-24T21:48:53.000Z	1353459785157419008	@Kishiridan_127 @nolisics ちか平のり平(^O^)／おはよう〜今日は３日ぶりに出勤、椅子あるかな。お仕事ファイト	{'place_id': '9de423c47dbf207e'}
2021-01-24T21:36:32.000Z	1353456679149465600	そろそろ出勤な時間ですが、コタツから出たくないな！ #gps897	{'place_id': 'bcf7dca0cae1c2e6'}
2021-01-24T21:33:30.000Z	1353455913340784640	QUINTETが面白すぎて夜通し観てしまった🤣柔道がベースのオイラにとっては物凄く攻防が楽しめる試合ばかりと、団体戦が勝ち残り方式が懐かしい！若い頃に昇段試験で15人抜きを達成して合格した事を思い出した😆このままのテンションで出勤🛵💨#QUINTET#格闘技#寝技#関節技#絞技#打撃なし https://t.co/WDTUwp5eRf	{'place_id': 'f72cbd7b378a05fc'}
2021-01-24T21:29:41.000Z	1353454955328200705	(月)おはようございます今朝は寒さちょっと緩め？出勤するぞ出勤するぞ出勤するぞ	{'place_id': '0fd33386c57b038a'}
2021-01-24T21:25:12.000Z	1353453825399558145	結局、ほとんど寝れないまま出勤。そしてナイトの囲いが朝から出番💢しかも今日は月曜日、偽池上季実子しかいないから無線は鳴らないであろう(-'д-)y-~	{'place_id': '2dca688458c4fd18'}
2021-01-24T21:17:49.000Z	1353451964944633857	@kasuga_75 すみちと飲みに行こう！←	{'place_id': '32049a95db695cb8'}
2021-01-24T21:04:07.000Z	1353448518661197824	#身長を晒す見た人も晒す184cm電車内の広告頭刺さります	{'place_id': 'afd2dbc6df82cca8'}
2021-01-24T21:02:17.000Z	1353448058256646144	朝起きて今日は休みじゃぐふふと思ってたら出勤しなきゃいけなくなってりんかい線ホームにいる	{'place_id': '4ad3383e25ac98d9'}
2021-01-24T21:01:57.000Z	1353447974160932865	今、電車乗って珍しく近くに席があいていたので、座ろうとしたらおばさんが物凄い勢いで席に突っ込んできた😳	{'place_id': 'de733ecbe94a943c'}
2021-01-24T21:00:11.000Z	1353447528503492608	いつもの電車乗った	{'place_id': 'e60fb4e164191d47'}
2021-01-24T20:51:19.000Z	1353445299050536962	おはようございます。今から出勤です。今日は「本厚木」の現場です。今日も頑張ります。	{'place_id': '61774861ea700565'}
2021-01-24T20:39:11.000Z	1353442246415183872	さて、出勤です。最近は週末の方が色々としんどいので月曜の段階で疲労困憊だったりする(;´д｀)	{'place_id': 'e60fb4e164191d47'}
2021-01-24T20:27:27.000Z	1353439291892969472	出勤 (@ 新桜台駅 - @seiburailway in 練馬区, 東京都) https://t.co/37EomdJjL2	{'place_id': 'dcc2630623880f96', 'coordinates': {'type': 'Point', 'coordinates': [139.66837741, 35.74082025]}}
2021-01-24T20:20:18.000Z	1353437491148201984	ぐっもーにん。始発から2本目で出勤中。今日もがんばるぞい。	{'place_id': '1b0cfebe3424e14f'}
2021-01-24T19:55:48.000Z	1353431327190568960	週の初めから早朝出勤です…眠い。#年寄りにはきつい #眠い #日帰り出張 #リモートワークとは #緊急事態宣言とは https://t.co/AvoicNpwsA	{'place_id': '3cdba7c1247961ea'}
2021-01-24T19:41:42.000Z	1353427777114972160	今朝は早めの外出のため、いつもより少し早起き。体重は週末に68kg台になって、そのまま戻せず。今週も外出が多いので、たくさん歩こう。#あすけん #ダイエット垢さんと繋がりたい https://t.co/gJAvhTfP1B	{'place_id': 'bfdffb491d839e84'}
2021-01-24T19:41:33.000Z	1353427740892876801	本日はご予約ありがとうございました🥰♡次の出勤は♡26日(火曜日)20〜4時27日(水曜日)20〜4時29日(金曜日)20〜4時30日(土曜日)20〜4時31日(日曜日)20〜4時事前ご予約お待ちしております (❁´ω`❁)♪ #高輪RYUGU #メンエス #メンズエステ #出張マッサージ #出張メンエス #Gカップ #鼠径部 https://t.co/UcDaqQEp46	{'place_id': '4c1c4868f96634ed'}
2021-01-24T18:42:11.000Z	1353412802031964160	友人へ　自分が選択した道を突き進むも次々と予期せぬ嫌な事や悪い事が何度も起き続けウツ気味になる人は多いこれって運が悪いのではなく選択した道が間違ってるから運が開けないだけ！進む道と人生観をほんの少し変えるだけで運命はガラッと変わる！線路から脱線した電車のまま走り続けると転覆する	{'place_id': '594fa6c6bc5b5ba9'}
2021-01-24T17:12:07.000Z	1353390134259924993	出勤予定だったドライバーが、『熱があって咳が止まらないから休ませて欲しい』って言ってきたよっ⁉️雨で面倒だからだろ⁉️ずる休み常習犯め💢	{'place_id': '32049a95db695cb8'}
2021-01-24T17:08:34.000Z	1353389242194378753	週休3日になってゴゥトゥで旅行しろってことまたかよ。。。	{'place_id': '307c68972fd1dc20'}
2021-01-24T16:29:53.000Z	1353379505734365188	ストレス…カラオケに行けないことが…(-∀-`; )	{'place_id': '86315f8740971686'}
2021-01-24T16:15:25.000Z	1353375867171266560	新成人の団体飲みに来たけど若気の至りはやっぱり最強だった🤤	{'place_id': '7ee61f505fdfdf5c'}
