2021-07-21T13:06:56.000Z	1417833471922249729	小池おめーみたいなクソババアの云うことは謙虚になる気がしねえよ。　謙虚や真面目に聞くだけバカ見そう。　小池百合子都知事「4連休は外出控えて」の支離滅裂…「バッハは」「歓迎会やっておいて」(SmartFLASH)#Yahooニュースhttps://t.co/x4l3oAYAR3	{'place_id': '7bd3d82b03caf040'}
2021-07-21T12:55:34.000Z	1417830610131767296	日比谷線の電車のシート、1人一席になってるのすげえ！他のとこもそうなんかな？	{'place_id': '32049a95db695cb8'}
2021-07-21T12:55:04.000Z	1417830483904376835	夜の慣らし運転🏍 外気温は少し下がってきて外出する気になったけど、股下が火傷しそうなほど熱い🥵 #S1000RR (@ EXPASA海老名 上り in 海老名市, 神奈川県) https://t.co/6wJ1cJqnAD https://t.co/dBTB4SBXj4	{'place_id': '411f0aa7fce9a8fc', 'coordinates': {'type': 'Point', 'coordinates': [139.39885495, 35.43198615]}}
2021-07-21T12:51:46.000Z	1417829656556802051	@koharuakatonbo こはるちゃん写メ日記見たよ美容と健康そんなに頑張らないで♥ゆっくり休んで下さいお客様はこはるちゃんが健康に出勤する事楽しみしています😍❤️	{'place_id': '920d3a170bebcb1a'}
2021-07-21T12:50:02.000Z	1417829219241893889	@nenkotoboo @kuritarou45 出てるけど普通に旅行してるし買い物してるしみんな遊んでる💦	{'place_id': '1df8c91136c4c140'}
2021-07-21T12:49:52.000Z	1417829175675658245	【緊急事態宣言発令中】都内では、新型コロナウイルスの感染が急速に拡大しています。明日から四連休ですが、皆様には引き続き不要不急の外出や都県境をまたぐ移動は、極力控えていただきますようお願いいたします。ご不便をおかけいたしますが、ご理解、ご協力をよろしくお願いいたします。百合子	{'place_id': 'faab662cb34cf04f'}
2021-07-21T12:49:17.000Z	1417829029143404544	この時間帯の外は、歩いてて気持ち良いなあ。外出することの、ありがたさよ。	{'place_id': '28b9063fdce43645'}
2021-07-21T12:48:57.000Z	1417828944997322754	今日のTalkport2本目Finally Megちゃん相変わらずの関西弁にやられた👈外出出来ないのが 本当に辛いみたいだけど あと2日の我慢らしい。歌いたくて歌いたくてたまらないらしい！全然話し足りない🥺 https://t.co/SKGqEBAnRe	{'place_id': '0d8054846be7f7be'}
2021-07-21T12:41:47.000Z	1417827144185438211	お金をおろさなきゃいけなかったので電車を1本見送りました。お次は横浜へ向かいます。 https://t.co/ag17nApmXv	{'place_id': '07d9f73f54884001'}
2021-07-21T12:41:38.000Z	1417827106235375616	電車内咳してる人多い気がするよ	{'place_id': '03060ba847e52dcd'}
2021-07-21T12:41:20.000Z	1417827029991391239	電車……反対方向に乗ってる…さっさと寝よ(-.-)y-~	{'place_id': '7ee61f505fdfdf5c'}
2021-07-21T12:38:49.000Z	1417826396127195136	今、電車。隣の人のLINEの内容が気になりすぎて中央林間まで行ってしまいそう。	{'place_id': '1b0cfebe3424e14f'}
2021-07-21T12:37:45.000Z	1417826129155559427	@tatatatagosaku @mevius125mg よっ社長出勤！(笑)	{'place_id': 'dcc2630623880f96'}
2021-07-21T12:37:28.000Z	1417826058661875716	快活クラブ都賀店なぅ( ≧∀≦)ノ腹減ったので、外出してローソンでご飯買わなくては( ≧∀≦)ノ	{'place_id': '02cf29c8a57c9265'}
2021-07-21T12:36:00.000Z	1417825688963321863	久しぶりに若林踏切を車で通過したんですが、最近の歩行者は電車来てるのに信号無視して電車直前横断とかするようになってるんですねぇ。スマホいじっててイヤホンしてるからわかりませーんってことなのかしら。行きも帰りもそんな景色を目の当たりにして、ちょっと残念な気持ちに。	{'place_id': '519decbcbebfd98d'}
2021-07-21T12:33:21.000Z	1417825019233669122	合宿終了。電車を何度か乗り継いで楽しい旅にもなりました。 https://t.co/7dpKaO7qqu	{'place_id': '07d9ca76bf487001'}
2021-07-21T12:30:25.000Z	1417824283326222338	西松さんに就活したくないって言ったら「いいじゃないそんなのしなくて〜、あなた旅行好きなんだから、色んなとこ行って色んなもの見てやりたいこと探せばいいのよ。まだ若いんだから〜」と仰られていたファビュラス	{'place_id': 'dcc2630623880f96'}
2021-07-21T12:29:00.000Z	1417823926940409857	オリンピックの為、明日から㊗️日だとは知らず初めての祝日におねぇさんスパを経験する鮎川です🙇‍♀️💦こんばんは٩( ᐛ )و事前予約やお問い合わせ感謝です😭ドキドキ💓しながらお待ちしてます💋出勤情報♡おねぇさんスパ https://t.co/2ehZe1aZ5KMimosa https://t.co/gHKNpNCLIvTEL♡080-7096-0077 https://t.co/eYMoZMh988	{'place_id': '0fc343cb9c555001'}
2021-07-21T12:28:45.000Z	1417823864210432001	夜勤が明日に変更😵わたくし出勤です(笑)昼やって夜中に出勤。オリンピックだな😄	{'place_id': '02cf29c8a57c9265'}
2021-07-21T12:23:18.000Z	1417822493599965186	4連休ツイートめっちゃ見かけるがわいは明日も明後日も通常出勤や	{'place_id': '4c1c4868f96634ed'}
2021-07-21T12:16:06.000Z	1417820678900707340	【緊急事態宣言発令中】都内では、新型コロナウイルスの感染が急速に拡大しています。明日から四連休ですが、皆様には引き続き不要不急の外出や都県境をまたぐ移動は、極力控えていただきますようお願いいたします。ご不便をおかけいたしますが、ご理解、ご協力をよろしくお願いいたします。	{'place_id': '77173905596af4ab'}
2021-07-21T12:15:02.000Z	1417820409739677699	"あーーーーーーーーーーーーー！！！！！！！！！データがないんだったわ""す""れ""て""た""本日2度目の出勤が確定しました👎👎👎"	{'place_id': 'a398e1f1025abe37'}
2021-07-21T12:13:42.000Z	1417820077412343809	こんばんは(^o^)これから出勤です。	{'place_id': '1df8c91136c4c140'}
2021-07-21T12:13:11.000Z	1417819945505726465	爺ちゃんの近所の大ばあば達が言うんだ。ワクチン打ってないって。大ばあば達は家から出ないし出掛けない。なんで電車乗って仕事してる高齢者に打たないのか?因みに爺ちゃんの知り合いの高齢者施設の 方はワクチンまだです。	{'place_id': '307c68972fd1dc20'}
2021-07-21T12:12:30.000Z	1417819773254004736	@nana__0428__ リプありがとう！電車の中で二度見してニヤけてしまいました🤭♡♡	{'place_id': '594fa6c6bc5b5ba9'}
2021-07-21T12:11:54.000Z	1417819622078705665	久しぶりに友達とちょっとだけお出かけ。スイーツを食べながらお話して、その後氷川神社へGO🚗 ³₃風鈴を見てきた。夕方なので暑さもやわらぎ過ごしやすい。風鈴の音色が心地よい。楽しい時間はあっという間に終わっちゃうね。 https://t.co/2vg7CLaAll	{'place_id': '71d8082054241230'}
2021-07-21T12:02:02.000Z	1417817139050811396	💐7/21(水)出勤💐アイドルよりも可愛い🥰リピーター様続出中💋💕るいさん💕https://t.co/Iuyhe2Ya7B早めのご予約オススメです❣️ご連絡お待ちしております💭🌐 https://t.co/gJ8xzP9oJn☎️ 08079669481✳️ https://t.co/6CeRsxOiuv	{'place_id': 'f7c22e0cf7b3af2b'}
2021-07-21T12:00:50.000Z	1417816836100411398	明日はPIA八王子です。今日は久々の出勤で足が痛うございます	{'place_id': '86315f8740971686'}
2021-07-21T11:54:43.000Z	1417815299626213379	本日は鈴本演芸場。さん喬師匠の夢の酒🍶から。三三師匠のかぼちゃ屋はほのぼのした内容。この和やかさが尊い！🎃文菊師匠の長短。短七さんの性格がいい。二人の間に友情があることが伝わる。そして、トリの白酒師匠は大山詣り。気ままな旅行もままならぬご時世、噺で旅行気分を味わう…明日も行こう♪ https://t.co/U5jhbCDLu0	{'place_id': '1119ddf397d55000'}
2021-07-21T11:46:23.000Z	1417813199886290952	横浜中華街まで走りました。中華街で飲んだので帰りは電車を空母の様に使って渋谷まで運んでもらいます。 https://t.co/EYoRGfA7pz	{'place_id': '07d9d23dfd880000'}
2021-07-21T11:40:01.000Z	1417811599474139137	@smj_1 たまには浦和方面にもお出かけ下さい！😊	{'place_id': 'e711a8fc9ecc013e'}
2021-07-21T11:39:30.000Z	1417811466841853952	小池百合子都知事「4連休は外出控えて」の支離滅裂…「バッハは」「歓迎会やっておいて」（SmartFLASH）#Yahooニュース https://t.co/3fwJmYWo6g	{'place_id': 'f72cbd7b378a05fc'}
2021-07-21T11:36:41.000Z	1417810760739090436	照ノ富士の横綱昇進を祝い、明日の朝ランは伊勢ヶ濱部屋まで走ろう。家から遠いので、場合によっては電車で帰ろう。	{'place_id': '4c1c4868f96634ed'}
2021-07-21T11:36:34.000Z	1417810730254958596	お出かけ前にメニューの打ち合わせ済み👍🏼とんこつらーめん🍜にキクラゲトッピング＋黒油卵かけご飯＋唐揚げ❗️で完ぺきじゃない⁉️だがバットしかし、途中で黒油卵かけご飯にとんこつスープ掛け申して、らーめんのとんこつスープに醤油ぶっ込んで、通常ばんからに変身❗️させるという味変成功✌️ https://t.co/1eHJMesOE9	{'place_id': '0fc349007d94d001'}
2021-07-21T11:35:50.000Z	1417810544581496833	全く怖いですねぇ!私は高齢者だから繁華街に行く事も無いし、酒が呑め無いので居酒屋に行く事も無いので感染する事は無いです。出掛ける時は自転車でマスクをして、出掛けるのは食料品を買いにいく時とテニスをやりに行く時だけです。仕事している人は大変ですねぇ。通勤電車が問題か！？ https://t.co/9jNNlmScYg	{'place_id': '8f844bd31a72243f'}
2021-07-21T11:35:29.000Z	1417810458103271427	今からちょっとした旅行に出掛けてきますw	{'place_id': '07d9e4f161088001'}
2021-07-21T11:33:42.000Z	1417810009539309568	今日は土曜日ですか？(笑)→もちろん、今日は水曜日であることはわかっているけど、感覚的に曜日の意識がずれてきている。(笑)しかも、世間は連休なのに、私は連続出勤。または、連戦。(笑)	{'place_id': 'cd477ff3b533582b'}
2021-07-21T11:31:13.000Z	1417809384441188355	今頃、靴の衣替え。あると思っていたサンダル、捨てちゃったみたい。夏履が全然ないわ、お出かけの予定もないけれど😢	{'place_id': '594fa6c6bc5b5ba9'}
2021-07-21T11:31:06.000Z	1417809355546583046	電車の屋根に付いているパンダグラフってなに？（ハルメクWEB） https://t.co/leCkQb52OZ	{'place_id': '0b7c83abc823ec59'}
2021-07-21T11:30:53.000Z	1417809300269854721	こんばんわm(_ _)m昨日は沢山のご来店ありがとうございました(^o^)本日も冷たいお飲み物をご用意してお待ちしております！皆さん少しだけでも涼みに来てね本日の出勤えみるらきゆりねりらせりひなたねねゆりね#歌舞伎町ガールズバー #飲み放題 #西武新宿 #ゆずっこ店長 #朝まで営業 #水槽	{'place_id': '7ee61f505fdfdf5c'}
2021-07-21T11:29:11.000Z	1417808871280676870	明日から東京で過ごす最後の連休なにしよーー。東京で行っとくべきとことか、食べとくべきものとかあるかな。赤坂か、六本木から電車30分以内の範囲で。	{'place_id': '594fa6c6bc5b5ba9'}
2021-07-21T11:28:55.000Z	1417808806151479297	小池百合子都知事「4連休は外出控えて」の支離滅裂…「バッハは」「歓迎会やっておいて」（SmartFLASH） https://t.co/qWsIJYTnDL	{'place_id': '0b7c83abc823ec59'}
2021-07-21T11:27:55.000Z	1417808552698155008	@pixiins エッセンシャルワーカーの仕事なので祝日も出勤します。	{'place_id': '4ad3383e25ac98d9'}
2021-07-21T11:17:58.000Z	1417806048627281922	@mememe_me_me うちのムスメがまだ幼女だった頃、よく行った海は三浦半島周辺でした。横須賀よりもっと先っぽ、電車でも行けるし、車なら第三京浜が無料の高速道路です。でもどちらかと言えば泳ぐより磯遊びとか魚市場で買い出しとかが多かったです。春先の暖かい日とか。https://t.co/9OKkteOvSA	{'place_id': 'faab662cb34cf04f'}
2021-07-21T11:17:13.000Z	1417805860810608644	今日はお休みで次回22日の17時～出勤予定ですので、ご予約ぜひぜひお待ちしてます🧸𖤐⡱ブログも更新しました🧸💕https://t.co/TfsKDaOE2t動画はいつかの帰り道の私、都会だけど意外に緑とかあります🍀#ラブプラス #メンズエステ #コロナに負けるな #Twittalk #池袋 #新宿 #新橋 #リフレ https://t.co/glQrVb8EbW	{'place_id': '7ee61f505fdfdf5c'}
2021-07-21T11:13:34.000Z	1417804941117300736	これ、#客車列車 の来るホームにあるものかと思っていた。電車ホームに。#品川 も。#rail #tokyo #JREast#鷹乃ちわざをならう#小暑#水無月#July#2021 場所: 田町駅 https://t.co/lxbhDtox1O	{'place_id': '594fa6c6bc5b5ba9', 'coordinates': {'type': 'Point', 'coordinates': [139.74758333, 35.64572222]}}
2021-07-21T11:05:59.000Z	1417803034470457347	今日は全員出勤したんだけど活気がある感じが出て良かった。	{'place_id': '28b9063fdce43645'}
2021-07-21T11:02:31.000Z	1417802162415964160	明日買えるかな😓とりあえず休日出勤はHGナイチンゲールのためにずらしたww https://t.co/I1SaqMFWFP	{'place_id': '1df8c91136c4c140'}
2021-07-21T11:01:51.000Z	1417801994496974849	考え方変えるとフッと楽になることある。変えられるものと変える必要ないもの、取捨選択していこう。明日は家族でドライブお出かけ。全力で楽しむぞ♫	{'place_id': '594fa6c6bc5b5ba9'}
2021-07-21T10:58:52.000Z	1417801244706443265	@YuNkrU36 クッションは確率機で1つ2,000円くらい。残りのぬいぐるみとフィギュアで2,000円くらい。トータル6,000円位使ったかなぁ🤔まさか旅行先でここまでプレイするとは思わなかったが💦	{'place_id': '1b0cfebe3424e14f'}
2021-07-21T10:57:16.000Z	1417800838592884736	寒がりだけど暑がり、冬は電車内で汗かくし夏の電車はシベリア超特急水野晴郎。でも、一番好きな季節は夏です。だって、何かワクワクしませんか？別に何もないけど笑	{'place_id': '4fc060f8061bb535'}
2021-07-21T10:56:32.000Z	1417800654551076865	夏祭りイベントの始まりじゃあ🍻🏮今日はフードあるんやけどいいつまみになりまっせ！皆飲みにおいで〜😊👊#ホスト #エルコレ #夏祭り #LaughTale https://t.co/hrsvRJ3r4y	{'place_id': '7ee61f505fdfdf5c'}
2021-07-21T10:56:17.000Z	1417800594580934660	電車でホルモン本番へキタコレ！亀戸初めてだっ！ https://t.co/VbnbsBXsmx	{'place_id': '4c1c4868f96634ed'}
2021-07-21T10:55:18.000Z	1417800347129581570	出勤したら流石にお腹すいた……早く家帰ってご飯食べたい	{'place_id': '4ad3383e25ac98d9'}
2021-07-21T10:54:26.000Z	1417800125552889858	こんばんは☽･:*しごおわ田町(三田)のタリーズさんにてワンモアアイスティと大豆ミートのピリ辛ピタサンド🥙明日は8時出勤だー( ´△｀)ｱｧ- https://t.co/tKW6TcqoYq	{'place_id': '0fc3938f9994c000'}
2021-07-21T10:53:41.000Z	1417799937954258944	帰ったら、りさも嫁も居なかった…カラオケに行ってる…ななパフェ買って来たのに。5個買ったのに。3個は、僕の☺️	{'place_id': '8b0ea1e7e0f9eba8'}
2021-07-21T10:42:13.000Z	1417797054693138432	@__pandadayoo__ @graces_cocone ありがとうございます😊今日も楽しく先生とお話しできましたー帰るまでが旅行なのー私もおやつ買ってきた😁電車🚃は逆に空いている時間だから座れましたー一昨日みたいにチビすわん君なら脱走していたらとドキドキでした😁	{'place_id': '28b9063fdce43645'}
2021-07-21T10:37:27.000Z	1417795852991492097	昨日から毎日7時間ピッチでそろそろ声が出なくなりそうだけど、明日までなので何とかなりそう。アジア+オーストラリアは欧米と真逆でかなり慎重。彼らの旅行再開の予測は2022年半ばが多く、これまで自分が欧米バイアスにかかっていたことを知りました。	{'place_id': '451617631d24d98c'}
2021-07-21T10:33:04.000Z	1417794748744560646	@k0t0nOheya2 後工場の見廻りして工場閉めておうちに帰ります世間では明日から4連休みたいでーすねぇ明日も出勤	{'place_id': 'de733ecbe94a943c'}
2021-07-21T10:33:03.000Z	1417794745271611394	7月22日出勤予定❗️⭐️東さん       10時から15時⭐️⭐️布施さん   10時から18時⭐️⭐️大橋さん   15時から21時⭐️⭐️渋田くん   18時から22時⭐️予定変更になる事もありますのでお電話でご確認ください。ご来店お待ちしております。03-6383-0039#中野区マッサージ#鷺宮整体#鷺ノ宮整体	{'place_id': '07d9d26a32085003'}
2021-07-21T10:31:52.000Z	1417794448017158144	今日はテキトーに飲みに行きます。自分見つけたら声かけてね😌	{'place_id': 'f7c22e0cf7b3af2b'}
2021-07-21T10:26:26.000Z	1417793079281549312	東京じゃ、もうずっと前から繁華街じゃ、｢野良飲み会｣をやってるよ。今日、電車🚃💨でちょっと出かけたけど、酷いもんでっせ。😂電車、駅、商業施設は、人でイッパイだ‼️平日だよ。特に、学生、若い者が平気で闊歩しとるよ‼️これじゃ、感染者減るわけないよ。😱宣言なんか関係ないよ。😂 https://t.co/jiZC1IiNmr	{'place_id': 'b3b52bda7ae86b07'}
2021-07-21T10:23:42.000Z	1417792392648744961	@SakonShogen_ 左近さん〜今日はオーストラリア🇦🇺旅行楽しかったですね！エアーズロックは神秘的でしたねぇ👍癒されたぁ　笑笑🤣 https://t.co/aHcNy9LffJ	{'place_id': '307c68972fd1dc20'}
2021-07-21T10:17:33.000Z	1417790845156085766	日立さんの電車が台湾を走る🚆帰ったら乗りたい！ https://t.co/Lvy9DDtTS1	{'place_id': '7ee61f505fdfdf5c'}
2021-07-21T10:17:23.000Z	1417790805410926593	東京都で新たに1832人の感染確認、半年ぶりに1800人超 20代577人、30代410人（ABEMA ）https://t.co/Xjns1JvLWyここまで来たらもう、悪いのは酒を提供する店でもなく、酒を飲みに来る客でもなく、当初から検査数を増やそうとしない無能政府だと言うことだよな‼️#自民党に殺される	{'place_id': 'd313627ad749ca61'}
2021-07-21T10:16:35.000Z	1417790601697796098	the day for teaching今日は千葉大学へ出勤の日。暑い熱い課題提出日。 https://t.co/JTdNErtcXS	{'place_id': '0fc3453b7115e000'}
2021-07-21T10:13:52.000Z	1417789917954936840	帰りの電車が空いている🚃😳✨	{'place_id': '28b9063fdce43645'}
2021-07-21T10:13:31.000Z	1417789831673835523	四連休が無くなり何も出来ねぇ、やらねぇ奴らのお陰で土曜日出勤。(*｀へ´*)	{'place_id': '336251fac4207ae3'}
2021-07-21T10:12:13.000Z	1417789505336008710	菅 会見で国民はオリンピックを家で家族で不要不急外出はしのいでて、それなら国会議員が開会式を欠席する事が国民に国民の命を守ると言えるのではないか？国民に不要不急外出控えててオリンピックは意地でも国民の命寄り大会をする事だけしか国会議員が考えていないのに国民が不要不急てふざけんな‼️	{'place_id': '44bd8dbe9ffe1625'}
2021-07-21T10:10:04.000Z	1417788962383405060	2019年の夏に #青春18きっぷ で東北旅行した時の動画を編集してみました。良かったら旅気分味わってくださいね(^^) しかし座りっぱなしはキツい！でも楽しかったなぁ。青春18きっぷでめぐる、夏の東北旅行！！仙台→遠野、平泉、会津若松へ。4泊5日の大移動。 https://t.co/QOyxkzk7ot	{'place_id': '451617631d24d98c'}
2021-07-21T10:06:10.000Z	1417787981100851208	@tatatatagosaku 早う出勤しなさーい💨💨	{'place_id': 'a35b6b4421e1a506'}
2021-07-21T10:05:55.000Z	1417787916852416514	なんとかアリオ橋本で牛乳を買えたので、外出した意味はあった。	{'place_id': '0fc3b9cb6614c000'}
2021-07-21T10:02:38.000Z	1417787089542737926	@canann_0221 あと電車乗る時はクラウチングスタート	{'place_id': '1df8c91136c4c140'}
2021-07-21T10:01:42.000Z	1417786854720425984	お疲れ様でした。激務1日目終了。本番は明日からです。今日は明日からの出勤者が多いので、スタッフすかすかでした。だから激務になった。水ダウ観て、麒麟特製レモンサワーと鬼レモン飲もう🎵	{'place_id': '2dca688458c4fd18'}
2021-07-21T10:01:24.000Z	1417786782305849344	接種後、外出は控えて家の片付け。不要物を処分。疲れたが怠さはなく気分的にスッキリした。	{'place_id': '0fd33386c57b038a'}
2021-07-21T09:55:31.000Z	1417785299673829378	電車 遅れている！！#小田急#小田急線	{'place_id': '07d9c95ee2087003'}
2021-07-21T09:54:58.000Z	1417785160632737792	@canann_0221 またネタ写真大会の流れになったら強めの切り札として用意しておくｗ知らない人の家に「泊めてください！」って土下座したり、電柱に喧嘩売ったり、電車の中で開脚後転してるやつとかあるよ	{'place_id': '451617631d24d98c'}
2021-07-21T09:52:01.000Z	1417784421504012293	明日の練習場所は確保したし、ちょうどよい移動電車も見つけたし(^^)。明後日は家にいる日、まだ練習場所は確保してないからどこか確保しよ。土曜の弾き合い会演奏曲は連絡したけど、練習しなきゃぁ、その前にデュオ練習せねば…マズイ…間に合うのか…	{'place_id': 'faab662cb34cf04f'}
2021-07-21T09:51:43.000Z	1417784344169517057	仕事終わったので、４連休突入。といっても外出しないので、娘と映画、ゲーム三昧🎮	{'place_id': '56c04190b03cfa94'}
2021-07-21T09:38:58.000Z	1417781133614272514	オリンピックやるくせに外出自粛呼びかけとか	{'place_id': '4fc060f8061bb535'}
2021-07-21T09:37:27.000Z	1417780755728457728	仕事終了、暑いってだけで疲れる😅　2連休で土曜日出勤	{'place_id': '0d8054846be7f7be'}
2021-07-21T09:37:15.000Z	1417780702251143173	あまり外に出てないので気分転換に何度もオファーくれてる会社の人に会いに外出。が、とにかく道中暑かった😱 後悔。だかしかし、帰り道にある新橋の家系ラーメン屋はめちゃ美味かった！うずらじゃなかったけど🤣 https://t.co/H4MF4I9s38	{'place_id': '594fa6c6bc5b5ba9'}
2021-07-21T09:34:31.000Z	1417780014855036938	@type_water13 旅行行っちゃおw	{'place_id': 'f72cbd7b378a05fc'}
2021-07-21T09:32:09.000Z	1417779421121970178	電車、クソ人いて怖いんだけど。感染て飲食店じゃなくて電車じゃねぇのと思ってしまう。	{'place_id': '77173905596af4ab'}
2021-07-21T09:31:33.000Z	1417779270886182917	連休２日目なのに出勤してしまった😭１日目爆睡して２日目たくさん出掛けて完全に２日間が経ったと思ってたわ…🌀もしかしてタイムリープしたとか😳⁉️報酬MTの日は時間忘れ罰金１万円💸👋ALICE好きなのか嫌いなのかどっちだwまぁ〜これも人生💗 @alice___usagi  #クラブアリス https://t.co/rAIbvLUvQH	{'place_id': '7ee61f505fdfdf5c'}
2021-07-21T09:30:08.000Z	1417778911178539008	夜勤出勤前に期間限定の松屋のうな丼W (@ 松屋 大和渋谷店 - @matsuya_foods in 大和市, 神奈川県) https://t.co/HVNMmQY9oo https://t.co/pLCKmPyWQQ	{'place_id': '95484b83e4708f58', 'coordinates': {'type': 'Point', 'coordinates': [139.46199685, 35.43667485]}}
2021-07-21T09:30:01.000Z	1417778881386356738	お昼休みくらいに職場近くでブルーインパルスが予行飛行してたらしいです🙄（←自分 暑いからお昼に外出しないひと。）興奮気味で帰って来た営業さんに写真を貰ったんだが……近すぎww =͟͟͞͞✈そして夕方、女子トイレからウッスラ富士山が見える事を知りました🗻 https://t.co/tlGY0xtUnI	{'place_id': '07d9cd8e54086001'}
2021-07-21T09:29:22.000Z	1417778718043299845	残業、準夜勤、夜勤、24時間勤務の方お疲れ様です。https://t.co/n1Ntbll3za明日は私は通常通り出勤いたします。なお明日は通常通りの勤務となっております。	{'place_id': '107307ec53945000'}
2021-07-21T09:29:04.000Z	1417778644890447872	@yuu_kawakami 後で出勤途中コンビニで買うね。明日になると売り切れ御免❗になるおそれがあるから。それにしてもゆうちゃん、自ら宣伝なんて珍しいじゃん。🤣ホントは私なんかが告知ツイートしておくべきなんだけど…😅	{'place_id': 'e20cd4ef291c416b'}
