2021-06-30T11:57:47.000Z	1410205924044664843	@maruyamahodaka とりあえず酒でも飲みに行ってください。あとは旅行にでも行ってパッと使っちゃってください。飲食、旅行業界は我慢強いられていますので。	{'place_id': '6d3998663bfdad9b'}
2021-06-30T11:55:57.000Z	1410205463015157769	船橋まで来たのに人身事故で電車に閉じ込められました！ついてないなぁ🥶	{'place_id': 'f1299e526e0cc34d'}
2021-06-30T11:55:46.000Z	1410205418454884358	感染拡大防止で外出自粛しろと言い、首都高速は期間限定値上げして人流・物流を止めようとしながら、一方で深夜までの外出を容認するような…？不思議。～JR東、五輪期間中に臨時列車　首都圏の21路線、終電後に運行 2021/6/30 https://t.co/ioE1sr9mmz	{'place_id': '1b0cfebe3424e14f'}
2021-06-30T11:53:38.000Z	1410204879344181256	今日は銚子までお出かけ。帰りは営業さんが奢ってくれた酒盛じゃ。…早いとこみんなでご飯食べたいねえ https://t.co/gX1YR1y6gR	{'place_id': '28b9063fdce43645'}
2021-06-30T11:47:23.000Z	1410203309143560192	マジで広告媒体の人が店を通さず積極的にキャスト様達と絡んでんのって変じゃない？それで取引先の子の出勤が減っちゃったり辞めちゃったりしたらどうする？おかしいって思うの俺だけ？	{'place_id': '7efb0fd5276fdda5'}
2021-06-30T11:42:29.000Z	1410202072893431810	鉄道草創期から電車線と列車線による複々線化がなされた東海道線。歴史が長いだけに、後年の五方面作戦での複々線化では殆どが解消された踏切も、東海道線だけは数多く残っている。京浜東北線が行ったかと思ったら、また東海道線が。おばちゃんも「ん⁉︎」って言いたくなるわ。(0:30前後)  #S駅散歩 https://t.co/MkUY9BMH3m	{'place_id': '0fc28eb6c5541000'}
2021-06-30T11:36:57.000Z	1410200680057372683	もうオースティンが電車道だわ😳	{'place_id': 'd313627ad749ca61'}
2021-06-30T11:36:27.000Z	1410200556539314181	出勤前に踏切で幸せの黄色い電車に遭遇👌こりゃーいいことあるぜ❗ https://t.co/4Zq0d3yl2X	{'place_id': '86dd570dcbbf393e'}
2021-06-30T11:36:01.000Z	1410200445784530944	ビーズフェスティバルin 京王百貨店　新宿世界レベルの素敵なビーズデザイナーさんが集結！！新宿までお出かけになった方はぜひ行ってみましょう#ビーズフェスティバル https://t.co/1leFkQekd8	{'place_id': '33b6dbea26d0c6df'}
2021-06-30T11:33:21.000Z	1410199775174029318	来月の出勤予定です！31日は高橋のバースデーハウストーナメントを予定しております^_^詳細は後日あげるのでお楽しみにー！ https://t.co/GzyVd0hag6	{'place_id': '4c1c4868f96634ed'}
2021-06-30T11:29:16.000Z	1410198749507330050	@jun_86_0809 むしろ東京で当たり前にやってるのがちょっと…なんですけどね(ライブ行っちゃう身分だから何も言えない情報入ってくるって言って頂けるの、素直に嬉しいです笑 ぜひいろいろ落ち着いたら飲みに行きましょ！！	{'place_id': '28b9063fdce43645'}
2021-06-30T11:27:14.000Z	1410198238494289924	なぁ、一泊10万の旅館やホテルってさ、一般人20代にはそんなホイホイいける様なとこじゃないと思うんだけどさ、なんで、みんなそんなホイホイ、高級旅行に慣れてんのさ？オジさん、やんなっちゃうね。	{'place_id': '4c1c4868f96634ed'}
2021-06-30T11:25:18.000Z	1410197750059180036	今日は20時～朝まで出勤してますので、ご予約お待ちしてます🧸指名料1000円オフの合言葉｢ラスク｣ブログも更新しました🧸⚡️https://t.co/TfsKDaOE2t動画は #マカロン #allatonce#ラブプラス #メンズエステ #コロナに負けるな #Twittalk #池袋 #新宿 #新橋 #リフレ https://t.co/qhQDqi3jB8	{'place_id': '7ee61f505fdfdf5c'}
2021-06-30T11:22:22.000Z	1410197012436316164	いつもブログを読んでくださり、ありがとうございます😭💕 https://t.co/SeImFQwh5a本日ようやくブログランキングで１位となりました。Twitter で繋がってくださった皆様の存在が無ければ、これほど書き続けられなかったと思います。専念して9ヶ月、旅行と歴史の記事を書くのが本当に楽しかった📝🖥 https://t.co/9WYZF4DFTE	{'place_id': '77173905596af4ab'}
2021-06-30T11:16:40.000Z	1410195578948972545	@NAVExNooDLE おぉ❗️明日からコッチ出勤かぁ	{'place_id': '95484b83e4708f58'}
2021-06-30T11:12:53.000Z	1410194624421908481	途中駅での普通電車との接続はなく、しかも金沢文庫行という…コロナ禍で姿を消した「深夜特急」が一時的に復活する訳です。 https://t.co/hPG67oXCo4	{'place_id': '1df8c91136c4c140'}
2021-06-30T11:11:05.000Z	1410194171105714181	@kounanronin いつもありがとうございます‼️‼️いつもの感じな夕飯でした(^^)はい、明日も出勤ですが、ゆっくり寝られそうです😌	{'place_id': '41d9dd520c812894'}
2021-06-30T11:10:13.000Z	1410193952955801604	おじさん。電車空いてるのになんでどんどん近づいてくるんだい😂？	{'place_id': 'b41f5dcb002a1886'}
2021-06-30T11:10:10.000Z	1410193943791235080	電車のモニターで「海の鼻水」のニュース流れてて西野ちゃん思い出す。	{'place_id': '76c498282a5a7997'}
2021-06-30T11:07:48.000Z	1410193344479731716	@concert_1750 素晴らしい情報ありがとうございます。やむを得ない外出で人と接近した状態になる時のために購入しました！	{'place_id': '1b0cfebe3424e14f'}
2021-06-30T11:02:27.000Z	1410192000427515909	電車ん中で涙止まんなくてどーしよ。みんなは知らないんだろうな、校長先生が忘れ物ボックス全部チェックして畳んでくれたり、不登校のおうちの訪問積極的にしてくれたり、学校のために裏では動いてくれてること。早くみんな良さに気づいて欲しいな。こんなに子どものこと思ってる校長先生いないよ。	{'place_id': '4fc060f8061bb535'}
2021-06-30T10:59:34.000Z	1410191274938753028	都会へ向かう電車はガラガラ🚃都会って大宮です。🌃 https://t.co/R4ClZT0rYf	{'place_id': '07d9e3c177083000'}
2021-06-30T10:52:46.000Z	1410189562828050433	@SAKURAI152S 学生時代に祖父と2人で行って以来ですねぇ。あの時は下吉田で「パノアル」を見たのが印象的ですね。あとは「富士登山電車」とか。	{'place_id': 'e9d13ad4ff9f02c1'}
2021-06-30T10:51:16.000Z	1410189187232321547	職域接種は、まずはお客さんと話をしなきゃいけないところだったり、毎日出勤しなきゃいけない運用だったりするみたい。リモートワークやってる人は、まだ先みたい。	{'place_id': '4ad3383e25ac98d9'}
2021-06-30T10:48:24.000Z	1410188465245868037	では宿に向かおう。上野広小路行のバスに乗る。地図をよく見ると、 #常磐線 が遠回りしているために、上野から南千住までは歩いても２キロ無かったりする。荷物を山程抱えてラッシュの電車に乗りたくないし。バスが機械系再起動のために、停電エンジン再始動。割と貴重な場面かも。 #北東パス21夏 https://t.co/CXn7GauteD	{'place_id': '0fc3525457d4d000'}
2021-06-30T10:46:38.000Z	1410188020486053888	こんばんはからのお疲れさまでした😊今日は少しだけ早く終わったして新人さんも1人入った。ちゃんと出勤してきますように🙏今日の晩ご飯はローストチキンのパスタサラダ&amp;ハイボールんーハイボールうまっwww#みんなが良き夜を過ごせますように https://t.co/jGIRguwuLH	{'place_id': 'e1868e4848694c69'}
2021-06-30T10:46:28.000Z	1410187978882785282	バスの同じ話、5月にやらかした！オンラインサイン会の日だったわーお友達とニトリに出かけるときに目的地に着くと信じてバスに乗ったのに…その時は余分に歩いて余計な電車に乗って大変でした。楽しかったから良いけどー😜笑見て！コインの枚数＝1Q,QQQ舞！！#舞Qメール https://t.co/Uw6VIuLuLJ	{'place_id': '28b9063fdce43645'}
2021-06-30T10:44:49.000Z	1410187560886829059	仕事で必要な人から足を奪っているのに、五輪観戦客には電車を遅くまで運転する？もうむちゃくちゃ。支離滅裂菅政権。https://t.co/KivcGbzeGk	{'place_id': '86dd570dcbbf393e'}
2021-06-30T10:44:08.000Z	1410187390895890439	@3939zak コロナ関係で明日明後日出勤停止になりました。 https://t.co/vUiUOtYIah	{'place_id': '3ae278a47b227f1f'}
2021-06-30T10:35:15.000Z	1410185155864522758	交通系ゆ…、普段見てるし好きなジャンルではあるけどお出かけ中に出くわしたくはねぇなぁ…といえ思いは強い	{'place_id': 'cd477ff3b533582b'}
2021-06-30T10:33:24.000Z	1410184688522563587	なんか日帰りで旅行に行けるところないかな？青春18きっぷでもいいけど、もっと近場で安くで楽しめるところがあるような気がする😺	{'place_id': '4ad3383e25ac98d9'}
2021-06-30T10:29:48.000Z	1410183783400149000	最近電車に乗ると気になるんだけど周りの乗客を見渡すとスマホのカメラレンズが2つ3つが当たり前でレンズが一つしかないiPhoneXR持ちのワイは肩身が狭い🥲 https://t.co/pyJUkOocV4	{'place_id': '2e6e669592f1353f'}
2021-06-30T10:22:49.000Z	1410182026477539334	@roman_589 なに？娘娘出勤だと？？	{'place_id': '735b6f2b933efaf6'}
2021-06-30T10:22:38.000Z	1410181978238849025	久しぶりにピアノとバイオリンのミニコンサートに行き、私は生演奏が好きだったことを思い出した。雰囲気あるレストランで生演奏聴きながら、料理とお酒を楽しむ。すっかり忘れてた。	{'place_id': 'bb7a59998ec7fdba'}
2021-06-30T10:19:44.000Z	1410181249382043649	ハーレー、洗車した( ´∀`)雨降りだしたので電車で帰るの面倒だから外泊する✨ https://t.co/xaHzBSYwGw	{'place_id': '28b9063fdce43645'}
2021-06-30T10:13:53.000Z	1410179776623480841	@momo40427193 今日もお休みの所出勤お疲れでした‼️クッキングパパ懐かしい🎵	{'place_id': 'f7c22e0cf7b3af2b'}
2021-06-30T10:12:56.000Z	1410179537883729922	こんばんはm(_ _)mいつもご来店頂きましてありがとうございます！本日も雨が振りそうですが朝まで可愛い女の子が揃えておりますので是非ご来店をお待ちしております本日の出勤えみるらむみうにこせりひなたねねかえで#歌舞伎町ガールズバー #ゆずっこ店長 #飲み放題 #西武新宿 #可愛い女	{'place_id': '7ee61f505fdfdf5c'}
2021-06-30T10:11:50.000Z	1410179262632529921	こんばんわ🌠今日は、西川口の帰りにスタバの47都道府県フラッペチーノSAITAMA早速買いましたぁ〜😍金曜日に、池袋出勤だからTOKYO買う予定です😘 https://t.co/E7z0NPSEBb	{'place_id': 'e60fb4e164191d47'}
2021-06-30T10:09:35.000Z	1410178694295945218	@Bar_Chainon @yuina_2780 唯奈ちゃん出勤ご苦労様です	{'place_id': 'de733ecbe94a943c'}
2021-06-30T10:04:16.000Z	1410177357470584834	赤い電車に乗ってませんが今日はくるり×MOROHAライブ楽しい‼️	{'place_id': '07d9db2446883001'}
2021-06-30T09:58:33.000Z	1410175919608668161	今日は今の身体で出来ること出来ないことを学べたなぁ① 座る事が楽とは限らない② 浮腫み切った脚は使い物にならない③ 症状がキツイ日の外出は厳禁帰りはベンチが無かったら確実にぶっ倒れてた😇安全第一！！今夜は廃人になろう_(:3｣ ∠ )_#重症筋無力症	{'place_id': 'ceb864015598e127'}
2021-06-30T09:57:08.000Z	1410175562467794947	@HIS_kix 素敵な企画ありがとうございます☺️旅行行きたくなりました‼️Instagram、twitter、ブログ等で投函&amp;報告します🎶よろしくお願いいたします😆	{'place_id': 'a35b6b4421e1a506'}
2021-06-30T09:48:58.000Z	1410173505966993414	大会開催中は深夜に電車走らせるとか東京都の役人さん関係は知ってたんじゃねーの？のぼりの無観客って意味は街宣のギャラリーが無観客ってことで解釈していい？実際そうだったけども https://t.co/XesM0cco1C	{'place_id': '451617631d24d98c'}
2021-06-30T09:43:38.000Z	1410172163110293510	残業、準夜勤、夜勤、24時間勤務の方お疲れ様です。https://t.co/n1Ntbll3za明日は私は通常通り出勤いたします。なお明日は通常通り勤務となっております。	{'place_id': '107307ec53945000'}
2021-06-30T09:40:47.000Z	1410171447578742789	ラウドネスのギター、高崎晃からも花が来ていた。高校生の時コンサートに行ったのが懐かしいw https://t.co/Mas4El1ndh https://t.co/UkJRbuVUzm	{'place_id': '11c52a4b93d57000'}
2021-06-30T09:39:55.000Z	1410171227474251779	本日も相模原にお出かけし無事に任務完遂したので淵野辺駅前の「志おん」にて晩ごはん！初入店だけど綺麗な店構えと丁寧なスタッフさんに好印象！メニュー最上段の「土佐ゆず塩らーめん」を注文したら透き通る黄金色のスープと上品な盛り付けに感動！美味しいだけじゃなく美しいラーメンでした！🍜 https://t.co/u71shTDZKV	{'place_id': '920d3a170bebcb1a'}
2021-06-30T09:37:55.000Z	1410170726611505160	お疲れ様帰りの電車です https://t.co/12CwRRymoG	{'place_id': '07d9db374f486001'}
2021-06-30T09:37:13.000Z	1410170549230202887	あるこほりっく今日も元気に開院しております♪りなちちゃんラスト出勤いっぱいお祝いしちゃいましょ https://t.co/aN2RohQkUv	{'place_id': '28b9063fdce43645'}
2021-06-30T09:37:05.000Z	1410170518515326976	電車おんち笑笑	{'place_id': '28b9063fdce43645'}
2021-06-30T09:32:33.000Z	1410169377211572233	さっき会社の子がね出勤してる時に前から○○さん来たのに道譲らなくてすいませんって謝ってきたのそんなの気にしないでぇーって言ったんだけど体育館裏に呼び出されるとでも思われてるのかな🤣🤣🤣 https://t.co/cU9rPqjTqF	{'place_id': 'a398e1f1025abe37'}
2021-06-30T09:31:39.000Z	1410169147879616514	まて、これ早めに新宿から帰ってきたら電車でしぬんじゃないか？よし、最寄り駅まで自転車乗ったでよしとしよう。	{'place_id': '4fc060f8061bb535'}
2021-06-30T09:31:01.000Z	1410168988546437122	@rWiWXpr5ZJr6fTt banさんお名前点呼おめでとうございます🥰長崎は路面電車もありますしどこかエキゾチックですね🤗	{'place_id': '07d9d249f5081000'}
2021-06-30T09:25:07.000Z	1410167506698870801	外散歩したいけど、ちょい雨模様。それでも外出てリフレッシュしたい。ということで、行ってこよう。	{'place_id': 'f7c22e0cf7b3af2b'}
2021-06-30T09:24:43.000Z	1410167402361344000	最悪電車間違えた…	{'place_id': '4ad3383e25ac98d9'}
2021-06-30T09:22:12.000Z	1410166770032205829	さて、出勤時間です。#万国橋けっこう降ってますね(^-^; https://t.co/nZRmL9yl2U	{'place_id': '0d8054846be7f7be'}
2021-06-30T09:20:50.000Z	1410166427957399560	久しぶりにラッシュの電車乗るけどフツーに混んでる	{'place_id': '735b6f2b933efaf6'}
2021-06-30T09:20:27.000Z	1410166329768923137	@maruyamahodaka 大学病院に勤務している看護師の妻は1年以上旅行、外食、九州の実家に帰省も出来ていません。妻をねぎらう為にフードデリバリーをして自宅でお疲れ様会を行いたいと考えています。	{'place_id': 'f43d3d50a3b017e9'}
2021-06-30T09:18:43.000Z	1410165894622302208	@yamihebi7493 @sweettripss 休みの日と出勤合う日は出来るだけ行かねば。営業時間31日迄に延びるといいなぁ。	{'place_id': '7efb0fd5276fdda5'}
2021-06-30T09:15:37.000Z	1410165113076609026	また緊張事態宣言の発出で酒の提供がなくなる前に、外飲みにしないとな。	{'place_id': '28b9063fdce43645'}
2021-06-30T09:13:48.000Z	1410164657608794113	小学校の友達と旅行に行きたい😊大好きなんだよなあの人たち	{'place_id': '1b0cfebe3424e14f'}
2021-06-30T09:11:42.000Z	1410164127675211779	繁忙期もあと少しでおしまい。普段は週40時間、今週は休日出勤で週50時間(1日10時間、残業なしで)。仕事できる人のお墨付きはいただいてますが、あまり前面に出しません。割りを喰うのでね。	{'place_id': '5e7a40b139b18a34'}
2021-06-30T09:09:04.000Z	1410163467344961538	チャリ用意しようと外出たら☂️降ってるのかよ…	{'place_id': '1df8c91136c4c140'}
2021-06-30T08:53:52.000Z	1410159639732310017	電車行っちゃった… (@ 京王稲田堤駅 - @keiodentetsu in 川崎市, 神奈川県) https://t.co/rd3sXEtcBq	{'place_id': 'd9ac10e7c031f3c2', 'coordinates': {'type': 'Point', 'coordinates': [139.53125583, 35.6339273]}}
2021-06-30T08:53:35.000Z	1410159570408808464	7月1日出勤予定❗️⭐️布施さん　  10時から18時⭐️⭐️東さん         10時から15時⭐⭐️大橋さん     18時から22時⭐️予定変更になる事もありますのでお電話でご確認ください。ご来店お待ちしております。03-6383-0039#中野区マッサージ#鷺宮整体#鷺ノ宮整体	{'place_id': '07d9d26a32085003'}
2021-06-30T08:51:37.000Z	1410159073912229891	@kJoYcXzOKXcBKg2 沖縄旅行したかったな🥺	{'place_id': '32049a95db695cb8'}
2021-06-30T08:50:36.000Z	1410158816696569858	@harastudio 電車かあ。遠いもんな。	{'place_id': 'faab662cb34cf04f'}
2021-06-30T08:47:14.000Z	1410157972181770243	国鉄通勤電車の代表、JR奈良線103系が送る余生 今や“絶滅危惧種”、内装と走行音にもレトロ感(東洋経済オンライン)#Yahooニュースhttps://t.co/3af6NJQ73M	{'place_id': '3d4bcaf184b72e12'}
2021-06-30T08:37:14.000Z	1410155456153014273	@rikachon36 @jeepee04 他の電車大体山に向かってるからロックできるの小田急だけだな	{'place_id': '7ee61f505fdfdf5c'}
2021-06-30T08:17:42.000Z	1410150537144664064	電車にて大橋さんに遭遇(２年ぶり3度目)なおお互いに目があった後に無視	{'place_id': '61774861ea700565'}
2021-06-30T08:16:42.000Z	1410150287805804548	今月のランニングノルマ後3kmちょい。飲みに行かなければよゆー。 https://t.co/AsxpGQGJ2a	{'place_id': '1b0cfebe3424e14f'}
2021-06-30T08:13:50.000Z	1410149564577988608	出勤前にガチャコーナーをウロつく (@ アニメイト - @animateebina in 海老名市, 神奈川県) https://t.co/eG0JaNpM57 https://t.co/Z5HuG13rvK	{'place_id': '411f0aa7fce9a8fc', 'coordinates': {'type': 'Point', 'coordinates': [139.39382296, 35.45264536]}}
2021-06-30T08:13:21.000Z	1410149444285132801	藤井二冠のニュースを見て感じたんだけど、伝えるのは将棋の内容だけで良くない？「勝負めし」や「おやつ」までクローズアップして取り上げる必要性ってあるの？こんなことを報じて遠回しに外出を促すからコロナ感染者が減らないんじゃないの？	{'place_id': 'e9d13ad4ff9f02c1'}
2021-06-30T08:12:10.000Z	1410149146929942528	今日は1年ぶりに会う友達とお出かけだからテレ東音楽祭は録画組🙌！帰ってゆっくり見よ〜🙆‍♀️	{'place_id': '5c43b25fece122d2'}
2021-06-30T08:03:09.000Z	1410146878415458305	コロナ禍で孤独な出産をし、里帰りも叶わず、親の手も借りれず、現在生後5ヶ月になる娘をずーっとワンオペで育てています。親が医療従事者でまだまだ会えそうにないのですが、ワクチンも全員完了したらみんなで温泉旅行にでもいってゆっくりのんびり会いたいです！ https://t.co/vUnuejgkyT	{'place_id': '4c1c4868f96634ed'}
2021-06-30T07:57:23.000Z	1410145426594877441	オープンしました♪今日もジメジメして雨降りそうですねー😭本日はひろみちゃんの出勤でーす😊それではみなさまお待ちしております✨ https://t.co/CQXJuZvGEr	{'place_id': '0fd33386c57b038a'}
2021-06-30T07:54:15.000Z	1410144637788905475	乗ろうとしていた電車が駅に着いた瞬間で電話かかってきて電車乗り過ごしてしまった(&gt;_&lt;)	{'place_id': '1b0cfebe3424e14f'}
2021-06-30T07:51:27.000Z	1410143933359804420	阪神電車の「赤胴車」武庫川団地で「第三の人生」へ 交流スペースとして7/10から開放 | 乗りものニュース https://t.co/YzuhWMPvV9	{'place_id': '0fd33386c57b038a'}
2021-06-30T07:48:55.000Z	1410143295750086657	明日も仕事だけど！😂飲みに行きたくて😂笑 https://t.co/WXzhmTsxnE	{'place_id': '110181eebd176002'}
2021-06-30T07:47:13.000Z	1410142869076074497	何だかなぁ。出勤日が変更続きになってる…。	{'place_id': '1d5d82d43a574e4f'}
2021-06-30T07:40:34.000Z	1410141193707552769	最寄りの駅で既に乗る電車ミスったわ。恵比寿に飲みに行こうとして、中目黒乗換を意識してたら何か目黒線乗ってた。それは目黒。	{'place_id': '451617631d24d98c'}
2021-06-30T07:33:17.000Z	1410139361341964291	おはようございます！たかはしです！週末の試合の抽選結果出ました！相手が誰であれ、全力を出せるように頑張ります！本日は馬場プロ出勤になります！週末のfidoに向けてスティールもソフトも練習しましよう！💕納豆パスタの研究中です！めちゃくちゃ美味しい納豆パスタを作るので待っててくださいね https://t.co/IvhxTxnchb	{'place_id': '4c1c4868f96634ed'}
2021-06-30T07:25:20.000Z	1410137361220968451	@nana77n7n そうまくん敵視！笑笑笑笑笑笑←(音消してたはずなのに電車の中で鳴り響いたの恥ずかしいので責任取ってください🤣🤣🤣笑笑)	{'place_id': '1df8c91136c4c140'}
2021-06-30T07:24:08.000Z	1410137057159094274	今日の京成電車をどーぞw https://t.co/ayzKpREkJG	{'place_id': '07d9ec8244c88002'}
2021-06-30T07:12:37.000Z	1410134161881370626	あるこほりっく今日も元気に開院しました😊今日は、りなちちゃんラスト出勤です。沢山のご来院お待ちしてます😊#コンカフェ　#あるこほりっく　#秋葉原 https://t.co/EliiYKa6TH	{'place_id': '28b9063fdce43645'}
2021-06-30T07:07:22.000Z	1410132840705003521	日曜日は可愛いあの娘のバレンタイン最終出勤でございます。	{'place_id': 'a35b6b4421e1a506'}
2021-06-30T06:57:21.000Z	1410130319378845699	皆さん！おはようございます🙇‍♀️本日はこのスタイルで出勤ですわよ😉二丁目でお待ちしてるわよ💗 https://t.co/b8Tz9oqxxL	{'place_id': '7ee61f505fdfdf5c'}
2021-06-30T06:56:29.000Z	1410130098598989826	本日、今の現場ラストなのでPC返却のため出勤〜そして明日は新しい現場に出勤〜	{'place_id': '3ae278a47b227f1f'}
2021-06-30T06:55:13.000Z	1410129782717575174	旅行感すごい。いつも「宇都宮線直通」っていう表示だけ見てる宇都宮線ってやつに初めて(?)乗ってる…	{'place_id': '07d9d225df484000'}
2021-06-30T06:54:20.000Z	1410129558628564994	留学前の最終出勤日です。全然実感ないけどさみしい〜〜〜😭😭 https://t.co/VVzR7YVuT0	{'place_id': '07d9ca4f56c85000'}
2021-06-30T06:52:53.000Z	1410129194739064832	《拡散希望》本日の出勤みゆちゃん　18時みなみちゃん　18時半ですよ〜(^-^)/週中楽しく飲みましょう🍻🍾🎶#大森ガールズバー#ガールズバー#ダーツ#カラオケ#飲み放題#歌い放題#喫煙許可店#コロナ対策https://t.co/6MckqTVlhw	{'place_id': '1df8c91136c4c140'}
2021-06-30T06:51:28.000Z	1410128837963251714	@nunuganbaru 降りた次の電車乗って江ノ島向かったけど🤣	{'place_id': '61774861ea700565'}
2021-06-30T06:45:12.000Z	1410127259629850624	@wagaqvr 意外にハイボールがすいすいと…一人で立ち飲みには丁度いいです(*ﾟ▽ﾟ)ﾉ流石にこの後は誰も入店しませんが（ ﾟдﾟ ）	{'place_id': 'afd2dbc6df82cca8'}
2021-06-30T06:41:38.000Z	1410126364313796612	蘭たんの放送きいてたらあんバタサンドたべたくなったので出勤前にきた (at @Starbucks_j in 墨田区, 東京都) https://t.co/LWVFDAHrve	{'place_id': '27b43920b8b63188', 'coordinates': {'type': 'Point', 'coordinates': [139.81166272, 35.71035359]}}
2021-06-30T06:40:22.000Z	1410126042304376832	小田急って気が変わったら江ノ島行けるからいい電車だよな	{'place_id': '1b0cfebe3424e14f'}
2021-06-30T06:36:53.000Z	1410125166374363136	コンビニに行きたいんだけど、クロネコさんが来ないと、外出できない🥲２時〜４時指定なので、そろそろ来るかなぁ。	{'place_id': '1df8c91136c4c140'}
2021-06-30T06:31:51.000Z	1410123899757424640	神田駅前にて休憩中なぅ☕️今から「にゃお」神田店に出勤しまーす😅 https://t.co/cKP8Mqtf86	{'place_id': '1076f8e0c4141001'}
