2021-08-08T23:58:42.000Z	1424520475359596546	六本木のバーがトレンド入りで、ん？と思ったら、私が前日に行ってたお店😂五輪出場者や関係者がお酒飲んでいただけで警察が動くとかなんなの。飲みに出歩いた選手・五輪関係者、緊急事態宣言下で午前3時にお酒提供してる店、午前3時に飲んでる人を通報できる状況にあった人、誰も悪くない…	{'place_id': '594fa6c6bc5b5ba9'}
2021-08-08T23:58:21.000Z	1424520388847955975	あの大雨の今治から七年も経つのか····電車が途中で運転中止、代行バスで移動とか大変な目にあった···· https://t.co/JTDrtksPTd	{'place_id': '519decbcbebfd98d'}
2021-08-08T23:56:58.000Z	1424520038887825409	雨降ってるしバイクはお休みして最近乗ってなかった車に乗ってコーヒーでも飲みに行くかな‼️	{'place_id': '920d3a170bebcb1a'}
2021-08-08T23:55:29.000Z	1424519667477934080	これから電車に乗るときは前からやってるけどリュックを前にやっていれば防御になるかなあ	{'place_id': '519decbcbebfd98d'}
2021-08-08T23:54:54.000Z	1424519519024812034	おはようございます😃コロナ禍で食べ物しか買って無かったので10年使って調子が微妙だったエアコンを買い替えた。外出先から室内の温度も調整出来るから帰ってすぐに快適です。 https://t.co/O0jG2PnVrw	{'place_id': '1b0cfebe3424e14f'}
2021-08-08T23:54:17.000Z	1424519364489801729	外国人選手ら 六本木で飲酒#Yahooニュースhttps://t.co/ZGOQ7zDNjv 私が7日の夜に行った六本木のあそこのお店ねw上がクラブで店員にフランス人がいるからとコッソリ「明日近隣ヨーロッパ諸国の選手団が貸切予約してくれて飲みに来るんですよ｣って意気揚々と仲良くなったオーナー社長が教えてくれた	{'place_id': '594fa6c6bc5b5ba9'}
2021-08-08T23:50:20.000Z	1424518368959234053	今朝も楽しい時間を皆さんありがとうございました🙌通勤中…雨が止んだかと思ったら勢いよく降ってみたり…風も強くなったりで１日荒天っぽい💦お出かけする皆さんいろいろと気をつけて‼️まぁいいや💨ではお仕事お休み関わらずより良い１日を🙆あしたまにあーな🙋#ちょうどいいラジオ	{'place_id': 'fd6d701398e33eaa'}
2021-08-08T23:49:28.000Z	1424518152256294914	ドデスカ。オリンピック開催中、家のテレビにクギズケになって観戦していた人は、オリンピックロス症候群に陥る可能性があります。つならない、むなしい、といった心理状態になったり、不要不急の外出が多くなったり、。家の中で楽しめるものを何か見つけよう。#浅尾美和  #正木裕美 #ドデスカ https://t.co/sWCHsEToN3	{'place_id': 'f05d4b0cfac65c65'}
2021-08-08T23:42:58.000Z	1424516515357806597	おはよーございます。大人しく（クロワッサン食べてから）休日出勤しまづ😑颱風の悪戯による、お約束の天候不安定☔️ロードバイクで被るヘルメットでは無いですが、ヨシ🙂ブライ豚をロード号に付けてみたら、実速度の倍の指示。GPSに切り替えると復帰。なぜ？（実際の場所は、アムフルス） https://t.co/RJdqxXCLAv	{'place_id': '0fc3339c6694f000'}
2021-08-08T23:40:35.000Z	1424515915404611590	新宿さざなみ1号…春に館山のめいぷるスカイに乗りに行ったときの列車だが山の日連休最終日のためか雨予報のためかガラガラ。今回はその5分後を追いかける横須賀線からの電車で袖ヶ浦へ。 https://t.co/9GShYpDQYc	{'place_id': '0fc3453dacd55000'}
2021-08-08T23:38:52.000Z	1424515484469186561	東海道線直通の上野東京ライン熱海行きが止まった。車内の電気も消えて、空調も止まった😫周囲の電車からの危険を知らせる信号って何や😅何があったんやー😖💦#上野東京ライン#東海道線#熱海行き#車両点検#運転見合わせ https://t.co/7DF9SbSZTA	{'place_id': '28b9063fdce43645'}
2021-08-08T23:37:56.000Z	1424515250628415489	よくまあ8人も馬鹿が立候補したな。このコロナ禍にオンライン投票にしないと行かないよ。外出禁止って県知事が言ってるじゃん https://t.co/lgItgQp5SS	{'place_id': '124cf982b30781ca'}
2021-08-08T23:36:07.000Z	1424514791389896710	電車乗ってる時、道を自転車で走っいるとき、すれ違う人、乗車してくる人、普通にマスクしてない人いるけど、あれはなんなのか？	{'place_id': 'b3b52bda7ae86b07'}
2021-08-08T23:33:12.000Z	1424514057881542666	@hiroshimilano スポーツダイジェストで十分な万年外出自粛の年寄りには地獄の2週間のテレビ放送だった。何が多様性だ、フン。スポーツに熱狂しない国民は反日非国民とばかりに、これでもかと熱狂するテレビ、絶叫するバカアナ。ニュースを見たいと思ってテレビを付けると悶絶((꜆꜄•̀ω•́)꜆꜄꜆ｽﾙｽﾙ	{'place_id': 'b2216c57788fc225'}
2021-08-08T23:29:53.000Z	1424513224200884231	電車空いとると思ったら祝日やったわいや😇 (@ 南池袋公園 in 豊島区, 東京都) https://t.co/aLR86rfiZu https://t.co/4QZcV0cpqQ	{'place_id': '7efb0fd5276fdda5', 'coordinates': {'type': 'Point', 'coordinates': [139.7143364, 35.7275927]}}
2021-08-08T23:26:12.000Z	1424512295913226247	豪雨を回避して遅めの出勤。いつも定時1時間前に出社しているけど、今日はのんびりできないな。	{'place_id': '77173905596af4ab'}
2021-08-08T23:25:02.000Z	1424512004862009348	おはようございます🌞出勤直前に豪雨☔️🤣今日仕事入れなきゃ良かった〜😩と思いながら出たらすっかり止んでた😆相変わらず今日もツイてるー👯‍♀️最近は自分のペースでやるために案件手放したりしてたら、スムーズにやれる追加案件が定期で入る様になった😮やっぱり無理せず手放す事も大事❣️	{'place_id': '594fa6c6bc5b5ba9'}
2021-08-08T23:24:25.000Z	1424511850616553475	@hankyu_ex 私は千葉県在住なので、なかなか阪急電車に乗る機会がありません。初めて、阪急梅田駅に行った時の行き止まりホームに並ぶ電車たちの壮観さに感動したのは忘れません。首都圏には、阪急電車のような気品に溢れた会社がないので、コロナが収束したら、阪急三昧したいです！	{'place_id': 'b74d0f4a87a68c66'}
2021-08-08T23:20:59.000Z	1424510984937349120	@WOoSQYxHXODbitf 私は人の嫁をNTしてたら、自分の妻にNTRされました。そのときの恐怖があるからか、今の妻が外出するのは好みません。でも自分はNTをまだやめられません。	{'place_id': '27b43920b8b63188'}
2021-08-08T23:17:25.000Z	1424510086626484227	出勤してすぐ早弁したからお昼食べるものがありません。	{'place_id': '0fd33386c57b038a'}
2021-08-08T23:15:45.000Z	1424509668622147584	@msialifejp 2回目接種から２週間は免疫が逆に低下するので新たに免疫が完成するまで外出、他人と会うのは控え厳守に注意しないと逆に色々感染リスク高まるとドクター、看護師、薬剤師さんに確認済みちょうどまだ新たな免疫が出来るまでの期間だったのでしょうか😢🥺	{'place_id': '77173905596af4ab'}
2021-08-08T23:09:30.000Z	1424508093241593863	旅行や帰省が禁止されたわけではないので現状誰も止めることはできないんだけど、それはそれとしてその行いをSNSやらライブ配信で全世界へ公開するのは明確に間違ってるんじゃないかなぁと思ってしまう。	{'place_id': 'afd2dbc6df82cca8'}
2021-08-08T23:05:20.000Z	1424507046125207553	豪雨だが出勤…	{'place_id': 'a35b6b4421e1a506'}
2021-08-08T23:01:57.000Z	1424506192974385158	目の前で女性が倒れた。電車から身体が飛び出した。駆け寄ったけれどドア押さえるしかできなかった。駅員さんも気づかない。駅員さんを呼びに行くべきだったか。	{'place_id': 'd9ac10e7c031f3c2'}
2021-08-08T22:57:56.000Z	1424505184374300672	電車に人が少なすぎて不安になる。遅刻してないよな…。周りはお盆休み？	{'place_id': 'e55409e2b3f74247'}
2021-08-08T22:56:58.000Z	1424504940408426498	宣言中だからか、もう盆休みなのか通勤電車空いてる＠江戸	{'place_id': 'ed61afd47a8bfd91'}
2021-08-08T22:54:39.000Z	1424504359551782915	東京でこれほど多くの感染が広がっている理由？それは「自分は感染しても大丈夫」と思っている人の行動と「気を付けているから移動しても帰省しても旅行しても知人宅で飲み会をしても多分大丈夫」と思っている人の行動が原因でしょう。少し体調が悪かったり、少しだるい、少し熱があるけど大丈夫だ！	{'place_id': '594fa6c6bc5b5ba9'}
2021-08-08T22:52:59.000Z	1424503938800250886	@yumegiwalastboy 祝日ですが午後から出勤します。(-^〇^-)/	{'place_id': 'f05d4b0cfac65c65'}
2021-08-08T22:49:20.000Z	1424503021132607489	今日は絶好の休日出勤&amp;夜間作業日和？？	{'place_id': '27b43920b8b63188'}
2021-08-08T22:48:44.000Z	1424502868187303942	おはようございます‼️今日出勤したら6連休😍😍美味い餃子食べたい🥟🥟🥟　#浜松餃子 https://t.co/ihTcESd293	{'place_id': '336251fac4207ae3'}
2021-08-08T22:48:03.000Z	1424502698657779713	一本気な階段が駅前にある#青春18きっぷの旅#ほぼ電車 https://t.co/bIZk9JCIh1	{'place_id': '07d9ec8390087001'}
2021-08-08T22:47:33.000Z	1424502569989132291	@mifiopicocre きょうからさびしくなりますねー。五輪をテレビで見ることが自然と外出自粛になっていましたし。3回目の東京オリンピックがあるなら見てみたいなぁー	{'place_id': '46f04ccee8ce6b7d'}
2021-08-08T22:47:16.000Z	1424502500309143552	電車空いてるなぁと思ったら祝日（の振替）だったー！なんでうちの会社は出勤日なんだー😭でも12日のこと考えるとドキドキしちゃうから仕事してグッズ代を稼ごう(´^∀^｀)	{'place_id': '7efb0fd5276fdda5'}
2021-08-08T22:45:33.000Z	1424502069193445381	さっきまで晴れてたのに急に外出られないぐらいの暴風雨。少しでも弱まってくんないかなぁ...	{'place_id': '4f8c5ba59b1e3250'}
2021-08-08T22:45:32.000Z	1424502061824020481	奥様と娘今朝38度💦私は5日ぶりの出勤体力戻らず💦暑さでやられてますファイザーワクチン接種でこれだとモデルナ、アストロゼネカワクチン接種だったらと想像すると((((;ﾟ;Д;ﾟ;))))ｶﾀｶﾀｶﾀｶﾀｶﾀｶﾀｶﾀｶﾀｶﾀです	{'place_id': 'db215c78c59027e4'}
2021-08-08T22:39:11.000Z	1424500466730213377	@GlSTQ4x5RKDKItQ 今日は休日出勤〰️😵	{'place_id': 'e20cd4ef291c416b'}
2021-08-08T22:34:28.000Z	1424499279415050240	休日出勤朝飯はボスの奢りでレペゼン彩の国　山田うどんにて山活！目玉焼き定食を蕎麦でクーポンのカレーコロッケ添えて✨目玉焼き丼にして楽しんだ😋#埼玉県　#彩の国　#魂飯　#ソウルフード#山田うどん #山田うどん2021#山田うどん食堂#2021僕の外ご飯#食べる喜び  #仕事前のお楽しみ https://t.co/AHg2mmFiqE	{'place_id': '07d9e63b8f888000'}
2021-08-08T22:29:52.000Z	1424498119765467138	@8KElkb2TphxrZwH @iroa1991 @nonpoli9 オリンピックを警護している(警備員ではなく)警察官に電車を見させろとか言ってる輩もいましたね(笑)。 https://t.co/ror2O9Gd3R	{'place_id': '28b9063fdce43645'}
2021-08-08T22:27:41.000Z	1424497572127801344	@ske_ltd_exp 振替休日出勤？	{'place_id': '962b0af43cd1ad6c'}
2021-08-08T22:24:59.000Z	1424496893229338629	・うがい、手洗いをする。・体調が悪いと感じたら仕事を休み、外出しない。・体調の悪い人がきちんと医療機関を受診できるように体制を整えるのが政治の役割。#モニフラ	{'place_id': 'f05d4b0cfac65c65'}
2021-08-08T22:21:16.000Z	1424495956272189447	電車乗る時定期券忘れて、切符買ってまで会社に着いたらビルが空いてない。そうか、今日は祝日か	{'place_id': '1df8c91136c4c140'}
2021-08-08T22:20:14.000Z	1424495694446940160	電車は良いが、駅からのバスが休日極端に少ない。	{'place_id': '962b0af43cd1ad6c'}
2021-08-08T22:19:22.000Z	1424495478859698183	吉祥寺の真っ直ぐな駅前の道が新鮮な中央線#青春18きっぷの旅#ほぼ電車	{'place_id': 'ae10e4565c20a69b'}
2021-08-08T22:16:09.000Z	1424494666775400448	向日葵も咲き揃い、稲穂も頭を垂れて来た。まさるクンもお目覚め（笑）５時起床後散歩、シャワーと朝食後にのんびり出勤。このルーティンが心地よい。さ、出勤だ。#朝の散歩 場所: 寺家ふるさと村 https://t.co/gKc8ICtD3n	{'place_id': 'd473ed704dbcd4a5', 'coordinates': {'type': 'Point', 'coordinates': [139.504472, 35.568611]}}
2021-08-08T22:15:27.000Z	1424494493525450755	おはようございます今日は山の日の振替休日で祝日です。お盆休みも重なって今朝は出勤する電車も普段使っている駐輪場もガラガラですね週末までお仕事頑張りますさて写真は続いていますが先日撮影した富士吉田市からの赤富士です#富士山#mtfuji#農村公園#赤富士#マルミフィルター#ソフトGND https://t.co/abfhF6lgv8	{'place_id': 'f808b328dbac41d3'}
2021-08-08T22:04:31.000Z	1424491739616743430	@kereru0ciel おはよーーーーーございます☀️☀️☀️休日出勤、ご苦労様です💦	{'place_id': 'a1383746d9e64c93'}
2021-08-08T22:02:02.000Z	1424491114166427660	出勤 (@ モノレール 天空橋駅 in 大田区, 東京都) https://t.co/cLD3mKWJ9U	{'place_id': '1df8c91136c4c140', 'coordinates': {'type': 'Point', 'coordinates': [139.75430466, 35.54914951]}}
2021-08-08T21:59:11.000Z	1424490399050059776	@WnPyvoA3qSFjPDs 今日はどこかお出かけですか～😃	{'place_id': 'e60fb4e164191d47'}
2021-08-08T21:56:20.000Z	1424489680695746560	④見えにくい人が受けた電車のプチ嫌がらせ【CC】 https://t.co/zXMNgoyyiK @YouTubeより	{'place_id': 'f72cbd7b378a05fc'}
2021-08-08T21:54:04.000Z	1424489110253703172	@CKV36typeP ゆうさん、おはようございます☀️今日はお出かけですか？安全運転で、素敵な一日をお過ごしくださいね！🚗³₃	{'place_id': '76c498282a5a7997'}
2021-08-08T21:47:51.000Z	1424487548357808129	みなさんお久しぶりです。久々の投稿すぎて申し訳ないです😢山下流星元気にしてましたw今日も出勤してます。あと明日告知があるのでみていただけると嬉しいです🥺 https://t.co/vkigdS0DwQ	{'place_id': '0fc291fda3947000'}
2021-08-08T21:42:11.000Z	1424486120562249728	おはようございます千葉県佐倉市近辺は晴れ🌤台風一過も湿った生暖かい風が容赦なく吹きこんできます。今日はしんどい休日出勤。 場所: 南ユーカリが丘 https://t.co/dl9V94x8lA	{'place_id': 'f1299e526e0cc34d', 'coordinates': {'type': 'Point', 'coordinates': [140.15527778, 35.71744444]}}
2021-08-08T21:38:04.000Z	1424485084216791044	たまに電車通勤すると高確率で寝過ごす💦💦今日は飯田橋まで寝過ごした	{'place_id': '28b9063fdce43645'}
2021-08-08T21:37:00.000Z	1424484815399649281	日本政府に提案:電車の利用者、外食利用者、高速利用者はワクチン接種証明の提示を義務化。 https://t.co/md08SpPmd8	{'place_id': '594fa6c6bc5b5ba9'}
2021-08-08T21:30:28.000Z	1424483170246815745	@blackdiamod0831 パペちゃん電車の中で粗チンを出しちゃダメよ❣️	{'place_id': '7efb0fd5276fdda5'}
2021-08-08T21:27:05.000Z	1424482319478427652	出勤 (@ 新桜台駅 - @seiburailway in 練馬区, 東京都) https://t.co/fZl0CES435	{'place_id': 'dcc2630623880f96', 'coordinates': {'type': 'Point', 'coordinates': [139.66837741, 35.74082025]}}
2021-08-08T21:26:36.000Z	1424482197453512704	早朝ウォーキングday67今朝はいつもよりもう一段早い5時台。明け方は1日のうちで一番涼しいので、真夏でも快適に外出できます。#早朝ウォーキング#坂道コレクション https://t.co/n8OzUqZ8sE	{'place_id': '1df8c91136c4c140'}
2021-08-08T21:24:40.000Z	1424481710595481601	今日は休日出勤でございます（ ;  ; ）べつの日に休み入れるからいいけど笑#89の日なんだけどあえてロクイチの夏の日の撮影で😀 https://t.co/4JasWiH2Fo	{'place_id': '307c68972fd1dc20'}
2021-08-08T21:23:35.000Z	1424481441425989632	お盆は休まずバナナジュースを作り続けております🍌🥤✨緊急事態宣言下のお盆、キイロイジュースは、感染対策を徹底して毎日休まず営業しております。キャンセルになった帰省、ちょっと行きにくくなった旅行、そんなステイホームの息抜きに、自粛疲れの癒しとして、皆様に美味しいバナナジュースを！ https://t.co/VM9BEfMTIM	{'place_id': '11f2c65839146000'}
2021-08-08T21:23:32.000Z	1424481426263605248	電車空いてんなーて思ったら今日祝日か😇😇	{'place_id': '28b9063fdce43645'}
2021-08-08T21:15:51.000Z	1424479491959578629	営業時間を拡げます⭐️キャスト様急募⭐️✨19時〜翌朝6時迄※終電上がり希望者、遅めの出勤希望者未経験者、経験者問わず週1から可お気軽にお問い合わせください#コスプレ　#高収入　#副業　#ガールズバー #体入ショコラ　#コンセプトバー   #アルバイト#高収入バニラ　#拡散希望　#コンカフェ https://t.co/LxjTtW7POp	{'place_id': '7ee61f505fdfdf5c'}
2021-08-08T21:12:41.000Z	1424478695851319301	2日間貸切バス(観光)運転します(  '-' )出勤が早いんじゃあ(  ˙꒳​˙)	{'place_id': '1df8c91136c4c140'}
2021-08-08T21:08:47.000Z	1424477717085364225	おはようございます🍀今日一日頑張れば明日は定休日です。(発送3件あるので出勤しますが😅)明日は久しぶりに朝は、ゆっくり。今朝もちょこっと仕入れ行って来ます🌸#イマソラ#flower#花のある暮らし #ワンちゃん大歓迎#北鎌倉の小さな花屋 https://t.co/FXuuxlnyM6	{'place_id': '56c04190b03cfa94'}
2021-08-08T21:04:05.000Z	1424476532995624961	おはようございます！今朝も蒸し暑い！久々の #皇居ラン に行きましたが、一周したところでギブ😅電車に揺られて帰宅しましたw三連休最後は家でゆっくり休みます。五輪も終わっちゃったし、映画でも観よ。#朝ラン https://t.co/axM8yTsbOr	{'place_id': '594fa6c6bc5b5ba9'}
2021-08-08T21:02:57.000Z	1424476246361051143	おはようございます。今から出勤です。今日は「大船」の現場です。今日も頑張ります。土曜日とは違う現場です。	{'place_id': '61774861ea700565'}
2021-08-08T20:21:24.000Z	1424465790762323973	今日は休日出勤。昨日のざきゃらよんでは永遠の推しを素敵に送ることができてありがたかったです✨ありがとうございました😊今日は余韻に浸りたかったけど締切に間に合うかどうかの状況なので一区切りついたらフォトブックなど開いてみます☺️今日も熱中症と天気の急変と感染防止対策しっかりして文字数 https://t.co/CM8Sy2MpLy	{'place_id': 'dded92a2db180dd1'}
2021-08-08T20:16:13.000Z	1424464487692734465	おはようございます。ｸｿ両親の野郎ﾓｰ起きてやがり台所、使ってやがる😭台所、狭いし、いじめるから、うーざーい💢ｺﾞﾛ2(専業)主婦夫婦なんだから私の出勤日の朝ぐらいは台所、優先させてよ💢ｸｿﾊｹﾞ親父が大邪魔邪魔邪魔邪魔邪魔邪魔邪魔邪魔邪魔💢	{'place_id': '8f844bd31a72243f'}
2021-08-08T19:45:42.000Z	1424456807112527872	∩∩ (･ x ･)2021年8月9日月曜日おはようございますうさ　始発電車うさ https://t.co/7WQgynJe21	{'place_id': '28b9063fdce43645'}
2021-08-08T19:10:21.000Z	1424447911664959489	病気自慢：虞メンヘラ(似合わねえ)。とりあえずは不眠で、ここ48時間なら小刻みに4時間半睡眠。さすがに外出には不安がある(歩くとふらついたりするのね)。幸い振替休日だもので、少しだけ書類仕事など。あとは寝ろ。火曜日は区役所から医院でええやろ。久しぶりにアタマ使うが、たまには。	{'place_id': '7ee61f505fdfdf5c'}
2021-08-08T18:49:51.000Z	1424442753044291587	そして、22:00以降はたり猫になって、題して、深夜真夏のリモート合宿をやりましたー笑　恋バナして人生ゲームして、楽しかったね🎶明日は天気によってお出かけ配信とカラオケ配信します！#CANAQOLE #LINELIVE #RT数が審査対象です #世界猫の日 #深夜真夏のリモート合宿　#恋話 https://t.co/JpckbWvKnc	{'place_id': 'e55409e2b3f74247'}
2021-08-08T17:03:46.000Z	1424416055229763586	徒歩と電車。自転車だとやはり限界が、車はきついけど原付きぐらい欲しいな	{'place_id': '95484b83e4708f58'}
2021-08-08T17:02:05.000Z	1424415629801443345	オリンピックで移動制約がなくなったらみんな旅行行くに決まってるじゃん。ワクチン打ってない人もね…どうなるかねえ…	{'place_id': '61774861ea700565'}
2021-08-08T16:55:52.000Z	1424414067247128585	@758_heaven 私は、穿っていますので…すみませんが、なんとなく雰囲気での方もですが、今回の五輪メダル取ったで喜んだのは、スポンサー、関係者しかいないと思います！電車に乗っていても、五輪の話しなど聞きませんし、むしろ、コロナ関連の話しの方が多く、あとは、家庭の話しで…病院に行っても、なく…	{'place_id': '5cf616c8f739cb2b'}
2021-08-08T16:53:06.000Z	1424413370245996550	レアな電車乗って車窓に変な模様を描いた紙置いて発狂する撮り鉄を後からYouTubeとかで見てみたい。	{'place_id': '519decbcbebfd98d'}
2021-08-08T16:42:08.000Z	1424410610901553160	台風も通過して、外の空気吸うために外出してたついでに、パパパパパインへ🍍昼くらいにKissBeeの藤井くんがツイートしてたから、久々に身体が求めてしまったよね🍜塩ラーメンにパインの甘さがうまく絡んでイイ味出てるんだよね〜✨酢豚のパインは苦手なんだけど、これはイケる👍 https://t.co/gLgtHeTupR	{'place_id': '0d24eb832415c000'}
2021-08-08T16:13:25.000Z	1424403381842370561	@D0905Kenly 電車が止まるかもしれないから近い人から早番にされちゃいますし…早番嫌い	{'place_id': '9de423c47dbf207e'}
2021-08-08T16:13:08.000Z	1424403312716046337	世間的にいうと今はお盆休みなわけだが、田舎がないようなやつはシフト制で火曜から出勤にさせられるパターン😢	{'place_id': 'dcc2630623880f96'}
2021-08-08T16:09:15.000Z	1424402336642830336	東京オリンピックも無事に閉会。首脳陣が自分を信頼していただいて少し関わらせていただいた選手たち金メダルおめでとう。電車や駅で選手たちから「お久しぶりです。」と声をかけてもらえて嬉しかった。次のステージでの活躍をいのります。 https://t.co/TtZ3BcSjac	{'place_id': '07d9e4fad8c84004'}
2021-08-08T15:57:47.000Z	1424399449883693057	今日やること帰宅シャワー仮眠家事出勤	{'place_id': 'a1383746d9e64c93'}
2021-08-08T15:55:34.000Z	1424398889914814470	渋谷は爆破してもいいけど電車内でナイフはやめてください。	{'place_id': '0d8054846be7f7be'}
2021-08-08T15:53:21.000Z	1424398333682982913	え？8月8日って山の日だったんだ！知らずに富士山を眺める日帰り旅行に行ってたし🙃	{'place_id': 'dded92a2db180dd1'}
2021-08-08T15:42:44.000Z	1424395660225224712	こういう、どゆこと…？ってなる事件も、ちょうど一緒にご飯食べてた人が事件の祖師谷大蔵が最寄りで、帰りの電車に影響あったし、日常すれすれなわけで。明日も、自分や周りの人が元気でいれるかなんてわからないんだから、本当に毎日を大切に生きようと思った。https://t.co/QCV0y1UgPy	{'place_id': '7ee61f505fdfdf5c'}
2021-08-08T15:39:09.000Z	1424394762207989762	@katsuta66 一年前と比べて明らかにエスカレーターのベルトを掴む人、電車の吊り革や手すりを掴む人が増えています。それによる感染拡大だと思うのですが…	{'place_id': '7ee61f505fdfdf5c'}
2021-08-08T15:31:53.000Z	1424392930077265927	なぜ無観客なのか？理解せず自分本位の行動で密に飛び込むこれでまた週末に増加し思い当たる行動はしていないと言われたら悲しくなる罰金10万で給付金返してもらえばいいのに、不要でしかない外出なのだから	{'place_id': '735b6f2b933efaf6'}
2021-08-08T15:29:16.000Z	1424392272649457674	明日は午後出勤なので迎え酒開始❤️	{'place_id': 'f43d3d50a3b017e9'}
