2021-03-03T13:16:50.000Z	1367101661685055489	前の家から今の家へロードバイクを持ってこようと輪行バックに入れたはいいものの、電車が満員で乗せることが出来ず、結局組み立て直して1時間荒川を走る羽目になった疲れた	{'place_id': 'f72cbd7b378a05fc'}
2021-03-03T13:09:43.000Z	1367099872004907011	そうなのか。もう人手が出始めてるから、外出の流れが止めれないのでは。。https://t.co/2VusS7Xvb2	{'place_id': '1df8c91136c4c140'}
2021-03-03T13:08:44.000Z	1367099623517552643	今日の朝は電車止まってたけどJRで行ったら富士山🗻がすごい綺麗に見えたんでよかったです。	{'place_id': '0d8054846be7f7be'}
2021-03-03T13:07:12.000Z	1367099236098076673	下町のブラジリアンワックスサロン😊下町価格で脱毛🎀女性専用のプライベートサロンだから他のお客様とばったりなんてこともなく密がさけられるお出かけスポット❤️#小岩 #小岩脱毛 #江戸川区 #ブラジリアンワックス #小岩ワックス脱毛 #makanasalon0813  #小岩ブラジリアンワックス https://t.co/cYVfIN2t5R	{'place_id': 'f72cbd7b378a05fc'}
2021-03-03T13:04:25.000Z	1367098537989730309	@cresta_vaarn 二両目の電車の下で生きていたそうです	{'place_id': 'e711a8fc9ecc013e'}
2021-03-03T13:04:22.000Z	1367098525415211008	@sakura__n おめでとうございます🎉幸いにも現在、神奈川県内、歌楽屋さんまで電車で１本の場所に住んでいますので、先週末にフライングでお祝いしてきました(^^)#万里小路楓生誕祭 https://t.co/fU4tDLlsQm	{'place_id': 'd313627ad749ca61'}
2021-03-03T13:00:45.000Z	1367097616379514880	···今日は若干いつもより早く帰れるかな  🤔まだ午後10時  少し前だけど新宿駅　やや　すいてます。みんな時短や  外出自粛に協力してくれてる証拠ですね  🤗 https://t.co/53py4WzWeQ	{'place_id': 'faab662cb34cf04f'}
2021-03-03T12:56:28.000Z	1367096537398927361	@fraporich そして、三鷹で戻りの電車に乗ったら、またまた特快で、中野まで。あるいは、各駅に乗ろうと、総武線に乗ったつもりが、地下鉄東西線で、なぜか大手町まで。って、ルートまで、検索済み😭＃中央線　＃総武線に東西線	{'place_id': '86315f8740971686'}
2021-03-03T12:55:21.000Z	1367096256686817285	昨日の事故で今朝は神奈川着けないかも〜と思って早めに出発して何事もなかったんだけど。スタジオにいらっしゃる生徒さんがみんな「先生、電車大丈夫だった？？」って聞いてくれるの結構嬉しいの。そしてひな祭りだからと可愛いマシュマロ頂きました✨一瞬で食べました❤️ありがと❤️ https://t.co/Hsy6DVOLGN	{'place_id': 'a35b6b4421e1a506'}
2021-03-03T12:55:00.000Z	1367096168514080771	@yojikun3 新越で田園都市線直通の電車乗るつもりで間違えて浅草行きのに乗ってしまいました	{'place_id': '32049a95db695cb8'}
2021-03-03T12:53:46.000Z	1367095856223031297	いつもは大手町のフィットネスから歩いて帰るけど、寒くて茅場町まで電車乗ってしまった。	{'place_id': '28b9063fdce43645'}
2021-03-03T12:43:31.000Z	1367093278286340104	社畜なんでまだ撮影終わって戻る途中の電車の中(まだ退勤してない)なんだけどこんな時間だともう晩御飯はコンビニで何か買うしか選択肢がないんだよね…	{'place_id': 'dcc2630623880f96'}
2021-03-03T12:41:50.000Z	1367092856146382848	久しぶりにこんな時間まで会社にいたけど😵電車が空いてるのが唯一の救いだなぁ🚉🎶	{'place_id': '594fa6c6bc5b5ba9'}
2021-03-03T12:36:48.000Z	1367091587403014147	重要な外出(出勤)時に撮影しました都営バス巣鴨自動車営業所所属の2010年式(推定)のニューエアロスターMP37F系・ラッシュ型ノンステップ車(LKG-MP37FK)のP-V350です。都02で、運用中でした🙆‍♀️巣鴨車では、4台しかいない貴重な三菱車ですね🥰2021/3/3 7:27 錦糸町駅北口#一日一都営バス https://t.co/Je1ZKlDoAk	{'place_id': '8e483d36e0b9b001'}
2021-03-03T12:35:09.000Z	1367091171755925504	今朝、腰に痛みが走ったので薬を塗ってコルセットをガチガチに締めて出勤しました。何とか悪化することなく一日をやり過ごせました。そんな今日、病気療養中のデッサン講師Y先生から届いたイチゴのお裾分けを頂きました。Y先生の一日も早い全快を祈るのみです。健康第一を再確認した一日でした。 https://t.co/s25x9oNr1v	{'place_id': 'ebf44036e84a8152'}
2021-03-03T12:24:15.000Z	1367088427640844293	仕事帰り。いつもの電車、いつもの車両で数日ぶりにまた面影の人に出逢えた。乗り込んで来るとき、やっぱり目が合う。けれどただ｢合う｣だけ。それ以上の展開はないんだろう。面影の人はあくまで中村さんの面影に過ぎなくてどうこうなる人ではないんだろう。だから私の気持ちもフラット状態。	{'place_id': '86315f8740971686'}
2021-03-03T12:22:48.000Z	1367088065135566848	3月4日出勤予定❗️⭐️川島くん　  10時から16時⭐️⭐️太田くん　  16時から22時⭐️予定変更になる事もありますのでお電話でご確認ください。ご来店お待ちしております。03-6383-0039#中野区マッサージ#鷺宮整体#鷺ノ宮整体#もみほぐし整体#肩コリ解消#肩こり改善サロン#身体の歪み改善	{'place_id': '07d9d26a32085003'}
2021-03-03T12:22:06.000Z	1367087888580497411	伊豆急行は各駅停車も豪華ですね。黒船電車乗ってみたいです。 https://t.co/ChQp2KeENE	{'place_id': '5daa72ccdd68afee'}
2021-03-03T12:21:44.000Z	1367087797983612939	@hirokokokuryo 帰りの電車の中でチラチラと…。な、なんと、浩子お嬢様がアイドルの王道のポニーテール‼︎😳😳😳ならば、もう一つの王道の👙も！お願いだよ〜🥺🥺🥺🥺🤣ウキャキャ！	{'place_id': '594fa6c6bc5b5ba9'}
2021-03-03T12:21:11.000Z	1367087659047292932	エントリー完了👩‍🚀🚀🌕世界初ちょんまげ宇宙旅行に連れて行って下さい！お願いします🙇🏻‍♂️💝#dearMoonCrew with @yousuck2020 https://t.co/9PczNJkAXG	{'place_id': '32049a95db695cb8'}
2021-03-03T12:15:00.000Z	1367086099571478532	@kozumayuta 今日初めてそれを知りました。千葉県からチャレラジを聴くようになってからは３年前の東京マラソンなどのスポーツ大会での応援や激励、３年前のアメリカ・ロサンゼルス４日間旅行などのメッセージ、リクエスト曲のオンエアありがとうございました！残り４週間頑張って下さい！千葉県から応援してます！	{'place_id': 'b2216c57788fc225'}
2021-03-03T12:13:29.000Z	1367085720528019459	今日も時短営業中の焼き鳥屋でテイクアウト用に２本買ったら１本オマケしてくれた♪お兄ちゃん、ありがとう！緊急事態宣言解除が２週間程度延びそうなので残念だけど解除されたら飲みに行くからね！	{'place_id': '1d5d82d43a574e4f'}
2021-03-03T12:09:23.000Z	1367084686665605128	外出した日にくしゃみ止まらないから花粉症になった説ある	{'place_id': '0fd33386c57b038a'}
2021-03-03T12:04:04.000Z	1367083349412442121	2週間とかチマチマしないで、どうせ外出自粛って言われるGWまで延長すれば。営業自粛でここまで下がったとは思えない	{'place_id': '336251fac4207ae3'}
2021-03-03T11:58:14.000Z	1367081881481584648	とばさんの話でやっぱiPadいいなと思ってる私がいる。旅行しても持ち歩けるのはいいよね	{'place_id': '451617631d24d98c'}
2021-03-03T11:55:48.000Z	1367081268425334787	@massugu_nao 満員電車　で押されたの	{'place_id': '1b0cfebe3424e14f'}
2021-03-03T11:53:31.000Z	1367080694824927237	#調光レンズ 、めちゃくちゃ魅力的✨✨✨出勤・退勤途中、眩しすぎるんだよなぁ😦😦😦次のメガネを、#調光レンズ にしようかな？🙄🙄🙄 https://t.co/b3761OdcTx	{'place_id': '66b90ad361cfc8e9'}
2021-03-03T11:51:02.000Z	1367080070662131712	いや、旅行の時に車で流してる曲の中の1つだけど、ただ1位ではないw	{'place_id': 'dded92a2db180dd1'}
2021-03-03T11:50:53.000Z	1367080030648426499	@usuke_3312st 退職してサンデー毎日だし😅、焦らず安心して旅行に行けるようになったらお城巡りしようと思ってます😊	{'place_id': '451617631d24d98c'}
2021-03-03T11:46:40.000Z	1367078973050482694	@May_Roma 千葉県電車圏内だと、小６がお別れイベントに、初めて子供だけで行きますね。学校は無関係で、誰と行くか大問題。誰にも誘われない子供も。男だけで行く予定が、女子が２人参加希望で、OKするか揉めてた。中で一部のメンバーがはぐれて、探し回り帰宅が夜になり、最寄り駅まで車で迎えに行った事が。	{'place_id': 'e55409e2b3f74247'}
2021-03-03T11:46:14.000Z	1367078861528211465	在宅ワークは楽で良いのだけど、一日中見ている景色が変わらないのは流石にやばい気がするので、基本夜はランニングするなり外出をしている。	{'place_id': 'd313627ad749ca61'}
2021-03-03T11:44:43.000Z	1367078481301938176	今年電車乗ったの2回目だけどやっぱ乗り換えめんどくさいわ〜	{'place_id': 'f7c22e0cf7b3af2b'}
2021-03-03T11:40:13.000Z	1367077346013044736	某バス停、駅行きの時刻表が系統ごとではなく一まとめになった。いわゆる電車の駅の時刻表スタイルここから先は全て同じ経路同じ行先なのに出発池で表まで分ける必要ないので、わかりやすくなった	{'place_id': '86315f8740971686'}
2021-03-03T11:40:11.000Z	1367077337989140481	そっか！今日は令和３年３月3日のゾロ目だね会社帰り電車🚃は動いてます	{'place_id': '451617631d24d98c'}
2021-03-03T11:34:38.000Z	1367075944238747653	3/3お疲れ様でしたー！週末卒検、来週夜勤明けで免許書換え出来そうです！大型キャンピングカーとかバスとかで旅行行けちゃう₍₍ ◝(꒪ω꒪`)◟ ⁾⁾ https://t.co/G0TugiLq9t	{'place_id': '86315f8740971686'}
2021-03-03T11:32:52.000Z	1367075498778533890	@SEscaper3 やはりそうなりますよねー😅自分も欲しいけどフレームの付け替えめんどくさがって朝練とか外出なくなりそうで嫁に稟議も出せてないですw先輩変わらず朝練しましょうね🤣笑	{'place_id': '4ad3383e25ac98d9'}
2021-03-03T11:31:45.000Z	1367075215407153152	久しぶりの出勤でした https://t.co/P0N4d4JshJ	{'place_id': '735b6f2b933efaf6'}
2021-03-03T11:29:01.000Z	1367074530347245569	たまに電車に乗るのだがこの冬は換気のせいか暑すぎず快適。普段コートで乗り込んで車内は暑いってのが多いからなだが夏は冷房全開で頼む	{'place_id': '76c498282a5a7997'}
2021-03-03T11:28:00.000Z	1367074272611471360	なおワシの自転車、黒服時代に朝帰りだったもんで駐輪代1出勤で日付変わるから2日分取られたり、酔って駐輪場置きっぱなしにして結局タクシー使ってたから大家さんが「あの錆びてんのずっと置いてあるけど居るの？」って言われて処分してもらったので出来ません。二輪嫌いだし...	{'place_id': '0fd33386c57b038a'}
2021-03-03T11:27:45.000Z	1367074209667555330	電車待ち後ろに近距離でおじさんいて怖いよ😣	{'place_id': '28b9063fdce43645'}
2021-03-03T11:26:18.000Z	1367073846579187713	@s_s_anemone お酒良いですよね〜久しぶりに飲みに行きたいな〜	{'place_id': '61774861ea700565'}
2021-03-03T11:25:04.000Z	1367073535080898560	電車でお酒(常温) 飲んでる	{'place_id': 'b41f5dcb002a1886'}
2021-03-03T11:23:57.000Z	1367073256407142400	@ne6iyo ありがとうございます！熱は下がったんですが解熱後3日出勤停止です🌡(￣ー￣)	{'place_id': 'b9351bbc6fc4189d'}
2021-03-03T11:17:48.000Z	1367071708792778755	続いて、電車待ちでお酒(常温) ◎ https://t.co/xALciRsHJp	{'place_id': '0fd33386c57b038a'}
2021-03-03T11:17:26.000Z	1367071614378987523	電車１両貸し切り状態 https://t.co/BK26bw7WLB	{'place_id': 'e0be6d4a13dfc410'}
2021-03-03T11:15:26.000Z	1367071111259643904	電車で、唐揚げ食べてる人初めて見たwww	{'place_id': '07d9e34050080001'}
2021-03-03T11:12:52.000Z	1367070466259578882	やっぱ徒歩出勤楽でいい、、🚶‍♂️	{'place_id': '7efb0fd5276fdda5'}
2021-03-03T11:08:57.000Z	1367069480988282880	みんなで青春18きっぷで旅行しよ	{'place_id': 'f7c22e0cf7b3af2b'}
2021-03-03T11:08:06.000Z	1367069264935407617	緊急事態宣言が2週間延長になりそうか😔外出自粛宣言下に遊びに出ている奴ら呪ってやる☠️都内でミッションやってる奴とか奴とか奴とか。	{'place_id': 'a24531308a92ae15'}
2021-03-03T11:07:29.000Z	1367069112300576769	@zeroro0106 ありがとうございます☺️休みの無いバスケ部で部長を続け、コロナ禍で最後のインハイや大会が無くなり。必死で勉強して第一志望合格。様々な想いが交錯してると思います。2週間後の卒業式、卒業旅行も出来ずモヤモヤすると思いますが緊急事態延長も乗り切って欲しいものです。	{'place_id': '49524fd7b35fd754'}
2021-03-03T11:05:51.000Z	1367068697987194883	電車の中、どこみても皆ウマ娘やってるなぁ	{'place_id': '8e483d36e0b9b001'}
2021-03-03T11:04:12.000Z	1367068285494120450	モリリンのスリーで、電車の中でガッツポーズ👊	{'place_id': '962b0af43cd1ad6c'}
2021-03-03T11:02:20.000Z	1367067812884148224	行政のせいで、手続きがやっかいなのに、遅れたら #過料 だとかいう、法務局ってとんでもない組織だな💢しかも県に一つで、#緊急事態宣言 下の中来いとかさ💦外出自粛っていう行政が、外出を強制するってどういうことだよ😵こんなんじゃ自粛なんて無視したほうがいいな🤯	{'place_id': '5e7a40b139b18a34'}
2021-03-03T10:54:06.000Z	1367065741787164681	まだ緊急事態感のないバラマキ緊急事態ごっこするの？終わった頃に桜咲いてみんなで宴会して流れで飲みに行って春だし、うっぷん溜まってるから飲み屋で大騒ぎするとこまで見えてるんだけど政治家の人は見えてる先が違うのかな？	{'place_id': '1df8c91136c4c140'}
2021-03-03T10:50:49.000Z	1367064914536239107	@kuwahachi @tanikumichou https://t.co/JTXgrIMQv0阪神電車と直通運転をしている路線です。	{'place_id': 'e711a8fc9ecc013e'}
2021-03-03T10:46:18.000Z	1367063778538348549	出勤日。 https://t.co/JdKsZ0lk82	{'place_id': '1b0cfebe3424e14f'}
2021-03-03T10:44:03.000Z	1367063211678162945	京王線、あと何10本電車通したら踏切開けてくれるん？？？	{'place_id': '8ffa995231a47059'}
2021-03-03T10:41:27.000Z	1367062556846661637	@Hakutsuru5831 🌟東横線 12：20、約14時間ぶりに全線運転再開し、通常ダイヤ戻る🚃 ビルの工事現場の足場が崩れ、電車に電力を供給する架線に引っ掛かり、停電が起き、一部区間に運転見合せ。 3日午前中に撤去が終わる。 上下線324本運休、利用者17万3800人影響‼️原因は強風とみられる🌀 https://t.co/mlDZeDZW8a	{'place_id': 'd313627ad749ca61'}
2021-03-03T10:40:38.000Z	1367062355255828487	明日出勤すれば金曜日病院！！そして週末！！楽しみや！！	{'place_id': '3bbf5d8ac434a644'}
2021-03-03T10:38:24.000Z	1367061789502939137	今日は、臨時出勤でしたが、飛び込みのお客様に紫微斗数で鑑定する機会を頂きました！名刺をくださいと言われて、占い師冥利に尽きますね！感謝です😊 https://t.co/PAZvMyBpB9	{'place_id': 'ed61afd47a8bfd91'}
2021-03-03T10:34:20.000Z	1367060768043061256	さて、出勤時間です。時間たつの早いなぁ…(^^;#万国橋 https://t.co/vkdPpijMe7	{'place_id': '0d8054846be7f7be'}
2021-03-03T10:25:20.000Z	1367058505132240902	出勤してます✌️❤ 25時までお誘いお待ちしてます🥰ひな祭り〜🎎🍡🌸 https://t.co/FDkOBCnea6	{'place_id': 'f7c22e0cf7b3af2b'}
2021-03-03T10:23:02.000Z	1367057925773033474	映画観てから出勤できるなw https://t.co/Dj0d5jl0WC	{'place_id': 'a703ad469c686234'}
2021-03-03T10:04:50.000Z	1367053345484017664	そして豪快に電車乗り間違え、違う路線行ってしまいましたが自宅から徒歩30秒のバス停まで、バスが行ってくれるんですね。便利だし、楽しい旅でした。今度はバス乗り継いで都内迄行ってみよう。 https://t.co/au9Nb08rx2	{'place_id': 'f1299e526e0cc34d'}
2021-03-03T10:02:21.000Z	1367052718892720129	あ〜飲みに行きてぇ〜	{'place_id': '3d4bcaf184b72e12'}
2021-03-03T09:59:02.000Z	1367051882678554631	電車にて隣のババアから漂うババア臭がキツいので乗り換えるはこととする	{'place_id': '4ad3383e25ac98d9'}
2021-03-03T09:57:36.000Z	1367051521783816193	花見はできないねー。まだまだ飲みにも行けないねー。みんなと会えないねー。つまらない世の中だねー。 https://t.co/7x04nK6FsX	{'place_id': '7efb0fd5276fdda5'}
2021-03-03T09:57:12.000Z	1367051421154074624	昨日から寒いとか寒くないとかしか呟いてないな😊そりゃ寒いからね🌼はよ電車こい	{'place_id': 'b41f5dcb002a1886'}
2021-03-03T09:56:42.000Z	1367051298760060932	最終出勤日が3月17日に決まった🔚。ここからは一日一日カウントダウンの日々。大きなクレームなど受けず、静かに去りたいと願う。	{'place_id': 'dcc2630623880f96'}
2021-03-03T09:55:09.000Z	1367050907980996613	いつもの半蔵門線車中。いつもの電車は落ち着くな〜😁	{'place_id': '594fa6c6bc5b5ba9'}
2021-03-03T09:54:45.000Z	1367050804570378241	@nyaoske 福岡県内が高速路線が充実しすぎていて、路線バスの鬼門になっていたのが意外でした。仕事で福岡の端の方の工場に行ったとき、タクシー送迎で高速使って空港にあっという間に運ばれたし。電車に乗る方が好きなのに。	{'place_id': 'e711a8fc9ecc013e'}
2021-03-03T09:42:50.000Z	1367047806788063232	だめだよなまただやっぱり焦ってるから…先々の事に頭いっちゃうからお薬もらっていい感じで電車乗ったのに…😂お財布お薬の所に忘れたーー😑隣の駅とはいえはぁ…んもぉーー https://t.co/BI6IynylDe	{'place_id': '336251fac4207ae3'}
2021-03-03T09:42:35.000Z	1367047746293690368	@sakebase_moriya 片っ端から飲みに行きますよー👌	{'place_id': '6439e221c8eaddaa'}
2021-03-03T09:36:46.000Z	1367046281047121924	むー……(;´・ω・`)どうせ何やろうとも批判されるんだろうから、言葉濁さずに延長しません！って断言して欲しかったな……(´・ω・`)そろそろ旅行行きたい(´・ω・`)	{'place_id': '18d30ff8086ed40c'}
2021-03-03T09:35:38.000Z	1367045994320302088	新しく仲間になってくれた、ベリーガールのキョウコちゃんでございます👏パリオンは昨日出勤で少しだけダンスを見ちゃいましたがうますぎー🤩お店で見掛けたら声かけてあげてくださいませ🙇🏼#エンタメ活動を止めない https://t.co/BJzl9tIWQN	{'place_id': '7ee61f505fdfdf5c'}
2021-03-03T09:31:57.000Z	1367045069421744128	@soracide @suezo_9999 週に一回しか通勤時間帯の電車に乗らない分、変化を強く感じます。	{'place_id': 'dee4362fa7f11785'}
2021-03-03T09:29:29.000Z	1367044446487896071	2021年3月の自転車教室。愛知県も仲間入り😄#自転車教室 #自転車 #習い事 #子ども #お出かけ #親子 #春休み #副業紹介 https://t.co/5OyENFewT6	{'place_id': '1ea0fd1a31366833'}
2021-03-03T09:27:37.000Z	1367043976902025217	この時間にお出かけできるうちにお出かけしよ	{'place_id': '594fa6c6bc5b5ba9'}
2021-03-03T09:27:02.000Z	1367043830717902848	もうホント笑える、モテないポッチャリ男が、電車内で、女の子を一生懸命気を引くように口説いてる。全然すべってて、面白くない話しに合わせる女の子が可愛しそうな感じです。がんばれ！ぽっちゃり！	{'place_id': '1b0cfebe3424e14f'}
2021-03-03T09:27:00.000Z	1367043825001066499	印旛日本医大駅という所に来てしまいました。家までバスを2本乗り継ぐようです。千葉は広いので電車乗り間違えると1時間はロスしますね。笑 https://t.co/qMXjuwKDrz	{'place_id': '363cc1df5487a576'}
2021-03-03T09:25:05.000Z	1367043342136057861	@yasuner1103 電車でDって知ってますか	{'place_id': 'a35b6b4421e1a506'}
2021-03-03T09:21:05.000Z	1367042334014140421	旅行業界って日本経済の中での比重はどれほどなのだろうか?	{'place_id': '86315f8740971686'}
2021-03-03T09:18:39.000Z	1367041723357032450	電車慣れしてないので乗り間違えました。バスとかで冒険してみようと思います。	{'place_id': '363cc1df5487a576'}
2021-03-03T09:17:05.000Z	1367041325409787904	@saku5324 いや、俺はソレはもうあるんで長旅に出れるのが欲しい。現実逃避旅行したいw	{'place_id': '3d4bcaf184b72e12'}
2021-03-03T09:16:12.000Z	1367041105481539587	収録だん@西新宿森清華のLife is the journeyゲスト🎧役者 コウガシノブさん映画『電車を止めるな』主演銚子電鉄にまつわる面白い話役者として本気になった30歳死ぬ演技は命がけ色々伺いました😎映画は竹橋 &amp; 神楽坂でも上映中📽#電車を止めるな#銚子電鉄#かわさきエフエム https://t.co/8VvHG9KgBf	{'place_id': '7ee61f505fdfdf5c'}
2021-03-03T09:07:13.000Z	1367038845041008640	外出自粛で本格的に始めたであろう囲碁から出会いがあって結婚までいくんだから人生って分からないものですわ。おめでとうございます。	{'place_id': 'ed61afd47a8bfd91'}
2021-03-03T09:06:36.000Z	1367038689591713795	電車乗る時間増えたから音楽聴く時間も増えたんだけど、bon joviのサビが来た時の合わせて歌いたくなる感じはなんなんだろう…	{'place_id': 'faab662cb34cf04f'}
2021-03-03T09:00:48.000Z	1367037228388552710	"""きれいのとびら""ではタオル、ウエア、スリッパなどの必要なものは全て貸し出しております✨お出かけやお仕事のお帰りに、お時間がある時に、お気軽にどうぞ🍀#きれいのとびら #セルフエステ ＃大宮 #駅近 #フェイシャル #美顔 #美肌 #痩せたい #温活 #岩盤浴 #脱毛 #ジェルネイル #美容 #さいたま https://t.co/hLlJ3gzPAJ"	{'place_id': 'c71f3a7498fe95d7'}
2021-03-03T08:51:02.000Z	1367034771843416065	今日も今日とて出勤してます☺️良かったら会いに来て〜✨ https://t.co/iRNmn8dCvt	{'place_id': '7ee61f505fdfdf5c'}
2021-03-03T08:39:00.000Z	1367031744696700931	@socio25064 おっしゃる通り。今日も電車の乗り換えみたいにたまたま空いた席へ運良く滑り込みでした。	{'place_id': '8ffa995231a47059'}
2021-03-03T08:33:51.000Z	1367030447612465157	ミーティング参加しながら、お出かけ準備😺	{'place_id': '4ad3383e25ac98d9'}
2021-03-03T08:23:47.000Z	1367027915888582657	猫は高いところが好き。でもその電車200キロで走るよイギリスの新幹線。 https://t.co/nuDcP5WTkR	{'place_id': '0fd33386c57b038a'}
2021-03-03T08:21:35.000Z	1367027358574645250	楽しみなイベント！ ジェットスタージャパンのアカウント(@Jetstar_Japan)で【フォロー＆RTで往復航空券が当たるキャンペーンを実施中！！】キャンペーン詳細はこちらhttps://t.co/0P9XHNHEDx 〆3/26(金)18:00まで*諸条件適用#キャンペーン #旅行 #懸賞 #プレゼント #プレゼント企画 #PR	{'place_id': '76c498282a5a7997'}
2021-03-03T08:11:22.000Z	1367024787348856837	電車でGO 都営浅草線とか？ https://t.co/gdA5obmBH9 @YouTubeより	{'place_id': '28b9063fdce43645'}
2021-03-03T08:07:33.000Z	1367023830632333314	奥出雲そば処一福出雲そばが届いた😃美味しそう😁2食1000円送料込み😉楽天、ヤフーポイントがたまってるので、人気ランキング格安グルメを買ってる。コロナで何処にも行けないから、少しでも旅行気分に😃明日も休み😉またね👋😃 https://t.co/ocBRMYqbMq	{'place_id': '07d9f32d1ec82000'}
2021-03-03T08:05:13.000Z	1367023241793990660	@mama64426302 コメントありがとう😉👍🎶ございました。戸塚駅の下りホームで電車を写真で撮った。😃👍	{'place_id': '61774861ea700565'}
2021-03-03T08:04:47.000Z	1367023134331736065	@rx8_sirius どのあたりかと思ったら、水戸線の沿線だったんですね。電車駅から近いと良いなあ。	{'place_id': 'e711a8fc9ecc013e'}
